,Company,Symbol,Industry,Identifier,Indices,Currency,Trading,urls,description
428,PUDO Inc.,PDO,Diversified Industries,,CSE Composite,CAD,01-Sep-15,https://thecse.com/en/listings/diversified-industries/pudo-inc,"Headquartered in Canada, PUDO is the first national carrier agnostic parcel pick-up and drop-off service, ensuring reliable and secure delivery where you want it, when you want it. Using easily-accessible community locations (“PUDOpoint”) such as convenience stores, gas stations, and grocery stores with extended hours, PUDO members, participating e-commerce retail customers and any business sector with a home-based workforce can now pick-up their parcels anytime, including evenings and weekends. PUDO eliminates the frustration of missed deliveries and gives control over parcel pick-up and delivery back to its members. With user-friendly technology, free membership, and PUDOpoint locations across Canada and the U.S., PUDO is changing the parcel delivery model in North America. PUDO was named one of the top 20 most innovative public technology companies by the Canadian Innovation Exchange in 2015. For more information, please visit: www.pudoinc.com"
429,Pushfor Investments Inc.,PUSH,Diversified Industries,,CSE Composite,CAD,19-Nov-15,https://thecse.com/en/listings/diversified-industries/pushfor-investments-inc,Pushfor Investments Inc. is a diversified industry corporation and seeks investment in various projects and corporations to bring value to its shareholders.
430,Quantum Cobalt Corp,QBOT,Mining,,,CAD,22-Dec-15,https://thecse.com/en/listings/mining/quantum-cobalt-corp,
431,QuestCap Inc. (formerly was QSC/Copper One Inc. until 2019-09-27),QSC,Diversified Industries,,CSE Composite,CAD,05-Sep-19,https://thecse.com/en/listings/diversified-industries/questcap-inc-(formerly-was-qsc/copper-one-inc-until-2019-09-27),
432,Quinsam Capital Corporation,QCA,Diversified Industries,Cannabis,CSE Composite,CAD,10-Sep-15,https://thecse.com/en/listings/diversified-industries/quinsam-capital-corporation,"Quinsam is a merchant bank based in Canada that is focusing on cannabis-related investments. Our merchant banking business may encompass a range of activities including acquisitions, advisory services, lending activities and portfolio investments. Quinsam invests its capital for its own account in assets, companies or projects which we believe are undervalued and where we see a viable plan for unlocking such value. We do not invest on behalf of any third party and we do not offer investment advice."
433,Quizam Media Corporation,QQ,Technology,,,CAD,12-Jul-18,https://thecse.com/en/listings/technology/quizam-media-corporation,
434,Qwick Media Inc.,QMI,Technology,,,CAD,01-Feb-16,https://thecse.com/en/listings/technology/qwick-media-inc,"
	Qwick Media is a development stage company engaged in the business of developing interactive proprietary software for digital media applications and integrating it with hardware. The Corporation primarily integrates its proprietary touchscreen software products as user interfaces and content management systems with flat LCD/LED screens, and computer hardware and related peripherals and enclosures provided by third parties, in the expectation of generating recurring fees under end-user licenses."
435,Radial Research Corp,RAD,Technology,,,CAD,31-Oct-18,https://thecse.com/en/listings/technology/radial-research-corp,"Radial Research Corp. is a technology company that develops online and download technologies and services, including software, websites and smartphone applications. The Company has focused recent efforts on e-commerce related technologies, and has acquired Zoompages, an e-commerce platform which we believe greatly simplifies the sales funnel construction process. The Company is also seeking other opportunities in e-commerce, internet and smartphone-based technologies."
436,Radiko Holdings Corp. (formerly was RDKO/International Cannabrands Inc. until 2020-07-23),RDKO,Life Sciences,US Cannabis,CSE Composite,CAD,25-Sep-17,https://thecse.com/en/listings/life-sciences/radiko-holdings-corp-(formerly-was-rdko/international-cannabrands-inc-until-2020-07-23),
437,Raffles Financial Group Limited,RICH,Diversified Industries,,CSE25,CAD,11-May-20,https://thecse.com/en/listings/diversified-industries/raffles-financial-group-limited,"Raffles Financial is an established Singapore company with an office in Hong Kong that provides an array of financial advisory services.  Raffles Financial is registered with the Monetary Authority of Singapore as an exempt corporate finance adviser. Unlike large investment banks and self-employed financial consultants, Raffles Financial offers customized public listing advisory, arrangement and anchoring-investors services by working with audit, legal, tax and banking professionals.  Raffles Financial intends to expand its business by investing in businesses which meet its investment criteria and guidelines."
438,Rain City Resources Inc.,RAIN,Mining,,,CAD,26-Apr-19,https://thecse.com/en/listings/mining/rain-city-resources-inc,"
	Rain City Resources Inc. is a Vancouver based mineral exploration company focused on base, rare earth elements, precious metals and gems exploration in North America. The company is currently exploring the Similkameen Mining Division of British Columbia."
439,Raindrop Ventures Inc.,RAYN,Mining,,,CAD,03-Feb-20,https://thecse.com/en/listings/mining/raindrop-ventures-inc,"Raindrop is a company involved in the business of acquiring and exploring mineral properties in Canada and the United States. Raindrop has been primarily involved in the exploration and evaluation of the Silver Star Property, located Southeast of Houston, British Columbia. Raindrop acquired an option in the Silver Star Property pursuant to the Option Agreement in June 2018. In September 2018, Raindrop acquired the Clover Mountain Property, located in Idaho, USA. Raindrop is headquartered in Vancouver, British Columbia."
440,Ramm Pharma Corp.,RAMM,Life Sciences,,CSE Composite,CAD,08-Nov-19,https://thecse.com/en/listings/life-sciences/ramm-pharma-corp,"RAMM Pharma Corp., through its wholly-owned operating subsidiaries, is engaged in the pharmaceutical and medical product business, and is a leader in the field of cannabinoid pharmacology and product formulation for cannabis-based pharmaceuticals and other cannabis-based products. With RAMM’s large scale cultivation facility, the combined operations are expected to provide for complete vertical integration.  Further to its industry leading activities in the cannabis sector, RAMM operates a pharmaceutical, cosmetic and nutraceutical product development and medical services business which has been servicing the local market for 30 years."
441,Range Energy Resources Inc. (formerly was RGO/Range Energy Resources Inc. until 2020-03-31),RGO.X,Oil and Gas,,,CAD,01-Sep-15,https://thecse.com/en/listings/oil-and-gas/range-energy-resources-inc-(formerly-was-rgo/range-energy-resources-inc-until-2020-03-31),
442,Rapid Dose Therapeutics Corp.,DOSE,Life Sciences,Cannabis,CSE Composite,CAD,17-Dec-18,https://thecse.com/en/listings/life-sciences/rapid-dose-therapeutics-corp,"Rapid Dose Therapeutics Corp. is a publicly traded Canadian life sciences company that provides innovative, proprietary drug delivery technologies designed to improve outcomes and quality of lives. RDT offers Quick, Convenient, Precise and Discreet™ choices to consumers. RDT is focused and committed to clinical research and product development for the healthcare manufacturing industry, including nutraceutical, pharmaceutical and cannabis industries."
443,Ravenquest BioMed Inc.,RQB,Life Sciences,Cannabis,,CAD,04-Oct-17,https://thecse.com/en/listings/life-sciences/ravenquest-biomed-inc,"RavenQuest BioMed Inc. is a diversified publicly traded cannabis company with divisions focused upon cannabis production, management services & consulting and specialized research & development.  RavenQuest is a licensed producer with facilities located in Markham, Ontario and Edmonton, Alberta."
444,Razore Rock Resources Inc.,RZR,Mining,,,CAD,17-Sep-15,https://thecse.com/en/listings/mining/razore-rock-resources-inc,"
	Razore Rock Resources Inc. is a mineral exploration company focused on the acquisition, exploration and development of mineral resources."
445,Red Lake Gold Inc.,RGLD,Mining,,CSE Composite,CAD,09-May-18,https://thecse.com/en/listings/mining/red-lake-gold-inc,"Red Lake Gold Inc. (CSE:RGLD) is focused on high-impact gold exploration through our 12,300 ha district-scale Whirlwind Jack Gold Project situated near Red Lake, Ontario and adjacent to the Dixie Gold Project being advanced by Great Bear Resources Ltd."
446,Red Light Holland Corp.,TRIP,Life Sciences,,CSE Composite,CAD,28-May-20,https://thecse.com/en/listings/life-sciences/red-light-holland-corp,"Red Light Holland’s business revolves around the production, growth and sale (through existing Smart Shops operators and an advanced e-commerce platform) of a premium brand of magic truffles to the legal, recreational market within the Netherlands, in accordance with the highest standards, in compliance with all applicable laws."
447,Red White & Bloom Brands Inc.,RWB,Life Sciences,US Cannabis,CSE25,CAD,05-Jun-20,https://thecse.com/en/listings/life-sciences/red-white-&-bloom-brands-inc,
448,Redfund Capital Corp.,LOAN,Diversified Industries,Cannabis,,CAD,14-Aug-18,https://thecse.com/en/listings/diversified-industries/redfund-capital-corp,<strong>Redfund Capital Corp</strong>
449,Relay Medical Corp.,RELA,Life Sciences,,CSE Composite,CAD,01-Sep-15,https://thecse.com/en/listings/life-sciences/relay-medical-corp,"Relay Medical is evolving an integrated Medtech incubator/accelerator platform, which develops and productizes multiple products and projects concurrently and vets strategic acquisitions, that are complimentary to current infrastructure assets and investment thesis."
450,Reliant Gold Corp.,RNG,Mining,,,CAD,28-Feb-18,https://thecse.com/en/listings/mining/reliant-gold-corp,"
	The Company is a junior mineral exploration company engaged in the acquisition, exploration and development of mineral resource properties in North America. The Company is an exploration and evaluation stage company currently focused on the exploration of mineral properties in Ontario, Canada."
451,Renforth Resources Inc.,RFR,Mining,,CSE Composite,CAD,20-Oct-15,https://thecse.com/en/listings/mining/renforth-resources-inc,"
	Renforth Resources Inc. is an active exploration company with gold resources on the Cadillac Break in Quebec, currently drilling the Parbec Property, contiguous to Canadian Malartic, to continue to define the total amount of gold present."
452,Reservoir Capital Corp.,REO,Diversified Industries,,CSE Composite,CAD,28-Sep-18,https://thecse.com/en/listings/diversified-industries/reservoir-capital-corp,"Reservoir Capital Corp. (“Reservoir”) is a clean power investment vehicle concentrating on operational projects located in growing economies. Reservoir's portfolio currently comprises 4 hydro power plants netting 46.3MW operating capacity via minority economic interests in Mainstream Energy Solutions Limited and North South Power Ltd, respectively the #1 and #2 clean power producers in Africa (and Nigeria). In addition to growth, Reservoir offers investors portfolio diversification, USD dividend streams, long term PPA protection and excellent operator-ship. Reservoir’s acquisition strategy is to approach owners of privately-held quality clean energy assets and offer their investors a way to surface value via share swap into our growing balanced portfolio of assets following a disciplined investment policy. "
453,Revive Therapeutics Ltd.,RVV,Life Sciences,Cannabis,CSE Composite,CAD,23-Jul-19,https://thecse.com/en/listings/life-sciences/revive-therapeutics-ltd,"Revive Therapeutics Ltd. is a life sciences company focused on the research and development of therapeutics for infectious diseases and rare disorders, and it is prioritizing drug development efforts to take advantage of several regulatory incentives awarded by the FDA such as Orphan Drug, Fast Track, Breakthrough Therapy and Rare Pediatric Disease designations.  Currently, the Company is exploring the use of Bucillamine for the potential treatment of infectious diseases, with an initial focus on severe influenza strains including COVID-19.  With its recent acquisition of Psilocin Pharma Corp., Revive is advancing the development of Psilocybin-based therapeutics in various diseases and disorders. Revive’s cannabinoid pharmaceutical portfolio focuses on rare inflammatory diseases and the Company was granted FDA orphan drug status designation for the use of Cannabidiol (CBD) to treat autoimmune hepatitis (liver disease) and to treat ischemia and reperfusion injury from organ transplantation.  For more information visit "
454,Rift Valley Resources Corp.,RVR,Mining,,,CAD,08-Sep-15,https://thecse.com/en/listings/mining/rift-valley-resources-corp,
455,Rise Gold Corp.,RISE,Mining,,CSE Composite,CAD,01-Feb-16,https://thecse.com/en/listings/mining/rise-gold-corp,"Rise Gold Corp. is an exploration stage mining company.  The Company's principal asset is the historic past producing Idaho-Maryland Gold Mine located in California, USA.  The Idaho-Maryland Gold Mine is one of the greatest past producing gold mines in the United States with total past production of 2,414,000 ounces of gold from 1866-1955.  Rise is a US corporation incorporated in Nevada USA and maintains its head office in Vancouver, British Columbia, Canada."
456,RISE Life Science Corp.,RLSC,Life Sciences,US Cannabis,,CAD,01-Dec-17,https://thecse.com/en/listings/life-sciences/rise-life-science-corp,RISE Life Science Corp.  is currently developing and evolving medical and adult-use hemp-based formulations to create general use health and well-being products for the emerging consumer category made possible by the legalization of hemp in the United States pursuant to the Agricultural Improvement Act of 2018.  The Company launched its CBD-based sexual wellness products in June 2018.  The acquisition of Life Bloom Organics in July 2018 expanded RISE’s portfolio of CBD products from sexual health and wellness products to include general wellness and sleep products and provides access to Life Bloom’s existing channels of distribution and production in the United States and California in particular.  RISE also leverages Life Bloom’s proprietary process of nanotizing CBD for increased bioavailability (without psychoactivity) in future products created under the RISE brand umbrella.
457,RMMI Corp.,RMMI,Life Sciences,Cannabis,,CAD,25-Sep-18,https://thecse.com/en/listings/life-sciences/rmmi-corp,"RMMI is an Alberta based company whose wholly owned subsidiary, Rocky Mountain Marijuana Inc., is licensed under the "
458,Rockcliff Metals Corporation,RCLF,Mining,,CSE Composite,CAD,07-May-19,https://thecse.com/en/listings/mining/rockcliff-metals-corporation,"Rockcliff is a Canadian resource exploration company focused on base metals, gold and royalties in the Snow Lake area of Manitoba, Canada. Rockcliff is the largest junior landholder in the Flin Flon-Snow Lake greenstone belt which is home to the largest Paleoproterozoic VMS district (copper, gold, zinc, silver) in the world and also contains gold mines and deposits. Its extensive portfolio of properties totals over 4,000 square kilometres. It includes 9 of the highest-grade undeveloped VMS deposits and 5 lode-gold properties including the historic Rex-Laguna gold mine, Manitoba’s first and highest-grade gold mine."
459,Rockex Mining Corporation,RXM,Mining,,,CAD,14-Sep-15,https://thecse.com/en/listings/mining/rockex-mining-corporation,"
	Rockex is a Canadian exploration company focused on developing high quality iron ore assets strategically located in areas largely under explored, and that host significant mineral potential. Its core asset is the Lake St. Joseph Project which includes the Eagle Island Deposit, as well as additional potential deposits at Wolf Island and Fish Island. Rockex's vision is to position the Lake St. Joseph project to become the first producer of Hot Briquetted Iron (HBI) in Canada."
460,Rockshield Capital Corp.,RKS,Diversified Industries,Cannabis,,CAD,01-Sep-15,https://thecse.com/en/listings/diversified-industries/rockshield-capital-corp,"
	Rockshield Capital is a diversified investment firm focused on, but not limited to, investing in early stage, high growth companies offering capital appreciation potential. Such investee companies may be private or public companies and there will be no bias to sector based on economic, financial and market conditions. The Company expects its investments will include companies at all stages of development."
461,Rubicon Organics Inc.,ROMJ,Life Sciences,Cannabis,CSE25,CAD,10-Oct-18,https://thecse.com/en/listings/life-sciences/rubicon-organics-inc,"Rubicon Organics Inc. (the “Company”) is a Canadian licensed producer focused on producing super-premium, certified organic cannabis from its flagship 125,000 sq. ft. hybrid greenhouse in Delta, British Columbia, Canada. "
462,Rubicon Organics Inc. Wts.,ROMJ.WT,Life Sciences,Cannabis,,CAD,23-Aug-19,https://thecse.com/en/listings/life-sciences/rubicon-organics-inc-wts,
463,SBD Capital Corp.,SBD,Diversified Industries,,,CAD,02-Feb-18,https://thecse.com/en/listings/diversified-industries/sbd-capital-corp,"
	SBD Capital Corp. acquires controlling interests in industrial companies in the manufacturing and distribution business. The initial acquisition is Secret Barrel Distillery Corporation which is a craft rum producer and distributor in Alberta, Canada. SBD Capital Corp. provides the capital to grow and expand the business, and also provides management expertise. SBD Capital Corp. continues to look for other acquisitions which may be in the similar industry as Secret Barrel Distillery Corporation or in an unrelated industry."
464,Scotch Creek Ventures Inc.,SCV,Mining,,,CAD,02-Jan-19,https://thecse.com/en/listings/mining/scotch-creek-ventures-inc,"Scotch Creek Ventures Inc. is a Vancouver based mineral exploration company focused on gold development in North America. The company is currently exploring the Cupz Property in the Esmerelda County, Nevada."
465,Seahawk Ventures Inc.,SHV,Mining,,CSE Composite,CAD,05-May-16,https://thecse.com/en/listings/mining/seahawk-ventures-inc,"Seahawk Ventures Inc. is a venture company looking to acquire a portfolio of mining assets. The Company currently owns four properties in the Urban-Barry Gold Camp, Abitibi Greenstone Belt region of Quebec, Canada."
466,Sensor Technologies Corp (formerly was SENS/Sensor Technologies Inc. until 2020-01-27),SENS,Technology,,,CAD,24-Oct-18,https://thecse.com/en/listings/technology/sensor-technologies-corp-(formerly-was-sens/sensor-technologies-inc-until-2020-01-27),
467,Sentinel Resources Corp.,SNL,Mining,,,CAD,02-Mar-20,https://thecse.com/en/listings/mining/sentinel-resources-corp,Sentinel Resources is in the business of the exploration of gold deposits on its three mineral properties located in the Nelson Mining Division in the Province of British Columbia.
468,Sharc International Systems Inc.,SHRC,CleanTech,,CSE Composite,CAD,28-Oct-15,https://thecse.com/en/listings/cleantech/sharc-international-systems-inc,<strong>About SHARC International Systems Inc.</strong>
469,Shoal Point Energy Ltd.,SHP,Oil and Gas,,CSE Composite,CAD,09-Sep-15,https://thecse.com/en/listings/oil-and-gas/shoal-point-energy-ltd,"
	Shoal Point Energy Ltd is a public company with a 100% interest in the shallow rights in Exploration License EL#1070 in the Province of Newfoundland comprising approximately 150,000 acres of oil-in-shale in Port au Port Bay and which can be developed almost entirely from land. In addition, Shoal Point has an agreement to earn a net 80% interest in the 67,298 acres of Green Point Shale (shallow rights) of EL #1120 which is owned by Ptarmigan Energy Inc. The total potential gross acreage in the Green Point Shale is approximately 220,000 acres."
470,Sierra Growth Corp.,SGRO,Mining,,,CAD,16-Oct-18,https://thecse.com/en/listings/mining/sierra-growth-corp,
471,Silver Dollar Resources Inc.,SLV,Mining,,,CAD,29-May-20,https://thecse.com/en/listings/mining/silver-dollar-resources-inc,"The Issuer is engaged in the business of mineral exploration and the acquisition of mineral property assets in Canada.  Its objective is to locate and develop economic precious and base metal properties of merit and to conduct its exploration program on the Longlegged Lake Property, located in the Red Lake Mining Division in north-western Ontario, approximately 30 kilometres south of the community of Red Lake.  Silver Dollar also has an interest in the Pakwash Lake Property, located approximately 30 kilometres southeast of the community of Red Lake, Ontario."
472,Silver Phoenix Resources Inc.,SP,Mining,,CSE Composite,CAD,23-Oct-15,https://thecse.com/en/listings/mining/silver-phoenix-resources-inc,Silver Phoenix Resources Inc. is a Project Generator. The company's goals are to acquire properties of merit in safe jurisdictions that can be improved on and to secure partners with the expertise to develop them to production. Their objective is to retain an interest that could be sold for cash and retain a royalty - resulting in minimized share dilution for shareholders.
473,Silver Sands Resources Corp. (formerly was GOOP/Golden Opportunity Resources Corp. until 2020-06-05),SAND,Mining,,CSE Composite,CAD,27-Nov-19,https://thecse.com/en/listings/mining/silver-sands-resources-corp-(formerly-was-goop/golden-opportunity-resources-corp-until-2020-06-05),
474,Sire Bioscience Inc.,SIRE,Life Sciences,Cannabis,CSE Composite,CAD,11-Sep-19,https://thecse.com/en/listings/life-sciences/sire-bioscience-inc,"Sire Bioscience Inc. is a life sciences company focused on the cultivation, production and sale of industrial hemp."
475,Sitka Gold Corp.,SIG,Mining,,CSE Composite,CAD,31-Jan-18,https://thecse.com/en/listings/mining/sitka-gold-corp,"Sitka Gold Corp. is a mineral exploration company headquartered in Canada and managed by a team of experienced mining industry professionals. The Company is focused on exploring for economically viable mineral deposits with its primary emphasis on gold and copper mineral properties of merit. Sitka currently has an option to acquire a 100% interest in the RC Gold Gold property in Yukon, an option to earn a 100% interest in the Burro Creek Property in Arizona and owns a 100% interest in its Coppermine River project in Nunavut and the Alpha Gold property in Nevada."
476,Sixth Wave Innovations Inc.,SIXW,Diversified Industries,,CSE Composite,CAD,11-Feb-20,https://thecse.com/en/listings/diversified-industries/sixth-wave-innovations-inc,"Sixth Wave Innovations Inc. is a nanotechnology company focused on extraction and detection of target substances at the molecular level.  The company's products provide significant advantages in cost and performance. These advantages are derived from application of the company's patented technologies in the highly specialized field of molecularly imprinted polymers (MIPs). Sixth Wave is commercializing IXOS®, a line of extraction polymers for the gold mining industry and Affinity™ for the Cannabis Industry."
477,Sixty North Gold Mining Inc.,SXTY,Mining,,,CAD,19-Apr-18,https://thecse.com/en/listings/mining/sixty-north-gold-mining-inc,
478,Skarb Exploration Corp.,SKRB,Mining,,,CAD,15-Feb-19,https://thecse.com/en/listings/mining/skarb-exploration-corp,"
	Skarb Exploration Corp. is engaged in the business of mineral exploration in Canada with an objective to locate and develop economic mineral properties. Skarb Exploration Corp. holds the sole and exclusive right and option to acquire a 100% right, title, and interest in and to the RDR Gold Project located in Quebec, consisting of 16 mining claims."
479,Skyledger Tech Corp.,SKYL,Technology,Blockchain,CSE Composite,CAD,29-Apr-19,https://thecse.com/en/listings/technology/skyledger-tech-corp,"
	Skyledger Tech Corp. is a bitcoin mining company that gives shareholders access to the potential price appreciation of bitcoin.  The Company currently operates ASIC Rigs, which are used to obtain rewards for confirming transactions on the bitcoin blockchain, at its facility in Gibsons, British Columbia."
480,SLANG Worldwide Inc.,SLNG,Life Sciences,US Cannabis,CSE Composite,CAD,29-Jan-19,https://thecse.com/en/listings/life-sciences/slang-worldwide-inc,"SLANG Worldwide is a leading cannabis-focused consumer packaged goods company. SLANG Worldwide is focused on acquiring and developing market-proven regional brands, as well as creating new brands to meet the needs of cannabis consumers worldwide."
481,Slave Lake Zinc Corp,SLZ,Mining,,,CAD,07-Nov-18,https://thecse.com/en/listings/mining/slave-lake-zinc-corp,"Slave Lake Zinc Corp. intends to develop the potential of its O'Connor Lake property, an historic zinc lead copper property located in the North West Territories of Canada.  The property is located south of Great Slave Lake and to the east of Osisko Metals' Pine Point project.  The property was initially developed after the Second World War and subsequently abandoned in 1952 when the prices of zinc and lead collapsed post war.  Slave Lake Zinc Corp. believes that it is well positioned to advance this project and to expand significantly the historic potential of the property."
