,Company,Symbol,Industry,Identifier,Indices,Currency,Trading,urls,description
0,12 Exploration Inc.,TWLV,Mining,,,CAD,16-Jun-20,https://thecse.com/en/listings/mining/12-exploration-inc,"12 Exploration Inc. is led by a team with extensive mineral exploration expertise and a track record of discoveries and exits in South America and globally. Through its subsidiary, 79North (www.79north.ca), 12 Exploration Inc. holds an indirect interest in mineral concessions in northern Suriname (formerly Dutch Guiana), and aims to become the premier junior exploration company in this underexplored district of the prolific Guiana Shield. 12 Exploration Inc.’s growing portfolio of high-quality targets which have not undergone modern exploration or drilling have a long history of artisanal mining and are strategically located within close proximity to modern gold mines operated by major mining companies."
1,1933 Industries Inc.,TGIF,Diversified Industries,US Cannabis,CSE Composite,CAD,16-Jun-17,https://thecse.com/en/listings/diversified-industries/1933-industries-inc,"1933 Industries is a vertically-integrated, growth-orientated company, focusing on the cultivation and manufacturing of cannabis consumer branded goods in a wide range of product formats. Operating through two subsidiaries, the Company controls all aspects of the value chain with cultivation, extraction, processing, and manufacturing assets supporting its diversified portfolio of cannabis brands and licensing partners."
2,1933 Industries Inc. Wts.,TGIF.WT,Diversified Industries,US Cannabis,,CAD,14-Sep-18,https://thecse.com/en/listings/diversified-industries/1933-industries-inc-wts,
3,1933 Industries Inc.10% 14SEP21,TGIF.DB,Diversified Industries,US Cannabis,,CAD,14-Sep-18,https://thecse.com/en/listings/diversified-industries/1933-industries-inc10%-14sep21,
4,3 Sixty Risk Solutions Ltd.,SAFE,Diversified Industries,Cannabis,,CAD,08-Jan-19,https://thecse.com/en/listings/diversified-industries/3-sixty-risk-solutions-ltd,<strong>About 3 Sixty Risk Solutions Ltd. </strong>
5,37 Capital Inc.,JJJ.X,Mining,,,CAD,01-Sep-15,https://thecse.com/en/listings/mining/37-capital-inc,"The Exchange has determined that 37 Capital Inc. (the “Issuer”) has not met the continued listing requirements as set out in CSE Policy 2, Appendix A section 2.9."
6,4Front Ventures Corp.,FFNT,Life Sciences,US Cannabis,CSE Composite,CAD,06-Aug-19,https://thecse.com/en/listings/life-sciences/4front-ventures-corp,"4Front Ventures Corp. is a vertically-integrated cannabis company with cultivation, production and retail facilities spread across several states in the US"
7,66 Resources Inc.,SXX,Mining,,,CAD,28-Jun-18,https://thecse.com/en/listings/mining/66-resources-inc,"66 Resources Corp. is a B.C. company located in Vancouver, B.C. The Company has a board of four directors with experience in the management of companies listed on the CSE. The Company has an option to acquire the Champ Property consisting of four contiguous mineral claims totalling 1054.63 hectares located in the Nelson Mining Division."
8,Abattis Bioceuticals Corp.,ATT,Life Sciences,Cannabis,,CAD,01-Sep-15,https://thecse.com/en/listings/life-sciences/abattis-bioceuticals-corp,"
	Abattis Bioceuticals Corp. (the ""Company"" or ""Abattis"") (OTCQB: ATTBF) (CSE: ATT), specialty biotechnology company with capabilities through its wholly-owned subsidiaries as a botanical drug development company that develops and licenses natural health products, medicines, extractions and ingredients for the biologics, nutraceutical, bioceutical and cosmetic markets, some of which will contain cannabinoid compounds. Abattis develops and is in the process of commercializing natural health products that target ailments and satisfy important market needs. Abattis is conducting ongoing research and development to create plant-based intellectual property and ingredients. Current areas of focus are growth through acquisition and business development and cash flow through commercialization of existing assets. The Company has an extensive pipeline of high-quality products and intellectual property for the rapidly expanding botanical drug market. Abattis follows strict standard operating protocols, and adhere to the applicable laws of Canada and foreign jurisdictions. For more information, visit the Company's website at: www.abattis.com."
9,"Acreage Holdings, Inc.",ACRG.U,Life Sciences,US Cannabis,,USD,15-Nov-18,"https://thecse.com/en/listings/life-sciences/acreage-holdings,-inc",
10,Adastra Labs Holdings Ltd.,XTRX,Life Sciences,Cannabis,CSE Composite,CAD,06-Jan-20,https://thecse.com/en/listings/life-sciences/adastra-labs-holdings-ltd,"Adastra Labs Holdings Ltd. is comprised of Chemia Analytics Inc., a Health Canada licensed cannabis Analytical Testing Laboratory and Adastra Labs Inc. a late-stage Health Canada cannabis Standard Processing licence applicant co-located in a 13,000 sq ft facility in Langley, British Columbia, fully renovated to Good Manufacturing Practice standards.  Adastra is expected to receive its Standard Processing licence, Health Canada permitting, by Q1 2020 and will provide cannabis extraction and concentrates services and white label services to B2B customers as well as develop and market its own cannabis concentrate and extract products for Provincial B2C sale."
11,Advantagewon Oil Corp.,AOC,Oil and Gas,,,CAD,13-Jul-17,https://thecse.com/en/listings/oil-and-gas/advantagewon-oil-corp,"Advantagewon is focused on building consistent cash flow from low cost, low risk oil wells in Canada. AOC applies specialized expertise in oil pool development by development drilling, pressure restoration and maintenance using water and chemical injection to increase oil recovery from 10-15% to up to 75% for each pool. Once the enhanced recovery strategy is successfully applied, AOC will repeat the process throughout the oil pool to maximize output and minimize cost and risk. Advantagewon's common shares are listed on the OTC Markets in the United States and on the Canadian Securities Exchange (""CSE"") in Canada. Advantagewon is a member of the CSE Composite Index (CSE:AOC).  For more information please visit www.aoc-oil.com"
12,Advantex Marketing International Inc.,ADX,Diversified Industries,,,CAD,17-Sep-15,https://thecse.com/en/listings/diversified-industries/advantex-marketing-international-inc,<em>Advantex is a leader in the merchant cash advance and marketing services industry.</em>
13,"Aether Catalyst Solutions, Inc.",ATHR,Technology,,CSE Composite,CAD,11-Apr-19,"https://thecse.com/en/listings/technology/aether-catalyst-solutions,-inc",
14,Affinor Growers Inc.,AFI,Life Sciences,Cannabis,,CAD,01-Sep-15,https://thecse.com/en/listings/life-sciences/affinor-growers-inc,"
	Affinor is focused on the design, development and commercialization of vertical farming technology for both indoor and outdoor (greenhouse) applications. The team is currently working on demand crops such as romaine lettuce and strawberries by developing processes, methods and models to cultivate true perpetual crops at competitive pricing. It is the mission of Affinor to be the world-wide technology and market leader in creating and commercializing the most economical vertical farming technologies that use the least possible resources (eg. land, water, and energy resources) to produce the highest quality pesticide-free produce year-round, regardless of environmental conditions. Affinor’s patent technology and licensed patent pending technology positions the Company well in the vertical farming industry. It is the only vertically integrated technology that can offer patented inline automated pollination for fruiting crops. Affinor can offer software driven growing solutions automating high quality, scientifically engineered products and process."
15,AgraFlora Organics International Inc,AGRA,Life Sciences,Cannabis,CSE Composite,CAD,01-Sep-15,https://thecse.com/en/listings/life-sciences/agraflora-organics-international-inc,"AgraFlora Organics International Inc. has an experienced management team with a growth strategy to develop a diversified portfolio of projects that can be taken into production. The Company’s main objective is to add shareholder value through cost efficient acquisitions, joint ventures, and effective marketing while maintaining a lower risk profile through project diversification and sound financial management."
16,Agrios Global Holdings Ltd.,AGRO,Life Sciences,US Cannabis,CSE Composite,CAD,12-Nov-18,https://thecse.com/en/listings/life-sciences/agrios-global-holdings-ltd,"Agrios Global Holdings Ltd. (the “Company”) is a data analytics driven agricultural technology, services and property management company, providing real property and equipment for lease and enhanced ancillary services to the agricultural and cannabis industries in the State of Washington. The Company’s mission is to enable licensed cultivators of cannabis and/or other agricultural crops to enhance both crop quality and yields through proprietary knowledge and the use of clean technology and tools."
17,AJN Resources Inc.,AJN,Mining,,CSE Composite,CAD,12-Jun-18,https://thecse.com/en/listings/mining/ajn-resources-inc,"
	AJN Resources Inc. is an exploration and development company formed for the purposes of acquiring, exploring and if warranted and feasible, developing Lithium resource properties.  We acquire and develop properties of demonstrated potential.  AJN’s management and directors possess over 75 years of collective industry experience and have been very successful from exploration, to financing, to developing major mines throughout the world."
18,Alchemist Mining Inc.,AMS,Mining,,,CAD,04-Sep-15,https://thecse.com/en/listings/mining/alchemist-mining-inc,Alchemist Mining is focused on maximizing shareholder value by continuously seeking out and identifying precious metal properties of with great potential. The Company has a growing portfolio of properties located in prolific gold-producing regions of Canada. Alchemist is currently in the process of evaluating mining and exploration opportunities at attractive prices in current market conditions.
19,Algernon Pharmaceutical Inc. Wts.,AGN.WT,Life Sciences,,,CAD,04-Nov-19,https://thecse.com/en/listings/life-sciences/algernon-pharmaceutical-inc-wts,
20,Algernon Pharmaceuticals Inc.,AGN,Life Sciences,,CSE Composite,CAD,01-Feb-16,https://thecse.com/en/listings/life-sciences/algernon-pharmaceuticals-inc,"Algernon Pharmaceuticals is a clinical stage pharmaceutical development company focused on advancing its lead compounds for non–alcoholic steatohepatitis (NASH), chronic kidney disease (CKD) inflammatory bowel disease (IBD), idiopathic pulmonary fibrosis (IPF) and chronic cough."
21,Alliance Growers Corp.,ACG,Life Sciences,Cannabis,,CAD,16-Oct-15,https://thecse.com/en/listings/life-sciences/alliance-growers-corp, 
22,Alternate Health Corp.,AHG,Life Sciences,"US Cannabis, Blockchain",,CAD,24-Jan-17,https://thecse.com/en/listings/life-sciences/alternate-health-corp,"Alternate Health (CSE: AHG, OTCQB: AHGIF) an international leader in the hemp-derived CBD industry, including extraction, product development and distribution. Alternate Health’s industry-leading software systems provide the platform for the company’s diverse operations, including blockchain tax collection systems, hemp-derived CBD product distribution, extract manufacturing and patient management systems for specialty clinics across North America."
23,American Aires Inc.,WIFI,Technology,,CSE Composite,CAD,07-Nov-19,https://thecse.com/en/listings/technology/american-aires-inc,"American Aires is currently engaged in business of production, distribution and sales of devices intended to protect persons from the harmful effects of electromagnetic emissions.  The company has developed a technology that is restructuring and transforming electromagnetic field haze into a more biologically-compatible form to reduce the harmful effects of electromagnetic radiation."
24,American Pacific Mining Corp.,USGD,Mining,,CSE Composite,CAD,08-Mar-18,https://thecse.com/en/listings/mining/american-pacific-mining-corp,"American Pacific Mining Corp. is a new gold explorer focused on precious metal opportunities in the Western United States. Tuscarora is a high grade, early stage gold project located in a prime precious metal district in Nevada, only 35km northeast of the Carlin trend, 20km southwest of the Jerritt Canyon deposit, and 50km east-northeast of the Midas deposit. American Pacific is Eyeing a Gold Discovery amidst gold’s next bull market."
25,AMP German Cannabis Group Inc.,XCX,Life Sciences,Cannabis,CSE Composite,CAD,04-Sep-19,https://thecse.com/en/listings/life-sciences/amp-german-cannabis-group-inc,
26,AMPD Ventures Inc.,AMPD,Technology,,CSE Composite,CAD,24-Oct-19,https://thecse.com/en/listings/technology/ampd-ventures-inc,"AMPD specializes in providing high-performance cloud and compute solutions for low-latency applications including video games and eSports, digital animation and visual effects, and big data collection, analysis and visualization."
27,Ansar Financial and Dev Corporation,AFD,Diversified Industries,,CSE Composite,CAD,03-Sep-15,https://thecse.com/en/listings/diversified-industries/ansar-financial-and-dev-corporation,
28,Appia Energy Corp.,API,Mining,,CSE Composite,CAD,14-Sep-15,https://thecse.com/en/listings/mining/appia-energy-corp,The mission of Appia Energy Corp. is to advance the development of its Saskatchewan rare earth elements and uranium projects into production and transform Appia into a world class energy company.
29,Aquarius Surgical Technologies Inc.,ASTI,Technology,,CSE Composite,CAD,21-Jun-17,https://thecse.com/en/listings/technology/aquarius-surgical-technologies-inc,"Aquarius Surgical Technologies Inc. is an exclusive provider of innovative, minimally invasive medical laser systems and consumables for multiple medical disciplines, principally in the field of urology. Solutions also comprise consumables, clinical education, service, support and maintenance and focus on increasing the availability of services for patients, enhancing the quality of patient care, improving operationally efficiencies and reducing total operational costs.  "
30,Arctic Glacier Income Fund,AG.UN,Diversified Industries,,CSE Composite,CAD,03-Sep-15,https://thecse.com/en/listings/diversified-industries/arctic-glacier-income-fund,"
	On August 15, 2012, the Fund announced (the “Default Announcement”) that it would not be able to file an interim financial report and interim management's discussion and analysis for the period ended June 30, 2012, together with the related certification of filings under National Instrument 52-109 Certification of Disclosure in Issuers’ Annual and Interim Filings (collectively, the “Continuous Disclosure Documents”) by August 29, 2012, the deadline prescribed by securities legislation (the “Specified Requirement”). Except as discussed below, there have been no material changes to the information contained in the Default Announcement or any other changes required to be disclosed under National Policy 12-203. The Fund still intends to file the Continuous Disclosure Documents as soon as is commercially reasonable, or as required by the Manitoba Court of Queen's Bench pursuant to the Fund's Companies’ Creditors Arrangement Act (the “CCAA”) proceedings. More information about the Arctic Glacier Parties’ CCAA proceeding can be found on the website of its Court-appointed monitor at "
31,AREV NanoTec Brands Inc. (formerly was AREV/AREV Brands International Ltd. until 2020-03-18),AREV,Diversified Industries,Cannabis,,CAD,05-Aug-16,https://thecse.com/en/listings/diversified-industries/arev-nanotec-brands-inc-(formerly-was-arev/arev-brands-international-ltd-until-2020-03-18),
32,Argo Gold Inc.,ARQ,Mining,,CSE Composite,CAD,22-Sep-16,https://thecse.com/en/listings/mining/argo-gold-inc,Argo Gold is focused on gold exploration projects in northwestern and central Ontario that have indications of economic viability.  All of the gold projects are 100% owned by Argo Gold and its shareholders.
33,Armada Mercantile Ltd.,ARM,Diversified Industries,,,CAD,24-Sep-15,https://thecse.com/en/listings/diversified-industries/armada-mercantile-ltd,"
	Armada Mercantile Ltd. has been a publicly-traded company in Canada since 1987. Armada is a advisory services, trade finance and relational FINRA broker dealer company. Armada Mercantile Ltd. provides specialized merchant banking, venture lending, factoring and corporate finance services internationally, as well as advising clients on corporate strategy, public markets entry, mergers and acquisitions, buy and sell side mandates and raising capital."
34,Armadillo Resources Ltd.,ARO,Mining,,,CAD,05-Aug-16,https://thecse.com/en/listings/mining/armadillo-resources-ltd,"
	Armadillo is a publicly traded company headquartered in Vancouver, British Columbia with a mandate to acquire, explore and develop base and precious metals properties throughout North & South America. In July 2010, we purchased from a privately held group, a 100% interest in the LD gold property located southeast of Atlin, BC from a privately held group. In May 2011, we acquired the Amazon Basin Projects in northern Brazil which encompasses 154 concessions in the states of Amazonas, Mato Grosso and Rondonia. The acquisition comprises approximately 1,250,000 hectares of processos minerais (mineral exploration). Most of the claims have been staked over Archaen to Lower Proterozoic greenstone belts which are considered to be prospective for gold. Gold production by artisanal miners (garimpeiros) in northern Mato Grosso from the end of the 1970 to 2000 is reported by the National Department of Mineral Production (DNPM) to have totaled 123t. In March 2013, we announced the completion of the acquisition of the historic Flagstaff Gold Mine in Baker City, Oregon. The Company intends to complete an initial program of sampling, trenching and drilling which will also include an upgrade to the existing tunnels to gain access and verify the existing orebody."
35,Asante Gold Corporation,ASE,Mining,,,CAD,04-Sep-15,https://thecse.com/en/listings/mining/asante-gold-corporation,"Asante Gold Corporation (CSE:ASE / FRANKFURT:1A9) is a Vancouver, Canada based gold exploration and development company. Our current focus is gold exploration and development in Ghana, West Africa. We have announced plans, subject to financing, to develop our Kubi Gold Project as a 550 tpd underground gold mine under the former AngloGold Ashanti open pit Kubi Gold Mine."
36,Asia Green Biotechnology Corp. (formerly was ASIA/Asia Cannabis Corp. until 2020-04-15),ASIA,Life Sciences,Cannabis,CSE Composite,CAD,24-Jan-19,https://thecse.com/en/listings/life-sciences/asia-green-biotechnology-corp-(formerly-was-asia/asia-cannabis-corp-until-2020-04-15),
37,Aurwest Resources Corporation (formerly was SRS/Shamrock Enterprises Inc. until 2020-01-07),AWR,Mining,,,CAD,09-Sep-15,https://thecse.com/en/listings/mining/aurwest-resources-corporation-(formerly-was-srs/shamrock-enterprises-inc-until-2020-01-07),
38,Australis Capital Inc.,AUSA,Diversified Industries,US Cannabis,CSE Composite,CAD,19-Sep-18,https://thecse.com/en/listings/diversified-industries/australis-capital-inc,"AUSA invests in, operates and builds transformative, differentiated companies operating in highly regulated industries. Initially focused on investments in the cannabis industry including Body and Mind Inc., Quality Green, and Cocoon Technology, AUSA has expanded its business to offer proprietary unattended hardware and software technology to industries with the highest regulatory compliance standards along with supporting payment and fulfillment services. The globally available kiosk platforms are purpose-built in the cloud to deliver custom solutions in complex environments while emboldening customer confidence with features including data analytics, privacy, security and regulatory compliance.  The Platform-as-a-Service (PaaS) technology delivers recurring revenue through long-term exclusive agreements initially focused on regulated retail environments while portable and scalable to profitably support organic growth and complementary acquisition opportunities."
39,Auxico Resources Canada Inc.,AUAG,Mining,,,CAD,17-Oct-17,https://thecse.com/en/listings/mining/auxico-resources-canada-inc,"Auxico Resources Canada Inc. (“Auxico”) is a Canadian Company founded in 2014 and based in Montreal. Auxico is engaged in the acquisition, exploration and development of mineral properties in Mexico. Its current focus is to conduct the proposed exploration program on the Zamora Property, on which Auxico holds a 100% interest, along with continuing to identify and potentially acquire additional property interests and conduct exploration and evaluation of to assess their potential. "
40,Avarone Metals Inc. (formerly was AVM/Avarone Metals Inc. until 2020-04-14),AVM.X,Mining,,,CAD,01-Feb-16,https://thecse.com/en/listings/mining/avarone-metals-inc-(formerly-was-avm/avarone-metals-inc-until-2020-04-14),
41,Aylen Capital Inc.,AYL,Diversified Industries,,,CAD,04-Nov-15,https://thecse.com/en/listings/diversified-industries/aylen-capital-inc,"
	Aylen provides data collection services for companies through its Grapevine Solutions division."
42,Ayr Strategies Inc. Rts.,AYR.RT,Life Sciences,US Cannabis,,CAD,19-Aug-19,https://thecse.com/en/listings/life-sciences/ayr-strategies-inc-rts,
43,Ayr Strategies Inc. S.V.,AYR.A,Life Sciences,US Cannabis,CSE25,CAD,19-Aug-19,https://thecse.com/en/listings/life-sciences/ayr-strategies-inc-sv,
44,Ayr Strategies Inc. Wts.,AYR.WT,Life Sciences,US Cannabis,,CAD,19-Aug-19,https://thecse.com/en/listings/life-sciences/ayr-strategies-inc-wts,
45,BacTech Environmental Corporation,BAC,CleanTech,,,CAD,04-Sep-15,https://thecse.com/en/listings/cleantech/bactech-environmental-corporation,"BacTech Environmental Corporation was created as a result of the BacTech Mining Corporation Plan of Arrangement in December 2010. The Company uses its patented BACOX bioleaching technology to process toxic, arsenic-laden mine tailings. Bioleaching, in addition to stabilizing arsenic, oxidizes sulphides, thereby eliminating a major source of acid mine drainage, while also recovering precious and base metals from tailings for sale to market."
46,Bam Bam Resources Corp. (formerly was KOPR/KOPR Point Ventures Inc. until 2019-12-04),BBR,Mining,,CSE Composite,CAD,20-Dec-17,https://thecse.com/en/listings/mining/bam-bam-resources-corp-(formerly-was-kopr/kopr-point-ventures-inc-until-2019-12-04),
47,BC Craft Supply Co. Ltd. (formerly was CRFT/Pasha Brands Ltd. until 2020-05-15),CRFT,Life Sciences,Cannabis,CSE Composite,CAD,03-Jun-19,https://thecse.com/en/listings/life-sciences/bc-craft-supply-co-ltd-(formerly-was-crft/pasha-brands-ltd-until-2020-05-15),
48,Beleave Inc.,BE,Life Sciences,Cannabis,CSE Composite,CAD,31-Dec-15,https://thecse.com/en/listings/life-sciences/beleave-inc,"Beleave is a vertically-integrated Canadian cannabis company headquartered in Oakville, Ontario, that operates streamlined facilities throughout Canada to cultivate high-quality cannabis flower, oil, and extracts with funded capacity in excess of 150,000 kg per year. Fully-licensed to cultivate and sell medical and recreational cannabis, Beleave is leading the way through research partnerships with universities to bridge the gap between science and tradition and to develop pharma-grade extracts and derivatives. Beleave is currently developing new product lines for October 2019 as the recreational market is expected to allow for food and beverage-based cannabis products. Beleave is growing its storefront and online sales presence rapidly through its wholly-owned subsidiaries, Beleave Kannabis Corp. and Seven Oaks, which are licensed for medicinal and recreational sales respectively. The company’s first retail location is opening this fall in Llyodminster, Saskatchewan. Beleave has also developed a network of medical cannabis clinics in Ontario and Quebec under the Medi-Green banner. Through its majority ownership of Procannmed S.A.S., Beleave has access to 60 hectares of outdoor grow space and is fully licensed to cultivate, produce, extract and distribute medical cannabis in Colombia to capitalize on exports and the expanding Latin American market.  "
49,Belgravia Hartford Capital Inc. (formerly was BLGV/Belgravia Capital International Inc. until 2019-12-20),BLGV,Diversified Industries,Cannabis,,CAD,23-Nov-17,https://thecse.com/en/listings/diversified-industries/belgravia-hartford-capital-inc-(formerly-was-blgv/belgravia-capital-international-inc-until-2019-12-20),
50,Benchmark Botanics Inc.,BBT,Life Sciences,Cannabis,CSE Composite,CAD,03-Nov-17,https://thecse.com/en/listings/life-sciences/benchmark-botanics-inc,"Benchmark Botanics Inc. is a licensed producer of medical dried cannabis at its facility in Peachland, British Columbia. Through its 100-per-cent-owned subsidiary, Potanicals Green Growers Inc. (""Potanicals""), Benchmark received a production and cultivation license in October 2017 and a sales license from Health Canada in July 2019. The Health Canada sales license allows Benchmark to supply and sell finished cannabis products to provincial governments throughout Canada and through Canada's distribution and retail supply chain. Benchmark is providing recreational and medical dried cannabis, and will be providing capsules and other forms of cannabis products . As part of its expansion strategy Benchmark through its wholly-owned subsidiary and licensed producer Potanicals , has received its second cultivation license, effectively November 29, 2019, from Health Canada for the Company's joint venture greenhouse operations located in Pitt Meadows, BC."
