,Company,Symbol,Industry,Identifier,Indices,Currency,Trading,urls,description
316,Luff Enterprises Ltd. (formerly was ASNT/Ascent Industries Corp. until 2020-05-19),LUFF,Life Sciences,US Cannabis,CSE Composite,CAD,09-Aug-18,https://thecse.com/en/listings/life-sciences/luff-enterprises-ltd-(formerly-was-asnt/ascent-industries-corp-until-2020-05-19),
317,Luxxfolio Holdings Inc.,LUXX,Technology,Blockchain,,CAD,06-May-19,https://thecse.com/en/listings/technology/luxxfolio-holdings-inc,"LUXXFOLIO Holdings Inc. is a financial technology company that is focused on the development of a permissioned based distributed ledger platform (the “Platform”) to enable an organization or individual to authenticate, secure, and track via a highly secure verifiable ledger their digital based assets, contracts and documents or physical based assets such as luxury or collector goods, and other unique products (“Uniquely Identified Assets” or “UIA”). The Platform aims to provide a secure and reliable place to authenticate and track UIA, and provide the ability to monetize or securitize these assets."
318,Mag One Products Inc.,MDD,Diversified Industries,,,CAD,02-Sep-15,https://thecse.com/en/listings/diversified-industries/mag-one-products-inc,"Mag One Products Inc (MOPI) is not an exploration company as its principal business is the development and commercialization of technologies for the processing and production of magnesium (Mg) metal, Mg-related compounds, by-products and co-products from already mined, above ground serpentinite tailings.  MOPI’s goal is to become the lowest cost producer of Mg metal in the world by producing Mg at a price equivalent to Aluminum.  Mag One’s potential is evidenced by the fact that it has received support from both the Federal and Provincial governments and is in the process of negotiating further support."
319,Major Precious Metals Corp. (formerly was EZNC/Eastern Zinc Corp. until 2020-06-19),SIZE,Mining,,CSE Composite,CAD,04-Sep-18,https://thecse.com/en/listings/mining/major-precious-metals-corp-(formerly-was-eznc/eastern-zinc-corp-until-2020-06-19),
320,Makara Mining Corp.,MAKA,Mining,,,CAD,04-May-20,https://thecse.com/en/listings/mining/makara-mining-corp,"The company is a mineral exploration company focused on the acquisition, exploration and development of gold properties. The company is based in Vancouver, BC."
321,Manning Ventures Inc.,MANN,Mining,,,CAD,25-Oct-19,https://thecse.com/en/listings/mining/manning-ventures-inc,"
	The Company is a mineral exploration Company and its principal business is the acquisition and exploration of mineral properties, with a focus on the Yukon Territory, Canada."
322,Marble Financial Inc. (formerly was MRBL/MLI Marble Lending Inc. until 2019-11-18),MRBL,Diversified Industries,,CSE Composite,CAD,21-Mar-19,https://thecse.com/en/listings/diversified-industries/marble-financial-inc-(formerly-was-mrbl/mli-marble-lending-inc-until-2019-11-18),
323,Mariner Resources Corp.,RNR,Mining,,,CAD,03-Jun-19,https://thecse.com/en/listings/mining/mariner-resources-corp,"
	Mariner Resources Corp. is a mineral exploration company focused on the exploration and development of the Silver Dollar Property, located within the Revelstoke Mining Division."
324,Marret High Yield Strategies Fund A,MHY.UN,Diversified Industries,,,CAD,28-Jun-16,https://thecse.com/en/listings/diversified-industries/marret-high-yield-strategies-fund-a,
325,Marret Multi-Strategy Income Fund A,MMF.UN,Diversified Industries,,,CAD,28-Jun-16,https://thecse.com/en/listings/diversified-industries/marret-multi-strategy-income-fund-a,
326,Matica Enterprises Inc.,MMJ,Life Sciences,Cannabis,CSE Composite,CAD,01-Sep-15,https://thecse.com/en/listings/life-sciences/matica-enterprises-inc,"
	MATICA ENTERPRISES INC. is a Canadian publicly traded company focused on the Canadian Cannabis sector. Matica’s RoyalMax Biotechnology Canada Inc. has been granted a cultivation licence from Health Canada and is currently growing cannabis on Montreal’s west island. Matica is also building a 200,000 square foot greenhouse in the township of Hemmingford, just south of Montreal. Matica is planning for 1,000,000 square feet of greenhouses and for 25 acres of outdoor growing of cannabis on the 181 acre Hemmingford property.  In addition to growing cannabis Matica is expanding into alternative cannabis delivery systems beginning with proprietary topicals creams using a mineral clay suspension technology which would provide a time released delivery. Recent developments in the regulation of cannabis have brought new opportunities to the Canadian marketplace and Matica will grow as the regulations unfold.  "
327,Maxtech Ventures Inc.,MVT,Diversified Industries,,CSE Composite,CAD,08-Sep-15,https://thecse.com/en/listings/diversified-industries/maxtech-ventures-inc,Maxtech Ventures is a diversified investment corporation.
328,McLaren Resources Inc.,MCL,Mining,,,CAD,20-Nov-15,https://thecse.com/en/listings/mining/mclaren-resources-inc,McLaren Resources Inc. is based in Toronto and is engaged in the gold exploration business. McLaren's experienced management team is exploring gold deposits from its operating base located in the Timmins Gold camp.
329,ME Resource Corp.,MEC,Mining,,,CAD,18-Sep-15,https://thecse.com/en/listings/mining/me-resource-corp,"
	ME Resource Corp. is a Canadian exploration company focused on the acquisition, exploration and development of resource properties. The Company's objective is to explore and develop its current assets and pursue additional acquisitions. The Corporation intends to acquire a portfolio of properties through project acquisitions, joint ventures and alliances. MEC is developing propriety micro-refinery technology that will process raw natural gas into Engineered FuelTM and Clean Power."
330,Media Central Corporation Inc,FLYY,Diversified Industries,,CSE Composite,CAD,28-Oct-19,https://thecse.com/en/listings/diversified-industries/media-central-corporation-inc,"Media Central Corporation Inc. is an independent and alternative media company situated to acquire and develop high-quality publishing assets, starting with the recent launch of CannCentral.com, a robust news, lifestyle and community cannabis platform curated for the human experience."
331,MedMen Enterprises Inc. Class B Subordinate Voting Shares,MMEN,Life Sciences,US Cannabis,CSE25,CAD,29-May-18,https://thecse.com/en/listings/life-sciences/medmen-enterprises-inc-class-b-subordinate-voting-shares,"MedMen Enterprises is a leading cannabis company in the U.S. with assets and operations across the country. Based in Los Angeles, MedMen brings expertise and capital to the cannabis industry and is one of the nation’s largest financial supporters of progressive marijuana laws."
332,MedMen Enterprises Inc. Wts.,MMEN.WT,Life Sciences,US Cannabis,,CAD,27-Sep-18,https://thecse.com/en/listings/life-sciences/medmen-enterprises-inc-wts,
333,MedXtractor Corp.,MXT,Life Sciences,Cannabis,,CAD,24-Oct-19,https://thecse.com/en/listings/life-sciences/medxtractor-corp,"The Corporation is a Calgary-based company that manufactures patented, proprietary small-scale carbon dioxide-based extractors that are used to extract essential oils and compounds from a variety of botanical materials. At present, the Corporation targets the ""Craft"" cannabis grower. Craft growers are those whose crop is up to 800 indoor-sized plants per crop cycle. In management's opinion, CO2 Extractors represent the state-of-the-art for high-potency, high-purity oils, one of the fastest growing segments of the overall cannabis market. Cannabis oils can be extracted from flowers (bud), trim (leaves) and/or post-pressed rosin ""chips"" (leftovers from hydraulic press extraction). The ongoing worldwide legalization of cannabis is underpinning the rapidly growing demand for cannabis products with major growth seen in oils due to their utility as feedstock for various ingestion methods. The Corporation owns the patents on its CO2 Extractors."
334,MegumaGold Corp,NSAU,Mining,,CSE Composite,CAD,19-Jan-18,https://thecse.com/en/listings/mining/megumagold-corp,"MegumaGold is a Canadian junior gold exploration company engaged in the business of acquiring, exploring and developing natural resource properties. During 2018, the Company has centered its exploration focus on the developing Meguma formation of Nova Scotia. As a result, the Company has assembled a strategically-positioned tenure of 180,754 hectares within the Meguma Gold District."
335,Meryllion Resources Corporation (formerly was MYR/Meryllion Resources Corporation until 2020-06-04),MYR.X,Mining,,,CAD,01-Sep-15,https://thecse.com/en/listings/mining/meryllion-resources-corporation-(formerly-was-myr/meryllion-resources-corporation-until-2020-06-04),
336,Metalo Manufacturing Inc.,MMI,Diversified Industries,,,CAD,17-Dec-15,https://thecse.com/en/listings/diversified-industries/metalo-manufacturing-inc,"<em>Metalo Manufacturing Inc. (MMI) is the largest shareholder in two advanced development assets where, collectively, more than $40 million has been invested in assessing and defining market solutions. One asset has a Bankable Feasibility Study and the other a Preliminary Economic Assessment.</em>"
337,Metamaterial Inc.,MMAT,Technology,,CSE Composite,CAD,09-Mar-20,https://thecse.com/en/listings/technology/metamaterial-inc,"META is changing the way we use, interact and benefit from light. META designs and manufactures advanced materials and performance functional films which are engineered at the nanoscale to control light and electromagnetic waves. META is currently developing new materials with diverse applications in the automotive, aerospace, consumer electronics and medical industries. META has a growing patent portfolio with three core technologies holographic, lithographic and wireless sensing, designed for high volume applications. META is headquartered in Halifax, Nova Scotia and has offices in London, UK and Pleasanton, California."
338,MGX Minerals Inc C Wts,XMG.WT.C,Mining,,,CAD,26-Oct-18,https://thecse.com/en/listings/mining/mgx-minerals-inc-c-wts,
339,MGX Minerals Inc.,XMG,Mining,,CSE Composite,CAD,02-Sep-15,https://thecse.com/en/listings/mining/mgx-minerals-inc,"MGX Minerals Inc. is a diversified Canadian mining company engaged in the development of large-scale industrial mineral portfolios in western Canada and the United States. The Company operates lithium, magnesium and silicon projects throughout British Columbia and Alberta as well as petro lithium exploration in Utah."
340,MGX Minerals Inc. B Wts.,XMG.WT.B,Mining,,,CAD,25-Jun-18,https://thecse.com/en/listings/mining/mgx-minerals-inc-b-wts,
341,Mich Resources Ltd (formerly was MICH/Michelin Mining Corp. until 2019-12-03),MICH,Mining,,CSE Composite,CAD,19-Jun-19,https://thecse.com/en/listings/mining/mich-resources-ltd-(formerly-was-mich/michelin-mining-corp-until-2019-12-03),
342,Micromem Technologies Inc.,MRM,Technology,,CSE Composite,CAD,02-Sep-15,https://thecse.com/en/listings/technology/micromem-technologies-inc,"MICROMEM TECHNOLOGIES INC. is a leader in Sensor Technology. Currently Micromem is focused on magnetic sensor applications through its wholly owned subsidiary, Micromem Applied Sensor Technologies, Inc. (MAST, Inc.)(www.mastinc.com). The core technology has a combination of superior sensitivity, robust structure, cost effectiveness and small size enabling a wide variety of applications within each industry sector, spanning Automotive, Oil & Gas and Utility companies. MAST, Inc. clients include Fortune 500 companies. Working with clients to solve unmet needs in their respective industries, Micromem has successfully delivered client approved prototypes. MAST, Inc. will now work directly with clients to move from approved prototype to production versions of patented solutions. Micromem holds a broad-based patent portfolio with patents claiming priority in the field going back to 1995."
343,Micron Waste Technologies Inc,MWM,Technology,Cannabis,,CAD,26-Oct-17,https://thecse.com/en/listings/technology/micron-waste-technologies-inc,"Micron Waste Technologies Inc. is a leading organic waste technology company based in Canada. Micron Waste has developed and commercialized an on-site treatment system that can turn organic waste into clean water. Their research & development team has already produced solutions to handle organic waste generated by food distributors, quick service restaurants, and marijuana cultivators."
344,Minera IRL Limited,MIRL,Mining,,CSE Composite,CAD,03-Feb-17,https://thecse.com/en/listings/mining/minera-irl-limited,
345,Miramont Resources Corp.,MONT,Mining,,CSE Composite,CAD,27-Mar-17,https://thecse.com/en/listings/mining/miramont-resources-corp, 
346,Mistango River Resources Inc.,MIS,Mining,,CSE Composite,CAD,02-Sep-15,https://thecse.com/en/listings/mining/mistango-river-resources-inc,Mistango River Resources Inc. is a Kirkland Lake based resources exploration company focussing on increasing shareholder value by exploring and development of precious metals and VMS hosted base metals with precious metals content. The company holds several properties in Ontario and Quebec and is presently focussing on the Omega and Sackville properties in Ontario.
347,"MJardin Group, Inc.",MJAR,Life Sciences,US Cannabis,CSE Composite,CAD,15-Nov-18,"https://thecse.com/en/listings/life-sciences/mjardin-group,-inc",
348,Modern Meat Inc.,MEAT,Diversified Industries,,,CAD,30-Jun-20,https://thecse.com/en/listings/diversified-industries/modern-meat-inc,"Modern Meat is a plant-based meat alternative company based in Vancouver, British Columbia. The Company develops a portfolio of nutritious, gourmet vegan food crafted from natural ingredients. All products are chef curated with proprietary recipes that are free of soy, gluten, nuts and gmo’s.  Modern Meat’s mission is to change the way food is produced and consumed for the benefit of people, animals and the environment."
349,Mojave Jane Brands Inc.,JANE,Life Sciences,Cannabis,,CAD,15-Sep-17,https://thecse.com/en/listings/life-sciences/mojave-jane-brands-inc,"Mojave Jane Brands Inc. is a Canadian-based company. Historically, the Company’s main activities have focused on the cannabis industry.   Currently going through a strategic review, Mojave Jane intends to generate shareholder value through recapitalization and investment in or the vending in of revenue generating assets."
350,Mongoose Mining Ltd.,MNG,Mining,,,CAD,29-Nov-19,https://thecse.com/en/listings/mining/mongoose-mining-ltd,Mongoose Mining Ltd. is engaged in the business of mineral exploration and the acquisition of mineral property assets in British Columbia. Its objective is to locate and develop economic precious and base metal properties of merit.
351,Montego Resources Inc. (formerly was MY/Montego Resources Inc. until 2020-07-07),MY.X,Mining,,,CAD,27-Nov-15,https://thecse.com/en/listings/mining/montego-resources-inc-(formerly-was-my/montego-resources-inc-until-2020-07-07),
352,Monterey Minerals Inc.,MREY,Mining,,,CAD,05-Feb-19,https://thecse.com/en/listings/mining/monterey-minerals-inc,"Monterey Minerals is a mineral exploration company focused on its 992 sq.km. of prospective ground on the eastern flank of the Pilbara Basin in Western Australia.  The Company has a total of sixteen tenements, including 140 sq. km. which abuts Pacton Gold’s tenement where gold-bearing conglomerates were identified.  The Company also owns the Cobalt Mountain Project (the “Project”), near Smithers, BC.  The Company’s NI 43-101, on SEDAR, notes historic sampling at the Project that returned mineralized showings of gold, silver, copper, zinc and cobalt."
353,Mota Ventures Corp.,MOTA,Life Sciences,Cannabis,CSE Composite,CAD,04-Dec-19,https://thecse.com/en/listings/life-sciences/mota-ventures-corp,"Mota Ventures Corp. is a Vancouver-based cannabis company with a wholly-owned subsidiary in Colombia that holds a license to cultivate and process non-psychoactive cannabis. The Company plans to complete a 60,000 square foot cultivation facility as well as a GMP EU compliant extraction lab which will produce CBD products for the Colombian and European markets."
354,Mountain Valley MD Holdings Inc.,MVMD,Life Sciences,,CSE Composite,CAD,02-Mar-20,https://thecse.com/en/listings/life-sciences/mountain-valley-md-holdings-inc,"Mountain Valley MD Holdings Inc., through its subsidiary Mountain Valley MD Inc. (“MVMD”) is building a health and wellness organization centred around the implementation of patented oral delivery technologies to create industry leading products that are sought out globally. MVMD’s proposition for delivering formulations that have rapid onset, with high bioavailability, with precision dosing technology, will be core to our success across key health and wellness categories."
355,MPV Exploration Inc,MPV,Mining,,,CAD,03-May-18,https://thecse.com/en/listings/mining/mpv-exploration-inc,
356,MPX International Corporation,MPXI,Life Sciences,Cannabis,CSE Composite,CAD,04-Feb-19,https://thecse.com/en/listings/life-sciences/mpx-international-corporation,"Focused on developing and operating assets across the global cannabis industry with an emphasis on cultivating, manufacturing and marketing products that include cannabinoids as their primary active ingredient."
357,MustGrow Biologics Corp.,MGRO,Life Sciences,US Cannabis,CSE Composite,CAD,10-Jul-19,https://thecse.com/en/listings/life-sciences/mustgrow-biologics-corp,"MustGrow is an agricultural biotech company focused on developing and commercializing a portfolio of patented natural bio-pesticides and bio-fertilizers, including its patented signature mustard-derived biologics. Targeting the fruit and vegetable and the cannabis industries, MustGrow has designed a US EPA and Canadian PMRA approved organic solution that uses the mustard seed’s natural defense mechanisms to protect plants from pests and diseases."
358,Mydecine Innovations Group Inc. (formerly was NLB/NewLeaf Brands Inc. until 2020-06-04),MYCO,Life Sciences,US Cannabis,CSE25,CAD,02-Sep-15,https://thecse.com/en/listings/life-sciences/mydecine-innovations-group-inc-(formerly-was-nlb/newleaf-brands-inc-until-2020-06-04),
359,MYM Nutraceuticals Inc.,MYM,Life Sciences,Cannabis,CSE Composite,CAD,02-Sep-15,https://thecse.com/en/listings/life-sciences/mym-nutraceuticals-inc,"MYM Nutraceuticals Inc. is a company that has applied to become a Licensed Producer under Canada’s Marihuana for Medical Purposes Regulations. The company has an extensive list of industry assets that make it well prepared for commercial distribution of medical marijuana, including a growing facility property, exclusive access to patients and many years of industry expertise on the company’s board of directors and staff."
360,Myriad Metals Corp.,MMC,Mining,,,CAD,05-Nov-19,https://thecse.com/en/listings/mining/myriad-metals-corp,"Myriad Metals Corp. is a Vancouver-based mineral exploration company currently focused on the exploration of its Millen Mountain Property located in Nova Scotia, Canada."
361,Nabis Holdings Inc.,NAB,Diversified Industries,US Cannabis,,CAD,15-Sep-15,https://thecse.com/en/listings/diversified-industries/nabis-holdings-inc,"Innovative Properties Inc. (d/b/a Nabis Holdings) manages its equity stock portfolio and investments in public and private companies across different industries. The Company was incorporated in 2002 and is headquartered in Toronto, Canada."
362,Nabis Holdings Inc. 8% 26MAR22,NAB.DB,Diversified Industries,US Cannabis,,CAD,29-Jul-19,https://thecse.com/en/listings/diversified-industries/nabis-holdings-inc-8%-26mar22,
363,Nabis Holdings Inc. Wts.,NAB.WT,Diversified Industries,US Cannabis,,CAD,29-Jul-19,https://thecse.com/en/listings/diversified-industries/nabis-holdings-inc-wts,
364,NameSilo Technologies Corp.,URL,Technology,,CSE Composite,CAD,01-Sep-15,https://thecse.com/en/listings/technology/namesilo-technologies-corp,"
	Brisio Innovations Inc. invests its capital in companies and opportunities which management believes are undervalued and have potential for significant appreciation.  Brisio recently acquired NameSilom, LLC, which is a low-cost provider of domain name registration and management services, and is an ICANN-accredited registrar.  NameSilo is a high growth registrar with over 1.85 million domains under management, and over 85,000 customers from approximately 160 countries."
365,NanoSphere Health Sciences Inc.,NSHS,Life Sciences,US Cannabis,,CAD,05-Dec-17,https://thecse.com/en/listings/life-sciences/nanosphere-health-sciences-inc,"
	NanoSphere Health Sciences is a biotechnology company that has developed and is commercializing its patented NanoSphere Delivery System™, a ground breaking platform using nanotechnology for the delivery of biological agents such as cannabinoids, supplements, nutraceuticals and over-the-counter medications for the cannabis, pharmaceutical and animal health industries, and beyond.  The NanoSphere Delivery System™ provides improved bioavailability, efficacy and onset of effect over traditional delivery systems, and represents one of the most important developments for advancing the non-invasive and user-friendly delivery of biological agents in over 25 years. 
	 
	Under the brand name “Evolve”, NanoSphere has already launched its acclaimed NanoSerum™  product for the recreational and medical cannabis markets in Colorado, and will build on that success by opening new markets for Evolve and developing and commercializing new applications for NanoSerum™."
366,Nass Valley Gateway Ltd.,NVG,Life Sciences,US Cannabis,CSE Composite,CAD,29-Mar-19,https://thecse.com/en/listings/life-sciences/nass-valley-gateway-ltd,
367,Nerds On Site Inc.,NERD,Technology,,,CAD,28-Nov-18,https://thecse.com/en/listings/technology/nerds-on-site-inc,"
	Nerds on Site Inc. (""NOS"") is a mobile IT technology solutions company. NOS boasts strong and growing Nerd-force of 125 technicians contractors servicing 13,000-14,000 Clients annually, with over 160,000 Clients served to date. Operations are handled by online, on-tablet mobile operating system called ""I am A Nerd or IAAN"". IAAN handles majority of day to day admin tasks autonomously bringing almost unlimited scalability, and keeps Nerds up to date through University of Nerdology. "
368,NetCents Technology Inc.,NC,Technology,Blockchain,CSE Composite,CAD,09-Mar-16,https://thecse.com/en/listings/technology/netcents-technology-inc,NetCents Technology Inc. is an electronic online Payment Service Provider. It offers clients and merchants online services for managing electronic payments by a variety of payment methods through its processing platform.
369,Netcoins Holdings Inc. (formerly was NETC/Netcoins Holdings Inc. until 2019-11-12),NETC.X,Technology,,,CAD,14-Mar-18,https://thecse.com/en/listings/technology/netcoins-holdings-inc-(formerly-was-netc/netcoins-holdings-inc-until-2019-11-12),
370,New Leaf Ventures Inc.,NLV,Life Sciences,Cannabis,,CAD,01-May-20,https://thecse.com/en/listings/life-sciences/new-leaf-ventures-inc,"The Issuer will provide consulting services, real property, intellectual property, equipment for lease and enhanced ancillary services to a licensed cannabis producer and processor."
371,New Tech Minerals Corp.,NTM,Mining,,,CAD,01-Sep-15,https://thecse.com/en/listings/mining/new-tech-minerals-corp,"New Tech Minerals Corp. has been exploring for Potash and associated brines including, Lithium in the Paradox Basin of SE Utah (UT), USA for over eight years. The company is also exploring for Cobalt and Vanadium in Nevada and Missouri."
372,New Wave Holdings Corp. (formerly was NWES/New Wave Esports Corp. until 2020-05-07),SPOR,Technology,,CSE Composite,CAD,28-Oct-19,https://thecse.com/en/listings/technology/new-wave-holdings-corp-(formerly-was-nwes/new-wave-esports-corp-until-2020-05-07),
373,New Wave Holdings Corp. Wts. (formerly was NWES.WT/New Wave Esports Corp. Wts. until 2020-05-07),SPOR.WT,,,,CAD,28-Oct-19,,
374,Newlox Gold Ventures Corp.,LUX,CleanTech,,,CAD,02-Sep-15,https://thecse.com/en/listings/cleantech/newlox-gold-ventures-corp,Newlox Gold Ventures Corp. is an environmental remediation company recovering contaminants and residual precious metals from historical waste left behind over more than a century of inefficient artisanal and small-scale mining in politically and socially stable jurisdictions in Latin America.
375,Nexco Resources Inc.,NXU,Mining,,,CAD,09-May-17,https://thecse.com/en/listings/mining/nexco-resources-inc,"Nexco Resources Inc. (“Nexco”) is a mineral resource company engaged in the acquisition, exploration and development of mineral resource properties. The sole mineral resource property interest of Nexco at the present time is the Berger-Golden Eagle Mineral property located near South Central British Columbia."
376,Next Green Wave Holdings Inc.,NGW,Life Sciences,US Cannabis,CSE Composite,CAD,10-Oct-18,https://thecse.com/en/listings/life-sciences/next-green-wave-holdings-inc,"The Company, through its subsidiary, intends to focus on its vertically integrated ""seed-to-sale"" operations in the City of Coalinga, California.   The Company holds Type R (Nursery Cultivation), Type 3A (Indoor Cultivation), Type 7 (Volatile Extraction) and Type 12 (Distribution) Conditional Use Permits that will enable it to produce, process, distribute and sell premium cannabis and cannabinoid infused products in the State of California.   "
