source,link_href,link_text,ticker
Motley Fool,/m/14688ebc-e168-3a21-a8cd-a31145e3533f/why-shares-of-acuityads-are.html,Why Shares of AcuityAds Are Down 23% Today,AT.TO
CNW Group,/news/acuityads-reports-third-quarter-2021-110000587.html,AcuityAds Reports Third Quarter 2021 Financial Results,AT.TO
Simply Wall St.,/news/weakness-acuityads-holdings-inc-tse-131940798.html,Should Weakness in AcuityAds Holdings Inc.'s (TSE:AT) Stock Be Seen As A Sign That Market Will Correct The Share Price Given Decent Financials?,AT.TO
Zacks,/news/acuityads-holdings-inc-aty-reports-190407206.html,AcuityAds Holdings Inc. (ATY) Reports Next Week: What You Should Expect,AT.TO
PR Newswire,/news/acuityads-announces-date-third-quarter-120000688.html,AcuityAds Announces Date for Third Quarter 2021 Financial Results Video Conference Call,AT.TO
Motley Fool,/m/36f57b00-7fef-329a-8ad1-1bbc61ec148e/got-1-000-4-stocks-to-buy.html,"Got $1,000? 4 Stocks to Buy Before Earnings",AT.TO
TipRanks,/news/3-strong-buy-stocks-under-134226339.html,3 “Strong Buy” Stocks Under $10 That Are Poised to Break Out,AT.TO
PR Newswire,/news/acuityads-named-globe-mails-third-123000357.html,AcuityAds Named to The Globe and Mail's Third-Annual Ranking of Canada's Top Growing Companies,AT.TO
Simply Wall St.,/news/investors-want-acuityads-holdings-tse-103620081.html,Investors Will Want AcuityAds Holdings' (TSE:AT) Growth In ROCE To Persist,AT.TO
PR Newswire,/news/acuityads-announces-appointment-interim-chief-120000030.html,AcuityAds Announces Appointment Of Interim Chief Financial Officer,AT.TO
CNW Group,/news/algonquin-power-utilities-corp-declares-223600652.html,"Algonquin Power & Utilities Corp. Declares Fourth Quarter 2021 Common Share Dividend of U.S.$0.1706 (C$0.2124), and Declares Fourth Quarter 2021 Preferred Share Dividends",AQN.TO
CNW Group,/news/algonquin-power-utilities-corp-announces-223600673.html,Algonquin Power & Utilities Corp. Announces 2021 Third Quarter Financial Results,AQN.TO
Zacks,/news/algonquin-power-utilities-aqn-reports-190107551.html,Algonquin Power & Utilities (AQN) Reports Next Week: Wall Street Expects Earnings Growth,AQN.TO
Simply Wall St.,/news/adding-algonquin-power-utilities-tse-120702515.html,Should You Be Adding Algonquin Power & Utilities (TSE:AQN) To Your Watchlist Today?,AQN.TO
CNW Group,/news/iiroc-trade-resumption-aqn-121600478.html,IIROC Trade Resumption - AQN,AQN.TO
GlobeNewswire,/news/algonquin-power-utilities-corp-announces-203800022.html,Algonquin Power & Utilities Corp. Announces Agreement to Acquire Kentucky Power Company and Concurrent Bought Deal Common Equity Financing,AQN.TO
PR Newswire,/news/aep-sell-kentucky-operations-liberty-203000863.html,"AEP To Sell Kentucky Operations To Liberty, Subsidiary Of Algonquin Power & Utilities",AQN.TO
CNW Group,/news/iiroc-trading-halt-aqn-202100182.html,IIROC Trading Halt - AQN,AQN.TO
Insider Monkey,/news/hedge-funds-piling-algonquin-power-153713034.html,Hedge Funds Are Piling Into Algonquin Power & Utilities Corp. (AQN),AQN.TO
PR Newswire,/news/algonquin-power-utilities-corp-announces-210000325.html,Algonquin Power & Utilities Corp. Announces Dates for Third Quarter 2021 Financial Results and Conference Call,AQN.TO
Yahoo Finance Video,/video/weed-legal-states-seeing-more-174323224.html,"Weed-legal states 'seeing more cannabis tax dollars than alcohol tax dollars,' Green Thumb CEO says",ACB.TO
Motley Fool,/m/ea9cf0ce-8f05-3f25-a1a5-1c2998248972/why-tilray-aurora-cannabis-.html,"Why Tilray, Aurora Cannabis, and Canopy Growth Stocks Just Popped",ACB.TO
Motley Fool,/m/6a802043-884e-38e8-9172-06a175ea13c7/why-curaleaf-aurora.html,"Why Curaleaf, Aurora Cannabis, and Hexo Shares Jumped Today",ACB.TO
Yahoo Finance Video,/video/cannabis-pendulum-swung-toward-legalization-174007236.html,"Cannabis: 'The pendulum has swung toward legalization,' Curaleaf CEO says",ACB.TO
Motley Fool,/m/f54cd971-aa60-36f0-afd4-55d27d918224/why-aurora-cannabis-canopy.html,"Why Aurora Cannabis, Canopy Growth, Tilray, and Sundial Growers Stocks Flamed Out on Wednesday",ACB.TO
MarketWatch,/m/61b66426-0533-389e-b73e-051c5981f88f/aurora-cannabis-shares-fall.html,Aurora Cannabis shares fall on revenue miss,ACB.TO
Motley Fool,/m/35a41d1e-f7f3-32c3-b35f-53ba22e7ec63/aurora-cannabis-inc-acb-q1.html,Aurora Cannabis Inc. (ACB) Q1 2022 Earnings Call Transcript,ACB.TO
Zacks,/news/aurora-cannabis-inc-acb-reports-010501301.html,"Aurora Cannabis Inc. (ACB) Reports Q1 Loss, Misses Revenue Estimates",ACB.TO
MarketWatch,/m/c189b236-0a04-33dc-b6f3-051e190e0def/aurora-cannabis-stock-dips-as.html,"Aurora Cannabis stock dips as earnings show another sales miss, but narrowing losses",ACB.TO
PR Newswire,/news/aurora-cannabis-announces-fiscal-2022-211500283.html,Aurora Cannabis Announces Fiscal 2022 First Quarter Results,ACB.TO
Yahoo Finance Video,/video/weed-legal-states-seeing-more-174323224.html,"Weed-legal states 'seeing more cannabis tax dollars than alcohol tax dollars,' Green Thumb CEO says",ACB.TO
Motley Fool,/m/ea9cf0ce-8f05-3f25-a1a5-1c2998248972/why-tilray-aurora-cannabis-.html,"Why Tilray, Aurora Cannabis, and Canopy Growth Stocks Just Popped",ACB.TO
Motley Fool,/m/6a802043-884e-38e8-9172-06a175ea13c7/why-curaleaf-aurora.html,"Why Curaleaf, Aurora Cannabis, and Hexo Shares Jumped Today",ACB.TO
Yahoo Finance Video,/video/cannabis-pendulum-swung-toward-legalization-174007236.html,"Cannabis: 'The pendulum has swung toward legalization,' Curaleaf CEO says",ACB.TO
Motley Fool,/m/f54cd971-aa60-36f0-afd4-55d27d918224/why-aurora-cannabis-canopy.html,"Why Aurora Cannabis, Canopy Growth, Tilray, and Sundial Growers Stocks Flamed Out on Wednesday",ACB.TO
MarketWatch,/m/61b66426-0533-389e-b73e-051c5981f88f/aurora-cannabis-shares-fall.html,Aurora Cannabis shares fall on revenue miss,ACB.TO
Motley Fool,/m/35a41d1e-f7f3-32c3-b35f-53ba22e7ec63/aurora-cannabis-inc-acb-q1.html,Aurora Cannabis Inc. (ACB) Q1 2022 Earnings Call Transcript,ACB.TO
Zacks,/news/aurora-cannabis-inc-acb-reports-010501301.html,"Aurora Cannabis Inc. (ACB) Reports Q1 Loss, Misses Revenue Estimates",ACB.TO
MarketWatch,/m/c189b236-0a04-33dc-b6f3-051e190e0def/aurora-cannabis-stock-dips-as.html,"Aurora Cannabis stock dips as earnings show another sales miss, but narrowing losses",ACB.TO
PR Newswire,/news/aurora-cannabis-announces-fiscal-2022-211500283.html,Aurora Cannabis Announces Fiscal 2022 First Quarter Results,ACB.TO
Simply Wall St.,/news/kind-shareholders-own-b2gold-corp-110909469.html,What Kind Of Shareholders Own B2Gold Corp. (TSE:BTO)?,BTO.TO
PR Newswire,/news/b2gold-corp-reports-continued-strong-070500083.html,"B2Gold Corp. Reports Continued Strong Total Gold Production for Q3 2021 of 310,261 oz,  7% Above Budget and 18% Higher than Q3 2020; Annual Production Guidance Range Increased to 1,015,000 to 1,055,000 oz",BTO.TO
CNW Group,/news/aurion-jv-partner-b2gold-provides-113000805.html,"Aurion JV Partner, B2Gold, Provides Notice to Exercise Option on Projects in Northern Finland",BTO.TO
Simply Wall St.,/news/b2golds-tse-bto-returns-heres-103855280.html,We Like B2Gold's (TSE:BTO) Returns And Here's How They're Trending,BTO.TO
CNW Group,/news/b2gold-updates-payment-date-third-201900077.html,B2Gold Updates Payment Date for Third Quarter 2021 Dividend,BTO.TO
PR Newswire,/news/b2gold-declares-third-quarter-2021-181800087.html,B2Gold Declares Third Quarter 2021 Dividend of $0.04 per share,BTO.TO
Zacks,/news/why-b2gold-btg-down-2-153103345.html,Why Is B2Gold (BTG) Down 2% Since Last Earnings Report?,BTO.TO
Zacks,/news/b2golds-btg-earnings-miss-estimates-124712532.html,"B2Gold's (BTG) Earnings Miss Estimates in Q2, Decline Y/Y",BTO.TO
Zacks,/news/b2gold-btg-lags-q2-earnings-004512922.html,B2Gold (BTG) Lags Q2 Earnings Estimates,BTO.TO
CNW Group,/news/b2gold-reports-strong-q2-2021-233600051.html,"B2Gold Reports Strong Q2 2021 Results with Continued Strong Total Gold Production of 211,612 oz, 5% Above Budget; On Track to Meet or Exceed the Upper End of its Annual Production Guidance Range of 970,000 to 1,030,000 oz",BTO.TO
Zacks,/news/bank-montreal-bmo-outperforming-other-161504359.html,Is Bank Of Montreal (BMO) Outperforming Other Finance Stocks This Year?,BMO.TO
CNW Group,/news/bmos-ula-ubani-recognized-one-161500728.html,BMO's Ula Ubani Recognized as One of Canada's Most Powerful Women: Top 100,BMO.TO
Bloomberg,/news/u-5-tops-1-2-141304830.html,Inflation Fears Wrack Bonds as Fed Seen Hiking Twice Next Year,BMO.TO
Bloomberg,/news/inflation-hits-4-4-canada-123501741.html,"Inflation Hits 4.4% in Canada, Deepening Central Bank Challenge",BMO.TO
CNW Group,/news/bmo-introduces-selfie-id-verification-124500746.html,BMO Introduces Selfie ID Verification to Enhance the Digital Customer Experience,BMO.TO
CNW Group,/news/bmo-global-asset-management-announces-123000441.html,BMO Global Asset Management Announces Cash Distributions for Certain BMO Exchange Traded Funds,BMO.TO
Bloomberg,/news/wood-mnuchin-rank-among-day-143000794.html,Mnuchin Is Investing in Blockchain -- Not Crypto: Milken Update,BMO.TO
CNW Group,/news/bmo-helps-teck-resources-advance-152700848.html,BMO Helps Teck Resources Advance ESG Goals with Sustainability-Linked Loan,BMO.TO
Bloomberg,/news/milken-conference-goes-live-person-170820825.html,"Milken Conference Goes Live, In Person and Virtually, After Covid Chaos",BMO.TO
Zacks,/news/bank-montreal-bmo-soars-52-131501787.html,"Bank of Montreal (BMO) Soars to 52-Week High, Time to Cash Out?",BMO.TO
PR Newswire,/news/blackberry-participate-upcoming-investor-conferences-120000432.html,BlackBerry to Participate in Upcoming Investor Conferences,BB.TO
Zacks,/news/blackberry-bb-gains-lags-market-215009461.html,BlackBerry (BB) Gains But Lags Market: What You Should Know,BB.TO
CNW Group,/news/blackberry-okta-partner-deliver-seamless-120000042.html,BlackBerry and Okta Partner to Deliver Seamless Identity and Access Capabilities,BB.TO
Benzinga,/news/elon-musks-net-worth-grew-202248352.html,Elon Musk's Net Worth Grew By The Value Of These 3 Companies Combined Today,BB.TO
Zacks,/news/blackberry-bb-stock-sinks-market-215009912.html,BlackBerry (BB) Stock Sinks As Market Gains: What You Should Know,BB.TO
Insider Monkey,/news/hedge-funds-dumping-blackberry-limited-180355374.html,Hedge Funds Are Dumping BlackBerry Limited (BB),BB.TO
CNW Group,/news/blackberry-named-newsweeks-list-most-120000171.html,BlackBerry Named to Newsweek's List of the Most Loved Workplaces for 2021,BB.TO
InvestorPlace,/news/blackberry-rise-nearly-35-free-202914269.html,Blackberry Can Rise Nearly 35% As Its Free Cash Flow Turns Positive,BB.TO
Zacks,/news/blackberry-bb-6-6-since-153003541.html,BlackBerry (BB) Up 6.6% Since Last Earnings Report: Can It Continue?,BB.TO
Investor's Business Daily,/m/7a61721c-1b1f-3257-9fd6-6c1ab575f5f9/is-blackberry-stock-a-buy-.html,"Is BlackBerry Stock A Buy? What Fundamentals, Fund Metrics, Chart Say",BB.TO
Motley Fool,/m/dc28d941-76ef-3378-8851-e9101ac32644/why-canada-goose-is-flying.html,Why Canada Goose Is Flying High Today,GOOS.TO
WWD,/news/canada-goose-short-canadian-supply-151252107.html,Canada Goose’s Short Canadian Supply Chain Pays Dividends,GOOS.TO
Benzinga,/news/canada-goose-shares-gain-solid-131544406.html,"Canada Goose Shares Gain On Solid Q2 Results, Upbeat FY22 Outlook",GOOS.TO
Bloomberg,/news/canada-goose-soars-outlook-ceo-130531512.html,Canada Goose Soars on Outlook; CEO Says Supply Chain Is Healthy,GOOS.TO
MarketWatch,/m/0924cfd6-e22c-3961-8a07-595753ecd0b6/canada-goose-shares-soar.html,"Canada Goose shares soar after surprise profit, raised guidance",GOOS.TO
TheStreet.com,/m/474b53a2-434e-32b5-8c6a-923d412da49e/canada-goose-shares-fly.html,Canada Goose Shares Fly Higher on Surprise Q2 Profit,GOOS.TO
Reuters,/news/canada-goose-beats-quarterly-revenue-105513939.html,"Canada Goose eyes strong holiday season on China demand, supply chain strength",GOOS.TO
Business Wire,/news/canada-goose-reports-results-second-104500570.html,Canada Goose Reports Results for Second Quarter Fiscal 2022 and Raises Fiscal 2022 Outlook,GOOS.TO
Investing.com,/news/peloton-draftkings-slump-premarket-pfizer-075620281.html,"Peloton, DraftKings Slump Premarket; Pfizer, Airbnb Rise",GOOS.TO
Business Wire,/news/canada-goose-announces-second-quarter-132100040.html,"Canada Goose Announces Second Quarter 2022 Earnings Release Date, Conference Call and Webcast",GOOS.TO
Yahoo Finance Video,/video/weed-legal-states-seeing-more-174323224.html,"Weed-legal states 'seeing more cannabis tax dollars than alcohol tax dollars,' Green Thumb CEO says",WEED.TO
Yahoo Finance Video,/video/cannabis-pendulum-swung-toward-legalization-174007236.html,"Cannabis: 'The pendulum has swung toward legalization,' Curaleaf CEO says",WEED.TO
Investor's Business Daily,/m/a72862de-cc5e-3ff8-aa5d-7e9bc39a83f6/any-reason-to-buy-canopy.html,Any Reason To Buy Canopy Growth After Brief Marijuana Stocks Rally?,WEED.TO
Investor's Business Daily,/m/6e8fb483-3ff2-3a41-8275-9e9949427873/are-any-marijuana-stocks-on.html,Are Any Marijuana Stocks On U.S. Exchanges Good Buys As Legislation Creeps Along?,WEED.TO
Benzinga,/news/cgc-earnings-veterans-initiatives-leading-184429671.html,"$CGC Earnings, Veterans Initiatives From Leading Cannabis Companies — Cannabis Daily November 5, 2021",WEED.TO
Barrons.com,/m/98fd85ff-dd65-3323-af31-ffaf4a6443cb/canopy-growth-stock-sinks-it.html,Canopy Growth Stock Sinks. It Will Take Longer to Achieve Profitability Than Expected.,WEED.TO
Bloomberg,/news/canopy-drops-consumer-pot-preferences-145157842.html,Canopy Drops as Consumer Pot Preferences Shift Amid Covid,WEED.TO
CNW Group,/news/canopy-growth-reports-second-quarter-110200535.html,Canopy Growth Reports Second Quarter Fiscal 2022 Financial Results,WEED.TO
CNW Group,/news/canopy-growths-deep-space-brand-120000216.html,Canopy Growth's Deep Space Brand Expands Product Offering with New 10mg THC-infused Beverage Flavour and 10mg THC-infused Deep Space XPRESS Gummies,WEED.TO
Zacks,/news/canopy-growth-corporation-cgc-expected-190007574.html,Canopy Growth Corporation (CGC) Expected to Beat Earnings Estimates: Should You Buy?,WEED.TO
GlobeNewswire,/news/cenovus-headwater-announce-closing-227-122300087.html,Cenovus and Headwater announce the closing of $227.5 million bought deal secondary offering of Headwater common shares,CVE.TO
Oilprice.com,/news/canada-oil-stocks-trading-bargain-170000995.html,Canada’s Oil Stocks Are Trading At Bargain Basement Prices,CVE.TO
Zacks,/news/cenovus-cve-jumps-30-7-153503723.html,Cenovus (CVE) Jumps 30.7% in 6 Months: More Room to Run?,CVE.TO
CNW Group,/news/cenovus-headwater-announce-increase-previously-130200993.html,Cenovus and Headwater announce increase to previously announced bought deal secondary offering of Headwater common shares,CVE.TO
CNW Group,/news/cenovus-headwater-announce-bought-deal-203400690.html,Cenovus and Headwater announce bought deal secondary offering of Headwater common shares worth approximately $114 million,CVE.TO
GlobeNewswire,/news/cenovus-announces-pricing-terms-pending-171900480.html,Cenovus announces the Pricing Terms of its Pending Maximum Tender Offer,CVE.TO
GlobeNewswire,/news/cenovus-announces-early-tender-results-122700324.html,Cenovus announces the Early Tender Results and Increase of its Pending Maximum Tender Offer,CVE.TO
GlobeNewswire,/news/cenovus-redeem-3-950-notes-120000323.html,"Cenovus to redeem its 3.950% notes due April 15, 2022 and 3.000% notes due August 15, 2022",CVE.TO
GlobeNewswire,/news/cenovus-announces-expiration-results-tender-232500161.html,Cenovus announces Expiration and Results of Any and All Tender Offer,CVE.TO
GlobeNewswire,/news/cenovus-announces-pricing-terms-pending-190400919.html,Cenovus announces the Pricing Terms of its Pending Any and All Tender Offer,CVE.TO
CNW Group,/news/cineplex-inc-reports-third-quarter-103000992.html,Cineplex Inc. Reports Third Quarter Results,CGX.TO
CNW Group,/news/updated-timing-cineplex-inc-announces-120000068.html,Updated Timing: Cineplex Inc. Announces Details of Third Quarter 2021 Earnings Release and Conference Call,CGX.TO
CNW Group,/news/cineplex-inc-announces-details-third-130000158.html,Cineplex Inc. Announces Details of Third Quarter 2021 Earnings Release and Conference Call,CGX.TO
CNW Group,/news/cineplex-launches-national-brand-campaign-120000988.html,"Cineplex Launches National Brand Campaign, Where Escape Begins, to Remind Canadians About the Magic of the Cinema Experience",CGX.TO
Yahoo Finance Video,/video/free-guy-dominates-weekend-box-161637093.html,"'Free Guy’ dominates weekend box office, raking in $18.8M",CGX.TO
CNW Group,/news/cineplex-inc-reports-second-quarter-101500957.html,Cineplex Inc. Reports Second Quarter Results,CGX.TO
CNW Group,/news/calling-big-screen-buffs-extra-113000746.html,"Calling All Big Screen Buffs and Extra Butter Lovers! Cineplex Launches CineClub™, Canada's First of Its Kind Movie Subscription Program for Just $9.99/Month",CGX.TO
CNW Group,/news/ready-bring-game-rec-room-130000192.html,Get Ready to Bring Your 'A' Game: The Rec Room Opens TODAY in Barrie!,CGX.TO
CNW Group,/news/cineplex-inc-announces-details-second-140000251.html,Cineplex Inc. Announces Details of Second Quarter 2021 Earnings Release and Conference Call,CGX.TO
CNW Group,/news/big-screen-back-ontario-moviegoers-170400585.html,THE BIG SCREEN IS BACK: Ontario Moviegoers Return to Cineplex Theatres Starting Next Friday,CGX.TO
GlobeNewswire,/news/converge-technology-solutions-corp-achieves-120000758.html,Converge Technology Solutions Corp. Achieves AWS Migration Competency Status,CTS.TO
GlobeNewswire,/news/converge-technology-solutions-corp-announces-133000325.html,Converge Technology Solutions Corp. Announces the Closing of Portage CyberTech Non Brokered Private Placement,CTS.TO
GlobeNewswire,/news/converge-technology-solutions-corp-acquires-130000145.html,Converge Technology Solutions Corp. Acquires LPA Software Solutions,CTS.TO
PR Newswire,/news/converge-technology-solutions-corp-awarded-200000481.html,Converge Technology Solutions Corp. Awarded 2021 Ingram Micro Cloud Reseller Partner of the Year,CTS.TO
CNW Group,/news/p-dow-jones-indices-announces-211500521.html,S&P Dow Jones Indices Announces Changes to the S&P/TSX Composite Index,CTS.TO
CNW Group,/news/converge-technology-solutions-corp-announces-130500469.html,Converge Technology Solutions Corp. Announces Closing of Previously Announced Bought Deal Financing and Exercise of Over-Allotment Option,CTS.TO
PR Newswire,/news/converge-technology-solutions-corp-completes-211600367.html,Converge Technology Solutions Corp. Completes Acquisition of Vicom Infinity and Infinity Systems Software,CTS.TO
CNW Group,/news/converge-technology-solutions-corp-announces-133300637.html,Converge Technology Solutions Corp. Announces Upsize to Previously Announced Bought Deal Financing,CTS.TO
CNW Group,/news/converge-technology-solutions-corp-announces-203400571.html,Converge Technology Solutions Corp. Announces $150 Million Bought Deal Financing,CTS.TO
CNW Group,/news/converge-technology-solutions-reports-second-200000980.html,Converge Technology Solutions Reports Second Quarter 2021 Financial Results,CTS.TO
CNW Group,/news/dye-durham-reports-first-quarter-213000523.html,Dye & Durham Reports First Quarter Fiscal 2022 Financial Results,DND.TO
CNW Group,/news/dye-durham-host-first-quarter-190000548.html,Dye & Durham to Host First Quarter Fiscal 2022 Conference Call,DND.TO
CNW Group,/news/dye-durhams-non-uk-business-130000539.html,Dye & Durham's non-UK business activities released from the United Kingdom's Competition and Markets Authority's Initial Enforcement Order,DND.TO
Bloomberg,/news/software-firm-dye-durham-rejects-120042158.html,Dye & Durham Falls After Rejecting $2.8 Billion Buyout Offer,DND.TO
CNW Group,/news/dye-durham-announces-recapitalization-credit-103500921.html,Dye & Durham Announces a Recapitalization of its Credit Facilities and Provides a Corporate Update,DND.TO
CNW Group,/news/dye-durham-announces-completion-special-103000916.html,Dye & Durham Announces Completion of Special Committee Process,DND.TO
CNW Group,/news/dye-durham-declares-quarterly-dividend-120000629.html,Dye & Durham Declares Quarterly Dividend Payment,DND.TO
CNW Group,/news/dye-durham-provides-united-kingdoms-100000407.html,Dye & Durham Provides Update on the United Kingdom's Competition and Markets Authority's Initial Enforcement Order in Respect of TM Group Acquisition,DND.TO
CNW Group,/news/united-kingdoms-competition-markets-authority-110000248.html,The United Kingdom's Competition and Markets Authority to Issue Initial Enforcement Order in Respect of TM Group Acquisition,DND.TO
CNW Group,/news/dye-durham-reports-fourth-quarter-203000141.html,Dye & Durham Reports Fourth Quarter and Fiscal Year 2021 Financial Results,DND.TO
Motley Fool,/m/c95f9d98-c92b-3753-9c71-6e550df3950a/2-dividend-aristocrats-that.html,2 Dividend Aristocrats That Could Announce Generous Rate Hikes in December,ENB.TO
News Direct,/news/enbridge-pledges-net-zero-emissions-201607698.html,Enbridge Pledges Net-Zero Emissions by 2050,ENB.TO
Bloomberg,/news/white-house-says-isn-t-192442895.html,White House Says It Isn’t Considering Enbridge Pipeline Shutdown,ENB.TO
Reuters,/news/canada-stocks-tsx-posts-record-215246493.html,CANADA STOCKS-TSX posts record high as defensive stocks pick up the baton,ENB.TO
Reuters,/news/1-white-house-u-not-194431612.html,UPDATE 2-White House: U.S. is not considering shutting down Enbridge's Line 5 pipeline,ENB.TO
Reuters,/news/white-house-u-not-considering-193935777.html,White House: U.S. is not considering shutting down Enbridge's Line 5 pipeline,ENB.TO
Bloomberg,/news/white-house-awaits-enbridge-pipeline-214914878.html,White House Awaits Enbridge Pipeline Review Before Decision,ENB.TO
News Direct,/news/innovative-thermal-thinking-powers-project-173108097.html,Innovative Thermal Thinking Powers This Project,ENB.TO
Motley Fool,/m/746ff41f-e235-3db1-a1f5-97fc660fd30a/enbridge-enb-q3-2021.html,Enbridge (ENB) Q3 2021 Earnings Call Transcript,ENB.TO
CNW Group,/news/enbridge-reports-strong-third-quarter-110100540.html,"Enbridge Reports Strong Third Quarter 2021 Results, Executing on Business Priorities",ENB.TO
GlobeNewswire,/news/enthusiast-gaming-reports-third-quarter-211500191.html,Enthusiast Gaming Reports Third Quarter 2021 Results,EGLX.TO
Simply Wall St.,/news/those-invested-enthusiast-gaming-holdings-105408603.html,Those who invested in Enthusiast Gaming Holdings (TSE:EGLX) a year ago are up 125%,EGLX.TO
GlobeNewswire,/news/enthusiast-gaming-unveils-two-events-110000488.html,Enthusiast Gaming Unveils Two Events: Pocket Gamer Connects Digital NEXT and Beyond Games,EGLX.TO
GlobeNewswire,/news/enthusiast-gaming-announce-third-quarter-123000457.html,"Enthusiast Gaming to Announce Third Quarter Financial Results on November 10, 2021",EGLX.TO
GlobeNewswire,/news/enthusiast-gaming-announces-updates-addicting-110000820.html,Enthusiast Gaming Announces Updates For Addicting Games,EGLX.TO
GlobeNewswire,/news/enthusiast-gaming-launches-project-gg-110000216.html,Enthusiast Gaming Launches Project GG Alpha,EGLX.TO
GlobeNewswire,/news/ceo-presenting-emerging-growth-conference-110000954.html,CEO Presenting on the Emerging Growth Conference on September 15.  Register Now,EGLX.TO
GlobeNewswire,/news/enthusiast-gaming-acquires-addicting-games-110000108.html,"Enthusiast Gaming Acquires Addicting Games, Enters Casual Gaming Market",EGLX.TO
GlobeNewswire,/news/enthusiast-gaming-announces-acquisition-gameknot-110000159.html,Enthusiast Gaming Announces Acquisition of GameKnot,EGLX.TO
GlobeNewswire,/news/enthusiast-gaming-collaborates-nielsen-verify-110000686.html,Enthusiast Gaming Collaborates with Nielsen to Verify Esports Audience,EGLX.TO
GlobeNewswire,/news/goodfood-report-fourth-quarter-fiscal-120000204.html,Goodfood to Report Fourth Quarter and Fiscal Year 2021 Results,FOOD.TO
GlobeNewswire,/news/goodfood-evolves-canada-modern-online-120000519.html,Goodfood Evolves as Canada’s Modern Online Grocer with Free One-Hour Delivery,FOOD.TO
Business Wire,/news/lightning-emotors-enters-canada-commercial-120000660.html,Lightning eMotors Enters Canada’s Commercial EV Market With Fully Electric Refrigerated Delivery Vehicles,FOOD.TO
GlobeNewswire,/news/goodfood-innovates-sustainability-first-operate-110000612.html,Goodfood Innovates for Sustainability as First to Operate Fully Electric Cold Delivery,FOOD.TO
Simply Wall St.,/news/investors-goodfood-market-tse-food-110832711.html,Investors in Goodfood Market (TSE:FOOD) have made a solid return of 210% over the past three years,FOOD.TO
GlobeNewswire,/news/goodfood-recognized-tsx30-list-second-110000921.html,Goodfood Recognized on the TSX30 List for the Second Year in a Row as One of Canada’s Top Performing Stocks,FOOD.TO
CNW Group,/news/toronto-stock-exchange-announces-2021-110000587.html,"Toronto Stock Exchange Announces the 2021 TSX30, Showcasing the Exchange's Top-Performing Companies",FOOD.TO
GlobeNewswire,/news/goodfood-appoints-bipasha-chiu-management-110000055.html,Goodfood Appoints Bipasha Chiu to its Management Team as  Chief Technology Officer,FOOD.TO
Simply Wall St.,/news/type-shareholders-own-most-number-071230853.html,What Type Of Shareholders Own The Most Number of Goodfood Market Corp. (TSE:FOOD) Shares?,FOOD.TO
GlobeNewswire,/news/goodfood-reports-record-quarterly-revenues-103000078.html,Goodfood Reports Record Quarterly Revenues of $108 Million,FOOD.TO
Simply Wall St.,/news/market-sentiment-around-loss-making-140056788.html,Market Sentiment Around Loss-Making Greenlane Renewables Inc. (TSE:GRN),GRN.TO
CNW Group,/news/greenlane-renewables-signs-6-1-120000802.html,Greenlane Renewables Signs $6.1 Million System Supply Contract for RNG Project with Green Impact Partners,GRN.TO
CNW Group,/news/greenlane-renewables-announces-second-quarter-201200514.html,Greenlane Renewables Announces Second Quarter 2021 Financial Results,GRN.TO
