source,link_href,link_text,ticker
Simply Wall St.,/news/read-considering-arc-resources-ltd-111731513.html,Read This Before Considering ARC Resources Ltd. (TSE:ARX) For Its Upcoming CA$0.10 Dividend,ARX.TO
CNW Group,/news/arc-resources-ltd-confirms-quarterly-210000705.html,"ARC Resources Ltd. Confirms Quarterly Dividend of $0.10 per Share for January 17, 2022",ARX.TO
Simply Wall St.,/news/arc-resources-tse-arx-shareholders-115924649.html,ARC Resources (TSE:ARX) shareholders are still up 84% over 1 year despite pulling back 4.4% in the past week,ARX.TO
CNW Group,/news/arc-resources-ltd-reports-record-232100396.html,"ARC Resources Ltd. Reports Record Third Quarter 2021 Results, Increases Dividend, and Announces 2022 Budget",ARX.TO
Simply Wall St.,/news/dividend-investors-dont-too-quick-143437655.html,Dividend Investors: Don't Be Too Quick To Buy ARC Resources Ltd. (TSE:ARX) For Its Upcoming Dividend,ARX.TO
CNW Group,/news/arc-resources-ltd-confirms-quarterly-210100330.html,"ARC Resources Ltd. Confirms Quarterly Dividend of $0.066 per Share for October 15, 2021",ARX.TO
CNW Group,/news/arc-resources-ltd-receives-tsx-113000863.html,ARC Resources Ltd. Receives TSX Approval for Normal Course Issuer Bid,ARX.TO
Simply Wall St.,/news/poor-financial-prospects-dragging-down-102105776.html,Are Poor Financial Prospects Dragging Down ARC Resources Ltd. (TSE:ARX Stock?,ARX.TO
CNW Group,/news/arc-resources-ltd-reports-second-210100848.html,ARC Resources Ltd. Reports Second Quarter 2021 Results and Announces Dividend Increase of 10 Per Cent,ARX.TO
CNW Group,/news/arc-resources-ltd-virtually-opens-150000239.html,ARC Resources Ltd. Virtually Opens the Market,ARX.TO
Simply Wall St.,/news/aritzia-inc-tse-atz-stock-095910758.html,Aritzia Inc.'s (TSE:ATZ) Stock Been Rising: Are Strong Financials Guiding The Market?,ATZ.TO
Simply Wall St.,/news/does-aritzia-tse-atz-deserve-100911834.html,Does Aritzia (TSE:ATZ) Deserve A Spot On Your Watchlist?,ATZ.TO
CNW Group,/news/iiroc-trade-resumption-atz-212100493.html,IIROC Trade Resumption - ATZ,ATZ.TO
CNW Group,/news/iiroc-trading-halt-atz-211200267.html,IIROC Trading Halt - ATZ,ATZ.TO
CNW Group,/news/aritzia-reports-third-quarter-fiscal-210100697.html,Aritzia Reports Third Quarter Fiscal 2022 Financial Results,ATZ.TO
CNW Group,/news/aritzia-announces-normal-course-issuer-210100540.html,ARITZIA ANNOUNCES NORMAL COURSE ISSUER BID,ATZ.TO
PR Newswire,/news/aritzia-release-third-quarter-fiscal-140000896.html,Aritzia to Release Third Quarter Fiscal 2022 Financial Results,ATZ.TO
Simply Wall St.,/news/time-consider-buying-aritzia-inc-120325915.html,Is It Time To Consider Buying Aritzia Inc. (TSE:ATZ)?,ATZ.TO
Simply Wall St.,/news/returns-capital-standout-aritzia-tse-104631198.html,Returns On Capital Are A Standout For Aritzia (TSE:ATZ),ATZ.TO
SmarterAnalyst,/news/aritzia-posts-better-expected-q2-154809204.html,Aritzia Posts Better-Than-Expected Q2; Shares Pop,ATZ.TO
Motley Fool,/m/9e2c8cd8-8651-3dd4-937b-357ae8c210ad/why-canopy-growth-sundial.html,"Why Canopy Growth, Sundial Growers, and Aurora Cannabis Stocks Jumped Today",ACB.TO
MarketWatch,/m/4299f1b6-2929-34e2-be94-ac524a31b616/canopy-growth-and-aurora.html,Canopy Growth and Aurora Cannabis are expected to generate less red ink when they report earnings this week,ACB.TO
GuruFocus.com,/news/ausdal-financial-partners-inc-buys-183810341.html,"Ausdal Financial Partners, Inc. Buys Ford Motor Co, Uber Technologies Inc, SPDR Portfolio ...",ACB.TO
Investor's Business Daily,/m/6e8fb483-3ff2-3a41-8275-9e9949427873/are-any-marijuana-stocks-on.html,Are Any Marijuana Stocks On U.S. Exchanges Buys Amid Stiffer Competition?,ACB.TO
Zacks,/news/aurora-cannabis-inc-acb-expected-200108919.html,Aurora Cannabis Inc. (ACB) Expected to Beat Earnings Estimates: Can the Stock Move Higher?,ACB.TO
PR Newswire,/news/aurora-cannabiss-reliva-expands-portfolio-121300939.html,"Aurora Cannabis's Reliva Expands Portfolio with New CBD Brand, KG7",ACB.TO
Motley Fool,/m/77d03c93-0d3b-3508-98ed-67bca3add6f8/should-investors-expect.html,Should Investors Expect Aurora Cannabis to Post a Profit in Q2?,ACB.TO
CNW Group,/news/aurora-cannabis-host-second-quarter-220300188.html,Aurora Cannabis to Host Second Quarter Fiscal Year 2022 Investor Conference Call,ACB.TO
GuruFocus.com,/news/greenwich-wealth-management-llc-buys-183802185.html,"Greenwich Wealth Management LLC Buys Confluent Inc, Cigna Corp, Popular Inc, Sells Interactive ...",ACB.TO
Motley Fool,/m/169ab6de-dfa8-3c5f-be1b-7a7f8239c37d/aurora-cannabis-stock-in.html,Aurora Cannabis Stock in 2022: Skyrocket or Crash?,ACB.TO
Motley Fool,/m/9e2c8cd8-8651-3dd4-937b-357ae8c210ad/why-canopy-growth-sundial.html,"Why Canopy Growth, Sundial Growers, and Aurora Cannabis Stocks Jumped Today",ACB.TO
MarketWatch,/m/4299f1b6-2929-34e2-be94-ac524a31b616/canopy-growth-and-aurora.html,Canopy Growth and Aurora Cannabis are expected to generate less red ink when they report earnings this week,ACB.TO
GuruFocus.com,/news/ausdal-financial-partners-inc-buys-183810341.html,"Ausdal Financial Partners, Inc. Buys Ford Motor Co, Uber Technologies Inc, SPDR Portfolio ...",ACB.TO
Investor's Business Daily,/m/6e8fb483-3ff2-3a41-8275-9e9949427873/are-any-marijuana-stocks-on.html,Are Any Marijuana Stocks On U.S. Exchanges Buys Amid Stiffer Competition?,ACB.TO
Zacks,/news/aurora-cannabis-inc-acb-expected-200108919.html,Aurora Cannabis Inc. (ACB) Expected to Beat Earnings Estimates: Can the Stock Move Higher?,ACB.TO
PR Newswire,/news/aurora-cannabiss-reliva-expands-portfolio-121300939.html,"Aurora Cannabis's Reliva Expands Portfolio with New CBD Brand, KG7",ACB.TO
Motley Fool,/m/77d03c93-0d3b-3508-98ed-67bca3add6f8/should-investors-expect.html,Should Investors Expect Aurora Cannabis to Post a Profit in Q2?,ACB.TO
CNW Group,/news/aurora-cannabis-host-second-quarter-220300188.html,Aurora Cannabis to Host Second Quarter Fiscal Year 2022 Investor Conference Call,ACB.TO
GuruFocus.com,/news/greenwich-wealth-management-llc-buys-183802185.html,"Greenwich Wealth Management LLC Buys Confluent Inc, Cigna Corp, Popular Inc, Sells Interactive ...",ACB.TO
Motley Fool,/m/169ab6de-dfa8-3c5f-be1b-7a7f8239c37d/aurora-cannabis-stock-in.html,Aurora Cannabis Stock in 2022: Skyrocket or Crash?,ACB.TO
GuruFocus.com,/news/manitou-investment-management-ltd-buys-193835651.html,"Manitou Investment Management Ltd. Buys Roper Technologies Inc, Brookfield Asset Management ...",BNS.TO
GuruFocus.com,/news/cibc-asset-management-inc-buys-183816116.html,"CIBC Asset Management Inc Buys Bank of Nova Scotia, Franco-Nevada Corp, Suncor Energy Inc, ...",BNS.TO
Zacks,/news/bank-nova-scotia-bns-gains-230011314.html,Bank of Nova Scotia (BNS) Gains As Market Dips: What You Should Know,BNS.TO
GuruFocus.com,/news/claret-asset-management-corp-buys-183813521.html,"CLARET ASSET MANAGEMENT Corp Buys Bristol-Myers Squibb Co, Shopify Inc, Hertz Global Holdings ...",BNS.TO
Zacks,/news/bank-nova-scotia-bns-top-164504071.html,Bank of Nova Scotia (BNS) is a Top Dividend Stock Right Now: Should You Buy?,BNS.TO
CNW Group,/news/scotiabank-announce-first-quarter-2022-140000902.html,Scotiabank to Announce First Quarter 2022 Results,BNS.TO
CNW Group,/news/scotiabank-wins-best-corporate-sustainability-145700430.html,Scotiabank Wins Best Corporate Sustainability Strategy at ESG Investing Awards 2022,BNS.TO
GuruFocus.com,/news/aull-monroe-investment-management-corp-143811736.html,"Aull & Monroe Investment Management Corp Buys CME Group Inc, Wells Fargo, Bank of America ...",BNS.TO
Zacks,/news/bank-nova-scotia-bns-outpaces-225010509.html,Bank of Nova Scotia (BNS) Outpaces Stock Market Gains: What You Should Know,BNS.TO
CNW Group,/news/scotiabank-announces-redemption-cdn-1-211500566.html,"Scotiabank Announces Redemption of CDN $1,250 million 2.58% Subordinated Debentures (Non-Viability Contingent Capital (NVCC)) due March 30, 2027",BNS.TO
Zacks,/news/apa-apa-stock-outpacing-oils-144002650.html,Is APA (APA) Stock Outpacing Its Oils-Energy Peers This Year?,BTE.TO
Investopedia,/m/35f0a9d2-d319-31be-a713-2e52395403f7/top-oil-and-gas-penny-stocks.html,Top Oil and Gas Penny Stocks for Q1 2022,BTE.TO
CNW Group,/news/p-dow-jones-indices-announces-221500598.html,S&P Dow Jones Indices Announces Changes to the S&P/TSX Composite Index,BTE.TO
GlobeNewswire,/news/baytex-announces-2022-budget-updated-220000196.html,Baytex Announces 2022 Budget and Updated Five-Year Outlook With Cumulative Free Cash Flow of $2.1 Billion,BTE.TO
Zacks,/news/zacks-industry-outlook-highlights-ovintiv-113611197.html,"Zacks Industry Outlook Highlights: Ovintiv, Crescent Point Energy, Baytex Energy and TC Energy",BTE.TO
Simply Wall St.,/news/those-invested-baytex-energy-tse-115243313.html,Those who invested in Baytex Energy (TSE:BTE) a year ago are up 838%,BTE.TO
GlobeNewswire,/news/baytex-announces-third-quarter-2021-211000787.html,"Baytex Announces Third Quarter 2021 Financial and Operating Results, Free Cash Flow of $101 Million and Repurchase of Long-Term Notes",BTE.TO
GlobeNewswire,/news/baytex-conference-call-webcast-third-203000827.html,"Baytex Conference Call and Webcast on Third Quarter 2021 Results to Be Held on November 5, 2021",BTE.TO
GlobeNewswire,/news/baytex-provides-2021-clearwater-appraisal-210000601.html,Baytex Provides Update to 2021 Clearwater Appraisal Program,BTE.TO
GlobeNewswire,/news/baytex-present-enercom-oil-gas-203600625.html,Baytex to Present at Enercom’s the Oil and Gas Conference,BTE.TO
PR Newswire,/news/blackberry-honored-se-labs-enterprise-130000957.html,BlackBerry Honored with SE Labs Enterprise Advanced Security Test Award,BB.TO
Bloomberg,/news/zero-click-hacks-growing-popularity-080022119.html,‘Zero-Click’ Hacks Are Growing in Popularity. There’s Practically No Way to Stop Them,BB.TO
Insider Monkey,/news/10-best-robinhood-stocks-buy-154148683.html,10 Best Robinhood Stocks To Buy Right Now,BB.TO
CNW Group,/news/blackberry-annual-threat-report-uncovers-130000974.html,BlackBerry Annual Threat Report Uncovers Growing Shared Economy in Cyber Criminal Underground,BB.TO
Zacks,/news/blackberry-bb-dips-more-broader-225010297.html,BlackBerry (BB) Dips More Than Broader Markets: What You Should Know,BB.TO
Moody's,/news/placin-r-l-moodys-changes-151206916.html,Placin S.á.r.l. -- Moody's changes outlook on Planasa's B2 ratings to stable from negative,BB.TO
GuruFocus.com,/news/2-underperforming-stocks-consider-decreasing-195726489.html,2 Underperforming Stocks to Consider Decreasing Exposure To,BB.TO
Simply Wall St.,/news/blackberry-tse-bb-using-too-115420725.html,"Shareholders in BlackBerry (TSE:BB) have lost 46%, as stock drops 10% this past week",BB.TO
Zacks,/news/blackberry-bb-outpaces-stock-market-225010430.html,BlackBerry (BB) Outpaces Stock Market Gains: What You Should Know,BB.TO
Motley Fool,/m/ce30b1b1-642b-3702-b3e6-913af34394d6/better-buy-blackberry-vs-.html,Better Buy: BlackBerry vs. Apple,BB.TO
Yahoo Finance Video,/video/canada-goose-cuts-sales-forecast-164159446.html,"Canada Goose cuts sales forecast, stock plunges",GOOS.TO
Motley Fool,/m/daefebee-7ba7-3ca2-a5cf-01d33db40cc1/canada-goose-plunged-today-.html,Canada Goose Plunged Today -- Is the Market Overreacting?,GOOS.TO
Motley Fool,/m/025626e6-d406-3e90-8e78-ca40f55c0929/why-canada-goose-stock.html,Why Canada Goose Stock Plunged 21% at the Open Today,GOOS.TO
Reuters,/news/canada-stocks-tsx-gains-strong-153326249.html,CANADA STOCKS-TSX gains on strong energy stocks; Canada Goose slumps,GOOS.TO
Bloomberg,/news/canada-goose-tumbles-sales-forecast-131638378.html,Canada Goose Plunges After Sales View Cut on Weakness Abroad,GOOS.TO
WWD,/news/canada-goose-outlook-hit-covid-140227723.html,Canada Goose Outlook Hit by COVID-19 Restrictions,GOOS.TO
MarketWatch,/m/7d4c085f-009d-3de3-89bf-25b22346e7a2/canada-goose-stock-tumbles.html,"Canada Goose stock tumbles after profit and revenue missed expectation, outlook lowered",GOOS.TO
Reuters,/news/canada-goose-cuts-annual-forecast-115637782.html,Canada Goose's Omicron-induced forecast cut sends shares tumbling,GOOS.TO
Business Wire,/news/canada-goose-reports-results-third-114500475.html,Canada Goose Reports Results for Third Quarter Fiscal 2022 and Revised Fiscal 2022 Outlook,GOOS.TO
Simply Wall St.,/news/taking-look-canada-goose-holdings-133524355.html,Taking A Look At Canada Goose Holdings Inc.'s (TSE:GOOS) ROE,GOOS.TO
Bloomberg,/news/cibc-beats-estimates-banking-revenue-110801388.html,"Volatile Markets Lift Trading Revenue at CIBC, National Bank",CM.TO
Reuters,/news/wrapup-1-canadas-cibc-national-123107136.html,"WRAPUP 2-Canada's CIBC, National Bank profits beat estimates on lending, markets units",CM.TO
Reuters,/news/1-canadas-cibc-profit-beats-113314133.html,"UPDATE 1-Canada's CIBC profit beats estimates on business lending, capital markets",CM.TO
CNW Group,/news/cibc-declares-dividends-quarter-ending-105700060.html,"CIBC Declares Dividends for the Quarter Ending April 30, 2022",CM.TO
CNW Group,/news/cibc-announces-first-quarter-2022-105500638.html,CIBC Announces First Quarter 2022 Results,CM.TO
Reuters,/news/cibc-plans-bring-canadian-employees-212855255.html,CIBC plans to bring Canadian employees back to office in March,CM.TO
Business Wire,/news/cibc-innovation-banking-provides-financing-140000717.html,CIBC Innovation Banking Provides Financing Solutions to Graphite Ventures,CM.TO
Reuters,/news/cibcs-c-125-million-settlement-151714460.html,CIBC's C$125 million settlement of financial crisis lawsuit gets court approval,CM.TO
Reuters,/news/cibcs-c-125-mln-settlement-151313285.html,CIBC's C$125 mln settlement of financial crisis lawsuit gets court approval,CM.TO
CNW Group,/news/cibc-asset-management-announces-cibc-123000930.html,CIBC Asset Management announces CIBC ETF cash distributions for February 2022,CM.TO
Yahoo Finance Video,/video/stocks-cvs-slips-earnings-beat-173937873.html,"Stocks: CVS slips after earnings beat, Canopy Growth rallies, Rivian rebounds",WEED.TO
Investor's Business Daily,/m/6e8fb483-3ff2-3a41-8275-9e9949427873/are-any-marijuana-stocks-on.html,Are Any Marijuana Stocks On U.S. Exchanges Buys After Canopy Spurs Rally?,WEED.TO
Barrons.com,/m/35a2d404-bb4d-3ef0-a726-bdf343a3dc71/canopy-growth-stock-jumps.html,"Canopy Growth Stock Jumps After Earnings, Despite Slowing Marijuana Sales",WEED.TO
PR Newswire,/news/canopy-growth-reports-third-quarter-120000309.html,CANOPY GROWTH REPORTS THIRD QUARTER FISCAL 2022 FINANCIAL RESULTS,WEED.TO
Investor's Business Daily,/m/a72862de-cc5e-3ff8-aa5d-7e9bc39a83f6/any-reason-to-buy-canopy.html,Any Reason To Buy Canopy Growth Ahead Of Earnings?,WEED.TO
GuruFocus.com,/news/cullen-buys-ishares-msci-eafe-023810675.html,"Cullen Buys iShares MSCI EAFE ETF, Vanguard Growth ETF, Vanguard FTSE Emerging Markets ETF, ...",WEED.TO
Yahoo Finance Video,/video/gop-congresswoman-nancy-mace-talks-195804142.html,"GOP Congresswoman Nancy Mace talks 5G and airplanes, autonomous vehicles, weed decriminalization",WEED.TO
GuruFocus.com,/news/alpine-woods-capital-investors-llc-183825504.html,"Alpine Woods Capital Investors, Llc Buys The Scotts Miracle Gro Co, HP Inc, ViacomCBS Inc, ...",WEED.TO
CNW Group,/news/ace-valley-brand-expands-product-130000186.html,Ace Valley Brand Expands Product Portfolio,WEED.TO
Zacks,/news/canopy-growth-corporation-cgc-report-200108743.html,Will Canopy Growth Corporation (CGC) Report Negative Earnings Next Week? What You Should Know,WEED.TO
GlobeNewswire,/news/cenovus-announces-2021-fourth-quarter-110000663.html,Cenovus announces 2021 fourth-quarter and full-year results,CVE.TO
Insider Monkey,/news/did-smart-money-play-cenovus-201108180.html,Did The Smart Money Play Cenovus Energy Inc (CVE) Correctly?,CVE.TO
GuruFocus.com,/news/heronetta-management-l-p-buys-183824390.html,"Heronetta Management, L.P. Buys Cenovus Energy Inc",CVE.TO
Zacks,/news/suncor-energy-su-misses-q4-015501614.html,Suncor Energy (SU) Misses Q4 Earnings Estimates,CVE.TO
Oilprice.com,/news/shell-betting-big-namibia-oil-003000678.html,Shell Is Betting Big On Namibia’s Oil Boom,CVE.TO
GlobeNewswire,/news/cenovus-hold-q4-conference-call-222300009.html,Cenovus to hold Q4 conference call and webcast on February 8,CVE.TO
Oilprice.com,/news/full-speed-ahead-world-most-000000137.html,It’s Full Speed Ahead For The World’s Most Exciting Oil Play,CVE.TO
Simply Wall St.,/news/growth-investors-industry-analysts-just-142635488.html,Growth Investors: Industry Analysts Just Upgraded Their Cenovus Energy Inc. (TSE:CVE) Revenue Forecasts By 17%,CVE.TO
GuruFocus.com,/news/jcic-asset-management-inc-buys-183819568.html,"JCIC Asset Management Inc. Buys Cenovus Energy Inc, Franco-Nevada Corp, Shopify Inc, Sells ...",CVE.TO
GuruFocus.com,/news/pacifica-partners-inc-buys-cenovus-223822033.html,"Pacifica Partners Inc. Buys Cenovus Energy Inc, PPG Industries Inc, Visa Inc, Sells Broadcom ...",CVE.TO
CNW Group,/news/jazz-aviation-named-one-canadas-175600582.html,Jazz Aviation Named One of Canada's Top Employers for Young People 2022,CHR.TO
CNW Group,/news/advisory-chorus-aviation-inc-present-210900791.html,"ADVISORY - CHORUS AVIATION INC. TO PRESENT FOURTH QUARTER AND YEAR-END 2021 FINANCIAL RESULTS ON FEBRUARY 17, 2022",CHR.TO
CNW Group,/news/jazz-aviation-named-one-best-211700958.html,Jazz Aviation Named One of the Best Places to Work in 2022,CHR.TO
CNW Group,/news/voyageur-aviation-unveils-excl-program-210100147.html,Voyageur Aviation unveils new EXCL Program with launch customer Sabena technics,CHR.TO
CNW Group,/news/chorus-aviation-announces-partial-redemption-173000826.html,CHORUS AVIATION ANNOUNCES PARTIAL REDEMPTION OF ITS 6.00% SENIOR DEBENTURES,CHR.TO
CNW Group,/news/chorus-aviation-announces-third-quarter-000000290.html,Chorus Aviation Announces Third Quarter 2021 Financial Results,CHR.TO
Simply Wall St.,/news/returns-capital-chorus-aviation-tse-124457854.html,The Returns On Capital At Chorus Aviation (TSE:CHR) Don't Inspire Confidence,CHR.TO
CNW Group,/news/chorus-aviation-announces-three-committed-225200390.html,Chorus Aviation announces new three-year committed operating credit facility,CHR.TO
CNW Group,/news/advisory-chorus-aviation-inc-present-141500504.html,"Advisory - Chorus Aviation Inc. to Present Third Quarter 2021 Financial Results on November 11, 2021",CHR.TO
GlobeNewswire,/news/chorus-aviation-announces-closing-85-122600371.html,Chorus Aviation announces closing of $85 million bought deal offering of 5.75% Senior Unsecured Debentures,CHR.TO
Reuters,/news/britains-cineworld-hit-appeal-cineplex-075927305.html,Britain's Cineworld hit by appeal in Cineplex legal battle,CGX.TO
The Independent,/news/cineworld-canadian-court-battle-heats-072806026.html,Cineworld Canadian court battle heats up with new counter-claim,CGX.TO
CNW Group,/news/cineplex-inc-announces-details-fourth-140000457.html,Cineplex Inc. Announces Details of Fourth Quarter and Year End 2021 Earnings Release and Webcast,CGX.TO
CNW Group,/news/attention-popcorn-lovers-enjoy-free-143000977.html,Attention Popcorn Lovers: Enjoy a Free Bag on Cineplex to Celebrate National Popcorn Day,CGX.TO
Reuters,/news/cineplex-temporarily-lays-off-6-191820499.html,"Cineplex temporarily lays off 6,000 workers as surging Omicron cases shut theatres",CGX.TO
CNW Group,/news/cineplex-announces-amendment-credit-facility-223000843.html,Cineplex Announces Amendment to Credit Facility,CGX.TO
Yahoo Finance Video,/video/movies-streaming-theaters-hybrid-release-175011413.html,Movies: How the streaming/theaters hybrid release experiment played out in 2021,CGX.TO
Business Wire,/news/bronstein-gewirtz-grossman-llc-notifies-193700764.html,"Bronstein, Gewirtz & Grossman, LLC Notifies Shareholders of Cineplex Inc. (CPXGF) Investigation",CGX.TO
Yahoo Finance Video,/video/marvel-spider-man-obliterated-expectations-174652058.html,Marvel’s ‘Spider-Man’ ‘obliterated expectations’ at the box office: Analyst,CGX.TO
The Independent,/news/cineworld-shares-plunge-canadian-court-125108943.html,Cineworld shares plunge as Canadian court tells them to pay up £720 million,CGX.TO
CNW Group,/news/dye-durham-reports-second-quarter-213000531.html,Dye & Durham Reports Second Quarter Fiscal 2022 Financial Results,DND.TO
CNW Group,/news/dye-durham-host-second-quarter-140000893.html,Dye & Durham to Host Second Quarter Fiscal 2022 Conference Call,DND.TO
CNW Group,/news/dye-durham-provides-cma-review-162800903.html,Dye & Durham Provides an Update on the CMA Review of TM Group Acquisition,DND.TO
CNW Group,/news/dye-durham-announces-agreement-acquire-234500659.html,Dye & Durham Announces Agreement to Acquire Link Group in Transformative C$3.2 Billion Transaction,DND.TO
CNW Group,/news/dye-durham-announces-voting-results-202200222.html,Dye & Durham Announces Voting Results from its Annual General and Special Meeting of Shareholders,DND.TO
CNW Group,/news/dye-durham-provides-cma-review-142000850.html,Dye & Durham Provides Update on CMA Review of TM Group Acquisition,DND.TO
CNW Group,/news/dye-durham-announces-fiscal-2023-110000058.html,Dye & Durham Announces Fiscal 2023 Outlook and Analyst Conference Call,DND.TO
CNW Group,/news/iiroc-trade-resumption-dnd-135200491.html,IIROC Trade Resumption - DND,DND.TO
CNW Group,/news/iiroc-trading-halt-dnd-134300008.html,IIROC Trading Halt - DND,DND.TO
CNW Group,/news/dye-durham-acquires-telus-financial-133000648.html,Dye & Durham Acquires TELUS' Financial Solutions Business for $500 million,DND.TO
Insider Monkey,/news/10-canadian-dividend-stocks-over-212347758.html,10 Canadian Dividend Stocks With Over 3% Yield,ENB.TO
Zacks,/news/enbridge-enb-q4-earnings-lag-160004164.html,"Enbridge (ENB) Q4 Earnings Lag Estimates, Revenues Rise Y/Y",ENB.TO
Motley Fool,/m/a51e2087-0be1-38ef-af47-2a3a5cb6378c/4-ultra-high-yield-dividend.html,4 Ultra-High-Yield Dividend Stocks to Buy Hand Over Fist Right Now,ENB.TO
Motley Fool,/m/773f9421-685b-30c7-b95a-5eb3349cde5b/this-surefire-6-4-yielding.html,This Surefire 6.4%-Yielding Dividend Stock Has the Fuel to Keep Growing,ENB.TO
News Direct,/news/enbridge-gas-affiliate-helps-global-170509470.html,Enbridge Gas Affiliate Helps Global Delivery Giant Go Cleaner With CNG,ENB.TO
Bloomberg,/news/enbridge-submit-mainline-toll-plan-131527577.html,Enbridge to Submit Mainline Toll Plan to Regulators in 2022,ENB.TO
Zacks,/news/enbridge-enb-misses-q4-earnings-135501943.html,Enbridge (ENB) Misses Q4 Earnings and Revenue Estimates,ENB.TO
PR Newswire,/news/enbridge-files-2021-end-disclosure-130200932.html,Enbridge Files 2021 Year End Disclosure Documents,ENB.TO
Zacks,/news/why-enbridge-enb-might-surprise-134401889.html,Why Enbridge (ENB) Might Surprise This Earnings Season,ENB.TO
Zacks,/news/heres-why-enbridge-enb-likely-142002489.html,Here's Why Enbridge (ENB) is Likely to Beat Earnings in Q4,ENB.TO
Insider Monkey,/news/10-canadian-dividend-stocks-over-212347758.html,10 Canadian Dividend Stocks With Over 3% Yield,ENB.TO
Zacks,/news/enbridge-enb-q4-earnings-lag-160004164.html,"Enbridge (ENB) Q4 Earnings Lag Estimates, Revenues Rise Y/Y",ENB.TO
Motley Fool,/m/a51e2087-0be1-38ef-af47-2a3a5cb6378c/4-ultra-high-yield-dividend.html,4 Ultra-High-Yield Dividend Stocks to Buy Hand Over Fist Right Now,ENB.TO
Motley Fool,/m/773f9421-685b-30c7-b95a-5eb3349cde5b/this-surefire-6-4-yielding.html,This Surefire 6.4%-Yielding Dividend Stock Has the Fuel to Keep Growing,ENB.TO
News Direct,/news/enbridge-gas-affiliate-helps-global-170509470.html,Enbridge Gas Affiliate Helps Global Delivery Giant Go Cleaner With CNG,ENB.TO
Bloomberg,/news/enbridge-submit-mainline-toll-plan-131527577.html,Enbridge to Submit Mainline Toll Plan to Regulators in 2022,ENB.TO
Zacks,/news/enbridge-enb-misses-q4-earnings-135501943.html,Enbridge (ENB) Misses Q4 Earnings and Revenue Estimates,ENB.TO
PR Newswire,/news/enbridge-files-2021-end-disclosure-130200932.html,Enbridge Files 2021 Year End Disclosure Documents,ENB.TO
Zacks,/news/why-enbridge-enb-might-surprise-134401889.html,Why Enbridge (ENB) Might Surprise This Earnings Season,ENB.TO
Zacks,/news/heres-why-enbridge-enb-likely-142002489.html,Here's Why Enbridge (ENB) is Likely to Beat Earnings in Q4,ENB.TO
GlobeNewswire,/news/goeasy-ltd-announces-enhancements-securitization-140800509.html,goeasy Ltd. Announces Enhancements to Securitization and Credit Facilities,GSY.TO
GlobeNewswire,/news/goeasy-ltd-announces-renewal-normal-125500067.html,goeasy Ltd. Announces Renewal of Normal Course Issuer Bid & Provides Capital Management Update,GSY.TO
GlobeNewswire,/news/goeasy-ltd-surpasses-2-billion-140000236.html,goeasy Ltd. Surpasses a $2 Billion Consumer Loan Portfolio,GSY.TO
GlobeNewswire,/news/goeasy-ltd-named-one-canada-152100178.html,goeasy Ltd. Named One of Canada’s Most Admired Corporate Cultures,GSY.TO
Simply Wall St.,/news/heres-why-think-goeasy-tse-150120642.html,Here's Why I Think goeasy (TSE:GSY) Might Deserve Your Attention Today,GSY.TO
GlobeNewswire,/news/goeasy-ltd-reports-record-results-210100619.html,goeasy Ltd. Reports Record Results for the Third Quarter,GSY.TO
GlobeNewswire,/news/goeasy-ltd-announces-timing-third-113700756.html,goeasy Ltd. Announces Timing of Third Quarter 2021 Conference Call and Webcast,GSY.TO
GlobeNewswire,/news/goeasy-ltd-receives-great-place-123000449.html,goeasy Ltd. Receives Great Place to Work® Certification,GSY.TO
CNW Group,/news/hisun-motors-canada-appoints-lendcare-173700733.html,HISUN Motors Canada Appoints LendCare as Preferred Lender,GSY.TO
Simply Wall St.,/news/ownership-structure-goeasy-ltd-tse-140959117.html,What Is The Ownership Structure Like For goeasy Ltd. (TSE:GSY)?,GSY.TO
PR Newswire,/news/hut-8-mining-holds-5-123000242.html,"Hut 8 Mining Holds 5,826 Self-Mined Bitcoin in Reserve as of January 31, 2022; Provides Monthly Production Update for January 2022",HUT.TO
CNW Group,/news/hut-8-expands-talent-roster-123000457.html,Hut 8 Expands Talent Roster with New Head of Marketing Role,HUT.TO
CNW Group,/news/hut-8-announces-closing-acquisition-000000219.html,Hut 8 Announces Closing of the Acquisition of TeraGo's Data Center Business,HUT.TO
