source,link_href,link_text,ticker
CNW Group,/news/mindbeacon-announces-filing-management-information-220000639.html,MindBeacon Announces Filing of Management Information Circular for the Meeting to Approve the Acquisition by CloudMD,DOC.V
GlobeNewswire,/news/cloudmd-graduates-otcqx-begins-trading-123000011.html,CloudMD Graduates to the OTCQX; Begins Trading Today Under “DOCRF”,DOC.V
PR Newswire,/news/otc-markets-group-welcomes-cloudmd-120000939.html,OTC Markets Group Welcomes CloudMD Software & Services Inc. to OTCQX,DOC.V
Simply Wall St.,/news/cloudmd-software-services-cve-doc-115248095.html,CloudMD Software & Services (CVE:DOC) Has Debt But No Earnings; Should You Worry?,DOC.V
GlobeNewswire,/news/cloudmd-reports-solid-performance-third-214300123.html,CloudMD Reports Solid Performance with Third Quarter 2021 Financial Results; Record Revenue of $39.2M and First Quarter with Positive Adjusted EBITDA,DOC.V
GlobeNewswire,/news/sun-life-partners-cloudmd-expand-123500937.html,Sun Life Partners with CloudMD to Expand Mental Health Coach To All Group Benefits Clients,DOC.V
CNW Group,/news/cloudmd-acquire-mindbeacon-one-north-110500241.html,"CloudMD to Acquire MindBeacon, One of North America's Leading Clinically-Validated iCBT Solutions",DOC.V
GlobeNewswire,/news/cloudmd-present-upcoming-north-american-123000471.html,CloudMD to Present at Upcoming North American Investor Conferences,DOC.V
GlobeNewswire,/news/cloudmd-announces-results-annual-general-231700383.html,CloudMD Announces Results of the Annual General & Special Meeting,DOC.V
Simply Wall St.,/news/dmg-blockchain-solutions-cve-dmgi-134533878.html,Is DMG Blockchain Solutions (CVE:DMGI) In A Good Position To Deliver On Growth Plans?,DMGI.V
GlobeNewswire,/news/dmg-blockchain-solutions-inc-appoints-110000763.html,DMG Blockchain Solutions Inc. Appoints New Board Director,DMGI.V
GlobeNewswire,/news/dmg-blockchain-solutions-purchases-1-110000883.html,"DMG Blockchain Solutions Purchases 1,800 Bitmain Antminer S19 XP Miners and Provides Core Bitcoin Mining Operations Update",DMGI.V
GlobeNewswire,/news/dmg-zodia-custody-successfully-test-120000236.html,DMG and Zodia Custody Successfully Test Blockseer’s “Petra” Platform,DMGI.V
Investopedia,/m/edfdd737-f6d6-3a65-8539-c4687d5d5f88/top-tech-penny-stocks-for-q4.html,Top Tech Penny Stocks for Q4 2021,DMGI.V
Simply Wall St.,/news/despite-currently-being-unprofitable-dmg-111406118.html,"Despite currently being unprofitable, DMG Blockchain Solutions (CVE:DMGI) has delivered a 980% return to shareholders over 1 year",DMGI.V
GlobeNewswire,/news/dmg-blockchain-set-join-marathon-120500115.html,"DMG Blockchain Set To Join Marathon’s Bitcoin Mining Pool, MaraPool",DMGI.V
GlobeNewswire,/news/dmg-blockchain-first-join-marapool-120000090.html,DMG Blockchain is the First to Join MaraPool,DMGI.V
Bloomberg,/news/billionaire-backed-exchange-funded-alleged-110018321.html,"Biggest Crypto Coin Sale Fueled by ‘Pump’ Scheme, Research Says",DMGI.V
GlobeNewswire,/news/dmg-blockchain-solutions-hold-conference-120000099.html,"DMG Blockchain Solutions to Hold Conference Call to Review Third Quarter 2021 Financial Results and Provide Corporate Update on September 1, 2021 at 5:00 PM ET",DMGI.V
CNW Group,/news/facedrive-reports-2021-q3-financial-022700453.html,Facedrive Reports 2021 Q3 Financial Results and Provides Update,FD.V
CNW Group,/news/facedrive-provides-change-auditor-process-010600621.html,Facedrive Provides Update on Change of Auditor Process,FD.V
CNW Group,/news/iiroc-trading-resumption-fd-145000368.html,IIROC Trading Resumption - FD,FD.V
CNW Group,/news/iiroc-trading-halt-fd-144800324.html,IIROC Trading Halt - FD,FD.V
Business Wire,/news/facedrive-announces-retirement-director-003900926.html,Facedrive Announces Retirement of Director,FD.V
CNW Group,/news/facedrive-provides-details-change-auditor-000000992.html,Facedrive Provides Details on Change of Auditor Process,FD.V
CNW Group,/news/facedrive-announces-change-auditor-process-120000670.html,Facedrive Announces Change of Auditor Process and Provides Corporate Update,FD.V
CNW Group,/news/facedrive-confirms-no-material-undisclosed-152600845.html,Facedrive Confirms No Material Undisclosed Information,FD.V
Business Wire,/news/facedrive-provides-corporate-120000593.html,Facedrive Provides Corporate Update,FD.V
Business Wire,/news/facedrive-reports-2021-q2-financial-223100329.html,Facedrive Reports 2021 Q2 Financial Results,FD.V
GlobeNewswire,/news/fobi-combines-power-ai-big-110000291.html,"Fobi Combines the Power of its AI, Big Data and Wallet Pass Technology to Deliver Digital and Contactless Golf Membership Solution",FOBI.V
GlobeNewswire,/news/kai-medical-fobi-deliver-rapid-110000675.html,Kai Medical & Fobi Deliver Rapid Covid Testing & Results Delivery for Huge Event in Las Vegas at the Aria Resort & Casino,FOBI.V
GlobeNewswire,/news/fobi-checkvax-vaccination-covid-testing-110000608.html,Fobi To Provide CheckVax™ Vaccination and Covid Testing Verification Solution For The Retail Solutions Providers Association (RSPA) Annual Leadership Conference,FOBI.V
GlobeNewswire,/news/fobi-announces-partnership-janam-technologies-130000051.html,"Fobi Announces Partnership with Janam Technologies To Offer Contactless Venue Solutions Targeting Hospitality, Ticketing, Retail, Health Care and Other Verticals",FOBI.V
GlobeNewswire,/news/fobi-signs-loi-acquire-passworks-110000573.html,"Fobi Signs LOI To Acquire Passworks, A Portugal Based Leading European Digital Wallet And Mobile Marketing Company With Tier-1 Global Clients",FOBI.V
GlobeNewswire,/news/fobi-announces-signing-amazon-fulfillment-124500835.html,Fobi Announces Signing Of Amazon Fulfillment And Business Seller Agreement,FOBI.V
GlobeNewswire,/news/fobi-announces-293-increase-first-110000048.html,Fobi Announces 293% Increase In First Quarter Revenue,FOBI.V
GlobeNewswire,/news/fobi-host-shareholder-earnings-webinar-165800313.html,Fobi to Host Shareholder Update and Earnings Webinar,FOBI.V
GlobeNewswire,/news/fobi-signs-agreement-caddle-canada-110000172.html,"Fobi Signs Agreement With Caddle, Canada’s Largest Mobile-First Insights Marketplace App To Target And Engage CPG Brands and Grocery Retailers",FOBI.V
GlobeNewswire,/news/fobi-announces-completion-soc2-type-110000247.html,Fobi Announces the Completion of SOC2 Type 1 Certification,FOBI.V
Newsfile,/news/hive-blockchain-provides-results-shareholder-060000904.html,"HIVE Blockchain Provides Results from Shareholder Meeting, Review of 2021 Achievements and Corporate Update",HIVE.V
Investopedia,/m/49a5e9ae-1512-3a84-93ee-eb0048d16dff/10-biggest-blockchain.html,10 Biggest Blockchain Companies,HIVE.V
Newsfile,/news/hive-blockchain-corporate-results-2021-192800190.html,HIVE Blockchain to Provide Corporate Update and Results from the 2021 Annual General Meeting,HIVE.V
GuruFocus.com,/news/vaneck-digital-transformation-etf-buys-023806639.html,"VanEck Digital Transformation ETF Buys HIVE Blockchain Technologies, Hut 8 Mining Corp, ...",HIVE.V
MoneyWise,/news/kiyosaki-crash-depression-coming-6-130000260.html,Kiyosaki: 'Crash and depression' are coming ⁠— here are the 6 simple ways he's looking to get rich from the fallout,HIVE.V
InvestorPlace,/news/7-top-rated-penny-stocks-145216311.html,7 Top-Rated Penny Stocks for a Happier Holiday Season,HIVE.V
Motley Fool,/m/2ae7932c-fb77-37bc-9a47-51e90f95c708/why-cryptocurrency-mining.html,Why Cryptocurrency Mining Stocks Were Up Big Today,HIVE.V
Newsfile,/news/retransmission-hive-presents-record-november-110000453.html,RETRANSMISSION: HIVE Presents Record November 2021 Production Figures and Provides Corporate Update,HIVE.V
Newsfile,/news/hive-presents-record-november-2021-060000333.html,HIVE Presents Record November 2021 Production Figures and Provides Corporate Update,HIVE.V
Newsfile,/news/retransmission-hive-announces-investment-titan-110000488.html,"RETRANSMISSION: HIVE Announces Investment in Titan, Leading Blockchain Software Company",HIVE.V
Simply Wall St.,/news/heres-why-were-not-concerned-092233319.html,Here's Why We're Not At All Concerned With Sernova's (CVE:SVA) Cash Burn Situation,SVA.V
GlobeNewswire,/news/life-sciences-companies-investors-presentations-123500941.html,Life Sciences Companies Investors Presentations Now Available for On-Demand Viewing,SVA.V
GlobeNewswire,/news/sernova-webcast-live-life-sciences-143600339.html,Sernova to Webcast Live at Life Sciences Investor Forum March 25th,SVA.V
GlobeNewswire,/news/virtual-conference-life-sciences-companies-123500232.html,"Virtual Conference for Life Sciences Companies Broadcast Live March 25th, 2021",SVA.V
CNW Group,/news/iiroc-trade-resumption-sona-140900767.html,Lung cancer patient care - The Conference Board of Canada cites the Quebec Heart and Lung Institute as a model even as its labs are threatened,SVA.V
CNW Group,/news/imaginear-signs-two-agreement-valencia-103000787.html,Food Safety Warning - Consumption of Our Father's Farm brand bitter apricot kernel products may cause cyanide poisoning,SVA.V
CNW Group,/news/qatar-foundations-wise-announces-special-184300144.html,Raising a fork to agriculture: Join Minister Bibeau in celebrating farmers and food businesses on Canada's Agriculture Day,SVA.V
Newsfile,/news/btv-news-alert-video-sernova-215600910.html,BTV News Alert Video: Sernova Corp. - A Functional Cure for Type I Diabetes,SVA.V
CNW Group,/news/unified-commerce-group-announces-strategic-120000956.html,Sernova Corp. Announces C$10 Million Bought Deal Offering of Units,SVA.V
ACCESSWIRE,/news/medisure-canada-receives-health-canada-103000730.html,MediSure Canada Receives Health Canada Licence For Two New Best-In-Class Products,CBDT.CN
ACCESSWIRE,/news/empower-clinics-opens-first-medi-103000502.html,"Empower Clinics Opens Its First “The Medi-Collective” in London, Ontario With Co-Located Guardian Pharmacy",CBDT.CN
CNW Group,/news/iiroc-trade-resumption-cbdt-152300142.html,IIROC Trade Resumption - CBDT,CBDT.CN
ACCESSWIRE,/news/empower-clinics-subsidiary-medisure-submits-150500708.html,Empower Clinics Subsidiary MediSure Submits Health Canada Application For Its Rapid COVID-19 Antigen Tests,CBDT.CN
CNW Group,/news/iiroc-trading-halt-cbdt-130000660.html,IIROC Trading Halt - CBDT,CBDT.CN
ACCESSWIRE,/news/empower-clinics-hires-chief-financial-110000773.html,Empower Clinics Hires Chief Financial Officer With NASDAQ Healthcare Experience,CBDT.CN
ACCESSWIRE,/news/empower-clinics-division-medi-collective-113000115.html,Empower Clinics Division The Medi-Collective Opens Clinic With Co-Located Rexall Pharmacy,CBDT.CN
ACCESSWIRE,/news/empower-clinics-fobi-launch-premier-110000589.html,Empower Clinics and Fobi Launch Premier SMS Integration System,CBDT.CN
ACCESSWIRE,/news/empower-clinics-kai-medical-laboratory-133000898.html,Empower Clinics Kai Medical Laboratory Secures COVID-19 Testing Contract For Large Gaming Event In Las Vegas,CBDT.CN
ACCESSWIRE,/news/empower-clinics-successfully-completes-health-103000047.html,Empower Clinics Successfully Completes Health Canada Review To Sell Covid-19 At-Home Saliva Collection Kit,CBDT.CN
GlobeNewswire,/news/mountain-valley-md-holdings-completes-124500600.html,Mountain Valley MD Holdings Completes Licensing Agreement With Red White and Bloom Brands Inc.,MVMD.CN
GlobeNewswire,/news/mountain-valley-md-holdings-provides-200100116.html,"Mountain Valley MD Holdings Provides Business Update, Results of Shareholder Meeting",MVMD.CN
GlobeNewswire,/news/mountain-valley-md-holdings-announces-130000258.html,Mountain Valley MD Holdings Announces Letter of Intent with Red White and Bloom Brands Inc.,MVMD.CN
GlobeNewswire,/news/mountain-valley-md-holdings-announces-234200440.html,"Mountain Valley MD Holdings Announces Voluntary Retraction of a Reported Data Set, No Material Change to Business Plan Anticipated",MVMD.CN
GlobeNewswire,/news/mountain-valley-md-holdings-announces-200100940.html,Mountain Valley MD Holdings Announces Annual Shareholder Meeting,MVMD.CN
PR Newswire,/news/otc-markets-group-welcomes-mountain-110000703.html,OTC Markets Group Welcomes Mountain Valley MD Holdings Inc. to OTCQX,MVMD.CN
GlobeNewswire,/news/mountain-valley-md-holdings-graduate-200100733.html,"Mountain Valley MD Holdings to Graduate to OTCQX Best Market, Updates Broader Up-Listing Strategy",MVMD.CN
GlobeNewswire,/news/mountain-valley-md-appoints-chief-124500784.html,Mountain Valley MD Appoints Chief Medical Officer,MVMD.CN
GlobeNewswire,/news/mountain-valley-md-announces-appointment-124500438.html,"Mountain Valley MD Announces Appointment of Advisors, Stock Option Grant and Provides Uplisting Update",MVMD.CN
GlobeNewswire,/news/mountain-valley-md-announces-results-124500903.html,Mountain Valley MD Announces Results From Cold Chain Storage Evaluation of Novel Quicksome™ Technology,MVMD.CN
Newsfile,/news/screenpro-security-covid-testing-travel-130000616.html,ScreenPro Security COVID Testing with Travel Certificate Available Seven Days a Week in Toronto and Vancouver,SCRN.CN
Newsfile,/news/screenpro-security-ready-help-canadians-142800731.html,ScreenPro Security Is Ready to Help Canadians and the Government with Increased COVID Testing Capacity,SCRN.CN
Newsfile,/news/screenpros-bc-lab-trusted-laboratory-130000180.html,ScreenPro's BC Lab is a Trusted Laboratory for Travel to Africa,SCRN.CN
Newsfile,/news/screenpro-security-reports-q3-financial-133000266.html,ScreenPro Security Reports Q3 Financial Results,SCRN.CN
Newsfile,/news/screenpro-completes-acquisition-concierge-medical-121900312.html,ScreenPro Completes Acquisition of Concierge Medical Consultants Inc.,SCRN.CN
Newsfile,/news/screenpro-security-provides-testing-productions-110000856.html,ScreenPro Security Provides Update on Testing with Productions,SCRN.CN
Newsfile,/news/screenpro-announces-acquisition-concierge-medical-110000964.html,ScreenPro Announces Acquisition of Concierge Medical Consultants Inc.,SCRN.CN
Newsfile,/news/screenpro-provides-corporate-updates-110000746.html,ScreenPro Provides Corporate Updates,SCRN.CN
Newsfile,/news/screenpro-security-completed-upgrade-us-110000970.html,ScreenPro Security Completed Upgrade of US Listing to OTCQB,SCRN.CN
Newsfile,/news/screenpro-provides-covid-19-testing-110000615.html,ScreenPro Provides Covid-19 Testing Service To Media And Entertainment's Cruise Line,SCRN.CN
