source,link_href,link_text,ticker
GuruFocus.com,/news/guinness-atkinson-asset-management-inc-223801950.html,"Guinness Atkinson Asset Management Inc Buys Amphenol Corp, Autohome Inc, Texas Instruments Inc, ...",AT.TO
Motley Fool,/m/92167cb7-d5a9-35c3-943d-49e4a523ae1e/why-acuityads-stock-tumbled.html,Why AcuityAds Stock Tumbled 45% in November,AT.TO
Simply Wall St.,/news/does-acuityads-holdings-tse-healthy-111108810.html,Does AcuityAds Holdings (TSE:AT) Have A Healthy Balance Sheet?,AT.TO
CNW Group,/news/acuityads-appoints-elliot-muchnik-chief-130000657.html,AcuityAds Appoints Elliot Muchnik As Chief Financial Officer,AT.TO
CNW Group,/news/acuityads-participate-upcoming-2021-virtual-130000569.html,AcuityAds to Participate in Upcoming 2021 Virtual Investor Conferences,AT.TO
Motley Fool,/m/14688ebc-e168-3a21-a8cd-a31145e3533f/why-shares-of-acuityads-are.html,Why Shares of AcuityAds Are Down 23% Today,AT.TO
CNW Group,/news/acuityads-reports-third-quarter-2021-110000587.html,AcuityAds Reports Third Quarter 2021 Financial Results,AT.TO
Simply Wall St.,/news/weakness-acuityads-holdings-inc-tse-131940798.html,Should Weakness in AcuityAds Holdings Inc.'s (TSE:AT) Stock Be Seen As A Sign That Market Will Correct The Share Price Given Decent Financials?,AT.TO
Zacks,/news/acuityads-holdings-inc-aty-reports-190407206.html,AcuityAds Holdings Inc. (ATY) Reports Next Week: What You Should Expect,AT.TO
PR Newswire,/news/acuityads-announces-date-third-quarter-120000688.html,AcuityAds Announces Date for Third Quarter 2021 Financial Results Video Conference Call,AT.TO
GlobeNewswire,/news/aeterna-zentaris-appoints-giuliano-la-210500140.html,Aeterna Zentaris Appoints Giuliano La Fratta as Chief Financial Officer,AEZS.TO
GlobeNewswire,/news/aeterna-zentaris-reports-third-quarter-200500835.html,Aeterna Zentaris Reports Third Quarter 2021 Financial Results and Provides Pipeline Program Updates,AEZS.TO
Oilprice.com,/news/isn-t-sci-fi-ai-233000080.html,This Isn’t Sci-Fi: How AI Is About To Disrupt This $11 Trillion Industry,AEZS.TO
Oilprice.com,/news/why-trigger-next-great-medical-233000110.html,Why A.I. Is About To Trigger The Next Great Medical Breakthrough,AEZS.TO
InvestorPlace,/news/3-hot-penny-stocks-why-164652677.html,"3 Hot Penny Stocks: Why ZOM, AEZS and PROG Are Seeing Big Gains Today",AEZS.TO
Simply Wall St.,/news/aeterna-zentaris-tse-aezs-shareholders-120236638.html,Aeterna Zentaris (TSE:AEZS) shareholders have endured a 82% loss from investing in the stock five years ago,AEZS.TO
GlobeNewswire,/news/aeterna-zentaris-present-h-c-120000493.html,Aeterna Zentaris to Present at the H.C. Wainwright 23rd Annual Global Investment Conference,AEZS.TO
GlobeNewswire,/news/aeterna-zentaris-reports-second-quarter-200500356.html,Aeterna Zentaris Reports Second Quarter 2021 Financial Results and Provides Pipeline Program Updates,AEZS.TO
GlobeNewswire,/news/aeterna-zentaris-receives-nasdaq-notification-120500307.html,Aeterna Zentaris Receives Nasdaq Notification Regarding Minimum Bid Price Compliance; No Immediate Impact on Listing,AEZS.TO
Simply Wall St.,/news/think-aeterna-zentaris-tse-aezs-055623057.html,We Think Aeterna Zentaris (TSE:AEZS) Can Easily Afford To Drive Business Growth,AEZS.TO
CNW Group,/news/algonquin-power-utilities-corp-business-120000340.html,Algonquin Power & Utilities Corp. to Provide Business Update at Investor Day,AQN.TO
CNW Group,/news/algonquin-power-utilities-corp-host-220000930.html,Algonquin Power & Utilities Corp. to Host Virtual Analyst and Investor Day on December 14,AQN.TO
Zacks,/news/algonquin-power-utilities-aqn-q3-160304881.html,"Algonquin Power & Utilities (AQN) Q3 Earnings Lag, Sales Top",AQN.TO
Motley Fool,/m/c0ca3b35-24be-3885-bed4-2f28bcbf76f3/algonquin-power-utilities.html,Algonquin Power & Utilities Corp (AQN) Q3 2021 Earnings Call Transcript,AQN.TO
CNW Group,/news/algonquin-power-utilities-corp-announces-223600673.html,Algonquin Power & Utilities Corp. Announces 2021 Third Quarter Financial Results,AQN.TO
CNW Group,/news/algonquin-power-utilities-corp-declares-223600652.html,"Algonquin Power & Utilities Corp. Declares Fourth Quarter 2021 Common Share Dividend of U.S.$0.1706 (C$0.2124), and Declares Fourth Quarter 2021 Preferred Share Dividends",AQN.TO
Zacks,/news/algonquin-power-utilities-aqn-reports-190107551.html,Algonquin Power & Utilities (AQN) Reports Next Week: Wall Street Expects Earnings Growth,AQN.TO
Simply Wall St.,/news/adding-algonquin-power-utilities-tse-120702515.html,Should You Be Adding Algonquin Power & Utilities (TSE:AQN) To Your Watchlist Today?,AQN.TO
CNW Group,/news/iiroc-trade-resumption-aqn-121600478.html,IIROC Trade Resumption - AQN,AQN.TO
GlobeNewswire,/news/algonquin-power-utilities-corp-announces-203800022.html,Algonquin Power & Utilities Corp. Announces Agreement to Acquire Kentucky Power Company and Concurrent Bought Deal Common Equity Financing,AQN.TO
CNW Group,/news/argonaut-gold-provides-updated-magino-110000722.html,Argonaut Gold Provides Updated Magino Construction Capital Estimate and Announces Leadership Change,AR.TO
Newsfile,/news/ir-inc-vid-conferences-present-163300318.html,IR.INC & VID Conferences Present Virtual Investor Day V - December 6 - 8 2021,AR.TO
Investopedia,/m/0d2740b5-443a-3a4a-a83b-fc116ec083cd/top-gold-stocks-for-december.html,Top Gold Stocks for December 2021,AR.TO
InvestorPlace,/news/check-gold-stocks-amid-rally-214957827.html,Check Out These Gold Stocks Amid the Rally in Gold Prices,AR.TO
CNW Group,/news/argonaut-gold-intersects-16-0-120500085.html,Argonaut Gold Intersects 16.0 Metres at 6.1 g/t Gold and 7.0 Metres at 8.8 g/t Gold at Magino's Elbow Zone,AR.TO
CNW Group,/news/argonaut-gold-announces-quarterly-production-122500079.html,"Argonaut Gold Announces Quarterly Production of 58,777 Gold Equivalent Ounces, $39.6 Million of Cash Flow¹ and Provides Third Quarter 2021 Operating and Financial Results",AR.TO
Simply Wall St.,/news/investors-want-argonaut-golds-tse-111425981.html,Investors Will Want Argonaut Gold's (TSE:AR) Growth In ROCE To Persist,AR.TO
CNW Group,/news/argonaut-gold-announces-release-date-110500170.html,Argonaut Gold Announces Release Date For Third Quarter 2021 Operational and Financial Results,AR.TO
CNW Group,/news/argonaut-gold-acquires-key-mineral-110500366.html,Argonaut Gold Acquires Key Mineral Concessions Surrounding its San Agustin Mine from Fresnillo for US$5.75 Million and More Than Quadruples Mineral Tenure in the San Agustin District,AR.TO
Simply Wall St.,/news/investing-argonaut-gold-tse-ar-102412081.html,Investing in Argonaut Gold (TSE:AR) three years ago would have delivered you a 55% gain,AR.TO
CNW Group,/news/iiroc-trade-resumption-atz-212100493.html,IIROC Trade Resumption - ATZ,ATZ.TO
CNW Group,/news/iiroc-trading-halt-atz-211200267.html,IIROC Trading Halt - ATZ,ATZ.TO
CNW Group,/news/aritzia-reports-third-quarter-fiscal-210100697.html,Aritzia Reports Third Quarter Fiscal 2022 Financial Results,ATZ.TO
CNW Group,/news/aritzia-announces-normal-course-issuer-210100540.html,ARITZIA ANNOUNCES NORMAL COURSE ISSUER BID,ATZ.TO
PR Newswire,/news/aritzia-release-third-quarter-fiscal-140000896.html,Aritzia to Release Third Quarter Fiscal 2022 Financial Results,ATZ.TO
Simply Wall St.,/news/time-consider-buying-aritzia-inc-120325915.html,Is It Time To Consider Buying Aritzia Inc. (TSE:ATZ)?,ATZ.TO
Simply Wall St.,/news/returns-capital-standout-aritzia-tse-104631198.html,Returns On Capital Are A Standout For Aritzia (TSE:ATZ),ATZ.TO
SmarterAnalyst,/news/aritzia-posts-better-expected-q2-154809204.html,Aritzia Posts Better-Than-Expected Q2; Shares Pop,ATZ.TO
PR Newswire,/news/aritzia-reports-second-quarter-fiscal-200100306.html,Aritzia Reports Second Quarter Fiscal 2022 Financial Results,ATZ.TO
CNW Group,/news/aritzia-release-second-quarter-fiscal-130000513.html,Aritzia to Release Second Quarter Fiscal 2022 Financial Results,ATZ.TO
Zacks,/news/aurora-cannabis-inc-acb-gains-231511560.html,Aurora Cannabis Inc. (ACB) Gains As Market Dips: What You Should Know,ACB.TO
Yahoo Finance Video,/video/cannabis-fundamental-state-story-stay-152229163.html,Cannabis 'is a fundamental state story' that is here to stay: Trulieve CEO,ACB.TO
Motley Fool,/m/1e600688-2f87-346b-8d87-d5be44f79d01/is-this-pot-stock-repeating.html,Is This Pot Stock Repeating Aurora Cannabis' Mistakes?,ACB.TO
Motley Fool,/m/37bd74c7-a110-31e8-98a4-fb159e0237b7/why-hexo-aurora-cannabis-.html,"Why Hexo, Aurora Cannabis, and Sundial Growers Stocks Dropped Today",ACB.TO
Investor's Business Daily,/m/6e8fb483-3ff2-3a41-8275-9e9949427873/are-any-marijuana-stocks-on.html,Are Any Marijuana Stocks On U.S. Exchanges Buys As Canada's Struggles Continue?,ACB.TO
CNW Group,/news/aurora-22nd-century-group-license-210500502.html,Aurora and 22nd Century Group License Foundational Biosynthesis IP to Cronos Group,ACB.TO
CNW Group,/news/aurora-cannabis-again-scores-highest-122000016.html,Aurora Cannabis Again Scores Highest Among Cannabis Corporate Boards in The Globe and Mail's Board Games Report,ACB.TO
Yahoo Finance Video,/video/bitcoin-ether-cockroaches-theyre-not-173320555.html,"Bitcoin and ether 'are like cockroaches — they're not going to die,' Ross Gerber says",ACB.TO
Exec Edge,/news/humble-fume-charts-u-expansion-140614108.html,Humble & Fume Charts U.S. Expansion Roadmap With Johnson Brothers Partnership,ACB.TO
Motley Fool,/m/6c4b11fd-5d69-3d93-9d90-cdb734951614/why-tilray-aurora-cannabis-.html,"Why Tilray, Aurora Cannabis, and Canopy Growth Are Glowing Green",ACB.TO
Moody's,/news/bmo-harris-bank-national-association-140905746.html,BMO Harris Bank National Association -- Moody's announces completion of a periodic review of ratings of Bank of Montreal,BMO.TO
GuruFocus.com,/news/symmetry-partners-llc-buys-ishares-183804475.html,"Symmetry Partners, LLC Buys iShares National Muni Bond ETF, Pfizer Inc, Chevron Corp, Sells ...",BMO.TO
CNW Group,/news/bmo-savings-study-cash-king-110000481.html,"BMO Savings Study: Cash is King in TFSAs, as Many Canadians Miss Out on Higher Returns from Longer-Term Investments",BMO.TO
PR Newswire,/news/bmo-introduces-two-per-cent-220000449.html,BMO Introduces a Two Per Cent Discount for Shares Issued Under its Dividend Reinvestment Plan,BMO.TO
GuruFocus.com,/news/carret-asset-management-llc-buys-183806646.html,"Carret Asset Management, Llc Buys Qurate Retail Inc, ChargePoint Holdings Inc, ChargePoint ...",BMO.TO
Simply Wall St.,/news/bank-montreals-tse-bmo-upcoming-105919786.html,Bank of Montreal's (TSE:BMO) Upcoming Dividend Will Be Larger Than Last Year's,BMO.TO
CNW Group,/news/media-advisory-bmo-ceo-darryl-140000049.html,Media Advisory - BMO CEO Darryl White to Speak at RBC Capital Markets Canadian Bank CEO Conference,BMO.TO
Reuters,/news/rpt-focus-td-deal-hunt-060000188.html,RPT-FOCUS-TD on deal hunt after BancWest bid as Canadian lenders pursue U.S. growth,BMO.TO
Motley Fool,/m/f496b314-5139-31f8-b3ee-ef75f1cdebd4/big-bank-acquisition-is-bank.html,Big Bank Acquisition: Is Bank of Montreal a Buy?,BMO.TO
Barrons.com,/m/849a60b0-d02a-3aab-a52d-06d539adbd68/research-reports.html,Research Reports,BMO.TO
Moody's,/news/bmo-harris-bank-national-association-140905746.html,BMO Harris Bank National Association -- Moody's announces completion of a periodic review of ratings of Bank of Montreal,BMO.TO
GuruFocus.com,/news/symmetry-partners-llc-buys-ishares-183804475.html,"Symmetry Partners, LLC Buys iShares National Muni Bond ETF, Pfizer Inc, Chevron Corp, Sells ...",BMO.TO
CNW Group,/news/bmo-savings-study-cash-king-110000481.html,"BMO Savings Study: Cash is King in TFSAs, as Many Canadians Miss Out on Higher Returns from Longer-Term Investments",BMO.TO
PR Newswire,/news/bmo-introduces-two-per-cent-220000449.html,BMO Introduces a Two Per Cent Discount for Shares Issued Under its Dividend Reinvestment Plan,BMO.TO
GuruFocus.com,/news/carret-asset-management-llc-buys-183806646.html,"Carret Asset Management, Llc Buys Qurate Retail Inc, ChargePoint Holdings Inc, ChargePoint ...",BMO.TO
Simply Wall St.,/news/bank-montreals-tse-bmo-upcoming-105919786.html,Bank of Montreal's (TSE:BMO) Upcoming Dividend Will Be Larger Than Last Year's,BMO.TO
CNW Group,/news/media-advisory-bmo-ceo-darryl-140000049.html,Media Advisory - BMO CEO Darryl White to Speak at RBC Capital Markets Canadian Bank CEO Conference,BMO.TO
Reuters,/news/rpt-focus-td-deal-hunt-060000188.html,RPT-FOCUS-TD on deal hunt after BancWest bid as Canadian lenders pursue U.S. growth,BMO.TO
Motley Fool,/m/f496b314-5139-31f8-b3ee-ef75f1cdebd4/big-bank-acquisition-is-bank.html,Big Bank Acquisition: Is Bank of Montreal a Buy?,BMO.TO
Barrons.com,/m/849a60b0-d02a-3aab-a52d-06d539adbd68/research-reports.html,Research Reports,BMO.TO
Zacks,/news/best-momentum-stocks-buy-december-150003844.html,Best Momentum Stocks to Buy for December 27th,BNS.TO
Zacks,/news/best-income-stocks-buy-december-125712099.html,Best Income Stocks to Buy for December 27th,BNS.TO
Zacks,/news/zacks-analyst-blog-highlights-broadcom-114711386.html,"The Zacks Analyst Blog Highlights: Broadcom, The Bank of Nova Scotia and DENSO",BNS.TO
Zacks,/news/p-500-due-major-pullback-191007573.html,Is the S&P 500 Due for a Major Pullback? 3 Ultra-Safe Stocks,BNS.TO
CNW Group,/news/scotia-global-asset-management-announces-140000781.html,Scotia Global Asset Management announces estimated year-end reinvested distributions for the Scotia Index Tracker ETFs,BNS.TO
CNW Group,/news/scotia-global-asset-management-announces-140000485.html,Scotia Global Asset Management announces estimated year-end cash distributions for  the Scotia Index Tracker ETFs,BNS.TO
News Direct,/news/cdp-recognizes-scotiabank-above-industry-143108691.html,CDP Recognizes Scotiabank With Above-Industry-Average A- Score for Strong Climate-Related Disclosure and Management for Second Consecutive Year,BNS.TO
Zacks,/news/bank-nova-scotia-bns-stock-144002027.html,Is Bank of Nova Scotia (BNS) Stock Outpacing Its Finance Peers This Year?,BNS.TO
GuruFocus.com,/news/aqr-funds-buys-toyota-motor-173803243.html,"AQR Funds Buys Toyota Motor Corp, Commonwealth Bank of Australia, Westpac Banking Corp, Sells ...",BNS.TO
CNW Group,/news/scotia-wealth-management-recognized-global-170000002.html,Scotia Wealth Management recognized by Global Finance for 2nd consecutive year,BNS.TO
Investopedia,/m/35f0a9d2-d319-31be-a713-2e52395403f7/top-oil-and-gas-penny-stocks.html,Top Oil and Gas Penny Stocks for Q1 2022,BTE.TO
CNW Group,/news/p-dow-jones-indices-announces-221500598.html,S&P Dow Jones Indices Announces Changes to the S&P/TSX Composite Index,BTE.TO
GlobeNewswire,/news/baytex-announces-2022-budget-updated-220000196.html,Baytex Announces 2022 Budget and Updated Five-Year Outlook With Cumulative Free Cash Flow of $2.1 Billion,BTE.TO
Zacks,/news/zacks-industry-outlook-highlights-ovintiv-113611197.html,"Zacks Industry Outlook Highlights: Ovintiv, Crescent Point Energy, Baytex Energy and TC Energy",BTE.TO
Simply Wall St.,/news/those-invested-baytex-energy-tse-115243313.html,Those who invested in Baytex Energy (TSE:BTE) a year ago are up 838%,BTE.TO
GlobeNewswire,/news/baytex-announces-third-quarter-2021-211000787.html,"Baytex Announces Third Quarter 2021 Financial and Operating Results, Free Cash Flow of $101 Million and Repurchase of Long-Term Notes",BTE.TO
GlobeNewswire,/news/baytex-conference-call-webcast-third-203000827.html,"Baytex Conference Call and Webcast on Third Quarter 2021 Results to Be Held on November 5, 2021",BTE.TO
GlobeNewswire,/news/baytex-provides-2021-clearwater-appraisal-210000601.html,Baytex Provides Update to 2021 Clearwater Appraisal Program,BTE.TO
GlobeNewswire,/news/baytex-present-enercom-oil-gas-203600625.html,Baytex to Present at Enercom’s the Oil and Gas Conference,BTE.TO
GlobeNewswire,/news/baytex-releases-2020-esg-report-212000278.html,Baytex Releases 2020 ESG Report and Appoints Chief Operating and Sustainability Officer,BTE.TO
Yahoo Finance UK,/news/gamestop-amc-2021-the-year-when-memes-humbled-hedge-funds-000125884.html,2021: The year when memes humbled hedge funds,BB.TO
Insider Monkey,/news/10-key-quarterly-reports-watch-171658656.html,10 Key Quarterly Reports to Watch,BB.TO
Yahoo Finance Video,/video/why-retail-investors-very-good-160124998.html,"Why retail investors have been ‘very good for markets,’ according to a finance professor",BB.TO
Zacks,/news/company-news-dec-23-2021-143502987.html,"Company News for Dec 23, 2021",BB.TO
American City Business Journals,/m/908be5f6-9fc3-3a91-ab0a-815e85819bbc/durham-firm-that-hosted.html,Durham firm that hosted Fortune 500 companies will shut down,BB.TO
Motley Fool,/m/66edf322-4a36-3764-ac69-9aee35ed1797/blackberry-stock-bear-vs-.html,BlackBerry Stock: Bear vs. Bull,BB.TO
Simply Wall St.,/news/kind-shareholders-hold-majority-blackberry-101640937.html,What Kind Of Shareholders Hold The Majority In BlackBerry Limited's (TSE:BB) Shares?,BB.TO
InvestorPlace,/news/4-top-stock-trades-thursday-223240106.html,"4 Top Stock Trades for Thursday: PTON, PG, BB, KMX",BB.TO
TipRanks,/news/blackberry-earnings-bulls-win-next-200728689.html,"BlackBerry Earnings: Bulls Win, What’s Next?",BB.TO
Yahoo Finance Video,/video/earnings-blackberry-stock-declines-beat-145526582.html,"Earnings: BlackBerry stock declines on beat, CarMax shares jump on strong used car demand",BB.TO
MarketWatch,/m/dea0b309-395c-3a72-8139-d4afc84f00d1/kohl%E2%80%99s-abercrombie-fitch-.html,"Kohl’s, Abercrombie & Fitch, Canada Goose downgraded with inflation expected to put fashion and retail under pressure in 2022",GOOS.TO
Simply Wall St.,/news/shareholders-canada-goose-holdings-tse-094959802.html,Shareholders in Canada Goose Holdings (TSE:GOOS) are in the red if they invested three years ago,GOOS.TO
InvestorPlace,/news/10-stocks-buy-heading-teeth-191503060.html,10 Stocks to Buy Heading Into the Teeth of Winter,GOOS.TO
Zacks,/news/tpr-vs-goos-stock-better-164004569.html,TPR vs. GOOS: Which Stock Is the Better Value Option?,GOOS.TO
GuruFocus.com,/news/american-century-variable-portfolios-inc-183802557.html,"American Century Variable Portfolios Inc Buys Food & Life, Koninklijke DSM NV, BayCurrent ...",GOOS.TO
Zacks,/news/tractor-supplys-tsco-life-strategy-155103485.html,Tractor Supply's (TSCO) Life Out Here Strategy Steals the Show,GOOS.TO
GuruFocus.com,/news/royce-value-trust-inc-buys-093803320.html,"Royce Value Trust, Inc. Buys Calix Inc, MaxCyte Inc, Dutch Bros Inc, Sells EQT Corp, ...",GOOS.TO
Zacks,/news/down-24-3-4-weeks-150003590.html,"Down 24.3% in 4 Weeks, Here's Why Canada Goose (GOOS) Looks Ripe for a Turnaround",GOOS.TO
Zacks,/news/plce-goos-better-value-stock-164004240.html,PLCE or GOOS: Which Is the Better Value Stock Right Now?,GOOS.TO
Simply Wall St.,/news/canada-goose-holdings-tse-goos-150501502.html,Canada Goose Holdings' (TSE:GOOS) Returns Have Hit A Wall,GOOS.TO
PR Newswire,/news/cascades-release-fourth-quarter-2021-213000683.html,"Cascades to Release Fourth Quarter 2021 Earnings and 2022 - 2024 Strategic Plan Details on February 24, 2022",CAS.TO
Simply Wall St.,/news/investors-undervaluing-cascades-inc-tse-122135369.html,Are Investors Undervaluing Cascades Inc. (TSE:CAS) By 25%?,CAS.TO
CNW Group,/news/cascades-reports-results-third-quarter-110000050.html,Cascades Reports Results for the Third Quarter of 2021,CAS.TO
PR Newswire,/news/cascades-inc-announces-early-tender-015100819.html,"Cascades Inc. Announces Early Tender Results, Pricing and Upsizing of Modified Dutch Auction Tender Offers for Its 5.375% Senior Notes Due 2028 and 5.125% Senior Notes Due 2026",CAS.TO
PR Newswire,/news/cascades-inc-announces-modified-dutch-005000127.html,Cascades Inc. Announces Modified Dutch Auction Tender Offers for up to US$200 Million of its 5.375% Senior Notes Due 2028 and 5.125% Senior Notes Due 2026,CAS.TO
PR Newswire,/news/cascades-completes-sale-equity-position-143000308.html,Cascades Completes the Sale of its Equity Position in RDM Group,CAS.TO
PR Newswire,/news/cascades-fourth-sustainability-action-plan-141200584.html,Cascades' Fourth Sustainability Action Plan: A Prix initiatives circulaires Winner,CAS.TO
Simply Wall St.,/news/percentage-cascades-inc-tse-cas-131314561.html,What Percentage Of Cascades Inc. (TSE:CAS) Shares Do Insiders Own?,CAS.TO
PR Newswire,/news/cascades-announces-sale-equity-interest-180000623.html,Cascades Announces That the Sale of its Equity Interest in RdM Group Will Be Completed in Q4 2021,CAS.TO
GlobeNewswire,/news/closing-acquisition-apollo-funds-approx-180000247.html,Closing of the acquisition by Apollo Funds of approx. 67% stake in RDM group,CAS.TO
ACCESSWIRE,/news/bronstein-gewirtz-grossman-llc-notifies-171500612.html,"Bronstein, Gewirtz & Grossman, LLC Notifies Shareholders of Cineplex Inc. (CPXGF) Investigation",CGX.TO
Bloomberg,/news/cineworld-plunges-prospect-1-billion-101216891.html,"Cineworld Plunges, Cineplex Soars on $1 Billion Court Ruling Over Deal",CGX.TO
The Independent,/news/cineworld-shares-plunge-canadian-court-125108943.html,Cineworld shares plunge as Canadian court tells them to pay up £720 million,CGX.TO
The Telegraph,/news/cineworld-shares-collapse-700m-court-120851638.html,Cineworld shares collapse after £700m court ruling,CGX.TO
Reuters,/news/1-cineworld-shares-plunge-957-082249230.html,UPDATE 1-Cineworld shares plunge after $957 mln damage ruling on aborted Cineplex deal,CGX.TO
Reuters,/news/cineworld-shares-plunge-957-million-072956966.html,Cineworld shares tumble after damages over scrapped Cineplex deal,CGX.TO
Investing.com,/news/cineworld-tumbles-1-billion-damages-040522783.html,Cineworld Tumbles After $1 Billion Damages Ruling Over Failed Takeover,CGX.TO
CNW Group,/news/ontario-superior-court-justice-rules-233000414.html,Ontario Superior Court of Justice Rules in Favour of Cineplex,CGX.TO
CNW Group,/news/scotiabank-cineplex-transform-loyalty-landscape-120000334.html,Scotiabank and Cineplex Transform Loyalty Landscape in Canada with the Launch of Scene+,CGX.TO
CNW Group,/news/holiday-spirit-escape-holiday-hustle-150000513.html,Get into the Holiday Spirit - or Escape the Holiday Hustle - with Cineplex!,CGX.TO
GlobeNewswire,/news/constellation-software-inc-announces-formation-220500993.html,Constellation Software Inc. Announces Formation of a Venture Capital Fund and Management Changes,CSU.TO
Simply Wall St.,/news/much-constellation-software-inc-tse-092337672.html,How Much Of Constellation Software Inc. (TSE:CSU) Do Insiders Own?,CSU.TO
GlobeNewswire,/news/change-directors-constellation-software-035600634.html,Change of Directors at Constellation Software,CSU.TO
GlobeNewswire,/news/harris-adds-industry-leading-telecommunication-173500306.html,Harris adds industry-leading telecommunication solutions to its portfolio with the acquisition of Globys,CSU.TO
GlobeNewswire,/news/constellation-software-inc-announces-results-210400852.html,"Constellation Software Inc. Announces Results for the Third Quarter Ended September 30, 2021, Declares Quarterly Dividend, and Appoints John Billowits as Chair of the Board of Directors",CSU.TO
GlobeNewswire,/news/constellation-software-inc-topicus-com-210200339.html,"Constellation Software Inc. and Topicus.Com Inc. Announce Results for Topicus.com Inc. for the Third Quarter Ended September 30, 2021",CSU.TO
GlobeNewswire,/news/harris-acquires-uk-based-apprenticeship-160800589.html,Harris acquires UK-based apprenticeship EdTech software provider Onefile,CSU.TO
GlobeNewswire,/news/constellation-software-inc-announces-release-223800539.html,Constellation Software Inc. Announces Release Date for Third Quarter Results,CSU.TO
Simply Wall St.,/news/constellation-software-inc-tse-csu-125206041.html,Is Constellation Software Inc.'s (TSE:CSU) Stock's Recent Performance A Reflection Of Its Financial Health?,CSU.TO
GlobeNewswire,/news/lumine-group-acquires-kansys-inc-120200577.html,Lumine Group Acquires Kansys Inc,CSU.TO
Simply Wall St.,/news/crescent-point-energy-corp-tse-101255163.html,Has Crescent Point Energy Corp.'s (TSE:CPG) Impressive Stock Performance Got Anything to Do With Its Fundamentals?,CPG.TO
GuruFocus.com,/news/rmb-investors-trust-buys-mitsui-163801760.html,"Rmb Investors Trust Buys Mitsui Fudosan Co, Compass Group PLC, Diageo PLC, Sells Rio Tinto PLC, ...",CPG.TO
GuruFocus.com,/news/oshares-europe-quality-dividend-etf-153805821.html,"O'Shares Europe Quality Dividend ETF Buys Roche Holding AG, Nestle SA, LVMH Moet Hennessy Louis ...",CPG.TO
Oilprice.com,/news/totalenergies-perfect-energy-transition-play-220000961.html,Is TotalEnergies The Perfect Energy Transition Play?,CPG.TO
CNW Group,/news/crescent-point-announces-2022-budget-113000968.html,Crescent Point Announces 2022 Budget and Increased Return of Capital to Shareholders,CPG.TO
Zacks,/news/value-investors-buy-crescent-point-165004794.html,Should Value Investors Buy Crescent Point Energy (CPG) Stock?,CPG.TO
Zacks,/news/zacks-industry-outlook-highlights-ovintiv-113611197.html,"Zacks Industry Outlook Highlights: Ovintiv, Crescent Point Energy, Baytex Energy and TC Energy",CPG.TO
Oilprice.com,/news/could-biggest-winner-oil-price-230000126.html,Could This Be The Biggest Winner Of The Oil Price Boom?,CPG.TO
Simply Wall St.,/news/investors-undervaluing-crescent-point-energy-112712966.html,Are Investors Undervaluing Crescent Point Energy Corp. (TSE:CPG) By 50%?,CPG.TO
Motley Fool,/m/c9f2e6b7-6189-30bc-bb10-619dba9e8e00/crescent-point-energy-corp.html,Crescent Point Energy Corp (CPG) Q3 2021 Earnings Call Transcript,CPG.TO
Simply Wall St.,/news/crescent-point-energy-corp-tse-101255163.html,Has Crescent Point Energy Corp.'s (TSE:CPG) Impressive Stock Performance Got Anything to Do With Its Fundamentals?,CPG.TO
GuruFocus.com,/news/rmb-investors-trust-buys-mitsui-163801760.html,"Rmb Investors Trust Buys Mitsui Fudosan Co, Compass Group PLC, Diageo PLC, Sells Rio Tinto PLC, ...",CPG.TO
GuruFocus.com,/news/oshares-europe-quality-dividend-etf-153805821.html,"O'Shares Europe Quality Dividend ETF Buys Roche Holding AG, Nestle SA, LVMH Moet Hennessy Louis ...",CPG.TO
