source,link_href,link_text,ticker
CNW Group,/news/opsens-host-fourth-quarter-fiscal-140000071.html,"OpSens to Host Fourth Quarter Fiscal Year 2021 Financial Results Conference Call and Year-End Update on Tuesday, November 23, 2021",OPS.TO
CNW Group,/news/opsens-participate-stifel-2021-virtual-140000313.html,OpSens will Participate at Stifel 2021 Virtual Healthcare Conference and Canaccord Genuity  MedTech & Diagnostics Forum,OPS.TO
CNW Group,/news/opsens-savvywire-featured-transcatheter-cardiovascular-120000375.html,OPSENS' SAVVYWIRE™ Featured at the Transcatheter Cardiovascular Therapeutics 2021 Annual Meeting in Orlando,OPS.TO
Simply Wall St.,/news/4-measures-indicate-opsens-tse-165500172.html,These 4 Measures Indicate That Opsens (TSE:OPS) Is Using Debt Reasonably Well,OPS.TO
CNW Group,/news/opsens-successfully-treats-first-patients-110000078.html,OpSens Successfully Treats First Patients in Human Clinical Study for TAVR Procedure,OPS.TO
CNW Group,/news/p-dow-jones-indices-announces-221500598.html,S&P Dow Jones Indices Announces Changes to the S&P/TSX Composite Index,POU.TO
CNW Group,/news/paramount-resources-ltd-announces-december-120000426.html,Paramount Resources Ltd. Announces December Dividend,POU.TO
Simply Wall St.,/news/paramount-resources-ltd-tse-pou-152840480.html,Paramount Resources Ltd.'s (TSE:POU) Intrinsic Value Is Potentially 79% Above Its Share Price,POU.TO
CNW Group,/news/paramount-resources-ltd-announces-third-100000111.html,"Paramount Resources Ltd. Announces Third Quarter 2021 Results, Updated 2021 Guidance, 2022 Capital Budget and Guidance and Increased Dividend",POU.TO
GlobeNewswire,/news/alaris-equity-partners-announces-board-215000697.html,Alaris Equity Partners Announces Board Member Appointment,POU.TO
CNW Group,/news/paramount-resources-ltd-announces-october-110000747.html,Paramount Resources Ltd. Announces October Dividend,POU.TO
Simply Wall St.,/news/read-considering-paramount-resources-ltd-133429919.html,Read This Before Considering Paramount Resources Ltd. (TSE:POU) For Its Upcoming CA$0.02 Dividend,POU.TO
CNW Group,/news/paramount-resources-ltd-announces-september-113000046.html,Paramount Resources Ltd. Announces September Dividend,POU.TO
CNW Group,/news/paramount-resources-ltd-announces-implementation-210000391.html,"Paramount Resources Ltd. Announces Implementation of Monthly Dividend, Settlement of Strath Dissent and Normal Course Issuer Bid",POU.TO
Simply Wall St.,/news/investors-bought-paramount-resources-tse-120330274.html,Investors Who Bought Paramount Resources (TSE:POU) Shares A Year Ago Are Now Up 522%,POU.TO
CNW Group,/news/rbc-global-asset-management-inc-140500610.html,"RBC Global Asset Management Inc. announces December sales results for RBC Funds, PH&N Funds and BlueBay Funds",RY.TO
Reuters,/news/canadas-royal-bank-tells-staff-142902358.html,Canada's Royal Bank tells staff to keep working remotely,RY.TO
CNW Group,/news/dave-mckay-rbc-speak-rbc-140100379.html,Dave McKay of RBC to Speak at RBC Capital Markets 2022 Canadian Bank CEO Conference,RY.TO
Bloomberg,/news/rbc-retakes-canadian-ipo-crown-130000673.html,RBC Retakes Canadian IPO Crown as Market Surge Fuels Record Year,RY.TO
GuruFocus.com,/news/enterprise-bank-trust-co-buys-023805402.html,"Enterprise Bank & Trust Co Buys FlexShares Global Upstream Natural Resources Index, The ...",RY.TO
Bloomberg,/news/tesla-races-against-clock-hit-144106216.html,Tesla Races Against the Clock to Hit Record Deliveries Before the New Year,RY.TO
CNW Group,/news/rbc-global-asset-management-inc-130500664.html,RBC Global Asset Management Inc. announces final annual reinvested capital gains distributions for RBC ETFs,RY.TO
Yahoo Finance Video,/video/libor-era-nears-end-firms-161447505.html,"Libor era nears end, firms move to SOFR for financial contracts",RY.TO
GuruFocus.com,/news/advisors-inner-circle-fund-iii-043809097.html,"Advisors' Inner Circle Fund III Buys Petroleo Brasileiro SA Petrobras, Gazprom PJSC, Roche ...",RY.TO
Reuters,/news/rpt-focus-td-deal-hunt-060000188.html,RPT-FOCUS-TD on deal hunt after BancWest bid as Canadian lenders pursue U.S. growth,RY.TO
Motley Fool,/m/cbddf3b5-6f78-393c-bfa2-b3087f5ab455/why-shopify-stock-cratered-on.html,Why Shopify Stock Cratered on Thursday,SHOP.TO
Motley Fool,/m/0a913b21-0012-348f-acf4-ddb91723eee7/should-companies-approach-the.html,"Should Companies Approach the Buy Now, Pay Later Craze With Caution?",SHOP.TO
GuruFocus.com,/news/cottage-street-advisors-llc-buys-143802489.html,"Cottage Street Advisors LLC Buys PIMCO Enhanced Short Maturity Active Exchange-Trad, SPDR ...",SHOP.TO
Insider Monkey,/news/guardian-fund-biggest-investment-shopify-141708885.html,Guardian Fund’s Biggest Investment: Shopify (SHOP),SHOP.TO
Motley Fool,/m/695b19ff-abfa-3209-8f28-f861cf24d33d/could-this-be-shopify-s-next.html,Could This Be Shopify's Next Acquisition?,SHOP.TO
Barrons.com,/m/ba901d2d-0cc0-3c23-9208-90e7f1284794/shopify-stock-has-dropped-a.html,Shopify Stock Has Dropped a Ton. Is It Time to Buy?,SHOP.TO
Motley Fool,/m/8df64ef8-c41e-3218-8382-dcb6f16a8bb9/why-c3-ai-is-a-top-tech-stock.html,Why C3.ai Is a Top Tech Stock to Watch in 2022,SHOP.TO
GuruFocus.com,/news/hoffman-alan-n-investment-management-143808547.html,"Hoffman, Alan N Investment Management Buys NVIDIA Corp, Vanguard Mega Cap Growth ETF, SPDR ...",SHOP.TO
GuruFocus.com,/news/linden-rose-investment-llc-buys-183807324.html,"Linden Rose Investment LLC Buys Apple Inc, Alphabet Inc, Amazon. ...",SHOP.TO
Insider Monkey,/news/10-most-successful-tech-ipos-144210811.html,10 Most Successful Tech IPOs of 2021,SHOP.TO
CNW Group,/news/stelco-enter-rapidly-growing-electric-123000619.html,Stelco to Enter the Rapidly Growing Electric Vehicle Battery Recycling Market Through Agreements with Technology-Leader Primobius,STLC.TO
Simply Wall St.,/news/stelco-holdings-inc-tse-stlc-153217478.html,Is Stelco Holdings Inc. (TSE:STLC) Popular Amongst Insiders?,STLC.TO
CNW Group,/news/stelco-holdings-inc-announces-intention-130000393.html,Stelco Holdings Inc. Announces Intention to Commence Substantial Issuer Bid,STLC.TO
CNW Group,/news/stelco-holdings-inc-reports-record-224400031.html,Stelco Holdings Inc. Reports Record Revenue and Earnings in Q3 2021 and Raises Dividend by 50%,STLC.TO
CNW Group,/news/stelco-holdings-inc-schedules-third-210000493.html,Stelco Holdings Inc. Schedules Third Quarter 2021 Earnings Release and Conference Call,STLC.TO
Simply Wall St.,/news/look-intrinsic-value-stelco-holdings-142516476.html,A Look At The Intrinsic Value Of Stelco Holdings Inc. (TSE:STLC),STLC.TO
Simply Wall St.,/news/stelco-holdings-inc-tse-stlc-103224554.html,Is Stelco Holdings Inc.'s (TSE:STLC) Recent Stock Performance Influenced By Its Fundamentals In Any Way?,STLC.TO
Investopedia,/m/98033c5e-300c-376a-a365-92c3076bc944/top-steel-stocks-for-q4-2021.html,Top Steel Stocks for Q4 2021,STLC.TO
CNW Group,/news/stelco-announces-closing-buyback-213100936.html,Stelco Announces Closing of Buyback,STLC.TO
CNW Group,/news/stelco-holdings-inc-announces-major-110100848.html,Stelco Holdings Inc. Announces Major Share Buyback and Cancellation of Approximately 13% of Its Outstanding Shares,STLC.TO
Insider Monkey,/news/10-oil-gas-stocks-billionaire-114527446.html,10 Oil and Gas Stocks in Billionaire Steve Cohen’s Portfolio,SU.TO
Zacks,/news/suncor-energy-su-gains-market-230011250.html,Suncor Energy (SU) Gains As Market Dips: What You Should Know,SU.TO
Oilprice.com,/news/canada-still-sees-future-oil-200000768.html,Canada Still Sees Future As Oil Exporter Despite Climate Ambitions,SU.TO
Zacks,/news/suncor-energy-su-stock-sinks-230011819.html,Suncor Energy (SU) Stock Sinks As Market Gains: What You Should Know,SU.TO
Newsfile,/news/suncor-nergie-publiera-les-r-223000592.html,Suncor Énergie publiera les résultats financiers du quatrième trimestre de 2021,SU.TO
Newsfile,/news/suncor-energy-release-fourth-quarter-223000985.html,Suncor Energy to Release Fourth Quarter 2021 Financial Results,SU.TO
Zacks,/news/suncor-energy-su-gains-lags-225010087.html,Suncor Energy (SU) Gains But Lags Market: What You Should Know,SU.TO
Motley Fool,/m/4a1cfab3-db0b-3fb6-b908-431e977b28ec/3-great-foreign-companies-to.html,3 Great Foreign Companies to Invest in Right Now,SU.TO
Zacks,/news/suncor-energy-su-outpaces-stock-230011887.html,Suncor Energy (SU) Outpaces Stock Market Gains: What You Should Know,SU.TO
Zacks,/news/oil-gas-stock-roundup-shells-131101521.html,"Oil & Gas Stock Roundup: Shell's Acquisition, EQT's Buyback & More",SU.TO
Bloomberg,/news/tesla-strikes-battery-metal-deal-223721833.html,Tesla Strikes Battery-Metal Deal in Push to Ensure Supply,TLO.TO
Zacks,/news/tesla-tsla-inks-nickel-supply-140602245.html,Tesla (TSLA) Inks Nickel Supply Deal With Talon for Battery Cells,TLO.TO
CNW Group,/news/iiroc-trade-resumption-tlo-125800818.html,IIROC Trade Resumption - TLO,TLO.TO
Reuters,/news/tesla-signs-deal-first-u-211115605.html,Tesla signs deal for first U.S. nickel supply with Talon Metals,TLO.TO
Newsfile,/news/tesla-talon-metals-enter-supply-205500129.html,Tesla and Talon Metals Enter into Supply Agreement for Nickel,TLO.TO
CNW Group,/news/iiroc-trading-halt-tlo-204300006.html,IIROC Trading Halt - TLO,TLO.TO
Newsfile,/news/us-ev-battery-supply-chain-215500291.html,US EV Battery Supply Chain: Talon Sets Ambitious 2022 Exploration Goals for the Tamarack Nickel Project in Minnesota and Provides Corporate Update,TLO.TO
Newsfile,/news/talon-metals-files-final-shelf-181000721.html,Talon Metals Files Final Base Shelf Prospectus,TLO.TO
Newsfile,/news/us-ev-battery-supply-chain-123000935.html,US EV Battery Supply Chain: Drilling Continues to Deliver High-Grade Nickel and Copper Intercepts at the Tamarack Nickel Project,TLO.TO
Simply Wall St.,/news/think-talon-metals-tse-tlo-171223162.html,We Think Talon Metals (TSE:TLO) Can Afford To Drive Business Growth,TLO.TO
Yahoo Finance Video,/video/market-check-stocks-fall-early-153719746.html,"Market check: Stocks fall in early trading, tech renews declines, Tilray shares soar",TLRY.TO
Bloomberg,/news/tilray-focuses-brand-growth-saturated-151336827.html,Tilray Focuses on Brand Growth in Saturated Canadian Pot Market,TLRY.TO
MarketWatch,/m/f6bf76f3-bff1-3141-8cab-bbe920d62e58/tilray-posts-narrower-loss-as.html,Tilray posts narrower loss as revenue rises,TLRY.TO
Zacks,/news/tilray-tlry-beats-q2-earnings-135601040.html,Tilray (TLRY) Beats on Q2 Earnings,TLRY.TO
MarketWatch,/m/c388a8bf-3ebf-34ff-9d0e-5a0263f7d3f4/tilray-results-beat-analyst.html,"Tilray results beat analyst target, shares rise",TLRY.TO
Reuters,/news/tilray-reports-20-jump-revenue-122735455.html,"Tilray posts surprise profit on cost cuts, pledges more savings",TLRY.TO
Reuters,/news/1-tilray-reports-20-jump-121155150.html,"CORRECTED-UPDATE 2-Tilray posts surprise profit on cost cuts, pledges more savings",TLRY.TO
GlobeNewswire,/news/tilray-inc-reports-profitable-second-120000619.html,"Tilray, Inc. Reports Profitable Second Quarter Fiscal Year 2022 Financial Results",TLRY.TO
TheStreet.com,/m/b98c5963-49ef-3823-a6d5-2aead71b7d01/i-wouldn-t-jump-on-the-tilray.html,"I Wouldn't Jump on the Tilray Bandwagon, But Here's What I Would Do",TLRY.TO
TheStreet.com,/m/c6e09e88-a505-3448-87df-3bc4546f0126/tilray-reports-surprise.html,Tilray Reports Surprise Profit as Revenue Jumps 20%,TLRY.TO
Moody's,/news/toronto-dominion-holdings-u-inc-140808575.html,"Toronto Dominion Holdings (U.S.A.), Inc. -- Moody's announces completion of a periodic review of ratings of Toronto-Dominion Bank (The)",TD.TO
PR Newswire,/news/td-bank-tops-small-business-142800320.html,"TD Bank Tops Small Business Banking in the South, According to J.D. Power",TD.TO
CNW Group,/news/td-asset-management-inc-announces-130000832.html,TD Asset Management Inc. Announces Final Annual Reinvested Distributions for TD ETFs,TD.TO
American City Business Journals,/m/b37a67f6-99f8-3a2d-922b-c78c37edd025/coalition-of-33-financial.html,Coalition of 33 financial institutions formally launches $100M fund for local minority-owned businesses,TD.TO
CNW Group,/news/canadian-renters-risk-expensive-repair-120000170.html,Canadian renters at risk of expensive repair or replacement costs of important personal belongings following a loss,TD.TO
Bloomberg,/news/toronto-dominion-ceo-sees-buybacks-172502919.html,Toronto-Dominion CEO Sees Buybacks as Plan B If No Deals Work,TD.TO
CNW Group,/news/toronto-dominion-bank-receives-regulatory-113000258.html,The Toronto-Dominion Bank Receives Regulatory Approval for Normal Course Issuer Bid,TD.TO
Bloomberg,/news/cryptos-hitting-lower-lows-lower-180245265.html,Cryptos Hitting Lower Lows and Lower Highs Not So Bad After All,TD.TO
PR Newswire,/news/pandemic-permanently-altered-consumer-restaurant-140000034.html,"The Pandemic has Permanently Altered the Consumer-Restaurant Relationship, TD Bank Survey Finds",TD.TO
CNW Group,/news/media-advisory-td-bank-group-113000526.html,MEDIA ADVISORY - TD Bank Group Executive to Present at the RBC Capital Markets Bank CEO Conference,TD.TO
Bloomberg,/news/collapsed-turbine-forces-transalta-rebuild-150705708.html,Turbine Collapse Spurs TransAlta to Rebuild Canada Wind Farm,RNW.TO
CNW Group,/news/transalta-renewables-provides-kent-hills-120000948.html,TransAlta Renewables Provides Update on Kent Hills Outage,RNW.TO
Insider Monkey,/news/10-best-high-dividend-stocks-175009678.html,10 Best High Dividend Stocks in Canada for 2022,RNW.TO
CNW Group,/news/transalta-renewables-announces-commercial-operation-211600222.html,TransAlta Renewables Announces Commercial Operation of Windrise and Pricing of $173 Million Project Financing,RNW.TO
Simply Wall St.,/news/weak-financial-prospects-seem-dragging-104124049.html,Weak Financial Prospects Seem To Be Dragging Down TransAlta Renewables Inc. (TSE:RNW) Stock,RNW.TO
CNW Group,/news/transalta-renewables-reports-third-quarter-120000344.html,TransAlta Renewables Reports Third Quarter 2021 Results,RNW.TO
CNW Group,/news/transalta-renewables-provides-operational-kent-110000814.html,TransAlta Renewables Provides Operational Update for Kent Hills Wind Facility and Revises 2021 Guidance,RNW.TO
CNW Group,/news/transalta-renewables-declares-dividends-230600335.html,TransAlta Renewables Declares Dividends,RNW.TO
Simply Wall St.,/news/returns-transalta-renewables-tse-rnw-161555174.html,Returns At TransAlta Renewables (TSE:RNW) Are On The Way Up,RNW.TO
CNW Group,/news/transalta-renewables-temporarily-suspends-operations-090000190.html,TransAlta Renewables Temporarily Suspends Operations at Kent Hills Wind Facility Pending Investigation of Wind Tower Failure,RNW.TO
CNW Group,/news/transat-t-inc-results-fourth-120000520.html,Transat A.T. Inc. - Results for fourth quarter of 2021,TRZ.TO
CNW Group,/news/r-e-p-e-t-115500359.html,/R E P E A T -- Transat A.T. Inc. - Media Advisory - Fourth Quarter and Fiscal 2021 Results/,TRZ.TO
CNW Group,/news/air-transat-launches-virtual-interlining-140000855.html,Air Transat launches a virtual interlining service: connectair by Air Transat,TRZ.TO
CNW Group,/news/air-transat-westjet-cooperate-transatlantic-120000984.html,Air Transat and WestJet to Cooperate on Transatlantic Codeshare,TRZ.TO
CNW Group,/news/air-transat-announces-summer-2022-140000633.html,Air Transat announces its summer 2022 flight program,TRZ.TO
CNW Group,/news/first-canadian-offtake-agreement-air-113000326.html,First Canadian offtake agreement - Air Transat and SAF+ announce a major offtake agreement,TRZ.TO
CNW Group,/news/air-transat-presents-routes-summer-130000856.html,Air Transat presents new routes for summer 2022,TRZ.TO
CNW Group,/news/air-transat-announces-direct-between-191700964.html,Air Transat announces direct service between Quebec City and London,TRZ.TO
CNW Group,/news/transat-announces-appointment-patrick-bui-110000067.html,Transat announces the appointment of Patrick Bui as Chief Financial Officer,TRZ.TO
CNW Group,/news/air-transat-named-worlds-best-130000953.html,Air Transat named World's Best Leisure Airline once again,TRZ.TO
Zacks,/news/totalenergies-se-sponsored-adr-tte-144002750.html,Is TotalEnergies SE Sponsored ADR (TTE) Outperforming Other Oils-Energy Stocks This Year?,VET.TO
Zacks,/news/shells-rds-q4-earnings-know-110011170.html,Shell's (RDS.A) Q4 Earnings Update: All You Need to Know,VET.TO
Simply Wall St.,/news/growth-investors-industry-analysts-just-115318800.html,Growth Investors: Industry Analysts Just Upgraded Their Vermilion Energy Inc. (TSE:VET) Revenue Forecasts By 12%,VET.TO
Zacks,/news/u-oil-stocks-fall-sixth-142902229.html,"U.S. Oil Stocks Fall for the Sixth Week, Fuel Supplies Swell",VET.TO
Zacks,/news/why-worth-buying-earthstone-este-163504089.html,Why is it Worth Buying Earthstone (ESTE) Stock Right Now,VET.TO
Zacks,/news/4-oil-gas-stocks-more-162104251.html,4 Oil & Gas Stocks That More Than Doubled in 2021,VET.TO
Motley Fool,/m/9b622257-8b00-36ce-bd1b-5967a03a989b/why-range-resources-and.html,"Why Range Resources and Antero Resources Fell as Much as 15% This Week, but Vermilion Energy Jumped 12%",VET.TO
CNW Group,/news/vermilion-energy-inc-announces-corrib-123500355.html,Vermilion Energy Inc. Announces Corrib Acquisition and 2022 Budget and Guidance,VET.TO
PR Newswire,/news/vermilion-energy-inc-announces-results-215200955.html,"Vermilion Energy Inc. Announces Results for the Three and Nine Months Ended September 30, 2021",VET.TO
CNW Group,/news/vermilion-energy-inc-announces-third-200500259.html,Vermilion Energy Inc. Announces Third Quarter 2021 Release Date and Conference Call and Webcast Details,VET.TO
Investopedia,/m/49a5e9ae-1512-3a84-93ee-eb0048d16dff/10-biggest-blockchain.html,10 Biggest Blockchain Companies,VOYG.TO
CNW Group,/news/voyager-digital-announces-trading-common-191500967.html,"VOYAGER DIGITAL ANNOUNCES TRADING OF COMMON SHARES AND VARIABLE VOTING SHARES UNDER SINGLE TRADING SYMBOL TO COMMENCE AS OF MARKET OPEN ON TSX ON DECEMBER 23, 2021",VOYG.TO
PR Newswire,/news/voyager-digital-announces-brian-brooks-124500080.html,"VOYAGER DIGITAL ANNOUNCES BRIAN BROOKS, FORMER ACTING COMPTROLLER OF THE U.S. CURRENCY, JOINS BOARD OF DIRECTORS",VOYG.TO
PR Newswire,/news/voyager-digital-becomes-official-cryptocurrency-124500625.html,VOYAGER DIGITAL BECOMES THE OFFICIAL CRYPTOCURRENCY BROKERAGE PARTNER OF THE NATIONAL WOMEN'S SOCCER LEAGUE,VOYG.TO
PR Newswire,/news/voyager-digital-extends-crypto-based-124500637.html,Voyager Digital Extends Crypto-Based Partnership With Nascar Driver Landon Cassill in Collaboration With Kaulig Racing,VOYG.TO
Simply Wall St.,/news/voyager-digital-tse-voyg-shareholders-155138309.html,Voyager Digital (TSE:VOYG) shareholders have earned a 695% return over the last year,VOYG.TO
GlobeNewswire,/news/usio-voyager-digital-extend-exclusive-150900350.html,Usio and Voyager Digital Extend Exclusive ACH Payments Processing Relationship for Another Three Years,VOYG.TO
CNW Group,/news/voyager-digital-partners-coinledger-streamline-124500833.html,Voyager Digital partners with CoinLedger to Streamline and Simplify Crypto Tax Reporting,VOYG.TO
PR Newswire,/news/small-cap-growth-investor-presentations-133500803.html,Small Cap Growth Investor Presentations Now Available for On-Demand Viewing,VOYG.TO
CNW Group,/news/voyager-digital-reminds-shareholders-upcoming-124500971.html,Voyager Digital Reminds Shareholders of Upcoming Annual General Meeting and Provides Instructions on How To Vote in Advance of the Meeting,VOYG.TO
CNW Group,/news/well-health-provides-organic-growth-120000866.html,WELL Health Provides Update on Organic Growth of its US-Based Virtual Services Businesses,WELL.TO
Simply Wall St.,/news/expect-profit-well-health-technologies-184257360.html,When Can We Expect A Profit From WELL Health Technologies Corp. (TSE:WELL)?,WELL.TO
CNW Group,/news/well-health-provides-organic-growth-151000759.html,"WELL Health Provides Update on the Organic Growth of its Virtual Services Business, and announces Tuck-in Acquisition of CognisantMD's Ocean Platform, Canada's Leader in Patient Engagement Technology and eReferral Software",WELL.TO
CNW Group,/news/well-health-completes-oversubscribed-70-142600778.html,WELL Health Completes Oversubscribed $70 Million Bought Deal Offering of Convertible Debentures,WELL.TO
CNW Group,/news/iiroc-trade-resumption-well-db-141600979.html,IIROC Trade Resumption - WELL.DB,WELL.TO
CNW Group,/news/iiroc-trading-halt-well-db-125400372.html,IIROC Trading Halt - WELL.DB,WELL.TO
GlobeNewswire,/news/well-health-announces-65-million-220800624.html,WELL Health Announces $65 Million Bought Deal Offering of Convertible Debentures,WELL.TO
CNW Group,/news/well-health-achieves-record-financial-113000383.html,WELL Health Achieves Record Financial Results with Over $99M Quarterly Revenue and Over $22M Adjusted EBITDA in Q3-2021,WELL.TO
CNW Group,/news/well-health-participate-upcoming-investor-145200416.html,WELL Health to Participate in Upcoming Investor Conferences,WELL.TO
PR Newswire,/news/well-health-announces-conference-call-144700786.html,WELL Health Announces Conference Call for Third Quarter 2021 Financial Results,WELL.TO
GlobeNewswire,/news/xebec-announces-q3-2021-financial-120000589.html,Xebec Announces Q3 2021 Financial Results,XBC.TO
GlobeNewswire,/news/xebec-acquires-colorado-based-uecompression-193500305.html,Xebec Acquires Colorado-based UECompression to Establish North America’s Leading Renewable Natural Gas and Hydrogen Manufacturing Facility,XBC.TO
GlobeNewswire,/news/xebec-announce-q3-2021-results-110000887.html,Xebec to Announce Q3 2021 Results on November 11 and Host Investor Webinar,XBC.TO
GlobeNewswire,/news/xebec-receives-eu-research-grant-110000112.html,Xebec Receives EU Research Grant to Design and Build 1 MW Electrolyser System for Production of Sustainable Liquid Fuels,XBC.TO
GlobeNewswire,/news/xebec-announces-bgx-biostream-orders-110000388.html,Xebec Announces BGX Biostream™ Orders from Brightmark and Chevron Renewable Natural Gas Partnership,XBC.TO
GlobeNewswire,/news/xebec-announces-hydrogen-contract-turkey-110000672.html,Xebec Announces On-site Hydrogen Contract with Turkey-based Flat Steel Manufacturer,XBC.TO
GlobeNewswire,/news/xebec-announces-q2-2021-financial-110000935.html,Xebec Announces Q2 2021 Financial Results,XBC.TO
GlobeNewswire,/news/xebec-welcomes-mr-brian-levitt-201500370.html,Xebec Welcomes Mr. Brian Levitt to Board of Directors,XBC.TO
GlobeNewswire,/news/xebec-announce-q2-2021-results-110000869.html,Xebec to Announce Q2 2021 Results on August 12 and Host Investor Webinar,XBC.TO
GlobeNewswire,/news/xebec-announces-master-agreement-bgx-110000027.html,Xebec Announces Master Service Agreement for BGX Biostream™ units with Leading U.S. RNG Dairy Farm Developer and Starts Production of 30 Systems,XBC.TO
Yahoo Finance Video,/video/crypto-regulation-2022-substantive-digital-170151008.html,"Crypto regulation: 2022 will be a ‘substantive year for digital asset policy,’ ADAM CEO says",BITF.V
Investopedia,/m/49a5e9ae-1512-3a84-93ee-eb0048d16dff/10-biggest-blockchain.html,10 Biggest Blockchain Companies,BITF.V
Investopedia,/m/bccd06c6-fa49-31b7-8e50-00be207294bf/top-crypto-mining-stocks-for.html,Top Crypto Mining Stocks for Q1 2022,BITF.V
GuruFocus.com,/news/vaneck-digital-transformation-etf-buys-023806639.html,"VanEck Digital Transformation ETF Buys HIVE Blockchain Technologies, Hut 8 Mining Corp, ...",BITF.V
Yahoo Finance Video,/video/stablecoin-infrastructure-strategic-national-security-170457903.html,Stablecoin infrastructure is ‘a strategic national security’ priority for the U.S: Paxos CEO,BITF.V
GlobeNewswire,/news/bitfarms-appoints-chief-operating-officer-120000086.html,Bitfarms Appoints Chief Operating Officer and Announces Grants of Options,BITF.V
GlobeNewswire,/news/ceos-bird-entef-oggff-bitf-133200959.html,"CEOs of BIRD, ENTEF, OGGFF, and BITF Riding Trillion Dollar Millennial and Gen Z Lifestyle Trends in: Plant-Based Foods, Crypto, Digital Entertainment, Eco-Friendly Brands",BITF.V
GlobeNewswire,/news/bitfarms-mined-over-3-000-120000739.html,"Bitfarms Mined over 3,000 Bitcoin in 2021 through November",BITF.V
GlobeNewswire,/news/bitfarms-present-b-riley-securities-120000531.html,Bitfarms to Present at B. Riley Securities Crypto Conference on December 8th,BITF.V
GlobeNewswire,/news/bitfarms-appoints-vice-president-corporate-120000952.html,Bitfarms Appoints Vice President of Corporate and Grants of Options,BITF.V
ACCESSWIRE,/news/cielo-announces-grant-stock-options-044500244.html,"Cielo Announces Grant of Stock Options, Restricted Share Units and Deferred Share Units",CMC.V
ACCESSWIRE,/news/cielo-announces-11-million-mortgage-135500704.html,"Cielo Announces $11 Million Mortgage Loan, Anticipated Partial Repayment Of Existing Loan, and Engagement of Investor Relations Firm",CMC.V
ACCESSWIRE,/news/cielo-announces-fiscal-q2-2022-034500635.html,Cielo Announces Fiscal Q2 2022 Financial Results,CMC.V
ACCESSWIRE,/news/cielo-announces-operational-elimination-royalty-090000678.html,Cielo Announces Operational Update; Elimination of Royalty and Refinery Fees; Retirement of Founder; Appointment to Board of Directors; And Details of Fiscal Q2 2022 Conference Call,CMC.V
ACCESSWIRE,/news/cielo-announces-improved-earnings-potential-075000310.html,Cielo Announces Improved Earnings Potential by Eliminating Royalty and Refinery Fees,CMC.V
ACCESSWIRE,/news/cielo-provides-operational-production-forecast-120500623.html,Cielo Provides Operational Update and Production Forecast for Aldersyde and Fort Saskatchewan Facilities,CMC.V
ACCESSWIRE,/news/cielo-announces-annual-general-special-023700688.html,Cielo Announces Annual General and Special Meeting Results,CMC.V
ACCESSWIRE,/news/cielo-announces-operational-corporate-043000760.html,Cielo Announces Operational and Corporate Update,CMC.V
ACCESSWIRE,/news/cielo-announces-fiscal-q1-2022-035500469.html,Cielo Announces Fiscal Q1 2022 Financial Results,CMC.V
ACCESSWIRE,/news/cielo-announces-fiscal-q1-2022-064500969.html,Cielo Announces Fiscal Q1 2022 Conference Call and Webcast,CMC.V
