source,link_href,link_text,ticker
Insider Monkey,/news/12-best-ipo-stocks-invest-151457711.html,12 Best IPO Stocks to Invest In Right Now,ZIM
Motley Fool,/m/67af79e8-4bef-3c4d-84da-ccd757c7071f/2-beaten-down-income-stocks.html,2 Beaten-Down Income Stocks With Jaw-Dropping Yields,ZIM
PR Newswire,/news/zim-announces-large-scale-long-120000719.html,ZIM Announces Large-Scale Long-Term LNG Bunkering Agreement with Shell,ZIM
InvestorPlace,/news/too-much-fear-priced-zim-162020995.html,There’s Too Much Fear Priced Into ZIM Integrated Shipping Stock,ZIM
PR Newswire,/news/zim-updates-withholding-tax-procedures-120000522.html,ZIM Updates on Withholding Tax Procedures on September 2022 Cash Dividend,ZIM
Investor's Business Daily,/m/2ff5f14f-e6ca-3192-8441-a04e6d652aa3/zim-integrated-shipping.html,ZIM Integrated Shipping Services Stock Shows Improving Market Leadership; Earns 83 RS Rating,ZIM
Motley Fool,/m/04235fc7-7528-3f9f-b987-16b8144dd2e4/zim-integrated-shipping.html,ZIM Integrated Shipping Services Ltd. (ZIM) Q2 2022 Earnings Call Transcript,ZIM
Benzinga,/news/zim-integrated-shipping-shares-down-132357562.html,ZIM Integrated Shipping Shares Down After Q2 Results Miss Street Expectations,ZIM
PR Newswire,/news/zim-reports-financial-results-second-110000639.html,ZIM Reports Financial Results for the Second Quarter of 2022,ZIM
Zacks,/news/zim-q2-preview-shares-remain-194907353.html,ZIM Q2 Preview: Can Shares Remain Hot?,ZIM
Simply Wall St.,/news/fgi-industries-ltd-beat-revenue-101747984.html,FGI Industries Ltd. Beat Revenue Forecasts By 6.2%: Here's What Analysts Are Forecasting Next,FGI
PR Newswire,/news/fgi-industries-announces-second-quarter-200500350.html,FGI INDUSTRIES ANNOUNCES SECOND QUARTER 2022 RESULTS,FGI
PR Newswire,/news/fgi-industries-participate-sidoti-micro-120000099.html,FGI INDUSTRIES TO PARTICIPATE IN THE SIDOTI MICRO-CAP VIRTUAL CONFERENCE,FGI
PR Newswire,/news/fgi-industries-announces-second-quarter-200500607.html,FGI INDUSTRIES ANNOUNCES SECOND QUARTER 2022 RESULTS CONFERENCE CALL DATE,FGI
Simply Wall St.,/news/fgi-industries-ltd-nasdaq-fgi-152850393.html,Is FGI Industries Ltd.'s (NASDAQ:FGI) ROE Of 27% Impressive?,FGI
PR Newswire,/news/fgi-industries-announces-first-quarter-200500891.html,FGI INDUSTRIES ANNOUNCES FIRST QUARTER 2022 RESULTS,FGI
ACCESSWIRE,/news/sidoti-may-virtual-micro-cap-110000375.html,Sidoti May Virtual Micro Cap Investor Conference,FGI
PR Newswire,/news/fgi-industries-attend-sidoti-company-200500710.html,FGI INDUSTRIES TO ATTEND SIDOTI & COMPANY MICRO-CAP CONFERENCE,FGI
PR Newswire,/news/fgi-industries-announces-first-quarter-200500004.html,FGI INDUSTRIES ANNOUNCES FIRST QUARTER 2022 RESULTS CONFERENCE CALL DATE,FGI
PR Newswire,/news/fgi-industries-attend-noblecon18-investor-200500436.html,FGI INDUSTRIES TO ATTEND NOBLECON18 INVESTOR CONFERENCE,FGI
Business Wire,/news/united-states-steel-corporation-provides-130100926.html,United States Steel Corporation Provides Third Quarter 2022 Guidance,X
Investor's Business Daily,/m/d2a02752-e059-337a-b398-a594c3c3ba90/nucor-warns-on-earnings-as.html,Nucor Warns On Earnings As Steel Prices Soften; NUE Stock Dives,X
Business Wire,/news/united-states-steel-corporation-donates-222300631.html,United States Steel Corporation Donates $1M to Osceola-Area Organizations,X
American City Business Journals,/m/4217b64a-d2c9-3c26-912e-1f1a86495130/health-department-urged-to-do.html,Health department urged to do more after July 4 US Steel Clairton power outage,X
InvestorPlace,/news/3-hot-stocks-avoid-aggressive-211613843.html,3 Hot Stocks to Avoid as an Aggressive Fed Tries to Cool the Economy,X
Business Wire,/news/u-steel-enhances-strong-balance-130300821.html,U. S. Steel Enhances its Strong Balance Sheet with Sustainable Financing; Completes Successful Tender Process,X
Zacks,/news/united-states-steel-x-gains-214509059.html,United States Steel (X) Gains As Market Dips: What You Should Know,X
American City Business Journals,/m/a748a472-f271-3025-9aca-80ed02de3d45/us-steel-united-steelworkers.html,"US Steel, United Steelworkers agree to extend negotiations beyond contract deadline",X
American City Business Journals,/m/39b6f830-80de-3235-9d85-f24ad1ee36ac/steelworkers-union-calls-u-s-.html,Steelworkers union calls U.S. Steel's new offer 'weak' as deadline nears,X
Business Wire,/news/united-states-steel-corporation-big-015200900.html,"United States Steel Corporation, Big River Steel LLC and BRS Finance Corp. Announce Early Tender Date Results of their Tender Offers to Purchase for Cash $300,000,000 Aggregate Principal Amount of Securities",X
