source,link_href,link_text,ticker
Business Wire,/news/nextech-ar-joins-interactive-advertising-123000383.html,Nextech AR Joins the Interactive Advertising Bureau’s (IAB) Augmented Reality (AR) Board,NTAR.NE
Business Wire,/news/nextech-successfully-launches-ad-network-123000049.html,"Nextech Successfully Launches its Ad Network Featuring Augmented Reality Capabilities on its Virtual Events Properties, Delivering Millions of Impressions",NTAR.NE
GlobeNewswire,/news/emerging-growth-conference-2-announced-123000292.html,"Emerging Growth Conference 2 Announced for March 3, 2021 Niche Companies in Technology, AR, eCommerce, Beverage and more in Attendance",NTAR.NE
Simply Wall St.,/news/acuity-brands-inc-nyse-ayi-060030475.html,"Acuity Brands, Inc.'s (NYSE:AYI) Has Had A Decent Run On The Stock market: Are Fundamentals In The Driver's Seat?",HIVE.V
GlobeNewswire,/news/routemaster-capital-announces-101-6-120000673.html,"Routemaster Capital Announces 101.6 Percent Increase in Treasury Balance in Leading DeFi Protocols and Announces Thibaut Ceyrolle, Snowflake EMEA Founder, as Special Advisor for Cloud Infrastructure; Olivier Roussy Newton Appointed as EIR",HIVE.V
ACCESSWIRE,/news/hive-blockchain-most-liquid-tsx-222000528.html,HIVE Blockchain Most Liquid TSX.V Stock Trading over 1.7 Billion Shares in 2020 and Named 4th on The 2021 OTCQX Best 50 has Established an At-the-Market Equity Program to Accelerate Growth,HIVE.V
ACCESSWIRE,/news/hive-blockchain-announces-plans-expand-060000639.html,HIVE Blockchain Announces Plans to Expand Ethereum Footprint by 30% Using 6 MW of Green Energy to Mine Ethereum,HIVE.V
ACCESSWIRE,/news/hive-blockchain-announces-filing-final-004500894.html,HIVE Blockchain Announces Filing of Final Base Shelf Prospectus,HIVE.V
ACCESSWIRE,/news/hive-blockchain-continues-bitcoin-mining-060000019.html,"HIVE Blockchain Continues Its Bitcoin Mining Momentum by Purchasing 6,400 Canaan Avalon Next Generation Miners to Expand Its Capacity to 1,229 PH/s in 2021",HIVE.V
ACCESSWIRE,/news/hive-blockchain-announces-closing-usd-060000131.html,HIVE Blockchain Announces Closing of USD $15 Million Convertible Debenture Private Placement,HIVE.V
InvestorPlace,/news/4-crypto-mining-stocks-worth-165938416.html,4 Crypto Mining Stocks Worth Investing In,HIVE.V
ACCESSWIRE,/news/hive-blockchain-doubles-bitcoin-production-060500674.html,HIVE Blockchain Doubles Its Bitcoin Production Capacity With The Purchase of New Generation Bitcoin Miners,HIVE.V
ACCESSWIRE,/news/hive-blockchain-announces-private-placement-060000498.html,HIVE Blockchain Announces Private Placement of Convertible Debentures,HIVE.V
GlobeNewswire,/news/namaste-technologies-announces-appointment-cfo-224100799.html,Namaste Technologies Announces Appointment of New CFO,N.V
GlobeNewswire,/news/sugarbud-expands-distribution-medical-cannabis-213300790.html,"Sugarbud Expands Distribution to Medical Cannabis Market, Enters National Supply Agreement with CannMart to Provide Access to Registered Medical Patients",N.V
GlobeNewswire,/news/namaste-technologies-announces-cannmart-com-130000864.html,Namaste Technologies Announces CannMart.com is LIVE in the USA,N.V
Investor's Business Daily,/m/6e8fb483-3ff2-3a41-8275-9e9949427873/are-any-marijuana-stocks-good.html,Are Any Marijuana Stocks Good Buys Amid March Cooldown?,APHA.TO
Motley Fool,/m/75dbb5e3-755e-36ec-9f82-1838fa47076b/better-cannabis-stock-aphria.html,Better Cannabis Stock: Aphria vs. Sundial Growers,APHA.TO
Motley Fool,/m/7c93924f-510d-397c-aff3-683ed2cd8705/the-10-best-marijuana-stocks.html,The 10 Best Marijuana Stocks in February,APHA.TO
Yahoo Finance Video,/video/suze-orman-gamestop-frenzy-crazy-110000406.html,Suze Orman: the Gamestop frenzy was crazy,BB.TO
GuruFocus.com,/news/4th-quarter-oakmark-international-small-211728557.html,4th-Quarter Update on the Oakmark International Small Cap Fund,BB.TO
Motley Fool,/m/7130e1a2-21fa-3a24-b8f7-e7aea5325e63/why-blackberry-stock-fell-in.html,Why BlackBerry Stock Fell in February,BB.TO
CNW Group,/news/r-e-p-e-t-120000184.html,Hut 8 Mining Announces Release Date for Full Year End Financials 2020: March 25th 2021,HUT.TO
CNW Group,/news/henrys-announces-successful-restructuring-plans-183000854.html,"Hut 8 Mining: Officially Repays Loan in Full, Saves Company US$1.6M",HUT.TO
CNW Group,/news/global-canadian-first-hut-8-110000344.html,Stablecorp Announces Closing of C$2mm Strategic Consortium Financing Round to Launch World's First Bank-Issued Deposit-Based Digital Currency,HUT.TO
GlobeNewswire,/news/laura-bastias-appointed-independent-director-234300070.html,Laura Bastias Appointed Independent Director,TBX.V
GlobeNewswire,/news/turmalina-intersection-72m-3-47-160200585.html,"Turmalina Intersection of 72m at 3.47% Copper, 100 g/t Silver and 0.71 g/t Gold (5.0% CuEq) Extends Known Mineralisation at SFdLA 300m Below Previous Drilling in Eastern Lobe",TBX.V
GlobeNewswire,/news/turmalina-intersects-6m-23-7-130000431.html,Turmalina Intersects 6m at 23.7 g/t Gold and 142 g/t Silver Near Surface in Newly Identified Oxide Zone at SFdLA,TBX.V
GlobeNewswire,/news/arht-media-recognized-part-2021-133000833.html,ARHT Media Recognized As Part Of The 2021 TSX Venture 50,ART.V
CNW Group,/news/cineplex-announces-closing-over-allotment-123000547.html,IIROC Trading Resumption - ART,ART.V
GlobeNewswire,/news/arht-prices-6-million-overnight-151900230.html,ARHT Prices $6 Million Overnight Marketed Equity Financing,ART.V
GlobeNewswire,/news/mydecine-fully-completes-first-ever-123000780.html,Mydecine Fully Completes the First-Ever International Export of Psilocybin Mushrooms and Solidifies its Clinical and Commercial Supply Chain,MYCO.CN
GlobeNewswire,/news/psychedelic-stocks-poised-resume-upward-133000028.html,Psychedelic Stocks Poised to Resume the Upward Trend,MYCO.CN
GlobeNewswire,/news/mydecine-announces-exclusive-partnership-increased-120000747.html,Mydecine Announces Exclusive Partnership and Increased Capabilities with Applied Pharmaceutical Innovation (API) at the University of Alberta,MYCO.CN
ACCESSWIRE,/news/ampd-announces-appearances-upcoming-conferences-140000673.html,AMPD Announces Appearances at Upcoming Conferences - Reinforcing Thought Leadership Status in Relation to High-Performance Compute and Cloud Solutions,AMPD.CN
ACCESSWIRE,/news/ampd-partners-lightbits-labs-tm-140000204.html,AMPD Partners with Lightbits Labs(TM) as their first Cloud Service Provider Partner with the Aim of Developing One of the World’s Fastest High-Performance Storage Systems for the Media & Entertainment Sector,AMPD.CN
ACCESSWIRE,/news/ampd-ceo-provides-corporate-outlook-140000601.html,AMPD CEO Provides Corporate Update and Outlook for Q1 2021,AMPD.CN
Newsfile,/news/graph-blockchain-leverages-proof-stake-080000509.html,Graph Blockchain Leverages Proof of Stake Mining,GBLC.CN
Newsfile,/news/graph-blockchain-issues-options-132200089.html,Graph Blockchain Issues Options,GBLC.CN
Newsfile,/news/graph-blockchain-announces-closing-non-080000944.html,Graph Blockchain Announces Closing of Non-Brokered Private Placement,GBLC.CN
ACCESSWIRE,/news/globex-data-ceo-interviewed-proactive-120000459.html,Globex Data CEO Interviewed on Proactive to Announce Its Multi-Currency Platform for Its Global Launch of Sekur.Com Communication Platform,SWIS.CN
ACCESSWIRE,/news/globex-data-prepares-multi-currency-120000867.html,GlobeX Data Prepares Multi-Currency Platform for Global Launch of its Swiss Hosted Sekur.com Secure Email and Messaging Security and Privacy Application,SWIS.CN
ACCESSWIRE,/news/globex-data-talks-large-south-110000614.html,GlobeX Data in Talks with Large South Asian Telecom Operator for its Swiss Hosted “Sekur” Secure Email and Secure Messaging Security and Privacy Application Solution,SWIS.CN
GlobeNewswire,/news/loop-insights-appoints-former-epson-110000608.html,"Loop Insights Appoints Former Epson General Manager of Global Brand & Marketing Communications, Ian Cameron, as VP of Marketing to Support Loop’s Continued Global Expansion in 2021",MTRX.V
CNW Group,/news/statement-minister-chagger-canadian-islamic-150000441.html,Popeyes® Announces New Quality & Sustainability Commitments,MTRX.V
CNW Group,/news/canadian-foundation-economic-education-ig-160000523.html,Kids With Physical Disabilities Struggling Through the Pandemic,MTRX.V
CNW Group,/news/blue-sky-uranium-closes-1st-141500764.html,Cineplex Announces Closing of Private Placement Notes Offering,CGX.TO
Bloomberg,/news/cineplex-unrated-debt-sees-c-234330986.html,Cineplex Sells Blowout Bond Deal as Investors Bet on Recovery,CGX.TO
CNW Group,/news/desjardins-announces-july-2020-cash-140000570.html,Cineplex Announces Pricing of Private Placement Notes Offering,CGX.TO
GlobeNewswire,/news/cenovus-provides-series-1-series-180800919.html,"Cenovus provides Series 1 and Series 2 First Preferred Shares conversion privilege notice, Series 1 and Series 2 First Preferred Shares dividend rate notice",CVE.TO
Simply Wall St.,/news/chief-sustainability-officer-senior-vp-061004597.html,Chief Sustainability Officer & Senior VP of Stakeholder Engagement Rhona Delfrari Just Bought 40% More Shares In Cenovus Energy Inc. (TSE:CVE),CVE.TO
Simply Wall St.,/news/opportunity-cenovus-energy-inc-tse-062337361.html,Is There An Opportunity With Cenovus Energy Inc.'s (TSE:CVE) 41% Undervaluation?,CVE.TO
Business Wire,/news/trutrace-technologies-joins-forces-customer-140000140.html,TruTrace Technologies Joins Forces with Customer Engagement Expert PharmaCentra to Provide a Blockchain-Secured Ecosystem for Medical Cannabis,TTT.CN
Business Wire,/news/applied-dna-trutrace-technologies-unveil-130000431.html,Applied DNA and TruTrace Technologies™ Unveil Complete Cannabis Product Validation and Authentication Solution,TTT.CN
Business Wire,/news/trutrace-technologies-appoints-two-members-125900471.html,TruTrace Technologies Appoints Two New Members to Board of Directors,TTT.CN
GlobeNewswire,/news/ev-battery-tech-provides-updates-140000887.html,EV Battery Tech Provides Updates on Definitive Agreement with EcoVille and LOI with Hillcrest,HRH.V
GlobeNewswire,/news/ev-battery-tech-signs-letter-130000276.html,EV Battery Tech signs Letter of Intent to Develop ESS Solutions for Renewable Energy,HRH.V
CNW Group,/news/iiroc-trading-resumption-hrh-124800763.html,SHL Call Center Hiring Solution Increases Customer Satisfaction by 32%,HRH.V
Yahoo Finance Video,/video/premium-trading-profitably-prudently-world-125500913.html,PREMIUM: Trading profitably and prudently as the world reopens,ACB.TO
Investor's Business Daily,/m/6e8fb483-3ff2-3a41-8275-9e9949427873/are-any-marijuana-stocks-good.html,Are Any Marijuana Stocks Good Buys Amid March Cooldown?,ACB.TO
MarketWatch,/m/29c336ad-5f18-3082-bdcb-6cbb84f68dc9/canadian-premium-cannabis.html,Canadian premium cannabis company Rubicon Organics initiated as 'strong buy' by Raymond James,ACB.TO
CNW Group,/news/global-announces-14-houseguests-ready-185200271.html,Air Canada Revises the Terms of its Capacity Purchase Agreement with Chorus Aviation for Regional Flying,AC.TO
PR Newswire,/news/tripactions-joins-uatps-latest-merchant-130000503.html,TripActions Joins as UATP's Latest Merchant,AC.TO
Reuters,/news/1-transat-says-air-canada-152332354.html,UPDATE 3-Canadian businessman seeks talks with Transat after deal with Air Canada left in limbo,AC.TO
ACCESSWIRE,/news/ydreams-global-secures-funds-edition-101500705.html,YDreams Global Secures Funds for New Edition of Interactive Exhibition,YDX.V
ACCESSWIRE,/news/ydx-innovation-corp-render-usa-110000823.html,"YDX Innovation Corp and Render USA Sign Editor Agreements with Popular YouTuber, CodeMiko",YDX.V
ACCESSWIRE,/news/ydx-innovations-pma-extends-contract-113000598.html,YDX Innovation's PMA Extends Contract with Mobapool,YDX.V
GlobeNewswire,/news/victory-square-technologies-announces-gameon-130000280.html,Victory Square Technologies Announces GameOn Share Dividend Initiative for VST Shareholders,VST.CN
GlobeNewswire,/news/former-soccer-star-tim-cahill-123000954.html,Former Soccer Star Tim Cahill Joins Victory Square Technologies Portfolio Company GameOn Entertainment Technologies as Strategic Advisor,VST.CN
GlobeNewswire,/news/victory-square-technologies-inc-portfolio-000100754.html,Victory Square Technologies Inc. Portfolio Company GameOn Entertainment Technologies Inc. Announces Upsizing of Its Previously Announced Private Placement for Up to an Aggregate of $3 Million Due to Strong Investor Demand,VST.CN
CNW Group,/news/iiroc-trading-halt-vsby-133900516.html,GSMA Heralds a new era of Connected Impact as MWC Shanghai returns as a hybrid event,VSBY.CN
CNW Group,/news/vsblty-groupe-technologies-announces-short-184700687.html,ZKW expands and generates more than one billion euros in revenue,VSBY.CN
GlobeNewswire,/news/vsblty-eos-linx-partner-solar-121000871.html,VSBLTY AND EOS LINX PARTNER TO PROVIDE A SOLAR-POWERED SECURITY SOLUTION UTILIZING AI-DRIVEN SECURITY SOFTWARE,VSBY.CN
CNW Group,/news/lightspeed-announces-fiscal-first-quarter-201000770.html,Quebec and Canada Invest in Energy Efficiency in Industrial Facilities,LSPD.TO
CNW Group,/news/canada-nickel-announces-airborne-geophysical-110000667.html,Lightspeed POS Inc. to Participate in Upcoming Investor Conferences,LSPD.TO
Bloomberg,/news/blistering-rallies-spur-canada-tech-142552105.html,"Canada Tech Stocks Outshine U.S., Sending Firms to Equity Market",LSPD.TO
GlobeNewswire,/news/factset-ping-offer-investors-esg-130000505.html,FactSet and Ping An to Offer Investors ESG Content and Analytics on Chinese Companies,OCFT
Bloomberg,/news/china-fintech-curbs-hit-ant-210000533.html,China Fintech Curbs That Hit Ant Were No Surprise: Ping An,OCFT
PR Newswire,/news/oneconnect-financial-technology-singapore-exchange-020400530.html,OneConnect Financial Technology and Singapore Exchange collaborate to address the region's ESG reporting needs,OCFT
CNW Group,/news/prodigy-technovations-announces-innovative-100baset1-060000829.html,Medavie Blue Cross partners with Medical Confidence to create new way to support Canadians on disability waiting for a specialist,DOC.V
CNW Group,/news/luxury-brand-partners-announces-one-130000385.html,Neurotech Start-Up Zentrela Announces Creation of Strategic Advisory Board,DOC.V
GlobeNewswire,/news/cloudmd-signs-definitive-agreement-acquire-123000549.html,"CloudMD Signs Definitive Agreement to Acquire IDYA4, a North American Leader in Healthcare Data Integration and Cybersecurity",DOC.V
Newsfile,/news/peak-fournit-des-mises-jour-123000674.html,Peak fournit des mises à jour sur la mise en œuvre des services de transfert de fonds et sa position de trésorerie suite à l'exercice de bons de souscription,PKK.CN
Newsfile,/news/peak-provides-updates-implementation-fund-123000521.html,Peak Provides Updates on Implementation of Fund Transfer Services and Cash Position from Exercise of Warrants,PKK.CN
Newsfile,/news/peak-signe-un-accord-partenariat-123000647.html,Peak signe un accord de partenariat stratégique avec le top fournisseur de logiciels de commerce électronique en Chine ShopEX,PKK.CN
GlobeNewswire,/news/west-mining-corp-announces-mining-120000783.html,West Mining Corp. Announces Mining Executive Sheldon Inwentash to the Advisory Board,IDK.CN
GlobeNewswire,/news/threed-capital-inc-acquires-securities-000600858.html,ThreeD Capital Inc. Acquires Securities of Windfall Geotek Inc.,IDK.CN
GlobeNewswire,/news/threed-capital-inc-announces-dtc-100000075.html,ThreeD Capital Inc. Announces DTC Eligibility of its Common Shares Trading in the United States,IDK.CN
CNW Group,/news/montoni-enters-residential-market-le-110000338.html,"CPDC Announces First Patient Dosed in a Phase 3 Clinical Trial of a Prostate Cancer Diagnostic Imaging Product, [18F]PSMA-1007",EFL.TO
ACCESSWIRE,/news/electrovaya-technology-intensive-lithium-ion-110000852.html,"Electrovaya, a Technology-Intensive Lithium Ion Battery Company, Applies to List on NASDAQ",EFL.TO
ACCESSWIRE,/news/electrovaya-announces-results-annual-special-224000434.html,Electrovaya Announces Results of Annual and Special Meeting of Shareholders,EFL.TO
Newsfile,/news/very-good-food-company-completes-120000212.html,The Very Good Food Company Completes Acquisition of The Cultured Nut,VERY.CN
Newsfile,/news/very-good-food-company-announces-123000330.html,The Very Good Food Company Announces Increased Distribution With National Retailers,VERY.CN
Newsfile,/news/very-good-food-company-announces-123000002.html,The Very Good Food Company Announces Director of US Sales and Provides E-commerce Update,VERY.CN
PR Newswire,/news/eat-beyond-portfolio-company-nabati-140000994.html,Eat Beyond Portfolio Company Nabati Foods Attracts Strong Leadership Team,EATS.CN
CNW Group,/news/iiroc-trading-halt-mms-120200651.html,Eat Beyond Joins Protein Industries Canada Supercluster,EATS.CN
CNW Group,/news/mfda-issues-notice-settlement-hearing-215400896.html,"Eat Beyond Portfolio Shows Early Returns, Seeding Larger Vision, and Enters Marketing Agreement",EATS.CN
CNW Group,/news/karnalyte-resources-inc-announces-2020-031600956.html,"Modern Plant Based Foods Now Distributing Products Through Birkby Food Service Ltd., One of the Largest Dairy and Ice Cream Distributors in Western Canada",MEAT.CN
CNW Group,/news/accenture-motive-io-develop-virtual-120000627.html,/R E P E A T -- Modern Plant Based Foods Announces Distribution Deal With World's Largest Food Wholesale Distributor/,MEAT.CN
CNW Group,/news/iiroc-trading-halt-ola-134000023.html,Modern Meat Announce Name Change to Modern Plant Based Foods Inc.,MEAT.CN
Newsfile,/news/retransmission-bee-vectoring-technologies-announces-130000586.html,RETRANSMISSION: Bee Vectoring Technologies Announces Strategic European Developments,BEE.CN
Newsfile,/news/bee-vectoring-technologies-announces-strategic-060000782.html,Bee Vectoring Technologies Announces Strategic European Developments,BEE.CN
Newsfile,/news/retransmission-bee-vectoring-technologies-announces-130000522.html,RETRANSMISSION: Bee Vectoring Technologies Announces Inaugural Grower Trials with Two of the World's Largest Berry Growers within a Month of Achieving California License,BEE.CN
CNW Group,/news/unifor-mourns-sheila-yakovishin-psw-222100607.html,Predictiv AI Signs SISCO to Distribute Thermalpass to Its U.S. Customer Base,PAI.V
CNW Group,/news/input-capital-corp-announces-sixteenth-235900627.html,Predictiv AI Launches Marketing Campaign with AGORACOM for Online Marketing and Social Media Engagement,PAI.V
CNW Group,/news/ga-asi-announces-team-skyguardian-220000767.html,Predictiv AI Signs TFG Concepts to Represent ThermalPass to its Clients Across Canada,PAI.V
GlobeNewswire,/news/mineworx-announces-results-special-meeting-181500371.html,Mineworx Announces Results of Special Meeting,MWX.V
GlobeNewswire,/news/mineworx-announces-addition-director-103000612.html,Mineworx Announces Addition Of New Director,MWX.V
GlobeNewswire,/news/mineworx-announces-rights-offering-proposed-142900252.html,Mineworx Announces Rights Offering and Proposed Share Consolidation,MWX.V
CNW Group,/news/one-third-canadians-having-difficulty-110000628.html,Cleverciti Launches Modern Parking Guidance System To Accelerate Redwood City Businesses' Recovery From Pandemic,MVAI.V
CNW Group,/news/government-canada-haida-nation-announce-173400412.html,Hilarious Fantasy Series Dwight In Shining Armor Comes to the Rescue on Family Channel This March,MVAI.V
CNW Group,/news/minerva-intelligence-announces-appointment-jason-130000953.html,"Minerva Intelligence Announces Appointment of Jason Petralia, formerly of Skillz Inc., as Advisor; Private Placement of 1,200,000 units",MVAI.V
GlobeNewswire,/news/quisitive-achieves-microsoft-co-sell-130000581.html,Quisitive Achieves Microsoft Co-sell Ready Status for LedgerPay,QUIS.V
CNW Group,/news/mira-x-acquisition-corp-announces-213400818.html,Estée Lauder Signs Actress Ana de Armas as New Global Brand Ambassador,QUIS.V
GlobeNewswire,/news/quisitive-recognized-2021-tsx-venture-150400411.html,Quisitive Recognized as a 2021 TSX ‘Venture 50’ Company,QUIS.V
GlobeNewswire,/news/trackx-reports-q4-fiscal-2020-133600382.html,TrackX Reports Q4 and Fiscal 2020 Financial Results,TKX.V
GlobeNewswire,/news/trackx-topl-announce-strategic-partnership-130000988.html,TrackX and Topl Announce Strategic Partnership Combining Blockchain with Asset Management to Empower End-to-End Supply Chain Transparency,TKX.V
GlobeNewswire,/news/trackx-announces-enterprise-wide-expansion-154900266.html,TrackX Announces Enterprise-Wide Expansion  for Global Powersports Company,TKX.V
CNW Group,/news/media-advisory-prime-ministers-itinerary-010700503.html,ImagineAR (OTCQB:IPNFF) Awarded US Patent Focused on Location-Based Virtual Gameplay,IP.CN
CNW Group,/news/imaginear-otcqb-ipnff-announces-world-120000281.html,"ImagineAR (OTCQB: IPNFF) Announces World Tens Series Rugby Three Year $380,000 Partnership Through Global Sports Initiatives",IP.CN
CNW Group,/news/laborie-medical-technologies-enters-strategic-160800680.html,Inspirational Black Canadian Changemakers to Speak at Live Citizenship Ceremony,IP.CN
Newsfile,/news/retransmission-netcents-technology-reports-february-140000716.html,"RETRANSMISSION: NetCents Technology Reports February Transaction Volume Exceeding $6,700,000",NC.CN
Newsfile,/news/netcents-technology-reports-february-transaction-080500988.html,"NetCents Technology Reports February Transaction Volume Exceeding $6,700,000",NC.CN
Newsfile,/news/netcents-technology-vesto-llc-announce-172900327.html,NetCents Technology and Vesto LLC Announce Strategic Joint Venture,NC.CN
GlobeNewswire,/news/repeat-earthrenew-signs-letter-intent-120000543.html,"REPEAT - EarthRenew Signs Letter of Intent for New Facility on 50,000 Head Feedlot in Colorado",ERTH.CN
GlobeNewswire,/news/earthrenew-signs-letter-intent-facility-050000190.html,"EarthRenew Signs Letter of Intent for New Facility on 50,000 Head Feedlot in Colorado",ERTH.CN
GlobeNewswire,/news/repeat-earthrenew-upsizes-previously-announced-130000443.html,REPEAT -- EarthRenew Upsizes Its Previously Announced Proposed Acquisition of Replenish Nutrients Equity From 38% to 100%,ERTH.CN
Newsfile,/news/appia-proposes-corporate-name-change-140000056.html,Appia Proposes Corporate Name Change to Highlight Its Rare Earth Element and Uranium Focus,API.CN
Newsfile,/news/appia-starts-bench-scale-monazite-131000312.html,Appia Starts Bench-Scale Monazite Processing and Metallurgical Testing with Saskatchewan Research Council,API.CN
Newsfile,/news/appia-confirms-monazite-source-high-134500362.html,"Appia Confirms Monazite as the Source for High-Grade Gallium, Alces Lake Property",API.CN
GlobeNewswire,/news/international-journal-energy-management-publishes-130000100.html,International Journal of Energy Management Publishes Dramatic GHG and Energy Reduction Results From SHARC Energy’s PIRANHA System,SHRC.CN
GlobeNewswire,/news/sharc-energy-showcases-wastewater-heat-130000502.html,SHARC Energy Showcases Wastewater Heat Recovery Retrofit to a Leading West Coast Laundry Service,SHRC.CN
GlobeNewswire,/news/sharc-energy-closes-15-greenshoe-211500603.html,SHARC Energy Closes 15% Greenshoe,SHRC.CN
ACCESSWIRE,/news/legend-power-customer-adds-2-120000227.html,Legend Power Customer Adds 2 More Systems to the Largest Order in Company History,LPS.V
ACCESSWIRE,/news/legend-power-r-reports-q1-015000876.html,Legend Power(R) Reports Q1 2021 Financial Results,LPS.V
ACCESSWIRE,/news/legend-power-schedules-q1-2021-120000248.html,Legend Power Schedules Q1 2021 Financial Results Release and Conference Call,LPS.V
CNW Group,/news/bespoke-capital-acquisition-corp-reports-205600769.html,/R E P E A T -- Media Advisory - Government of Canada to make announcement related to housing in Squamish/,MCLD.V
CNW Group,/news/gvc-sets-clear-strategy-sustainability-070500908.html,mCloud Highlights Accelerated Activity in Alberta,MCLD.V
CNW Group,/news/stuhini-announces-closing-1-35-172200476.html,SPARK Microsystems Announces CDN$17.5 Million Financing Led by Cycle Capital to Drive Commercialization,MCLD.V
GuruFocus.com,/news/bye-orem-202717484.html,"Bye, Orem",BRM.V
CNW Group,/news/bio-k-plus-international-expanding-110000777.html,Y Soft Announces COVID-Safe And Secure MFX Mobile Reader For User Authentication,BRM.V
PR Newswire,/news/biorem-announces-research-project-city-130000954.html,BIOREM Announces Research Project with City of New York to Control Release of Bioaerosols from Waste Water Treatment Facilities,BRM.V
ACCESSWIRE,/news/ecosynthetix-inc-host-earnings-call-113000932.html,"EcoSynthetix, Inc. to Host Earnings Call",ECO.TO
CNW Group,/news/iiroc-trading-halt-shrp-p-115700330.html,EcoSynthetix Reports 2020 Fourth Quarter and Year End Results,ECO.TO
CNW Group,/news/turquoise-hill-announces-funding-discussions-113000774.html,Zuoyebang Named Key Player in MIT Technology Review's 2021 List of 10 Breakthrough Technologies,ECO.TO
GlobeNewswire,/news/eguana-announces-1st-quarter-2021-210000707.html,Eguana Announces 1st Quarter 2021 Financial Results,EGT.V
GlobeNewswire,/news/eguana-announces-date-first-quarter-220000105.html,Eguana Announces Date for First Quarter 2021 Financial Results and Conference Call,EGT.V
CNW Group,/news/centraide-greater-montreal-launches-2020-110000514.html,Eguana Technologies Closes $20 Million Private Placement of Special Warrants,EGT.V
Newsfile,/news/greenbriar-announces-wealth-building-program-221000849.html,Greenbriar Announces Wealth Building Program with Paul Morris Keller Williams Forward Living,GRB.V
Newsfile,/news/greenbriar-announces-voya-financial-extension-182800694.html,Greenbriar Announces Voya Financial Extension of USD $195 Million Project Finance Mandate for Montalva,GRB.V
Newsfile,/news/greenbriar-moderate-clubhouse-discussion-real-053500000.html,Greenbriar to Moderate Clubhouse Discussion on Real Estate Investing with World Famous Real Estate and Capital Market Investors,GRB.V
