source,link_href,link_text,ticker
CNW Group,/news/cineplexs-entire-circuit-theatres-entertainment-211500300.html,Cineplex's Entire Circuit of Theatres and Entertainment Venues Fully Open as Operating Restrictions Lifted Across Canada,CGX.TO
Simply Wall St.,/news/estimating-intrinsic-value-cineplex-inc-123936327.html,Estimating The Intrinsic Value Of Cineplex Inc. (TSE:CGX),CGX.TO
Reuters,/news/britains-cineworld-hit-appeal-cineplex-075927305.html,Britain's Cineworld hit by appeal in Cineplex legal battle,CGX.TO
The Independent,/news/cineworld-canadian-court-battle-heats-072806026.html,Cineworld Canadian court battle heats up with new counter-claim,CGX.TO
CNW Group,/news/cineplex-inc-announces-details-fourth-140000457.html,Cineplex Inc. Announces Details of Fourth Quarter and Year End 2021 Earnings Release and Webcast,CGX.TO
CNW Group,/news/attention-popcorn-lovers-enjoy-free-143000977.html,Attention Popcorn Lovers: Enjoy a Free Bag on Cineplex to Celebrate National Popcorn Day,CGX.TO
Reuters,/news/cineplex-temporarily-lays-off-6-191820499.html,"Cineplex temporarily lays off 6,000 workers as surging Omicron cases shut theatres",CGX.TO
CNW Group,/news/cineplex-announces-amendment-credit-facility-223000843.html,Cineplex Announces Amendment to Credit Facility,CGX.TO
Yahoo Finance Video,/video/movies-streaming-theaters-hybrid-release-175011413.html,Movies: How the streaming/theaters hybrid release experiment played out in 2021,CGX.TO
Business Wire,/news/bronstein-gewirtz-grossman-llc-notifies-193700764.html,"Bronstein, Gewirtz & Grossman, LLC Notifies Shareholders of Cineplex Inc. (CPXGF) Investigation",CGX.TO
GlobeNewswire,/news/cenovus-reports-voting-results-election-000500882.html,Cenovus reports voting results of election of Directors,CVE.TO
Benzinga,/news/why-cenovus-energy-shares-trading-195212575.html,Why Cenovus Energy Shares Are Trading Higher Today,CVE.TO
Bloomberg,/news/cenovus-holds-line-production-growth-190711304.html,Cenovus Holds Line on Production Growth Even With Oil Above $100,CVE.TO
Zacks,/news/activists-caution-shell-shel-over-120912433.html,Activists Caution Shell (SHEL) Over Emission Target Liability,CVE.TO
Reuters,/news/cenovus-profit-seven-fold-crude-103703085.html,Cenovus triples dividend as profits soar with crude prices,CVE.TO
Reuters,/news/1-cenovus-profit-seven-fold-101618299.html,UPDATE 3-Cenovus triples dividend as profits soar with crude prices,CVE.TO
GlobeNewswire,/news/cenovus-announces-shareholder-returns-plan-100000156.html,"Cenovus announces shareholder returns plan, triples dividend",CVE.TO
Zacks,/news/cenovus-cve-report-q1-earnings-151903631.html,Cenovus (CVE) to Report Q1 Earnings: What's in the Cards?,CVE.TO
GlobeNewswire,/news/cenovus-donates-us-3-million-120000235.html,Cenovus donates US$3 million to Nature Conservancy of Canada to further natural habitat conservation work,CVE.TO
GlobeNewswire,/news/cenovus-hold-first-quarter-conference-224500362.html,Cenovus to hold first-quarter conference call and webcast; virtual annual meeting of shareholders on April 27,CVE.TO
CNW Group,/news/air-canada-airlink-flexport-org-133900485.html,"Air Canada, Airlink, Flexport.org and GlobalMedic Send Aid and Medical Supplies to Support Ukrainian Refugees on Second Special Humanitarian Flight",AC.TO
Reuters,/news/1-air-canada-adds-capacity-111219827.html,UPDATE 3-Air Canada adds capacity for spring flying after Q1 loss,AC.TO
Reuters,/news/air-canada-narrows-quarterly-loss-101752940.html,Air Canada adds capacity for spring flying after Q1 loss,AC.TO
CNW Group,/news/air-canada-reports-first-quarter-100000268.html,Air Canada Reports First Quarter 2022 Financial Results,AC.TO
CNW Group,/news/air-canada-celebrates-earth-day-141400894.html,Air Canada Celebrates Earth Day by Dedicating Sustainable Aviation Fuel to Four Flights Through Its Leave Less Travel Program,AC.TO
CNW Group,/news/air-canada-chauffeur-now-electrified-120000272.html,"Air Canada Chauffeur Service, Now Electrified by Porsche",AC.TO
PR Newswire,/news/mystifly-joins-uatp-network-120000211.html,Mystifly Joins UATP Network,AC.TO
CNW Group,/news/air-canada-facilitates-flights-ukrainians-183600259.html,Air Canada Facilitates Flights for Ukrainians to Travel to Canada with Aeroplan Donation,AC.TO
CNW Group,/news/air-canada-air-canada-cargo-130400130.html,Air Canada and Air Canada Cargo Inaugurate Freighter Service Into Halifax,AC.TO
Benzinga,/news/air-canadas-one-day-passenger-195908397.html,"Air Canada's One-Day Passenger Load Exceeds 100,000 After 2 Years",AC.TO
PR Newswire,/news/lightspeed-commerce-announces-promotions-hire-120100118.html,Lightspeed Commerce Announces Promotions and New Hire to its Leadership Team,LSPD.TO
CNW Group,/news/lightspeed-updates-timing-upcoming-investor-000000551.html,Lightspeed Updates Timing of Upcoming Investor Conference Participation,LSPD.TO
CNW Group,/news/lightspeed-participate-upcoming-investor-conference-120000830.html,Lightspeed to Participate in Upcoming Investor Conference,LSPD.TO
Simply Wall St.,/news/insiders-may-rethinking-us-4-162533237.html,Insiders may be rethinking their US$4.7m Lightspeed Commerce Inc. (TSE:LSPD) investment now that the company has lost CA$647m in value,LSPD.TO
PR Newswire,/news/lightspeed-appoints-lead-executive-customers-120000737.html,Lightspeed Appoints Lead Executive for Customers,LSPD.TO
PR Newswire,/news/lightspeed-announces-direct-selling-advertising-120000290.html,Lightspeed Announces Direct Selling and Advertising on TikTok via Ecwid,LSPD.TO
GuruFocus.com,/news/winch-advisory-services-llc-buys-193803431.html,"Winch Advisory Services, LLC Buys Vanguard Short-Term Inflation-Protected Securities, SPDR ...",LSPD.TO
GuruFocus.com,/news/gainplan-llc-buys-ishares-russell-143817981.html,"Gainplan LLC Buys iShares Russell 1000 Growth ETF, PowerShares QQQ Trust Ser 1, Lightspeed ...",LSPD.TO
PR Newswire,/news/lightspeed-announces-third-quarter-2022-231000244.html,Lightspeed Announces Third Quarter 2022 Financial Results,LSPD.TO
CNW Group,/news/lightspeed-president-jp-chauvet-appointed-231000583.html,Lightspeed President JP Chauvet Appointed Chief Executive Officer,LSPD.TO
Business Wire,/news/oneconnect-provides-status-under-holding-033000822.html,OneConnect Provides Update on Status Under Holding Foreign Companies Accountable Act,OCFT
Business Wire,/news/oneconnect-announces-annual-general-meeting-070000145.html,OneConnect Announces Annual General Meeting Results,OCFT
Business Wire,/news/oneconnect-files-annual-report-form-021600904.html,OneConnect Files Annual Report on Form 20-F,OCFT
Business Wire,/news/oneconnect-announces-share-purchase-ping-123000627.html,OneConnect Announces Share Purchase by Ping An Group,OCFT
Business Wire,/news/oneconnect-hold-annual-general-meeting-060000832.html,"OneConnect to Hold Annual General Meeting on April 8, 2022",OCFT
Business Wire,/news/oneconnect-announces-fourth-quarter-full-213000760.html,OneConnect Announces Fourth Quarter and Full Year 2021 Unaudited Financial Results,OCFT
Business Wire,/news/oneconnect-announces-share-repurchase-program-080000724.html,OneConnect Announces Share Repurchase Program,OCFT
Simply Wall St.,/news/institutions-own-oneconnect-financial-technology-150554053.html,"Do Institutions Own OneConnect Financial Technology Co., Ltd. (NYSE:OCFT) Shares?",OCFT
Business Wire,/news/oneconnect-announce-fourth-quarter-full-140000954.html,OneConnect to Announce Fourth Quarter and Full Year 2021 Financial Results,OCFT
PR Newswire,/news/oneconnect-makes-forbes-blockchain-50-100000838.html,OneConnect Makes Forbes Blockchain 50 2022 List for Advanced Trade and Financing Solutions,OCFT
GlobeNewswire,/news/cloudmd-reports-solid-performance-fourth-023900483.html,CloudMD Reports Solid Performance with Fourth Quarter 2021 Financial Results; Revenue of $38.7 Million and Second Consecutive Quarter with Positive Adjusted EBITDA,DOC.V
GlobeNewswire,/news/cloudmd-announces-may-3-2022-200500936.html,"CloudMD Announces May 3, 2022 as Revised Date for Fourth Quarter and Full Year 2021 Earnings Call",DOC.V
GlobeNewswire,/news/cloudmd-strengthens-board-appointment-gaston-113000937.html,CloudMD Strengthens Board with Appointment of Gaston Tano as Director,DOC.V
GlobeNewswire,/news/cloudmd-release-fourth-quarter-end-113000394.html,"CloudMD to Release Fourth Quarter and Year-End Financial Results on May 2, 2022",DOC.V
GlobeNewswire,/news/cloudmd-announces-resignation-director-113000727.html,CloudMD Announces Resignation of Director,DOC.V
GlobeNewswire,/news/cloudmd-announces-ceo-succession-113000168.html,CloudMD Announces CEO Succession,DOC.V
GlobeNewswire,/news/cloudmd-announces-cost-optimization-operational-113000311.html,CloudMD Announces Cost Optimization and Operational Integration Activities,DOC.V
GlobeNewswire,/news/cloudmd-establishes-public-sector-division-123000240.html,CloudMD Establishes Public Sector Division; Drives North American Growth with New Contract Wins,DOC.V
GlobeNewswire,/news/cloudmd-announces-cfo-transition-succession-123000896.html,CloudMD Announces CFO Transition and Succession Plan,DOC.V
GlobeNewswire,/news/cloudmd-announces-visionpros-120000340.html,CloudMD Announces Update on VisionPros,DOC.V
Newsfile,/news/tenet-end-2021-audited-financial-020100620.html,Tenet Year-end 2021 Audited Financial Results Confirm Growth Trajectory with Revenues of $103.6M for the Year,PKK.CN
Newsfile,/news/tenet-report-full-2021-financial-201500702.html,"Tenet To Report Full Year 2021 Financial Results on Monday, May 2",PKK.CN
Newsfile,/news/tenets-heartbeat-platform-achieves-major-120000740.html,"Tenet's Heartbeat Platform Achieves Major Milestone with Over 400,000 Insurance Policies Processed",PKK.CN
Newsfile,/news/tenet-signs-agreement-industrial-bank-120000693.html,Tenet Signs Agreement with the Industrial Bank Co. to Offer Business Hub(TM)-Linked Bank Accounts to Business Hub(TM) Members,PKK.CN
Newsfile,/news/tenet-expands-business-hub-tm-120000898.html,Tenet Expands Business Hub(TM) Capabilities with Opportunities for Freight Trucking Industry,PKK.CN
Newsfile,/news/tenet-begins-pre-registration-phase-130000975.html,Tenet Begins Pre-Registration Phase of Canadian Business Hub(TM),PKK.CN
Newsfile,/news/tenet-fournit-une-mise-jour-123000168.html,Tenet fournit une mise à jour opérationnelle pendant les vacances du Nouvel An chinois,PKK.CN
Newsfile,/news/tenet-provides-operational-chinese-break-123000016.html,Tenet Provides Operational Update at Chinese New Year Break,PKK.CN
PR Newswire,/news/tenet-appoints-financial-institution-relationship-130000388.html,Tenet Appoints New Financial Institution Relationship Manager and Credit Analyst for Cubeler Division,PKK.CN
PR Newswire,/news/tenet-unveils-brand-identity-130000554.html,Tenet Unveils New Brand Identity,PKK.CN
GlobeNewswire,/news/data-storage-corporation-reports-97-110000680.html,Data Storage Corporation Reports 97% Increase in Revenue for the Fourth Quarter of 2021,DTST
GlobeNewswire,/news/data-storage-corporation-schedules-fiscal-130000179.html,Data Storage Corporation Schedules Fiscal 2021 Business Update Conference Call,DTST
GlobeNewswire,/news/data-storage-corporation-participate-2022-134400938.html,Data Storage Corporation to Participate in the 2022 Virtual Growth Conference Presented by Maxim Group LLC and hosted by M-Vest on March 28th – 30th,DTST
GlobeNewswire,/news/data-storage-corporation-provides-recommendations-130000325.html,"Data Storage Corporation Provides Recommendations for Corporations, Governments and other Organizations to Address Heightened Cyber Security Concerns",DTST
GlobeNewswire,/news/data-storage-corporation-present-microcap-140000726.html,"Data Storage Corporation to Present at MicroCap Rodeo’s Winter Wonderland Best Ideas Conference on Wednesday, February 9",DTST
ACCESSWIRE,/news/36-best-ideas-companies-present-150700608.html,"36 of the Best Ideas Companies to Present at the 2nd Annual Winter Wonderland Virtual Investor Conference on February 8th - 11th, 2022",DTST
GlobeNewswire,/news/data-storage-corporation-provides-2021-133000297.html,Data Storage Corporation Provides 2021 Year-End Business Update,DTST
GlobeNewswire,/news/data-storage-corporation-announces-multi-140000816.html,Data Storage Corporation Announces Multi-Million Dollar Contract with One of the Nation’s Most Recognized Professional Sports Teams,DTST
GlobeNewswire,/news/data-storage-corporation-ceo-participate-133000735.html,Data Storage Corporation’s CEO to Participate in the Benzinga All Access Event,DTST
Simply Wall St.,/news/why-data-storage-corporation-nasdaq-112019525.html,Why Data Storage Corporation (NASDAQ:DTST) Could Be Worth Watching,DTST
