source,link_href,link_text,ticker
PR Newswire,/news/zim-announces-large-scale-long-120000719.html,ZIM Announces Large-Scale Long-Term LNG Bunkering Agreement with Shell,ZIM
PR Newswire,/news/zim-updates-withholding-tax-procedures-120000522.html,ZIM Updates on Withholding Tax Procedures on September 2022 Cash Dividend,ZIM
Investor's Business Daily,/m/2ff5f14f-e6ca-3192-8441-a04e6d652aa3/zim-integrated-shipping.html,ZIM Integrated Shipping Services Stock Shows Improving Market Leadership; Earns 83 RS Rating,ZIM
Motley Fool,/m/04235fc7-7528-3f9f-b987-16b8144dd2e4/zim-integrated-shipping.html,ZIM Integrated Shipping Services Ltd. (ZIM) Q2 2022 Earnings Call Transcript,ZIM
Benzinga,/news/zim-integrated-shipping-shares-down-132357562.html,ZIM Integrated Shipping Shares Down After Q2 Results Miss Street Expectations,ZIM
PR Newswire,/news/zim-reports-financial-results-second-110000639.html,ZIM Reports Financial Results for the Second Quarter of 2022,ZIM
Zacks,/news/zim-q2-preview-shares-remain-194907353.html,ZIM Q2 Preview: Can Shares Remain Hot?,ZIM
PR Newswire,/news/zim-announces-participation-series-financing-200500965.html,"ZIM Announces Participation in a Series A Financing Round in Hoopo, a Provider of Cutting-Edge Tracking Solutions for Unpowered Assets",ZIM
Zacks,/news/tsakos-energy-navigation-tnp-great-134001560.html,Is Tsakos Energy Navigation (TNP) a Great Value Stock Right Now?,ZIM
Zacks,/news/awaits-zim-integrated-shipping-zim-173605376.html,What Awaits ZIM Integrated Shipping (ZIM) in Q2 Earnings?,ZIM
Simply Wall St.,/news/fgi-industries-ltd-beat-revenue-101747984.html,FGI Industries Ltd. Beat Revenue Forecasts By 6.2%: Here's What Analysts Are Forecasting Next,FGI
PR Newswire,/news/fgi-industries-announces-second-quarter-200500350.html,FGI INDUSTRIES ANNOUNCES SECOND QUARTER 2022 RESULTS,FGI
PR Newswire,/news/fgi-industries-participate-sidoti-micro-120000099.html,FGI INDUSTRIES TO PARTICIPATE IN THE SIDOTI MICRO-CAP VIRTUAL CONFERENCE,FGI
PR Newswire,/news/fgi-industries-announces-second-quarter-200500607.html,FGI INDUSTRIES ANNOUNCES SECOND QUARTER 2022 RESULTS CONFERENCE CALL DATE,FGI
Simply Wall St.,/news/fgi-industries-ltd-nasdaq-fgi-152850393.html,Is FGI Industries Ltd.'s (NASDAQ:FGI) ROE Of 27% Impressive?,FGI
PR Newswire,/news/fgi-industries-announces-first-quarter-200500891.html,FGI INDUSTRIES ANNOUNCES FIRST QUARTER 2022 RESULTS,FGI
ACCESSWIRE,/news/sidoti-may-virtual-micro-cap-110000375.html,Sidoti May Virtual Micro Cap Investor Conference,FGI
PR Newswire,/news/fgi-industries-attend-sidoti-company-200500710.html,FGI INDUSTRIES TO ATTEND SIDOTI & COMPANY MICRO-CAP CONFERENCE,FGI
PR Newswire,/news/fgi-industries-announces-first-quarter-200500004.html,FGI INDUSTRIES ANNOUNCES FIRST QUARTER 2022 RESULTS CONFERENCE CALL DATE,FGI
PR Newswire,/news/fgi-industries-attend-noblecon18-investor-200500436.html,FGI INDUSTRIES TO ATTEND NOBLECON18 INVESTOR CONFERENCE,FGI
American City Business Journals,/m/a748a472-f271-3025-9aca-80ed02de3d45/us-steel-united-steelworkers.html,"US Steel, United Steelworkers agree to extend negotiations beyond contract deadline",X
American City Business Journals,/m/39b6f830-80de-3235-9d85-f24ad1ee36ac/steelworkers-union-calls-u-s-.html,Steelworkers union calls U.S. Steel's new offer 'weak' as deadline nears,X
Business Wire,/news/united-states-steel-corporation-big-015200900.html,"United States Steel Corporation, Big River Steel LLC and BRS Finance Corp. Announce Early Tender Date Results of their Tender Offers to Purchase for Cash $300,000,000 Aggregate Principal Amount of Securities",X
American City Business Journals,/m/5b66d05c-b988-324b-8446-8c4d4731cdb3/united-steelworkers-hit-back.html,United Steelworkers hit back at U.S. Steel in contract fight,X
Simply Wall St.,/news/united-states-steels-nyse-x-131209615.html,Do United States Steel's (NYSE:X) Earnings Warrant Your Attention?,X
American City Business Journals,/m/fef1c45d-8f12-3814-8f91-3ed2cca72513/exclusive-us-steel-talks.html,Exclusive: US Steel talks about the latest in contract negotiations,X
GuruFocus.com,/news/us-steel-going-green-204134672.html,US Steel Is Going Green,X
TheStreet.com,/m/346578cb-8980-38f6-b527-207a3f42192b/u-s-steel-strives-to-adapt.html,U.S. Steel Strives to Adapt to Modern World's Demands,X
American City Business Journals,/m/f7a62042-7072-3bb4-a2c1-f49db8aa3870/why-shell-u-s-steel-are.html,"Why Shell, U.S. Steel are eyeing a clean-energy hub — and how they'll get there",X
Business Wire,/news/united-states-steel-corporation-big-225200694.html,"United States Steel Corporation, Big River Steel LLC and BRS Finance Corp. Commence Tender Offers to Purchase for Cash $300,000,000 Aggregate Principal Amount of Securities",X
