source,link_href,link_text,ticker
ACCESSWIRE,/news/cielo-announces-private-placement-offering-210400882.html,"Cielo Announces Private Placement Offering of Convertible Debenture Units and First Closing of $396,000, Extension of Joint Venture Agreement Deadline",CMC.CN
ACCESSWIRE,/news/cielo-jv-partner-secures-80-132600913.html,"Cielo’s JV Partner Secures 80 Acre Site for Renewable Fuel Facility Near Medicine Hat, AB",CMC.CN
GlobeNewswire,/news/leading-parkinson-researcher-dr-robert-110000947.html,Leading Parkinson’s Researcher Dr. Robert A. Hauser Joins Pharmather as Scientific Advisor,PHRM.CN
GlobeNewswire,/news/pharmather-files-fda-orphan-drug-110000086.html,Pharmather Files for FDA Orphan Drug Designation for Ketamine in Neuropathic Pain,PHRM.CN
GlobeNewswire,/news/pharmather-secures-exclusive-rights-novel-110000613.html,Pharmather Secures Exclusive Rights to Novel Microneedle Delivery Technology for Psychedelic Pharmaceuticals,PHRM.CN
