source,link_href,link_text,ticker
CNW Group,/news/greenpower-forest-river-enter-exclusive-211500073.html,American Investment Migration Announces Launch of Live Work and Stay in the USA,GPV.V
CNW Group,/news/iiroc-trading-halt-gpv-194200279.html,RATESDOTCA hires veteran financial journalist Jameson Berkow as managing editor,GPV.V
CNW Group,/news/18th-lafontaine-baldwin-lecture-announces-120100867.html,Zeem Solutions Orders 30 GreenPower EV Stars for Los Angeles Area Operations,GPV.V
Motley Fool,/m/9dc2eba0-c8dd-3a4d-bb84-a0cdb7fa5b82/why-clean-energy-fuels-stock.html,Why Clean Energy Fuels Stock Rocketed Higher in February,WPRT.TO
Motley Fool,/m/55d16e9b-63df-3c63-b5fa-a936924128ee/why-shares-in-westport-fuel.html,Why Shares in Westport Fuel Systems Surged in February,WPRT.TO
GlobeNewswire,/news/westport-fuel-systems-announce-fourth-134500928.html,"Westport Fuel Systems to Announce Fourth Quarter and Full Year 2020 Financial Results on Monday, March 15, 2021",WPRT.TO
Simply Wall St.,/news/oceanic-wind-energy-cve-nkw-121742571.html,Can Oceanic Wind Energy (CVE:NKW) Afford To Invest In Growth?,NKW.V
CNW Group,/news/iiroc-trading-resumption-nkw-152000089.html,IIROC Trading Resumption - NKW,NKW.V
GlobeNewswire,/news/naikun-wind-provides-additional-details-150606276.html,NaiKun Wind Provides Additional Details Regarding the Sale of NaiKun Offshore Wind Project,NKW.V
Newsfile,/news/nano-one-launches-groundbreaking-m2cam-080500482.html,"Nano One Launches Groundbreaking M2CAM Technology to Reduce Cost, Waste and Carbon Footprint in Lithium-Ion Battery Supply Chain",NNO.V
Newsfile,/news/nano-one-achieves-tsx-venture-150000027.html,Nano One Achieves TSX Venture 50 Recognition as a Top Performing Company and Kicks Off Busy Conference Schedule,NNO.V
CNW Group,/news/bher-launches-national-online-challenge-173000875.html,OPPO Flash Charges the Future at MWC Shanghai,NNO.V
Simply Wall St.,/news/life-cielo-waste-solutions-cse-141115782.html,Such Is Life: How Cielo Waste Solutions (CSE:CMC) Shareholders Saw Their Shares Drop 69%,CMC.CN
ACCESSWIRE,/news/cielo-announces-private-placement-offering-210400882.html,"Cielo Announces Private Placement Offering of Convertible Debenture Units and First Closing of $396,000, Extension of Joint Venture Agreement Deadline",CMC.CN
ACCESSWIRE,/news/cielo-jv-partner-secures-80-132600913.html,"Cielo’s JV Partner Secures 80 Acre Site for Renewable Fuel Facility Near Medicine Hat, AB",CMC.CN
GlobeNewswire,/news/flyht-participate-cowen-aerospace-defense-120400826.html,FLYHT to Participate in the Cowen Aerospace/Defense & Industrials Conference,FLY.V
Benzinga,/news/flyht-flight-intelligent-way-boost-142522484.html,"FLYHT-And-Flight: The Intelligent Way To Boost Aircraft Profitability, Security And Connectivity In 2021",FLY.V
GlobeNewswire,/news/flyht-present-noblecon17-january-19-120400605.html,FLYHT to Present at NobleCon17 on January 19,FLY.V
ACCESSWIRE,/news/kabn-systems-na-holdings-corp-141000201.html,KABN Systems NA Holdings Corp Changes Its Name to Liquid Avatar Technologies Inc. with New Symbol LQID,KABN.CN
ACCESSWIRE,/news/outer-space-men-landing-liquid-142300845.html,The Outer Space Men are Landing at Liquid Avatar,KABN.CN
ACCESSWIRE,/news/kabn-north-america-launches-liquid-134500769.html,KABN North America Launches Liquid Avatar App in the Apple Store and Google Play,KABN.CN
CNW Group,/news/clean-air-metals-announces-step-110000664.html,Danavation Technologies Announces Expansion into Healthcare with Pilot Launch of Digital Smart Labels™ for The Ensign Group,DVN.CN
CNW Group,/news/ontario-lottery-gaming-corporation-evening-045600491.html,Danavation Technologies Announces Launch of Digital Smart Labels™ into First Bombay Spices Location,DVN.CN
CNW Group,/news/iiroc-trading-halt-og-195400467.html,Danavation Technologies Corp. Announces Changes to Board of Directors,DVN.CN
Business Wire,/news/namsys-reports-results-operations-fiscal-202200214.html,NamSys Reports Results of Operations for Fiscal 2020,CTZ.V
Business Wire,/news/namsys-terminates-employee-long-term-163600318.html,NamSys Terminates Employee Long Term Bonus Plan,CTZ.V
Simply Wall St.,/news/namsys-inc-cve-ctz-stock-075555636.html,NamSys Inc. (CVE:CTZ) Stock Has Shown Weakness Lately But Financials Look Strong: Should Prospective Shareholders Make The Leap?,CTZ.V
ACCESSWIRE,/news/keynotes-educational-panels-42-canadian-140000492.html,"Keynotes, Educational Panels and 42 Canadian-Listed Public Companies Presenting at the SNN Network Canada Virtual Event - January 6-7, 2021",MRBL.CN
ACCESSWIRE,/news/marble-financial-present-snn-network-120000210.html,"Marble Financial to Present at the SNN Network Canada Virtual Event on Thursday January 7, 2021",MRBL.CN
Newsfile,/news/marble-financial-inc-data-driven-182200831.html,"Marble Financial Inc., A Data-Driven Financial Future, CEO Clip Video",MRBL.CN
