source,link_href,link_text,ticker
InvestorPlace,/news/7-hot-penny-stocks-robinhood-163427122.html,7 Hot Penny Stocks for the Robinhood Traders,NTAR.NE
Business Wire,/news/nextech-ar-launches-holoportation-technology-113000146.html,Nextech AR Launches its Holoportation Technology in its AiRShow Application,NTAR.NE
Business Wire,/news/nextech-ar-joins-interactive-advertising-123000383.html,Nextech AR Joins the Interactive Advertising Bureau’s (IAB) Augmented Reality (AR) Board,NTAR.NE
GlobeNewswire,/news/repeat-defi-technologies-announces-strategic-120000978.html,REPEAT -- DeFi Technologies Announces Strategic Partnership with HIVE Blockchain Technologies,HIVE.V
GlobeNewswire,/news/defi-technologies-announces-strategic-partnership-071300152.html,DeFi Technologies Announces Strategic Partnership with HIVE Blockchain Technologies,HIVE.V
ACCESSWIRE,/news/hive-announces-strategic-partnership-share-050000723.html,HIVE Announces Strategic Partnership and Share Swap Agreement with DeFi Technologies,HIVE.V
GlobeNewswire,/news/namaste-technologies-provides-corporate-230600854.html,Namaste Technologies Provides Corporate Update,N.V
CNW Group,/news/seaspan-announces-continued-growth-acquiring-112800776.html,Minister Ng participates in International Women's Day roundtable discussion hosted by Startup Canada,N.V
CNW Group,/news/endo-acquire-biospecifics-enhance-profitability-113000487.html,"Media Advisory - Deputy Prime Minister's itinerary for Monday, March 8, 2021",N.V
Investopedia,/m/56bf7572-5067-3bd1-abeb-245cbe034e89/top-marijuana-stocks-for.html,Top Marijuana Stocks for April 2021,APHA.TO
TheStreet.com,/m/bd338165-23e3-3516-b941-f11c5a1bb901/cannabis-stock-watchlist-new.html,"Cannabis Stock Watchlist: New York, Aphria, Sundial Growers",APHA.TO
InvestorPlace,/news/7-marijuana-stocks-waiting-biden-163810889.html,7 Marijuana Stocks Waiting for Biden to Make a Move,APHA.TO
Benzinga,/news/preview-blackberrys-earnings-140438864.html,A Preview Of BlackBerry's Earnings,BB.TO
Zacks,/news/blackberry-bb-unveils-ivy-innovation-131601021.html,"BlackBerry (BB) Unveils IVY Innovation Fund, Fosters Startups",BB.TO
InvestorPlace,/news/bb-stock-one-big-reason-194359045.html,BB Stock: One Big Reason the r/WallStreetBets Star Is Stumbling Today,BB.TO
CNW Group,/news/ontario-lottery-gaming-corporation-midday-195900208.html,HUT 8 Expands Mining Capacity with $30 Million USD Purchase of NVIDIA CMPs,HUT.TO
ACCESSWIRE,/news/hut-8-mining-corp-host-121500260.html,Hut 8 Mining Corp. to Host Earnings Call,HUT.TO
CNW Group,/news/intact-financial-corporation-senior-vice-220000867.html,"Hut 8 Fiscal 2020 Earnings Release: 246% increase in Working Capital, $40.7M in Total Revenue, 87% Y.O.Y Increase in Net Income Before Tax",HUT.TO
Simply Wall St.,/news/think-turmalina-metals-cve-tbx-090244759.html,We Think Turmalina Metals (CVE:TBX) Can Afford To Drive Business Growth,TBX.V
GlobeNewswire,/news/laura-bastias-appointed-independent-director-234300070.html,Laura Bastias Appointed Independent Director,TBX.V
GlobeNewswire,/news/turmalina-intersection-72m-3-47-160200585.html,"Turmalina Intersection of 72m at 3.47% Copper, 100 g/t Silver and 0.71 g/t Gold (5.0% CuEq) Extends Known Mineralisation at SFdLA 300m Below Previous Drilling in Eastern Lobe",TBX.V
GlobeNewswire,/news/arht-medias-holopresence-technology-virtual-123100742.html,ARHT Media's HoloPresence Technology & Virtual Global Stage (VGS) Solution Is Being Featured at EPITOME -The In-Person Young Entrepreneurship Conference In Singapore - Co-Founders of Twitch and Rotten Tomatoes Appear Via VGS,ART.V
CNW Group,/news/iiroc-trade-resumption-ncu-wt-133200477.html,Field Effect and Harris partner to protect customers worldwide from cyber threats,ART.V
GlobeNewswire,/news/arht-announces-closing-previously-announced-154000603.html,ARHT Announces Closing of Previously Announced Public Offering Raising Gross Proceeds of $7.9 million,ART.V
Business Wire,/news/mydecine-innovations-group-graduates-listing-133000223.html,Mydecine Innovations Group Graduates Listing To NEO Exchange,MYCO.CN
GlobeNewswire,/news/mydecine-innovations-group-announces-migration-113000769.html,Mydecine Innovations Group Announces Migration to NEO Exchange,MYCO.CN
GlobeNewswire,/news/mydecine-innovations-group-provides-european-113000318.html,Mydecine Innovations Group Provides Update on European Operations,MYCO.CN
ACCESSWIRE,/news/ampd-joins-nvidia-cloud-provider-130000760.html,"AMPD Joins NVIDIA Cloud Service Provider Partner Program - Enhances GPU Cloud Service Offerings for Low-Latency Applications Across Media & Entertainment, Machine Learning",AMPD.CN
ACCESSWIRE,/news/stock-option-grant-150000477.html,Stock Option Grant,AMPD.CN
ACCESSWIRE,/news/ampd-announces-machine-learning-cloud-140000980.html,AMPD Announces ‘Machine Learning Cloud’ Initiative Built Around AMD Instinct (TM) MI100 accelerators - the World’s Fastest HPC GPU for Scientific Research,AMPD.CN
Newsfile,/news/graph-blockchain-announces-closing-cad-110000982.html,Graph Blockchain Announces Closing of CAD$10 Million Private Placement with Institutional Investors,GBLC.CN
Newsfile,/news/graph-blockchain-deploys-capital-polkadot-070000454.html,Graph Blockchain Deploys Capital into Polkadot for the Proof of Stake Mining,GBLC.CN
CNW Group,/news/islam-mohammad-not-licensed-conduct-184000113.html,Lion Electric Announces the Construction of its Battery Manufacturing Plant and Innovation Center in Quebec,GBLC.CN
ACCESSWIRE,/news/globex-data-secures-1-25-231000631.html,GlobeX Data Secures 1.25 Million Canadian Dollars in Financing Commitments,SWIS.CN
Newsfile,/news/hemostemix-announces-clinical-trial-contract-132200214.html,Hemostemix Announces Clinical Trial Update and Contract with GlobeX Data to Encrypt its Communications with Regulatory Authorities,SWIS.CN
ACCESSWIRE,/news/globex-data-ceo-interviewed-proactive-110000711.html,GlobeX Data CEO Interviewed on Proactive to Announce it Sekur.com Has Been Selected by Stem Cell Company Hemostemix,SWIS.CN
GlobeNewswire,/news/loop-insights-announces-definitive-agreement-100000416.html,"Loop Insights Announces Definitive Agreement To Complete $2,000,000 Acquisition Of Passcreator, A Leading European Digital Wallet And Mobile Marketing Company With Tier-1 Global Clients, In Anticipation Of Upcoming Major Business Developments",MTRX.V
CNW Group,/news/iiroc-trading-halt-mtrx-121000535.html,François Roberge Celebrates Twenty-Five Years at the Head of la Vie en Rose,MTRX.V
GlobeNewswire,/news/loop-insights-enters-five-store-100000367.html,"Loop Insights Enters Into Five-Store Pilot Agreement With Sobeys, Canada’s Second-Largest Grocer, To Deliver Digital Receipts Via Loop’s Wallet Pass Technology",MTRX.V
CNW Group,/news/choom-secures-4th-retail-location-124500650.html,UPDATE - Media advisory - Minister Jonathan Wilkinson to deliver opening keynote address at the Canadian Chamber of Commerce Executive Summit Series,CGX.TO
CNW Group,/news/lendcare-launches-technology-accelerate-point-121300985.html,Prime Minister announces changes to parliamentary secretaries,CGX.TO
CNW Group,/news/desjardins-announces-july-2020-cash-140000570.html,Cineplex Announces Pricing of Private Placement Notes Offering,CGX.TO
Insider Monkey,/news/why-l1-capital-bullish-cenovus-155007849.html,Here’s Why L1 Capital is Bullish on Cenovus Energy (CVE),CVE.TO
Zacks,/news/diamondback-fang-concludes-takeover-deal-171105029.html,Diamondback (FANG) Concludes Takeover Deal With QEP Resources,CVE.TO
GlobeNewswire,/news/cenovus-reports-results-series-1-130000708.html,Cenovus reports results of Series 1 and Series 2 First Preferred Shares conversion,CVE.TO
CNW Group,/news/mistango-river-resources-announces-3-130800872.html,Nauticol Energy and Enhance Energy partner to capture up to one million tonnes of CO2 annually from Blue Methanol production and distribution business,TTT.CN
Business Wire,/news/trutrace-technologies-joins-forces-customer-140000140.html,TruTrace Technologies Joins Forces with Customer Engagement Expert PharmaCentra to Provide a Blockchain-Secured Ecosystem for Medical Cannabis,TTT.CN
Business Wire,/news/applied-dna-trutrace-technologies-unveil-130000431.html,Applied DNA and TruTrace Technologies™ Unveil Complete Cannabis Product Validation and Authentication Solution,TTT.CN
GlobeNewswire,/news/ev-battery-tech-provides-updates-140000887.html,EV Battery Tech Provides Updates on Definitive Agreement with EcoVille and LOI with Hillcrest,HRH.V
GlobeNewswire,/news/ev-battery-tech-signs-letter-130000276.html,EV Battery Tech signs Letter of Intent to Develop ESS Solutions for Renewable Energy,HRH.V
CNW Group,/news/iiroc-trading-resumption-hrh-124800763.html,SHL Call Center Hiring Solution Increases Customer Satisfaction by 32%,HRH.V
Motley Fool,/m/ec8773fb-07c7-3a3e-82e0-0f106677ecd5/why-there-could-be-at-least-1.html,Why There Could Be at Least 1 More Big Acquisition in the Cannabis Industry This Year,ACB.TO
GlobeNewswire,/news/bc-craft-supply-announces-500-201600944.html,"BC Craft Supply Announces $500,000 Private Placement with Strategic Investor Mr. Daniel Petrov",ACB.TO
Investor's Business Daily,/m/6e8fb483-3ff2-3a41-8275-9e9949427873/are-any-marijuana-stocks-good.html,Are Any Marijuana Stocks Good Buys Amid March Cooldown?,ACB.TO
PR Newswire,/news/uatp-continues-payment-innovation-receives-120000031.html,"UATP Continues Payment Innovation, Receives Approval For Patent For Its Alternative Payment Processing Technology",AC.TO
CNW Group,/news/southern-empire-advance-funds-exploration-120000267.html,"Ontario Lottery and Gaming Corporation - EVENING LOTTERY WINNING NUMBERS - March 21, 2021",AC.TO
PR Newswire,/news/uatp-partners-nuvei-offer-payment-120000182.html,UATP Partners with Nuvei to Offer Payment Services,AC.TO
CNW Group,/news/khiron-declared-national-strategic-project-124700380.html,IIROC Trading Halt - YDX,YDX.V
ACCESSWIRE,/news/ydx-innovation-announces-letter-intent-001500506.html,YDX Innovation Announces Letter of Intent for Reverse Takeover with Moshun Media Development Corp.,YDX.V
ACCESSWIRE,/news/ydx-innovation-amuka-esports-wisdom-093000445.html,"YDX Innovation, Amuka Esports, and Wisdom Media Launches Esports Tournament Series with Women Win",YDX.V
GlobeNewswire,/news/immersive-tech-victory-square-technologies-131400021.html,"Immersive Tech, a Victory Square Technologies Portfolio Company, Announces C$1.5 Million Non-Brokered Private Placement",VST.CN
GlobeNewswire,/news/immersive-tech-teams-celebrity-youtube-124500256.html,Immersive Tech Teams Up With Celebrity YouTube Creator Chris Ramsay On An Exclusive Immersive Experience That Will Be Featured On His Social Media Channels To His 6.4 Million Fans,VST.CN
GlobeNewswire,/news/victory-square-technologies-ceo-issues-183200364.html,Victory Square Technologies CEO Issues Future Forecast Letter to Shareholders,VST.CN
CNW Group,/news/karora-delivers-another-strong-quarter-140000842.html,**New start time** - TSB to provide its comments on the final safety investigation report into the downing of Ukraine International Airlines flight 752,VSBY.CN
GlobeNewswire,/news/vsblty-grupo-modelo-retailigent-formalize-111000933.html,"VSBLTY, GRUPO MODELO & RETAILIGENT FORMALIZE AGREEMENT TO JOINTLY CREATE INTERNATIONAL DIGITAL IN-STORE MEDIA NETWORK",VSBY.CN
CNW Group,/news/vsblty-groupe-technologies-announces-short-184700687.html,ZKW expands and generates more than one billion euros in revenue,VSBY.CN
CNW Group,/news/iiroc-trading-resumption-pgx-201200365.html,"Hollywood Film Composer Mark Chait Begins the Journey ""Searching for Music along Poetry Road "" in Zhejiang",LSPD.TO
Bloomberg,/news/twitter-chairman-venture-firm-raises-100000922.html,Twitter Chairman’s Venture Firm Raises $450 Million Growth Fund,LSPD.TO
SmarterAnalyst,/news/lightspeed-acquires-vend-350m-street-143307087.html,Lightspeed Acquires Vend For $350M; Street Sees 25% Upside,LSPD.TO
Business Wire,/news/oneconnect-files-annual-report-form-130000915.html,OneConnect Files Annual Report on Form 20-F,OCFT
Motley Fool,/m/599964fa-eb48-3e0f-b742-1dc7f237d637/1-reason-smart-investors-are.html,1 Reason Smart Investors Are Watching OneConnect Financial Technology,OCFT
Simply Wall St.,/news/calculating-intrinsic-value-oneconnect-financial-094805563.html,"Calculating The Intrinsic Value Of OneConnect Financial Technology Co., Ltd. (NYSE:OCFT)",OCFT
GlobeNewswire,/news/life-sciences-companies-investors-presentations-123500941.html,Life Sciences Companies Investors Presentations Now Available for On-Demand Viewing,DOC.V
GlobeNewswire,/news/cloudmd-announces-closing-idya4-acquisition-113000443.html,CloudMD Announces Closing of IDYA4 Acquisition and North American roll out of Substance Use Disorder Platform to Address Growing Addiction Crisis,DOC.V
GlobeNewswire,/news/cloudmd-announces-rapid-growth-enterprise-113000473.html,CloudMD Announces Rapid Growth of Enterprise Health Solutions Division,DOC.V
CNW Group,/news/visiopharm-announces-scientific-advisory-board-060000412.html,OneQode Launches Asia-Pacific Gaming Hub in Guam,PKK.CN
Newsfile,/news/peak-fintech-group-engage-mz-113000252.html,Peak Fintech Group engage MZ Group pour diriger les relations stratégiques avec les investisseurs et son programme de communication avec ses actionnaires,PKK.CN
Newsfile,/news/peak-fintech-group-engages-mz-113000440.html,Peak Fintech Group Engages MZ Group to Lead Strategic Investor Relations and Shareholder Communication Program,PKK.CN
GlobeNewswire,/news/threed-capital-reports-premium-nickel-081500835.html,ThreeD Capital Reports Premium Nickel Resources Awarded Exclusivity to Acquire Former BCL Assets in Botswana,IDK.CN
GlobeNewswire,/news/threed-capital-inc-announces-completion-211400327.html,ThreeD Capital Inc. Announces Completion of Private Placement with Birchtree Investments Ltd.,IDK.CN
GlobeNewswire,/news/threed-capital-inc-completes-350-214000242.html,"ThreeD Capital Inc. Completes $350,000 Investment into Windfall Geotek Inc.",IDK.CN
ACCESSWIRE,/news/electrovaya-announces-commercial-launch-electric-100000805.html,Electrovaya Announces Commercial Launch of Its Electric Bus Battery,EFL.TO
CNW Group,/news/montoni-enters-residential-market-le-110000338.html,"CPDC Announces First Patient Dosed in a Phase 3 Clinical Trial of a Prostate Cancer Diagnostic Imaging Product, [18F]PSMA-1007",EFL.TO
ACCESSWIRE,/news/electrovaya-technology-intensive-lithium-ion-110000852.html,"Electrovaya, a Technology-Intensive Lithium Ion Battery Company, Applies to List on NASDAQ",EFL.TO
CNW Group,/news/greenpower-ev-star-selected-eligible-130000776.html,IIROC Trade Resumption - EATS,EATS.CN
CNW Group,/news/guidelines-maximizing-cures-minimizing-side-124300108.html,IIROC Trading Halt - EATS,EATS.CN
CNW Group,/news/voti-detection-pacers-sports-entertainment-162600487.html,Eat Beyond Portfolio Company Eat Just Closes US$200 Million in New Funding,EATS.CN
CNW Group,/news/mcloud-appoints-rca-financial-partners-110000857.html,Canadian housing market sees imbalances increase in large cities and smaller centres,MEAT.CN
CNW Group,/news/valens-company-verse-cannabis-roll-210000292.html,"edatanetworks Inc. Enhances Patent Portfolio with USPTO in Broadcast Advertising, Voice for Community, and Automated Cause Marketing",MEAT.CN
CNW Group,/news/karnalyte-resources-inc-announces-2020-031600956.html,"Modern Plant Based Foods Now Distributing Products Through Birkby Food Service Ltd., One of the Largest Dairy and Ice Cream Distributors in Western Canada",MEAT.CN
Newsfile,/news/retransmission-bee-vectoring-technologies-announces-120000099.html,RETRANSMISSION: Bee Vectoring Technologies Announces First Two Months of 2021 Invoicing Exceeds Entire Fiscal Year 2020,BEE.CN
Newsfile,/news/bee-vectoring-technologies-announces-first-050000890.html,Bee Vectoring Technologies Announces First Two Months of 2021 Invoicing Exceeds Entire Fiscal Year 2020,BEE.CN
Newsfile,/news/bee-vectoring-technologies-announces-start-155300436.html,Bee Vectoring Technologies Announces Start of the Sales Process in World's Largest Almond Market,BEE.CN
PR Newswire,/news/predictiv-ais-weather-telematics-partners-120000015.html,Predictiv AI's Weather Telematics Partners with Propel IT to Accelerate Commercialization of IT SAAS Fleet Safety Platform,PAI.V
CNW Group,/news/morguards-fifth-annual-beyou-campaign-182000443.html,Announcing Launch of Justice Fund Toronto,PAI.V
PR Newswire,/news/predictiv-ai-partners-waterloo-artificial-132500638.html,Predictiv AI Partners With Waterloo Artificial Intelligence Institute at University of Waterloo,PAI.V
GlobeNewswire,/news/mineworx-immediately-commencing-program-spanish-090000421.html,Mineworx Immediately Commencing Work Program on Spanish Iron Ore Property,MWX.V
GlobeNewswire,/news/mineworx-announces-corporate-webinar-090000512.html,Mineworx Announces Corporate Update Webinar,MWX.V
GlobeNewswire,/news/mineworx-provides-share-consolidation-171200925.html,Mineworx Provides Update on Share Consolidation,MWX.V
CNW Group,/news/minerva-announces-first-software-subscription-120000678.html,THYMOX EXT botanical disinfectant kills the COVID-19 virus in only 1 minute,MVAI.V
CNW Group,/news/one-third-canadians-having-difficulty-110000628.html,Cleverciti Launches Modern Parking Guidance System To Accelerate Redwood City Businesses' Recovery From Pandemic,MVAI.V
CNW Group,/news/government-canada-haida-nation-announce-173400412.html,Hilarious Fantasy Series Dwight In Shining Armor Comes to the Rescue on Family Channel This March,MVAI.V
CNW Group,/news/iiroc-trading-halt-quis-195500967.html,IIROC Trading Halt - QUIS,QUIS.V
GlobeNewswire,/news/quisitive-announces-agreement-acquire-bankcard-193300253.html,Quisitive Announces Agreement to Acquire BankCard USA,QUIS.V
GlobeNewswire,/news/quisitive-announces-closing-strategic-20-200500893.html,Quisitive Announces Closing of Strategic $20 Million Investment by FAX Capital,QUIS.V
GlobeNewswire,/news/trackx-reports-q4-fiscal-2020-133600382.html,TrackX Reports Q4 and Fiscal 2020 Financial Results,TKX.V
GlobeNewswire,/news/trackx-topl-announce-strategic-partnership-130000988.html,TrackX and Topl Announce Strategic Partnership Combining Blockchain with Asset Management to Empower End-to-End Supply Chain Transparency,TKX.V
GlobeNewswire,/news/trackx-announces-enterprise-wide-expansion-154900266.html,TrackX Announces Enterprise-Wide Expansion  for Global Powersports Company,TKX.V
CNW Group,/news/oasis-digital-studios-presents-nfts-131500298.html,"Oasis Digital Studios Presents NFTs - Myths, Markets, Media & Mania Live Online Webinar April 13th",IP.CN
CNW Group,/news/scotiabank-giller-prize-presents-2020-141000533.html,ImagineAR (OTCQB: IPNFF) Signs Three Year Partnership Agreement with First Brazilian Soccer Team - Club Atlético Mineiro -To Provide Interactive Augmented Reality Experiences for Fans,IP.CN
CNW Group,/news/cambridge-isotope-laboratories-inc-expands-130000772.html,Government of Canada takes action on fish fraud,IP.CN
Newsfile,/news/netcents-technology-reports-surge-partner-070100943.html,NetCents Technology Reports Surge in New Partner Sign-Ups and Leads,NC.CN
Newsfile,/news/netcents-technology-reports-transaction-volume-070000761.html,"NetCents Technology Reports Transaction Volume Exceeding $10,800,000 in First Half of March",NC.CN
Newsfile,/news/netcents-technology-expands-non-fungible-070500047.html,"NetCents Technology Expands Non-Fungible Token Scope, Launching NFT Division",NC.CN
GlobeNewswire,/news/life-sciences-companies-investors-presentations-123500941.html,Life Sciences Companies Investors Presentations Now Available for On-Demand Viewing,ERTH.CN
GlobeNewswire,/news/earthrenew-webcast-live-life-sciences-123500184.html,"EarthRenew to Webcast Live at Life Sciences Investor Forum on March 25, 2021",ERTH.CN
GlobeNewswire,/news/virtual-conference-life-sciences-companies-123500232.html,"Virtual Conference for Life Sciences Companies Broadcast Live March 25th, 2021",ERTH.CN
CNW Group,/news/imaginear-announces-first-ever-webar-103000488.html,Extractive Industry Investment Options: Live Virtual Investor Conference March 30th & 31st:,API.CN
Newsfile,/news/appia-confirms-high-grade-gallium-125200413.html,Appia Confirms High-Grade Gallium Mineralization in All Zones on Alces Lake Property,API.CN
PR Newswire,/news/global-metals-mining-live-virtual-123500883.html,Global Metals & Mining Live Virtual Investor Conference March 30th & 31st: Extractive Industry Investment Options,API.CN
GlobeNewswire,/news/sharc-wastewater-energy-recovery-system-130000950.html,SHARC Wastewater Energy Recovery System Toured by U.S. House Appropriations Subcommittee on Energy and Water Development,SHRC.CN
GlobeNewswire,/news/international-journal-energy-management-publishes-130000100.html,International Journal of Energy Management Publishes Dramatic GHG and Energy Reduction Results From SHARC Energy’s PIRANHA System,SHRC.CN
GlobeNewswire,/news/sharc-energy-showcases-wastewater-heat-130000502.html,SHARC Energy Showcases Wastewater Heat Recovery Retrofit to a Leading West Coast Laundry Service,SHRC.CN
ACCESSWIRE,/news/legend-power-secures-10-smartgate-110000379.html,"Legend Power Secures 10 SmartGATE Insights Engagements in Manhattan, New York",LPS.V
ACCESSWIRE,/news/legend-power-secures-15-smartgate-110000541.html,Legend Power Secures 15 SmartGATE Insights Engagements and Follow-on Sale of SmartGATE Platform to Large Ontario Multifamily Residential Property Owner,LPS.V
ACCESSWIRE,/news/legend-power-customer-adds-2-120000227.html,Legend Power Customer Adds 2 More Systems to the Largest Order in Company History,LPS.V
CNW Group,/news/sphera-introduces-product-features-eu-130000433.html,mCloud Announces Proposed US$1.718 Million Final Tranche of Convertible Debenture Financing,MCLD.V
CNW Group,/news/clearview-resources-ltd-july-2020-100000057.html,mCloud Announces Interest Payment on Convertible Debentures,MCLD.V
CNW Group,/news/semi-nbmc-invites-white-paper-150000523.html,Tax deadline needs to be extended for small businesses after a welcome extension to CEBA deadline,MCLD.V
CNW Group,/news/enerplus-releases-2020-esg-report-100000740.html,TSX Venture Exchange Stock Maintenance Bulletins,BRM.V
GuruFocus.com,/news/bye-orem-202717484.html,"Bye, Orem",BRM.V
PR Newswire,/news/biorem-announces-research-project-city-130000954.html,BIOREM Announces Research Project with City of New York to Control Release of Bioaerosols from Waste Water Treatment Facilities,BRM.V
Simply Wall St.,/news/heres-why-were-not-concerned-072048921.html,Here's Why We're Not At All Concerned With EcoSynthetix's (TSE:ECO) Cash Burn Situation,ECO.TO
ACCESSWIRE,/news/ecosynthetix-inc-host-earnings-call-113000932.html,"EcoSynthetix, Inc. to Host Earnings Call",ECO.TO
CNW Group,/news/iiroc-trading-halt-shrp-p-115700330.html,EcoSynthetix Reports 2020 Fourth Quarter and Year End Results,ECO.TO
GlobeNewswire,/news/eguana-announces-completion-conversion-debentures-130000073.html,Eguana Announces Completion of Conversion of Debentures and Debt Settlement Agreements,EGT.V
GlobeNewswire,/news/energysage-eguana-team-texas-homeowners-200000794.html,EnergySage and Eguana Team Up for Texas Homeowners with Residential Energy Storage Rebate Program,EGT.V
GlobeNewswire,/news/eguana-announces-debt-settlement-agreement-130000154.html,Eguana Announces Debt Settlement Agreement With ITOCHU Corporation and Closing of Shares for Debt Transactions,EGT.V
GlobeNewswire,/news/eestor-announces-fully-subscribed-offering-130000448.html,EEStor Announces Fully-Subscribed Offering for $1 Million,ESU.V
GlobeNewswire,/news/eestor-corporation-announces-change-name-130000959.html,EEStor Corporation Announces that it will Change its Name to FuelPositive Corporation,ESU.V
GlobeNewswire,/news/eestor-corporation-provides-ongoing-transactions-130300264.html,EEStor Corporation Provides Update on Ongoing Transactions,ESU.V
Newsfile,/news/greenbriar-announces-wealth-building-program-221000849.html,Greenbriar Announces Wealth Building Program with Paul Morris Keller Williams Forward Living,GRB.V
Newsfile,/news/greenbriar-announces-voya-financial-extension-182800694.html,Greenbriar Announces Voya Financial Extension of USD $195 Million Project Finance Mandate for Montalva,GRB.V
Newsfile,/news/greenbriar-moderate-clubhouse-discussion-real-053500000.html,Greenbriar to Moderate Clubhouse Discussion on Real Estate Investing with World Famous Real Estate and Capital Market Investors,GRB.V
TipRanks,/news/2-ev-stocks-over-100-145347172.html,"These 2 EV Stocks Have Over 100% Upside on the Horizon, Says Analyst",GPV.V
PR Newswire,/news/greenpower-receives-purchase-order-four-123000352.html,GreenPower Receives Purchase Order for Four Wirelessly Charged Buy America Compliant EV Stars From Grant Transit Authority in the State of Washington,GPV.V
Simply Wall St.,/news/insiders-buying-greenpower-motor-company-075015650.html,Have Insiders Been Buying GreenPower Motor Company Inc. (CVE:GPV) Shares?,GPV.V
Zacks,/news/auto-stock-roundup-gm-buy-122412688.html,"Auto Stock Roundup: GM to Buy Voyage, VWAGY Power Day Highlights & More",WPRT.TO
SmarterAnalyst,/news/westport-fuel-systems-inks-agreement-134344279.html,Westport Fuel Systems Inks Agreement To Increase Production Capacity In China,WPRT.TO
Zacks,/news/westport-wprt-boosts-manufacturing-hpdi-124012825.html,Westport (WPRT) Boosts Manufacturing of HPDI Injectors in China,WPRT.TO
Simply Wall St.,/news/oceanic-wind-energy-cve-nkw-121742571.html,Can Oceanic Wind Energy (CVE:NKW) Afford To Invest In Growth?,NKW.V
CNW Group,/news/iiroc-trading-resumption-nkw-152000089.html,IIROC Trading Resumption - NKW,NKW.V
GlobeNewswire,/news/naikun-wind-provides-additional-details-150606276.html,NaiKun Wind Provides Additional Details Regarding the Sale of NaiKun Offshore Wind Project,NKW.V
Simply Wall St.,/news/think-nano-one-materials-cve-121843542.html,How Many Nano One Materials Corp. (CVE:NNO) Shares Do Institutions Own?,NNO.V
