source,link_href,link_text,ticker
PR Newswire,/news/inspira-technologies-reveals-next-generation-130000871.html,"Inspira™ Technologies Reveals Next Generation Liby™ System, an Extracorporeal Membrane Oxygenation System, Targeting a $531 Million Global ECMO Market",IINN
PR Newswire,/news/inspira-technologies-signs-strategic-agreement-123000623.html,"Inspira™ Technologies Signs Strategic Agreement in U.S. to potentially provide $59 million for Inspira for deployment of 3,889 HYLA™ Blood Sensors",IINN
Yahoo Finance Video,/video/inspira-stock-soars-peloton-offers-195746187.html,"Inspira stock soars, Peloton offers workers cash bonuses, Rivian deliveries more than triple in Q2",IINN
PR Newswire,/news/inspira-technologies-develops-non-invasive-123000344.html,Inspira™ Technologies Develops a Non-Invasive Blood Sensor Designed to Alert Real-Time Change in Patients - Potentially Targets $2.5 Billion ABG Market,IINN
ACCESSWIRE,/news/redchip-interviews-inspira-technologies-cfo-130000720.html,RedChip Interviews Inspira Technologies' CFO Joe Hayon,IINN
PR Newswire,/news/inspira-technologies-announces-first-quarter-133000113.html,Inspira™ Technologies Announces First Quarter 2022 Financial Results,IINN
PR Newswire,/news/inspira-technologies-participate-upcoming-events-133000021.html,Inspira™ Technologies to Participate in Upcoming Events in May,IINN
PR Newswire,/news/inspira-technologies-announces-deployment-agreement-133000630.html,Inspira Technologies Announces Deployment Agreement in the Israeli Market to Target $15M,IINN
PR Newswire,/news/inspira-technologies-releases-q4-fy2021-120000966.html,Inspira Technologies Releases Q4 & FY2021 Financial Results,IINN
CNW Group,/news/inspira-technologies-applauded-frost-sullivan-140000347.html,"Inspira Technologies Applauded by Frost & Sullivan for Minimizing the Need for Invasive Mechanical Ventilation with Its Innovative Technology, the ART™ System",IINN
PR Newswire,/news/thinking-buying-stock-verrica-pharmaceuticals-133100244.html,"Thinking about buying stock in Verrica Pharmaceuticals, Scisparc, Adverum Biotechnologies, OneConnect Financial Tech, or Alaunos Therapeutics?",OCFT
PR Newswire,/news/thinking-buying-stock-cowen-oneconnect-123000421.html,"Thinking about buying stock in Cowen, OneConnect Financial Tech, Faraday Future Intelligent Electric, RA Medical Systems, or Athersys?",OCFT
Business Wire,/news/oneconnect-successfully-listed-main-board-013200601.html,OneConnect Successfully Listed on the Main Board of the Stock Exchange of Hong Kong,OCFT
Business Wire,/news/oneconnect-announces-proposed-dual-primary-100000412.html,OneConnect Announces Proposed Dual Primary Listing on The Stock Exchange of Hong Kong Limited,OCFT
Business Wire,/news/oneconnect-announces-arrangement-batch-conversion-100000459.html,OneConnect Announces Arrangement of Batch-Conversion of American Depositary Shares to Ordinary Shares Trading in Hong Kong,OCFT
Business Wire,/news/oneconnect-announces-upsize-share-repurchase-090000176.html,OneConnect Announces Upsize of Its Share Repurchase Program,OCFT
Simply Wall St.,/news/oneconnect-financial-technology-nyse-ocft-131742997.html,OneConnect Financial Technology (NYSE:OCFT) investors are sitting on a loss of 90% if they invested a year ago,OCFT
PR Newswire,/news/paob-ranks-highest-among-virtual-055400226.html,PAOB Ranks Highest Among Virtual Banks in Hong Kong in The Asian Banker's Global Top 100 Digital Bank Ranking,OCFT
Business Wire,/news/oneconnect-announces-first-quarter-2022-220000011.html,OneConnect Announces First Quarter 2022 Unaudited Financial Results,OCFT
Business Wire,/news/oneconnect-announce-first-quarter-2022-220000995.html,OneConnect to Announce First Quarter 2022 Financial Results,OCFT
Zacks,/news/value-investors-buy-gaslog-partners-134001751.html,Should Value Investors Buy GasLog Partners (GLOP) Stock?,ZIM
Zacks,/news/best-dividend-stocks-buy-now-095409049.html,Best Dividend Stocks to Buy Now According to the Zacks Rank,ZIM
Zacks,/news/value-investors-buy-navios-maritime-134001565.html,Should Value Investors Buy Navios Maritime Partners (NMM) Stock?,ZIM
Zacks,/news/zim-integrated-shipping-services-zim-214509632.html,ZIM Integrated Shipping Services (ZIM) Gains As Market Dips: What You Should Know,ZIM
Zacks,/news/safe-bulkers-sb-great-value-134001820.html,Is Safe Bulkers (SB) a Great Value Stock Right Now?,ZIM
Zacks,/news/zim-integrated-shipping-services-zim-214509878.html,ZIM Integrated Shipping Services (ZIM) Stock Sinks As Market Gains: What You Should Know,ZIM
Zacks,/news/zim-integrated-shipping-services-zim-214509690.html,ZIM Integrated Shipping Services (ZIM) Dips More Than Broader Markets: What You Should Know,ZIM
Zacks,/news/value-investors-buy-danaos-dac-134001651.html,Should Value Investors Buy Danaos (DAC) Stock?,ZIM
Zacks,/news/zacks-com-featured-highlights-pbf-083508724.html,"Zacks.com featured highlights PBF Energy, Suncor Energy and ZIM Integrated Shipping",ZIM
Zacks,/news/3-stocks-upgraded-broker-ratings-111411848.html,3 Stocks With Upgraded Broker Ratings to Buy Amid Bear Markets,ZIM
Simply Wall St.,/news/theres-lot-united-states-steels-101446194.html,There's A Lot To Like About United States Steel's (NYSE:X) Upcoming US$0.05 Dividend,X
Motley Fool,/m/40bcaf2d-464c-302e-bb57-ecf3fc6ed7e7/united-states-steel-x-q2.html,United States Steel (X) Q2 2022 Earnings Call Transcript,X
American City Business Journals,/m/d7a4e3ac-187b-3be4-babe-b8fad7a35907/u-s-steel-ceo-granite-city.html,U.S. Steel CEO: Granite City blast furnace sale will save 500 jobs,X
Zacks,/news/u-steels-x-earnings-miss-122912990.html,"U.S. Steel's (X) Earnings Miss Estimates in Q2, Revenues Beat",X
The Wall Street Journal,/m/8f7f43be-9113-363d-9394-7a380de09790/amazon-apple-and-more-stocks.html,"Amazon, Apple and More Stocks to Watch Friday",X
Zacks,/news/united-states-steel-x-q2-213509451.html,United States Steel (X) Q2 Earnings Lag Estimates,X
American City Business Journals,/m/47215367-6565-34bd-bf96-95d554b7d2c5/u-s-steel-announces-3rd.html,U.S. Steel announces 3rd round of share repurchasing in less than a year,X
Benzinga,/news/united-states-steel-shares-soar-212010545.html,"United States Steel Shares Soar As Q2 Results Tops Revenue Expectation, Authorizes $500M Stock Buyback",X
MarketWatch,/m/9f12ecb0-d204-39ad-ae1f-2e18bc6867cf/u-s-steel-stock-gains-4-.html,"U.S. Steel stock gains 4% after Q2 beat, $500 million share buyback",X
Business Wire,/news/united-states-steel-corporation-declares-204300889.html,United States Steel Corporation Declares Dividend,X
