source,link_href,link_text,ticker
GlobeNewswire,/news/routemaster-capital-announces-101-6-120000673.html,"Routemaster Capital Announces 101.6 Percent Increase in Treasury Balance in Leading DeFi Protocols and Announces Thibaut Ceyrolle, Snowflake EMEA Founder, as Special Advisor for Cloud Infrastructure; Olivier Roussy Newton Appointed as EIR",HIVE.V
ACCESSWIRE,/news/hive-blockchain-most-liquid-tsx-222000528.html,HIVE Blockchain Most Liquid TSX.V Stock Trading over 1.7 Billion Shares in 2020 and Named 4th on The 2021 OTCQX Best 50 has Established an At-the-Market Equity Program to Accelerate Growth,HIVE.V
ACCESSWIRE,/news/hive-blockchain-announces-plans-expand-060000639.html,HIVE Blockchain Announces Plans to Expand Ethereum Footprint by 30% Using 6 MW of Green Energy to Mine Ethereum,HIVE.V
GlobeNewswire,/news/namaste-technologies-advances-usa-expansion-234900911.html,Namaste Technologies Advances USA Expansion Plans with TSX Exchange Approval to Proceed,N.V
GlobeNewswire,/news/namaste-technologies-announces-evolution-wellness-223400008.html,Namaste Technologies Announces its Evolution to a Wellness Company with Expansion into Nutraceuticals Market,N.V
CNW Group,/news/cyient-reports-pat-inr-814-184100944.html,Namaste Technologies Closes $23 Million Bought Deal Public Offering,N.V
Barrons.com,/m/0f3e61e0-cc9b-3b0f-a3cf-d1074c080a07/pot-stocks-are-flying-high.html,Pot Stocks Are Flying High Again. It’s Not Just Reddit.,APHA.TO
Motley Fool,/m/47179e18-2286-30a6-8a88-62dd37b1b1e1/why-marijuana-stocks-like.html,Why Marijuana Stocks Like Aphria and Charlotte's Web Holdings Flew High Today,APHA.TO
MarketWatch,/m/a23c74c2-a11f-3628-82d9-bb9e888cec04/tilray-shares-soar-39-as.html,Tilray shares soar 39% as Reddit message board sets sights on cannabis sector,APHA.TO
Yahoo Finance,/news/gamestop-amc-reddit-investing-213609595.html,28% of Americans bought GameStop or other viral stocks in January: Yahoo Finance-Harris Poll,BB.TO
Benzinga,/news/blackberry-announces-qnx-software-power-183009474.html,BlackBerry Announces QNX Software Will Power Motional's Autonomous Vehicles,BB.TO
PR Newswire,/news/blackberrys-qnx-black-channel-communications-130000898.html,BlackBerry's QNX Black Channel Communications to be used in Motional's Driverless Platform,BB.TO
CNW Group,/news/hut-8-mining-named-11th-130000987.html,Hut 8 Mining Named 11th in the 2021 OTCQX Best 50,HUT.TO
CNW Group,/news/hut-8-builds-positive-momentum-123000801-181027463.html,Hut 8 Builds Positive Momentum and Value for Shareholders with Repayment of U$20M capital loan,HUT.TO
CNW Group,/news/bmo-housing-survey-covid-first-121600456.html,"Hut 8 Steadily Builds Talent Roster with the Appointment of Tanya Woods as General Counsel, EVP of Regulatory Affairs",HUT.TO
GlobeNewswire,/news/laura-bastias-appointed-independent-director-234300070.html,Laura Bastias Appointed Independent Director,TBX.V
GlobeNewswire,/news/turmalina-intersection-72m-3-47-160200585.html,"Turmalina Intersection of 72m at 3.47% Copper, 100 g/t Silver and 0.71 g/t Gold (5.0% CuEq) Extends Known Mineralisation at SFdLA 300m Below Previous Drilling in Eastern Lobe",TBX.V
GlobeNewswire,/news/turmalina-intersects-6m-23-7-130000431.html,Turmalina Intersects 6m at 23.7 g/t Gold and 142 g/t Silver Near Surface in Newly Identified Oxide Zone at SFdLA,TBX.V
Business Wire,/news/mydecine-innovations-group-files-final-192900709.html,Mydecine Innovations Group Files Final Prospectus in Connection with Bought Deal Offering of Units,MYCO.CN
CNW Group,/news/iiroc-trade-resumption-myco-165300804.html,"2021 LG Gram Laptops Bring Larger Screens, Sleek Design and New 2-in-1 Model to Canada",MYCO.CN
Business Wire,/news/mydecine-innovations-group-files-amended-130600599.html,Mydecine Innovations Group Files Amended and Restated Financial Statements,MYCO.CN
Newsfile,/news/graph-blockchain-announces-blockchain-contract-080000193.html,Graph Blockchain Announces Blockchain Contract,GBLC.CN
Newsfile,/news/graph-blockchain-provides-2020-corporate-214000059.html,Graph Blockchain Provides 2020 Corporate Review and Expected Strategies for 2021,GBLC.CN
Newsfile,/news/graph-blockchain-issues-options-194400591.html,Graph Blockchain Issues Options,GBLC.CN
ACCESSWIRE,/news/globex-data-launch-swiss-hosted-120000913.html,GlobeX Data to Launch Its Swiss Hosted Sekur.com Secure Email and Secure Messaging Security and Privacy Application Solution to US Mass Market,SWIS.CN
ACCESSWIRE,/news/globex-data-launch-sekur-com-130000340.html,Globex Data to Launch Its Sekur.com Secure Communications Solution and Its Sekursafe.com Document Management Solution in Colombia and Panama,SWIS.CN
ACCESSWIRE,/news/globex-data-engages-pr-distribution-113000573.html,"GlobeX Data Engages PR Distribution and Media Company Serving 100 Million German Speakers in Austria, Germany and Switzerland",SWIS.CN
CNW Group,/news/loop-insights-launches-contact-tracing-100000895.html,/C O R R E C T I O N from Source -- Ontario Public Service Employees Union (OPSEU/SEFPO)/,MTRX.V
GlobeNewswire,/news/loop-insights-enters-uk-market-110000379.html,"Loop Insights Enters UK Market With Pilot Agreement For Leading UK Pharmacy Solutions Provider, Servicing 12,000 Pharmacies Across United Kingdom",MTRX.V
CNW Group,/news/iiroc-trading-resumption-sxl-184800110.html,BitePRO Report Record Sales Of Bite Resistant Clothing Due To Increasing Violence In Schools,MTRX.V
GlobeNewswire,/news/loop-insights-signs-loi-acquire-110000542.html,"Loop Insights Signs LOI To Acquire Passcreator, A Leading European Digital Wallet And Mobile Marketing Company With Tier-1 Global Clients",MTRX.V
GlobeNewswire,/news/loop-insights-selected-bdg-sports-110000158.html,Loop Insights Selected by bdG Sports to Provide Venue Management Platform to NCAA Big West Conference Championships at Mandalay Bay in Las Vegas,MTRX.V
GlobeNewswire,/news/loop-insights-appoints-danny-spataro-110000357.html,"Loop Insights Appoints Danny Spataro as Sr. Director of Sales, Sports, and Entertainment, to Support the Rapid Growth of the Company",MTRX.V
GlobeNewswire,/news/telus-launches-expanded-sales-marketing-110000233.html,TELUS Launches Expanded Sales and Marketing Campaign Showcasing Loop Insights’ IoT Solutions Stack Utilizing Both Direct and Indirect National Sales Channels,MTRX.V
GlobeNewswire,/news/loop-insights-reviews-most-successful-110000381.html,"Loop Insights Reviews Its Most Successful Year in Its History, Highlighted by Revenue-Generating Partnerships, World-Class Telecom Partnerships, World’s First-Ever Venue Bubble Implementation and Expansion Into the Travel, Film, Live Entertainment Industries",MTRX.V
GlobeNewswire,/news/loop-insights-launches-digital-connect-110000539.html,"Loop Insights Launches Digital Connect Health Platform, A Fully-Integrated Digital Healthcare Solution For Governments, After Extended Discussions With Provinces, Federal Government and Private Sector",MTRX.V
GlobeNewswire,/news/loop-insights-inc-tsx-v-133000311.html,Loop Insights Inc.’s (TSX.V: MTRX) (OTCQB: RACMF) Venue-Tracing Solution Key to Bubble Success,MTRX.V
CNW Group,/news/cashfree-introduces-global-payouts-international-120600011.html,Cineplex Inc. Announces Timing of Fourth Quarter and Year End 2020 Earnings Release and Conference Call,CGX.TO
Yahoo Finance Video,/video/expect-streaming-industry-2021-160241873.html,What to expect from the streaming industry in 2021,CGX.TO
CNW Group,/news/great-west-lifeco-reports-second-233400389.html,Health Canada authorizes Moderna COVID-19 vaccine,CGX.TO
CNW Group,/news/dragonfly-therapeutics-initiates-phase-1-130000856.html,Scotiabank and Cineplex Announce Enhancements to the SCENE Loyalty Program,CGX.TO
CNW Group,/news/dfis-miniaturized-ipcs-empower-edge-010000318.html,Notice from the Office of the Secretary - Ontario Securities Commission,CGX.TO
CNW Group,/news/filo-mining-corporate-050000769.html,"IDÉLLO, Learning at Home with Confidence",CGX.TO
CNW Group,/news/choom-secures-4th-retail-location-124500650.html,Small groups. Big screens. - Cineplex introduces 'Private Movie Nights',CGX.TO
CNW Group,/news/cineplex-announces-details-fiscal-2019-130000588.html,Minister of Environment and Climate Change highlights action to stop the spread of mountain pine beetle in Rocky Mountain National Parks,CGX.TO
Bloomberg,/news/learned-live-without-movie-theaters-103015987.html,We Have Learned to Live Without Movie Theaters,CGX.TO
Thomson Reuters StreetEvents,/news/edited-transcript-cgx-earnings-conference-160836663.html,Edited Transcript of CGX.TO earnings conference call or presentation 30-Jun-20 12:00pm GMT,CGX.TO
Zacks,/news/cenovus-energy-cve-q4-earnings-144602498.html,"Cenovus Energy (CVE) Q4 Earnings Lag, '21 Capital Budget Set",CVE.TO
Benzinga,/news/analyzing-cenovus-energys-unusual-options-143649070.html,Analyzing Cenovus Energy's Unusual Options Activity,CVE.TO
GlobeNewswire,/news/cenovus-reports-2020-fourth-quarter-110100412.html,Cenovus reports 2020 fourth-quarter and full-year results,CVE.TO
Business Wire,/news/applied-dna-trutrace-technologies-unveil-130000431.html,Applied DNA and TruTrace Technologies™ Unveil Complete Cannabis Product Validation and Authentication Solution,TTT.CN
Business Wire,/news/trutrace-technologies-appoints-two-members-125900471.html,TruTrace Technologies Appoints Two New Members to Board of Directors,TTT.CN
CNW Group,/news/mistango-river-resources-announces-3-130800872.html,Minister Qualtrough welcomes report by Future Skills Council that will help Canadians prepare for a changing and modern labour market,TTT.CN
CNW Group,/news/superior-gold-inc-announces-second-100000511.html,GainShare Performance Marketing Launches to Turn Response into Revenue,AC.TO
Reuters,/news/air-canada-suspends-further-routes-203031983.html,"Air Canada suspends further routes, reduces workforce by 1,500 due to COVID-19",AC.TO
CNW Group,/news/seizure-contraband-edmonton-institution-214300525.html,"EM Microelectronic Commended by Frost & Sullivan for its Augmented RFID Solution, em|aura-sense",AC.TO
GlobeNewswire,/news/vsblty-ability-enterprise-co-announce-121000744.html,"VSBLTY & ABILITY ENTERPRISE CO. ANNOUNCE SOLUTION TO RUN DIRECTLY ON STATE-OF-THE-ART, AI-ENABLED CAMERA",VSBY.CN
GlobeNewswire,/news/vsblty-partners-911inform-improve-emergency-121000479.html,"VSBLTY PARTNERS WITH  911INFORM TO IMPROVE EMERGENCY RESPONSE, SAFETY & SECURITY IN SCHOOLS, HOSPITALS & OFFICES",VSBY.CN
GlobeNewswire,/news/vsblty-synq-partner-public-health-121000487.html,"VSBLTY AND SYNQ PARTNER TO PROVIDE PUBLIC HEALTH SAFETY,  SECURITY TECHNOLOGY FOR VICTORIA, BC CANADIAN TIRE STORE",VSBY.CN
CNW Group,/news/r-e-m-n-d-110000761.html,Lightspeed Announces Upsizing and Pricing of Marketed Public Offering of Subordinate Voting Shares,LSPD.TO
Benzinga,/news/lightspeed-seeks-raise-more-570m-103243915.html,Lightspeed Seeks To Raise More Than $570M In Secondary Offering To Bolster Financial Position,LSPD.TO
PR Newswire,/news/lightspeed-announces-launch-marketed-public-214100355.html,Lightspeed Announces Launch of Marketed Public Offering of Subordinate Voting Shares,LSPD.TO
Simply Wall St.,/news/oneconnect-financial-technology-co-ltd-113616526.html,"When Will OneConnect Financial Technology Co., Ltd. (NYSE:OCFT) Breakeven?",OCFT
Motley Fool,/m/8702a584-d085-34d7-ab45-a61e657af1ca/oneconnect-financial.html,"OneConnect Financial Technology Co., Ltd. (OCFT) Q4 2020 Earnings Call Transcript",OCFT
Benzinga,/news/recap-oneconnect-financial-tech-q4-222048392.html,Recap: OneConnect Financial Tech Q4 Earnings,OCFT
GlobeNewswire,/news/next-super-stocks-move-cloudmd-140300929.html,"NEXT SUPER STOCKS On The Move: CloudMD, Peak Fintech, FansUnite, and Logiq. Fintech, I-Gaming, and The Future of Healthcare",DOC.V
GlobeNewswire,/news/cloudmd-expands-virtual-mental-health-123000838.html,"CloudMD Expands Virtual Mental Health Services Through Acquisition of Aspiria Corp., a Healthcare Provider Focused on Delivering Employee (EAP) and Student (SAP) Assistance Programs",DOC.V
GlobeNewswire,/news/cloudmd-closes-acquisition-medical-confidence-220500652.html,"CloudMD Closes Acquisition of Medical Confidence Inc., a Revolutionary, Technology-based, Healthcare Navigation Platform for Enterprise Clients",DOC.V
GlobeNewswire,/news/cloudmd-closes-acquisition-humanacare-industry-123000310.html,"CloudMD Closes Acquisition of HumanaCare, an Industry Leader in Employee Health Services, Providing a Transformational Platform that Promotes Short and Long-Term Health and Wellness",DOC.V
CNW Group,/news/obsidian-energy-proposes-combination-transaction-100000487.html,"Ontario Lottery and Gaming Corporation - EVENING LOTTERY WINNING NUMBERS - January 2, 2021",DOC.V
CNW Group,/news/luxury-brand-partners-announces-one-130000385.html,Madison's Lumber Reporter - Forest of Products,DOC.V
GlobeNewswire,/news/cloudmd-acquire-idya4-north-american-123000997.html,"CloudMD to Acquire IDYA4, a North American Leader in Healthcare Data Integration and Cybersecurity",DOC.V
GlobeNewswire,/news/mental-health-commission-canada-imd-150000551.html,Mental Health Commission of Canada and iMD Health Global announce partnership to get credible online mental health resources into the hands of care providers and their patients,DOC.V
GlobeNewswire,/news/mental-health-commission-canada-cloudmd-150000071.html,Mental Health Commission of Canada and CloudMD’s iMD Health Global Announce Partnership To Get Credible Online Mental Health Resources into The Hands of Care Providers And Their Patients,DOC.V
GlobeNewswire,/news/cloudmd-launches-addiction-support-program-123000216.html,CloudMD Launches Addiction Support Program Focused on Early Intervention and Relapse,DOC.V
Newsfile,/news/peak-teste-avec-succ-le-123000987.html,Peak teste avec succès le processus de transfert de fonds de la Chine vers le Canada,PKK.CN
Newsfile,/news/peak-successfully-tests-fund-transfer-123000617.html,Peak Successfully Tests Fund Transfer Process from China to Canada,PKK.CN
Newsfile,/news/peak-d-pose-officiellement-une-123000652.html,Peak dépose officiellement une application pour que ses actions ordinaires soient négociées sur NASDAQ,PKK.CN
ACCESSWIRE,/news/electrovaya-closes-cdn-3-27-225500232.html,Electrovaya Closes CDN $3.27 Million Private Placement,EFL.TO
ACCESSWIRE,/news/raymond-electrovaya-announce-strategic-supply-051000378.html,Raymond and Electrovaya Announce Strategic Supply Agreement,EFL.TO
CNW Group,/news/fdas-convalescent-plasma-eua-requires-194900599.html,GSMA Announces MWC Shanghai Is Back For 2021,EFL.TO
CNW Group,/news/montoni-enters-residential-market-le-110000338.html,IIROC Trading Halt - EFL,EFL.TO
ACCESSWIRE,/news/electrovaya-reports-q4-fy2020-fiscal-023000817.html,"Electrovaya Reports Q4 FY2020 and Fiscal 2020 Results Strong Revenue Growth and Positive EBITDA1 in the Fourth Quarter, While Annual Revenue Nearly Triples Year-Over-Year",EFL.TO
ACCESSWIRE,/news/electrovaya-announces-date-end-september-162500028.html,"Electrovaya Announces Date of Year End September 30, 2020 Earnings Release and Conference Call to Discuss the Annual & Quarterly Financial Results",EFL.TO
ACCESSWIRE,/news/electrovaya-achieves-key-milestone-ul2580-110000976.html,Electrovaya Achieves Key Milestone with UL2580 (Batteries for Use in Electric Vehicles) Listing,EFL.TO
Simply Wall St.,/news/did-electrovaya-inc-tse-efl-104552290.html,Did Electrovaya Inc. (TSE:EFL) Insiders Buy Up More Shares?,EFL.TO
ACCESSWIRE,/news/electrovaya-reports-strong-revenue-growth-211500839.html,Electrovaya Reports Strong Revenue Growth,EFL.TO
ACCESSWIRE,/news/electrovaya-completes-repayment-15-million-211500940.html,Electrovaya Completes the Repayment of its $15 million Debentures and its $10 million Purchase Order Financing Facility,EFL.TO
Newsfile,/news/very-good-food-company-announces-123000002.html,The Very Good Food Company Announces Director of US Sales and Provides E-commerce Update,VERY.CN
Newsfile,/news/very-good-food-company-receives-123000570.html,The Very Good Food Company Receives Conditional Approval to List on the TSX Venture Exchange,VERY.CN
Newsfile,/news/very-good-food-company-announces-123000328.html,The Very Good Food Company Announces A New Flagship Butcher Shop,VERY.CN
CNW Group,/news/iiroc-trading-resumption-bhs-161900930.html,Mineração Vale Verde completes US$140m debt financing for Serrote development,MEAT.CN
CNW Group,/news/lufa-farms-doubles-production-capacity-100000843.html,Four Seasons Celebrates Culinary Excellence Around the World with 27 Michelin Stars,MEAT.CN
CNW Group,/news/r-e-p-e-t-120000481.html,"Modern Meat Signs Retail, E-Commerce, Distribution, and Food Service Deal With Premier BC Distributor Legends Haul",MEAT.CN
CNW Group,/news/input-capital-corp-announces-sixteenth-235900627.html,Predictiv AI Launches Marketing Campaign with AGORACOM for Online Marketing and Social Media Engagement,PAI.V
CNW Group,/news/ga-asi-announces-team-skyguardian-220000767.html,Predictiv AI Signs TFG Concepts to Represent ThermalPass to its Clients Across Canada,PAI.V
CNW Group,/news/desjardins-supports-canadian-youth-prepare-120000180.html,Predictiv AI Signs Additional Purchase Orders for its ThermalPass Fever Detection System,PAI.V
CNW Group,/news/government-canada-haida-nation-announce-173400412.html,Minerva Announces Contract with Freeport Resources for TERRA Mining AI Suite,MVAI.V
CNW Group,/news/minerva-prospector-announce-partnership-promises-110000805.html,"Media Advisory - Prime Minister's itinerary for Friday, October 23, 2020",MVAI.V
CNW Group,/news/minerva-announces-first-software-subscription-120000678.html,myScarTape Can Restore Normalcy and Confidence to a Life Disrupted by Scarring,MVAI.V
Simply Wall St.,/news/quisitive-technology-solutions-cve-quis-113034451.html,Quisitive Technology Solutions (CVE:QUIS) Shareholders Have Enjoyed An Impressive 171% Share Price Gain,QUIS.V
CNW Group,/news/quisitive-retains-payments-industry-leaders-130000706.html,Quisitive Retains Payments Industry Leaders to Further Accelerate LedgerPay Growth Initiatives,QUIS.V
CNW Group,/news/quisitive-earns-windows-server-sql-133000211.html,Quisitive Earns the Windows Server and SQL Server Migration to Microsoft Azure Advanced Specialization,QUIS.V
Newsfile,/news/netcents-technology-announces-nc-exchange-080500232.html,NetCents Technology Announces NC Exchange Activity Exceeding Four Million Dollars,NC.CN
Newsfile,/news/netcents-technology-signs-white-label-080500427.html,NetCents Technology Signs White Label Agreement for Cryptocurrency Exchange,NC.CN
Newsfile,/news/netcents-technologys-ceo-issues-letter-070000074.html,NetCents Technology's CEO Issues Letter to Shareholders,NC.CN
Newsfile,/news/appia-intersects-11-035-wt-130000614.html,Appia Intersects up to 11.035 wt% Total Rare Earth Oxide and 0.025 wt% Gallium Oxide over 2.8 Metres and Discovers New Uranium Mineralization on the High Grade Alces Lake Property,API.CN
Newsfile,/news/appia-announces-exercise-warrants-cash-154400225.html,Appia Announces Exercise of Warrants and Cash Position,API.CN
Newsfile,/news/appia-announces-closing-non-brokered-131600554.html,Appia Announces Closing of Non-Brokered Private Placement,API.CN
CNW Group,/news/ecosynthetix-host-2020-third-quarter-150000376.html,Report offers checkup on health of Chinese people in 2020,ECO.TO
CNW Group,/news/ecosynthetix-reports-third-quarter-2020-220000530.html,CAJ condemns Alberta's efforts to discredit climate journalists,ECO.TO
Simply Wall St.,/news/announcing-ecosynthetix-tse-eco-stock-125524266.html,Announcing: EcoSynthetix (TSE:ECO) Stock Increased An Energizing 160% In The Last Five Years,ECO.TO
CNW Group,/news/angold-resources-commence-trading-tsx-180000215.html,Eguana Technologies Announces Proposed Private Placement of Special Warrants,EGT.V
GlobeNewswire,/news/eguana-announces-operational-2020-annual-210000083.html,Eguana Announces Operational Update and 2020 Annual Results,EGT.V
Simply Wall St.,/news/introducing-eguana-technologies-cve-egt-080927495.html,"Introducing Eguana Technologies (CVE:EGT), The Stock That Soared 340% In The Last Year",EGT.V
CNW Group,/news/greenpower-ev-star-selected-eligible-130000776.html,TSX Venture Exchange Stock Maintenance Bulletins,GPV.V
TheStreet.com,/m/51dff68d-47f5-3532-af7e-762674bf1cb8/greenpower-motor-may-decline.html,GreenPower Motor May Decline in the Weeks Ahead,GPV.V
Simply Wall St.,/news/type-shareholders-greenpower-motor-company-062036940.html,What Type Of Shareholders Make Up GreenPower Motor Company Inc.'s (CVE:GPV) Share Registry?,GPV.V
Oilprice.com,/news/2-under-radar-electric-vehicle-000000333.html,2 Under The Radar Electric Vehicle Stocks That Could Soar In 2021,WPRT.TO
Motley Fool,/m/6a9fca0c-10ee-3b28-8017-63e51dd202d6/why-westport-fuel-systems.html,Why Westport Fuel Systems Stock Jumped Over 40% Monday Morning,WPRT.TO
TheStreet.com,/m/690c37c8-4f29-33eb-9f60-d69c2d60b956/5-top-stock-gainers-monday-.html,"5 Top Stock Gainers Monday: Westport Fuel, Clean Energy Fuels",WPRT.TO
Newsfile,/news/nano-one-announces-mr-alex-080500616.html,Nano One Announces Mr. Alex Holmes as COO,NNO.V
Newsfile,/news/nano-one-selected-showcase-clean-080500171.html,Nano One Selected to Showcase its Clean Technology Advantages in Chile,NNO.V
CNW Group,/news/crown-capital-partners-expands-network-153400637.html,CMA Foundation commits $2.5 million for virtual care research,NNO.V
ACCESSWIRE,/news/kabn-north-america-welcomes-leading-133000025.html,KABN North America Welcomes Leading Executives to its Industry Advisory Committee,KABN.CN
ACCESSWIRE,/news/kabn-north-america-partners-indicio-130000707.html,KABN North America Partners with Indicio to Build the  Liquid Avatar Verifiable Credential Ecosystem to Support Digital Identity Credentials for Everyday Use,KABN.CN
ACCESSWIRE,/news/kabn-north-america-release-liquid-130000061.html,"KABN North America to Release Liquid Avatar to Further Progress Self Sovereign Identity - Available in Popular App Stores  February 18, 2021",KABN.CN
Business Wire,/news/namsys-terminates-employee-long-term-163600318.html,NamSys Terminates Employee Long Term Bonus Plan,CTZ.V
Simply Wall St.,/news/namsys-inc-cve-ctz-stock-075555636.html,NamSys Inc. (CVE:CTZ) Stock Has Shown Weakness Lately But Financials Look Strong: Should Prospective Shareholders Make The Leap?,CTZ.V
Business Wire,/news/namsys-included-globe-mail-second-173300203.html,NamSys Included in The Globe and Mail’s Second-Annual Ranking of Canada’s Top Growing Companies,CTZ.V
