source,link_href,link_text,ticker
CNW Group,/news/shareholder-alert-pomerantz-law-firm-023900044.html,IIROC Trading Resumption - NNO,NNO.V
GlobeNewswire,/news/nano-one-announces-25-million-204400172.html,Nano One Announces $25 Million Bought Deal Offering of Common Shares,NNO.V
ACCESSWIRE,/news/cielo-engages-canadian-investor-relations-020000478.html,Cielo Engages Canadian Investor Relations Firm Investor Cubed (I3),CMC.CN
ACCESSWIRE,/news/cielo-announces-management-team-additions-045000239.html,Cielo Announces Management Team Additions,CMC.CN
ACCESSWIRE,/news/cielo-provides-entry-ontario-marketplace-040000100.html,"Cielo Provides Update on Entry Into Ontario Marketplace, Receives CDN$750,000 in JV Fees and Repays Loan Ahead of Schedule",CMC.CN
CNW Group,/news/greystar-joins-cpp-investments-cyrela-120400186.html,PharmaTher Advancing Research for Novel Microneedle Delivery of Ketamine,PHRM.CN
GlobeNewswire,/news/revive-therapeutics-announces-successful-research-113000446.html,Revive Therapeutics Announces Successful Research Results for Psilocybin to Treat Traumatic Brain Injury and Filing of International Patent Application,PHRM.CN
GlobeNewswire,/news/world-leading-depression-researcher-dr-131500981.html,World Leading Depression Researcher Dr. Maurizio Fava Joins PharmaTher as Scientific and Clinical Advisor,PHRM.CN
GlobeNewswire,/news/flyht-participate-cowen-aerospace-defense-120400826.html,FLYHT to Participate in the Cowen Aerospace/Defense & Industrials Conference,FLY.V
Benzinga,/news/flyht-flight-intelligent-way-boost-142522484.html,"FLYHT-And-Flight: The Intelligent Way To Boost Aircraft Profitability, Security And Connectivity In 2021",FLY.V
GlobeNewswire,/news/flyht-present-noblecon17-january-19-120400605.html,FLYHT to Present at NobleCon17 on January 19,FLY.V
PR Newswire,/news/imaginear-otcqb-ipnff-liquid-avatar-123000457.html,"ImagineAR (OTCQB: IPNFF) and Liquid Avatar Launch Oasis Digital Studios to Support the Development, Management, and Distribution of AR Enhanced NFTs",KABN.CN
ACCESSWIRE,/news/liquid-avatar-imaginear-launch-oasis-123000205.html,"Liquid Avatar and ImagineAR Launch Oasis Digital Studios to Support the Development, Management, and Distribution of AR Enhanced NFTs",KABN.CN
ACCESSWIRE,/news/kabn-systems-na-holdings-corp-141000201.html,KABN Systems NA Holdings Corp Changes Its Name to Liquid Avatar Technologies Inc. with New Symbol LQID,KABN.CN
CNW Group,/news/clean-air-metals-announces-step-110000664.html,Notice from the Office of the Secretary - Ontario Securities Commission,DVN.CN
CNW Group,/news/danavation-technologies-corp-provides-operational-123000642.html,Schmidt's Natural Deodorant Is Fighting FOBO (Fear of Body Odour) with Kaitlyn Bristowe,DVN.CN
CNW Group,/news/world-happiness-foundation-welcomes-satinder-110000248.html,Danavation Technologies Announces Participation at the Lytham Partners Spring 2021 Investor Conference,DVN.CN
Business Wire,/news/namsys-reports-results-operations-fiscal-202200214.html,NamSys Reports Results of Operations for Fiscal 2020,CTZ.V
Business Wire,/news/namsys-terminates-employee-long-term-163600318.html,NamSys Terminates Employee Long Term Bonus Plan,CTZ.V
Simply Wall St.,/news/namsys-inc-cve-ctz-stock-075555636.html,NamSys Inc. (CVE:CTZ) Stock Has Shown Weakness Lately But Financials Look Strong: Should Prospective Shareholders Make The Leap?,CTZ.V
ACCESSWIRE,/news/keynotes-educational-panels-42-canadian-140000492.html,"Keynotes, Educational Panels and 42 Canadian-Listed Public Companies Presenting at the SNN Network Canada Virtual Event - January 6-7, 2021",MRBL.CN
ACCESSWIRE,/news/marble-financial-present-snn-network-120000210.html,"Marble Financial to Present at the SNN Network Canada Virtual Event on Thursday January 7, 2021",MRBL.CN
Newsfile,/news/marble-financial-inc-data-driven-182200831.html,"Marble Financial Inc., A Data-Driven Financial Future, CEO Clip Video",MRBL.CN
CNW Group,/news/sable-receives-1-946-5-110000881.html,Carl Data Solutions Announces Preferred Supplier Partnership with Smart IoT Technologies to Provide Environmental Monitoring as a Service,CRL.CN
CNW Group,/news/duer-performance-apparel-available-nordstrom-120000136.html,Carl Data Solutions Partners with AGORACOM Platform for Online Investors,CRL.CN
CNW Group,/news/statement-unicef-canadas-president-ceo-204100894.html,"Carl Data Closes $5,601,288 Private Placement, $2,000,000 Line of Credit and $200,000 Convertible Debenture",CRL.CN
GlobeNewswire,/news/data-storage-corporation-announces-appointment-120000825.html,Data Storage Corporation Announces Appointment of Thomas Kempster as Executive Vice President of Strategic Development,DTST
GlobeNewswire,/news/data-storage-corporation-enters-joint-135600860.html,Data Storage Corporation Enters into Joint Venture with Canadian Technology Firm Able-One to Provide IBM Cloud Services in Canada,DTST
GlobeNewswire,/news/data-storage-corporation-announces-definitive-140000825.html,"Data Storage Corporation Announces Definitive Agreement to Merge Flagship Solutions, LLC and Data Storage FL, LLC",DTST
