source,link_href,link_text,ticker
GlobeNewswire,/news/naikun-wind-provides-additional-details-150606276.html,NaiKun Wind Provides Additional Details Regarding the Sale of NaiKun Offshore Wind Project,NKW.V
Newsfile,/news/nano-one-announces-mr-alex-080500616.html,Nano One Announces Mr. Alex Holmes as COO,NNO.V
Newsfile,/news/nano-one-selected-showcase-clean-080500171.html,Nano One Selected to Showcase its Clean Technology Advantages in Chile,NNO.V
CNW Group,/news/crown-capital-partners-expands-network-153400637.html,CMA Foundation commits $2.5 million for virtual care research,NNO.V
Simply Wall St.,/news/life-cielo-waste-solutions-cse-141115782.html,Such Is Life: How Cielo Waste Solutions (CSE:CMC) Shareholders Saw Their Shares Drop 69%,CMC.CN
ACCESSWIRE,/news/cielo-announces-private-placement-offering-210400882.html,"Cielo Announces Private Placement Offering of Convertible Debenture Units and First Closing of $396,000, Extension of Joint Venture Agreement Deadline",CMC.CN
ACCESSWIRE,/news/cielo-jv-partner-secures-80-132600913.html,"Cielo’s JV Partner Secures 80 Acre Site for Renewable Fuel Facility Near Medicine Hat, AB",CMC.CN
GlobeNewswire,/news/pharmather-announces-sale-psilocybin-program-140200533.html,PharmaTher Announces Sale of Psilocybin Program,PHRM.CN
GlobeNewswire,/news/pharmather-announces-successful-completion-pre-130000179.html,PharmaTher Announces Successful Completion of Pre-IND Meeting with FDA for the Clinical Development of Ketamine in the Treatment of Parkinson’s Disease,PHRM.CN
GlobeNewswire,/news/pharmather-signs-exclusive-worldwide-license-125900835.html,PharmaTher Signs Exclusive Worldwide License Agreement for Patented Microneedle Delivery Technology to Deliver Ketamine,PHRM.CN
GlobeNewswire,/news/flyht-participate-cowen-aerospace-defense-120400826.html,FLYHT to Participate in the Cowen Aerospace/Defense & Industrials Conference,FLY.V
Benzinga,/news/flyht-flight-intelligent-way-boost-142522484.html,"FLYHT-And-Flight: The Intelligent Way To Boost Aircraft Profitability, Security And Connectivity In 2021",FLY.V
GlobeNewswire,/news/flyht-present-noblecon17-january-19-120400605.html,FLYHT to Present at NobleCon17 on January 19,FLY.V
ACCESSWIRE,/news/kabn-north-america-launches-liquid-134500769.html,KABN North America Launches Liquid Avatar App in the Apple Store and Google Play,KABN.CN
ACCESSWIRE,/news/kabn-north-america-receives-approval-161000337.html,KABN North America Receives Approval to Change Corporate Name to Liquid Avatar Technologies,KABN.CN
ACCESSWIRE,/news/kabn-north-america-partners-uk-123000153.html,KABN North America Partners with UK and Barbados Based Tokenise International to Develop Verifiable Identity Credentials for Regulated Tokenized Securities Stock Exchange,KABN.CN
CNW Group,/news/iiroc-trading-halt-og-195400467.html,Danavation Technologies Corp. Announces Changes to Board of Directors,DVN.CN
Newsfile,/news/danavation-technologies-corp-discusses-modernization-153800805.html,Danavation Technologies Corp. Discusses Modernization of Retail Industry Through Their Digital Smart Labels(TM) with The Stock Day Podcast,DVN.CN
CNW Group,/news/danavation-technologies-corp-provides-operational-123000642.html,Danavation Technologies Corp. Provides Operational and Corporate Update,DVN.CN
Business Wire,/news/namsys-terminates-employee-long-term-163600318.html,NamSys Terminates Employee Long Term Bonus Plan,CTZ.V
Simply Wall St.,/news/namsys-inc-cve-ctz-stock-075555636.html,NamSys Inc. (CVE:CTZ) Stock Has Shown Weakness Lately But Financials Look Strong: Should Prospective Shareholders Make The Leap?,CTZ.V
Business Wire,/news/namsys-included-globe-mail-second-173300203.html,NamSys Included in The Globe and Mail’s Second-Annual Ranking of Canada’s Top Growing Companies,CTZ.V
ACCESSWIRE,/news/keynotes-educational-panels-42-canadian-140000492.html,"Keynotes, Educational Panels and 42 Canadian-Listed Public Companies Presenting at the SNN Network Canada Virtual Event - January 6-7, 2021",MRBL.CN
ACCESSWIRE,/news/marble-financial-present-snn-network-120000210.html,"Marble Financial to Present at the SNN Network Canada Virtual Event on Thursday January 7, 2021",MRBL.CN
Newsfile,/news/marble-financial-inc-data-driven-182200831.html,"Marble Financial Inc., A Data-Driven Financial Future, CEO Clip Video",MRBL.CN
GlobeNewswire,/news/draganfly-windfall-geotek-advance-testing-123000905.html,Draganfly and Windfall Geotek Advance Testing of Drone-Based AI Solution for Landmine Detection,WIN.V
Simply Wall St.,/news/quick-analysis-windfall-geoteks-cve-133324782.html,A Quick Analysis On Windfall Geotek's (CVE:WIN) CEO Compensation,WIN.V
PR Newswire,/news/metals-mining-investor-conference-presentations-133500805.html,Metals & Mining Investor Conference Presentations Now Available for On-Demand Viewing,WIN.V
