source,link_href,link_text,ticker
CNW Group,/news/carl-data-solutions-cse-crl-071000009.html,"Carl Data Solutions (CSE: CRL) announces new capital, team members, partnerships and growth objectives for Industry 4.0",CRL.CN
CNW Group,/news/carl-data-solutions-poised-global-130000637.html,"Carl Data Solutions poised for global growth after meeting 90-day targets for new capital, team members and corporate partners",CRL.CN
ACCESSWIRE,/news/adcore-announces-contract-israels-largest-110000160.html,Adcore Announces New Contract With Israel's Largest Department Store Chain,ADCO.TO
ACCESSWIRE,/news/adcore-first-quarter-2021-revenue-220000299.html,Adcore First Quarter 2021 Revenue Grows 161% to a Record $8.6 Million,ADCO.TO
ACCESSWIRE,/news/adcore-announces-contract-leading-online-192500163.html,Adcore Announces New Contract With Leading Online Retailer In Australia And New Zealand,ADCO.TO
GlobeNewswire,/news/data-storage-corporation-present-summer-161000477.html,Data Storage Corporation to Present at the Summer Solstice Conference - Best Ideas from the Buy-Side on June 1st,DTST
ACCESSWIRE,/news/35-best-ideas-companies-present-231500576.html,"35 of the Best Ideas Companies to Present at the Summer Solstice - Best Ideas from the Buy-Side Virtual Investor Conference on June 1-4, 2021",DTST
GlobeNewswire,/news/data-storage-corporation-announces-appointment-120000732.html,Data Storage Corporation Announces the Appointment of Chris Panagiotakos as Chief Financial Officer,DTST
Business Wire,/news/deepspatial-announces-addition-two-industry-130200764.html,Deepspatial Announces Addition of Two Industry Leaders to the Team to Catalyze Business Growth,DSAI.CN
Business Wire,/news/deepspatial-inc-partners-dfm-foods-124700568.html,DeepSpatial Inc. Partners With DFM Foods for Geodemographic Customer Profiling and Strategic Market Expansion,DSAI.CN
Business Wire,/news/deepspatial-inc-gains-high-level-133800298.html,DeepSpatial Inc. Gains High Level Sector Expertise on New Advisory Board,DSAI.CN
