source,link_href,link_text,ticker
CNW Group,/news/quisitive-technology-solutions-inc-reports-213000824.html,Quisitive Technology Solutions Inc. Reports Fiscal 2020 Second Quarter Results,QUIS.V
ACCESSWIRE,/news/quisitive-present-ld-500-virtual-192500799.html,Quisitive to Present at the LD 500 Virtual Conference,QUIS.V
ACCESSWIRE,/news/microcap-review-magazine-summer-2020-130000636.html,MicroCap Review Magazine Summer 2020 Issue Now Available,QUIS.V
CNW Group,/news/university-pittsburgh-joseph-m-katz-103000594.html,University of Pittsburgh Joseph M. Katz Graduate School of Business Selects ImagineAR as Partner in New MBA Course,IP.CN
CNW Group,/news/r-e-p-e-t-130000181.html,ImagineAR and The Pittsburgh Gateways Corporation Sign MOU To Integrate Augmented Reality Into the Energy Innovation Center,IP.CN
CNW Group,/news/imagine-ar-receives-additional-1000000-from-exercise-of-warrants-141358388.html,"ImagineAR Receives Additional $1,000,000 From Exercise Of Warrants For A Total Of Approximately $4,500,000 In 2020. Launches Moderated Forum On AGORACOM To Directly Engage Investors & Answer Questions",IP.CN
Newsfile,/news/netcents-technology-announces-advisory-board-120000855.html,NetCents Technology Announces Advisory Board Addition,NC.CN
Newsfile,/news/netcents-technology-announces-head-advisory-070000617.html,NetCents Technology Announces Head of Advisory Board Position,NC.CN
Newsfile,/news/netcents-technology-enters-partnership-xtm-090000800.html,NetCents Technology Enters Partnership with XTM INC.,NC.CN
GlobeNewswire,/news/paradigms-250-billion-edtech-market-142600700.html,"New Paradigms in $250 billion EdTech Market: CEO’s of 2U, NexTech AR, Chegg, and Pluralsight Discuss Digital Transformation & New Growth Opportunities",NTAR.CN
GlobeNewswire,/news/nextech-infernoar-host-virtual-conference-113000498.html,NexTech’s InfernoAR to host Virtual Conference at Carnegie Mellon,NTAR.CN
GlobeNewswire,/news/nextech-ar-solutions-reports-record-203300720.html,NexTech AR Solutions Reports Record Second Quarter 2020 Results,NTAR.CN
ACCESSWIRE,/news/frank-holmes-present-snn-network-123000817.html,"Frank Holmes to Present at the SNN Network Virtual Investor Conference on Monday, August 3, 2020",HIVE.V
PR Newswire,/news/hive-blockchain-partners-ecocooling-maximize-230000446.html,HIVE Blockchain partners with EcoCooling to maximize operational excellence in the most efficient High Performance Computing facility in the world; announces extended timeline for filing annual and quarterly financial statements due to COVID-19,HIVE.V
CNW Group,/news/hive-blockchain-continues-increasing-bitcoin-123000167.html,HIVE Blockchain Continues Increasing Bitcoin Mining Power Through Additional Purchase of Next Generation Miners for Green Energy-Powered Quebec Facility,HIVE.V
PR Newswire,/news/namaste-announces-addition-indiva-products-120000212.html,Namaste Announces the Addition of Indiva Products to CannMart,N.V
GlobeNewswire,/news/indiva-secures-agreement-cannmart-120000716.html,Indiva Secures Agreement With CannMart,N.V
CNW Group,/news/namaste-files-preliminary-shelf-prospectus-210100742.html,Namaste Files Preliminary Base Shelf Prospectus,N.V
Investor's Business Daily,/m/cbee73cc-6fb6-3f8a-b6f4-94162a0d75b1/top-marijuana-stock-to-expand.html,Top Marijuana Stock To Expand In Canada's Biggest Retail Market,APHA.TO
Investor's Business Daily,/m/6e8fb483-3ff2-3a41-8275-9e9949427873/marijuana-stocks-are-setting.html,Marijuana Stocks Are Setting Up After Long Declines; Should You Buy Them?,APHA.TO
Motley Fool,/m/6702840c-e21c-3624-9cfd-32915fe7e7f7/is-cronos-group-stock-a-buy-.html,Is Cronos Group Stock a Buy?,APHA.TO
TechCrunch,/news/blackberry-makes-china-push-os-035943148.html,BlackBerry makes China push as the OS for Xpeng smart cars,BB.TO
Zacks,/news/blackberry-teams-desay-connected-vehicle-135601268.html,BlackBerry Teams Up With Desay for Connected Vehicle Platform,BB.TO
SmarterAnalyst,/news/blackberry-nabs-automotive-win-safety-075536483.html,BlackBerry Nabs Automotive Win For Safety Solution; Street Says ‘Hold’,BB.TO
Newsfile,/news/hut-8-reports-second-quarter-114500892.html,Hut 8 Reports Second Quarter 2020 Financial Results,HUT.TO
Newsfile,/news/hut-8-announces-operational-updates-213000022.html,Hut 8 Announces Operational Updates,HUT.TO
Newsfile,/news/hut-8-mining-corp-announces-213000641.html,Hut 8 Mining Corp. Announces Release Date for Second Quarter 2020 Financial Results,HUT.TO
GlobeNewswire,/news/phase-two-drilling-intersects-further-120000862.html,"Phase Two Drilling Intersects Further High-Grade Gold-Silver-Copper Mineralisation Including 109m at 4.9 g/t Au, 109 g/t Ag and 1.1% Cu (7.5 g/t AuEq)",TBX.V
GlobeNewswire,/news/independent-board-member-steps-down-130000010.html,Independent board member steps down to become Minister of Mines,TBX.V
GlobeNewswire,/news/turmalina-metals-announces-agm-results-130000921.html,Turmalina Metals Announces AGM Results,TBX.V
GlobeNewswire,/news/arht-media-announces-q2-2020-123000110.html,ARHT Media Announces Q2 2020 Financial Results,ART.V
GlobeNewswire,/news/arht-media-partners-brazil-innova-130000712.html,"ARHT Media Partners With Brazil’s INNOVA - All Around the Brand, A Marketing Agency With A Vast Roster Of International And Domestic Clients",ART.V
GlobeNewswire,/news/arht-media-announces-strategic-partnership-140000341.html,ARHT Media Announces Strategic Partnership With TLC Creative Special Effects The First Client to Purchase New ARHT Engines With Transmission Bundles,ART.V
GlobeNewswire,/news/mydecine-innovations-group-announces-extended-174000357.html,Mydecine Innovations Group Announces Extended Lock-Up Arrangement,MYCO.CN
GlobeNewswire,/news/mydecine-launches-worlds-first-natural-113000629.html,"Mydecine™ Launches World's First Natural-Sourced cGMP Psilocybin for Global Research, Sales, and Distribution Enterprise",MYCO.CN
GlobeNewswire,/news/mydecine-innovations-group-featured-forbes-113700910.html,Mydecine Innovations Group Featured in Forbes for the First-Of-Its-Kind Clinicals Using Psilocybin Therapy For PTSD,MYCO.CN
ACCESSWIRE,/news/ampd-signs-letter-engagement-versatile-113000085.html,AMPD Signs Letter of Engagement with Versatile Media for Multi-Year Virtual Production Infrastructure Deal,AMPD.CN
ACCESSWIRE,/news/ampd-signs-deal-variational-ai-140000643.html,AMPD Signs Deal with Variational AI for Machine Learning Compute at DC1,AMPD.CN
ACCESSWIRE,/news/system73-ampd-partner-global-multi-140000977.html,System73 and AMPD Partner for Global Multi-CDN Solution and Expansion of the AMPD High-Performance Compute Platform into Europe,AMPD.CN
Newsfile,/news/graph-blockchain-announces-shares-debt-140100569.html,Graph Blockchain Announces Shares for Debt Settlement,GBLC.CN
Newsfile,/news/graph-blockchain-enters-binding-letter-124000527.html,Graph Blockchain Enters into a Binding Letter of Intent to Acquire Third Eye Insights Corp,GBLC.CN
Newsfile,/news/graph-blockchain-provides-launch-blustem-130000381.html,Graph Blockchain Provides Update on Launch of BluStem Ecommerce Wellness Platform,GBLC.CN
ACCESSWIRE,/news/max-selects-globexs-sekursafe-secure-120000724.html,"RE/MAX Selects GlobeX's ""SekurSafe"" for Secure Email and Data Management Solutions",SWIS.CN
ACCESSWIRE,/news/globex-data-rebrands-digitalsafe-sekursafe-090000814.html,GlobeX Data Rebrands DigitalSafe into SekurSafe,SWIS.CN
ACCESSWIRE,/news/globex-data-signs-agreement-prime-120000196.html,GlobeX Data Signs Agreement with Prime Technology Services Ltd. in The Bahamas,SWIS.CN
CNW Group,/news/thank-canada-cineplex-reopen-entire-140000721.html,Thank You Canada! Cineplex to Reopen Its Entire Circuit of Theatres Tomorrow,CGX.TO
Bloomberg,/news/cineplex-reports-95-revenue-drop-114601449.html,Cineplex Reports 95% Revenue Drop After Virus Closes Theaters,CGX.TO
CNW Group,/news/cineplex-announces-closing-over-allotment-123000547.html,Cineplex Announces Closing of Over-Allotment Option in Connection with Recently Completed Convertible Debenture Offering,CGX.TO
Zacks,/news/cenovus-energy-cve-stock-stands-123712098.html,How Cenovus Energy (CVE) Stock Stands Out in a Strong Industry,CVE.TO
Zacks,/news/why-cenovus-cve-down-6-153003936.html,Why Is Cenovus (CVE) Down 6% Since Last Earnings Report?,CVE.TO
Reuters,/news/rpt-canada-curbs-methane-emissions-100000891.html,"RPT-As Canada curbs methane emissions, new measurements show problem bigger than thought",CVE.TO
Business Wire,/news/trutrace-technologies-ensures-consumer-safety-120000185.html,"TruTrace Technologies Ensures Consumer Safety for Riviera Beverages & Bottling, West One Logistics and their Hygen-X Sanitizer Products",TTT.CN
GlobeNewswire,/news/medipharm-labs-selected-university-health-110110435.html,"MediPharm Labs Selected by University Health Network and Medical Cannabis by Shoppers Inc. for First Real-World Evidence, Patient-Centred Clinical Trial Using Blockchain Technology",TTT.CN
CNW Group,/news/trutrace-technologies-advancedcare-announce-strategic-110000922.html,TruTrace Technologies and AdvancedCare announce strategic plan to integrate technology platforms,TTT.CN
Investor's Business Daily,/m/cbee73cc-6fb6-3f8a-b6f4-94162a0d75b1/top-marijuana-stock-to-expand.html,Top Marijuana Stock To Expand In Canada's Biggest Retail Market,ACB.TO
Investor's Business Daily,/m/6e8fb483-3ff2-3a41-8275-9e9949427873/marijuana-stocks-are-setting.html,Marijuana Stocks Are Setting Up After Long Declines; Should You Buy Them?,ACB.TO
Motley Fool,/m/06482e06-2281-378c-be1d-93a699bf3060/could-there-be-a-marijuana.html,Could There Be a Marijuana Mega-Merger in the Future?,ACB.TO
Reuters,/news/boeing-finds-flaws-fuselage-dreamliners-140152046.html,Boeing finds flaws in fuselage of some Dreamliners; 8 aircraft affected,AC.TO
Reuters,/news/air-canada-plans-voluntary-covid-203919417.html,Air Canada plans voluntary COVID-19 passenger test trial: analyst note,AC.TO
Benzinga,/news/air-canada-beat-us-airlines-170058647.html,How Air Canada Beat US Airlines Removing Seats For Cargo,AC.TO
ACCESSWIRE,/news/ydx-amuka-esports-partnership-093000053.html,Update on YDX and Amuka Esports Partnership,YDX.V
ACCESSWIRE,/news/ydx-innovation-partners-comic-convention-091500638.html,YDX Innovation Partners with Comic Convention Group to Create an International Esports Cup in 17 Countries,YDX.V
ACCESSWIRE,/news/ydx-innovation-partners-liquid-media-143000173.html,YDX Innovation Partners with Liquid Media to Add More Virtual Reality Content to Streaming Platform,YDX.V
CNW Group,/news/iiroc-trade-resumption-vst-165600701.html,IIROC Trade Resumption - VST,VST.CN
GlobeNewswire,/news/victory-square-technologies-portfolio-company-163900768.html,Victory Square Technologies Portfolio Company is the first to be approved by the São Paulo State Government Covid-19 Innovation Programme,VST.CN
CNW Group,/news/iiroc-trading-halt-vst-153000580.html,IIROC Trading Halt - VST,VST.CN
CNW Group,/news/vsblty-groupe-technologies-announces-closing-130500060.html,VSBLTY Groupe Technologies Announces Closing of Prospectus Offering and Private Placement of Units For Total Gross Proceeds of $5.59 Million,VSBY.CN
CNW Group,/news/vsblty-groupe-technologies-announces-filing-013900462.html,VSBLTY Groupe Technologies Announces Filing of Final Prospectus,VSBY.CN
CNW Group,/news/vsblty-groupe-technologies-announces-short-184700687.html,VSBLTY Groupe Technologies Announces Short Form Prospectus Offering,VSBY.CN
CNW Group,/news/lightspeed-launches-ecom-restaurants-110000370.html,Lightspeed Launches eCom for Restaurants,LSPD.TO
CNW Group,/news/hls-therapeutics-host-q2-2020-103000771.html,Lightspeed POS Inc. to Participate in Upcoming Virtual Investor Conferences,LSPD.TO
CNW Group,/news/lightspeed-announces-voting-results-election-120000036.html,Lightspeed Announces Voting Results on the Election of Directors Held During its Annual Shareholders' Meeting,LSPD.TO
South China Morning Post,/news/ping-ans-oneconnect-fintech-arm-093000804.html,Ping An's OneConnect fintech arm expects flurry of deals in Southeast Asia as Covid-19 spurs shift to digital banking,OCFT
Business Wire,/news/oneconnect-announces-closing-public-offering-203000340.html,OneConnect Announces Closing of Public Offering of American Depositary Shares and Full Exercise of the Underwriters’ Over-Allotment Option,OCFT
Motley Fool,/m/d2b21c69-6b96-3489-8dfb-d6866fd44fdc/3-chinese-tech-stocks-to-buy.html,3 Chinese Tech Stocks to Buy Right Now,OCFT
GlobeNewswire,/news/cloudmd-presenting-ld-micro-virtual-113000341.html,CloudMD Presenting at LD Micro Virtual Conference,DOC.CN
GlobeNewswire,/news/digital-transformation-healthcare-ceo-onem-143700178.html,"Digital Transformation of Healthcare: CEO’s of ONEM, HCAT, DOCRF, IRTC, Discuss Telemedicine, Big Data, and Diagnostics",DOC.CN
GlobeNewswire,/news/cloudmd-acquire-profitable-seven-location-113000384.html,CloudMD to Acquire Profitable Seven Location Rehabilitation Clinic Network with $5.8 Million in Annual Revenue,DOC.CN
GlobeNewswire,/news/threed-capital-commences-trading-otcqb-150900917.html,ThreeD Capital Commences Trading On OTCQB Market Under Ticker Symbol IDKFF; Adds Information To Website Regarding Sector Investments,IDK.CN
GlobeNewswire,/news/threed-capital-inc-provides-investment-120010833.html,ThreeD Capital Inc. Provides Update To Its Investment in Premium Nickel Resources And Announces Normal Course Issuer Bid,IDK.CN
GlobeNewswire,/news/threed-capital-inc-announces-issuance-122010501.html,ThreeD Capital Inc. Announces Issuance of Common Shares,IDK.CN
Thomson Reuters StreetEvents,/news/edited-transcript-efl-earnings-conference-185415191.html,Edited Transcript of EFL.TO earnings conference call or presentation 21-Jul-20 12:00pm GMT,EFL.TO
ACCESSWIRE,/news/electrovaya-announces-us-3-million-110000504.html,Electrovaya Announces US$3 Million Purchase Order and Updates Previously Issued Revenue Guidance,EFL.TO
ACCESSWIRE,/news/electrovaya-reports-q3-fy2020-results-213500638.html,"Electrovaya Reports Q3 FY2020 Results Strong Revenue Growth, Positive EBITDA(1) and Net Profit for the Quarter",EFL.TO
Newsfile,/news/very-good-food-company-inc-110000607.html,The Very Good Food Company Inc. Announces Logistics Partners and Provides Production Capacity Update,VERY.CN
Newsfile,/news/very-good-food-company-announces-162500106.html,The Very Good Food Company Announces Closing of Oversubscribed $8.5 Million Bought Deal Public Offering,VERY.CN
Newsfile,/news/very-good-food-company-announces-182700728.html,The Very Good Food Company Announces Listing On Frankfurt Stock Exchange,VERY.CN
Newsfile,/news/modern-meat-closes-acquisition-manufacturing-073000952.html,Modern Meat Closes Acquisition of New Manufacturing Facility and Begins Move in Process,MEAT.CN
Newsfile,/news/modern-meat-significantly-expand-production-210000837.html,Modern Meat to Significantly Expand Production Capacity with New Manufacturing Facility,MEAT.CN
Newsfile,/news/modern-meat-doubles-retail-presence-070100740.html,Modern Meat Doubles Retail Presence to over 50 Locations and Closes Final Tranche of Non-Brokered Private Placement for $2.5 Million,MEAT.CN
GlobeNewswire,/news/earthrenew-host-live-webinar-september-123000149.html,EarthRenew to Host Live Webinar on September 2nd @ 11:00am ET (8:00am PT); Announces September Investor Presentation,ERTH.CN
GlobeNewswire,/news/earthrenew-field-trials-lethbridge-college-120000633.html,EarthRenew Field Trials With Lethbridge College Demonstrate Significant Increases to Plant Growth,ERTH.CN
GlobeNewswire,/news/earthrenew-announces-preliminary-results-feasibility-120000617.html,EarthRenew Announces Preliminary Results From Its Feasibility Study on Partner and Site Location for Its First U.S. Facility,ERTH.CN
Newsfile,/news/appia-congratulates-src-first-kind-144600640.html,"Appia Congratulates SRC on ""First-of-Its-Kind"" Rare Earth Processing Facility in Canada",API.CN
Newsfile,/news/appia-commences-diamond-drilling-high-114500093.html,Appia Commences Diamond Drilling on High-Grade Critical Rare Earth Elements Alces Lake Property,API.CN
Newsfile,/news/appia-provides-summary-alces-lake-120800151.html,"Appia Provides a Summary of the Alces Lake Project and Presents at the John Tumazos Virtual Conference, August 10, 2020",API.CN
GlobeNewswire,/news/sharc-energy-reports-q2-2020-130000467.html,SHARC Energy Reports on Q2 2020,SHRC.CN
GlobeNewswire,/news/sharc-energy-announces-acceleration-warrant-120000466.html,SHARC Energy Announces Acceleration of Warrant Expiry Date,SHRC.CN
GlobeNewswire,/news/sharc-energy-proud-help-colorado-120000961.html,SHARC Energy Proud to Help Colorado Achieve its First Net-Zero-Energy Building Offering Commercial Leases and Rents,SHRC.CN
GlobeNewswire,/news/legend-power-reports-q3-fiscal-200100031.html,Legend Power® Reports Q3 Fiscal 2020 Financial Results,LPS.V
GlobeNewswire,/news/legend-power-schedules-q3-2020-110000508.html,Legend Power® Schedules Q3 2020 Financial Results Release  and Conference Call,LPS.V
GlobeNewswire,/news/global-property-manager-deepens-legend-110000745.html,Global Property Manager Deepens Legend Power® Partnership to Drive Results,LPS.V
CNW Group,/news/mcloud-announces-second-quarter-2020-110000983.html,Government of Canada begins consultation to better ensure the continuity of supervised consumption sites and services in Canada,MCLD.V
CNW Group,/news/mcloud-host-virtual-mcloud-connect-110000626.html,mCloud to Host Virtual mCloud Connect 2020 from September 21 to 23,MCLD.V
CNW Group,/news/mcloud-announces-closing-public-offering-142600612.html,mCloud Announces Closing of Public Offering and Exercise of Underwriters' Over-Allotment Option,MCLD.V
PR Newswire,/news/biorem-reports-2020-second-quarter-120000491.html,BIOREM Reports 2020 Second Quarter Results,BRM.V
CNW Group,/news/biorem-reports-first-quarter-financial-213100566.html,Biorem Reports First Quarter Financial Results,BRM.V
CNW Group,/news/biorem-announces-delay-filing-interim-142100513.html,BIOREM Announces Delay in Filing Interim Financial Statements,BRM.V
Simply Wall St.,/news/quick-analysis-ecosynthetixs-tse-eco-133647377.html,A Quick Analysis On EcoSynthetix's (TSE:ECO) CEO Salary,ECO.TO
CNW Group,/news/ecosynthetix-host-2020-second-quarter-173000876.html,EcoSynthetix to Host 2020 Second Quarter Results Conference Call,ECO.TO
Thomson Reuters StreetEvents,/news/edited-transcript-eco-earnings-conference-051009946.html,Edited Transcript of ECO.TO earnings conference call or presentation 7-May-20 12:30pm GMT,ECO.TO
GlobeNewswire,/news/eguana-announces-3rd-quarter-2020-130000513.html,Eguana Announces 3rd Quarter 2020 Financial Results,EGT.V
GlobeNewswire,/news/eguana-highlight-solar-partner-bring-130000697.html,Eguana and Highlight Solar Partner to Bring Intelligent Energy Storage Solutions to San Jose and the San Francisco Bay Area,EGT.V
GlobeNewswire,/news/eguana-announces-debt-settlement-doughty-130000345.html,Eguana Announces Debt Settlement with Doughty Hanson,EGT.V
GlobeNewswire,/news/eestor-enters-letter-intent-acquire-174600825.html,EEStor enters into Letter of Intent to Acquire Green NH3,ESU.V
CNW Group,/news/iiroc-trading-halt-esu-163700235.html,IIROC Trading Halt - ESU,ESU.V
GlobeNewswire,/news/eestor-corporation-completes-filing-2019-012001215.html,EEStor Corporation Completes Filing of 2019 Audit and Q1,ESU.V
Newsfile,/news/greenbriar-comments-recent-controversy-social-045100439.html,Greenbriar Comments on Recent Controversy on Social Media,GRB.V
Newsfile,/news/greenbriar-executes-master-sales-marketing-220600246.html,Greenbriar Executes a Master Sales and Marketing Agreement with Keller Willams - Paul Morris Forward Living Inc,GRB.V
Newsfile,/news/greenbriar-engages-law-firm-application-205700715.html,Greenbriar Engages Law Firm for Application to the NASDAQ Market and to Complete the Form 20-F Registration Statement for the US Securities and Exchange Commission,GRB.V
CNW Group,/news/greenpower-announces-pricing-upsized-u-123700313.html,GreenPower Announces Pricing of its Upsized U.S. Initial Public Offering,GPV.V
CNW Group,/news/greenpower-initiates-share-consolidation-part-195900209.html,GreenPower Initiates Share Consolidation as Part of Recently Announced Strategic Initiatives,GPV.V
CNW Group,/news/iiroc-trading-resumption-gpv-194300058.html,Support for a safe return to school,GPV.V
GlobeNewswire,/news/westport-fuel-systems-secures-7-210000881.html,Westport Fuel Systems Secures €7 Million Loan from Deutsche Bank,WPRT.TO
Motley Fool,/m/a9edcbd0-ae8e-3bb0-8f7a-0bc8e77220e1/why-westport-fuel-systems.html,Why Westport Fuel Systems Stock Just Popped 12%,WPRT.TO
Zacks,/news/westport-wprt-q2-earnings-beat-132301958.html,"Westport (WPRT) Q2 Earnings Beat Estimates, Revenues Down",WPRT.TO
Simply Wall St.,/news/oceanic-wind-energy-cve-nkw-121742571.html,Can Oceanic Wind Energy (CVE:NKW) Afford To Invest In Growth?,NKW.V
CNW Group,/news/iiroc-trading-resumption-nkw-152000089.html,IIROC Trading Resumption - NKW,NKW.V
GlobeNewswire,/news/naikun-wind-provides-additional-details-150606276.html,NaiKun Wind Provides Additional Details Regarding the Sale of NaiKun Offshore Wind Project,NKW.V
GlobeNewswire,/news/nano-one-enters-joint-development-070700762.html,Nano One Enters into a Joint Development Agreement with a Global Cathode Material Producer,NNO.V
GlobeNewswire,/news/nano-one-reports-recent-financial-192329259.html,Nano One Reports on Recent Financial Events,NNO.V
GlobeNewswire,/news/nano-one-unaware-material-change-161510896.html,Nano One Is Unaware of Any Material Change,NNO.V
