source,link_href,link_text,ticker
GlobeNewswire,/news/nextech-ar-solutions-corp-cse-123000688.html,Nextech AR Solutions Corp. (CSE: NTAR) (OTCQB: NEXCF) Partners with Microsoft to Transform Higher Ed,NTAR.NE
Business Wire,/news/nextech-ar-solutions-announces-limited-113000920.html,Nextech AR Solutions Announces Limited Early Access to HoloX – Telepresence Creator Platform,NTAR.NE
Business Wire,/news/nextech-ar-solutions-partner-ryerson-113000433.html,Nextech AR Solutions and Partner Ryerson University Awarded Funds from Ontario Government,NTAR.NE
ACCESSWIRE,/news/repeat-hive-announces-nasdaq-listing-120000010.html,REPEAT - HIVE Announces NASDAQ Listing,HIVE.V
ACCESSWIRE,/news/hive-announces-nasdaq-listing-050000001.html,HIVE Announces Nasdaq Listing,HIVE.V
Simply Wall St.,/news/weakness-hive-blockchain-technologies-ltd-081901650.html,Should Weakness in HIVE Blockchain Technologies Ltd.'s (CVE:HIVE) Stock Be Seen As A Sign That Market Will Correct The Share Price Given Decent Financials?,HIVE.V
GlobeNewswire,/news/namaste-technologies-provides-corporate-120000348.html,Namaste Technologies Provides Corporate Update,N.V
GlobeNewswire,/news/namaste-technologies-provides-corporate-cannmart-120000272.html,Namaste Technologies Provides Corporate Update on CannMart Labs,N.V
GlobeNewswire,/news/namaste-technologies-announces-phyto-extractions-113000148.html,Namaste Technologies Announces Phyto Extractions Shatter Now Available Nationally for Medical Consumers,N.V
Yahoo Finance Video,/video/streaming-world-local-television-simply-195335653.html,"'In the streaming world, local television simply doesn’t exist': CEO of MNTN",BB.TO
Yahoo Finance Video,/video/were-seeing-retail-investor-revolution-145817066.html,We're seeing a retail investor revolution: analyst,BB.TO
Investor's Business Daily,/m/7a61721c-1b1f-3257-9fd6-6c1ab575f5f9/is-blackberry-stock-a-buy-.html,"Is BlackBerry Stock A Buy? What Fundamentals, Fund Metrics, Chart Say",BB.TO
CNW Group,/news/hut-8-mining-announces-closing-124400905.html,Hut 8 Mining Announces Closing of Previously Announced Bought Deal Public Offering and Listing of Common Shares on Nasdaq,HUT.TO
CNW Group,/news/hut-8-mining-announces-anticipated-110000657.html,Hut 8 Mining Announces Anticipated Nasdaq Listing Date and CAD$100 million Bought Deal Unit Offering,HUT.TO
CNW Group,/news/hut-8-mining-announces-approval-211200326.html,Hut 8 Mining Announces Approval to List Shares on NASDAQ,HUT.TO
GlobeNewswire,/news/drilling-sfdla-continues-extend-high-120000469.html,"Drilling at SFdLA Continues to Extend High Grade Mineralisation, with 17m at 4.3% Cu, 0.64 g/t Au and 108 g/t Ag (5.7% CuEq), including 3m at 18.9% Cu, 2.8 g/t Au and 431 g/t Ag (24% CuEq)",TBX.V
GlobeNewswire,/news/drilling-sfdla-continues-intersect-high-120000447.html,"Drilling at SFdLA Continues to Intersect High Grade Mineralisation, including 4.2m at 8.3% Cu, 1.8 g/t Au and 743 g/t Ag (16% CuEq)",TBX.V
Simply Wall St.,/news/think-turmalina-metals-cve-tbx-090244759.html,We Think Turmalina Metals (CVE:TBX) Can Afford To Drive Business Growth,TBX.V
GlobeNewswire,/news/arht-media-named-official-holopresence-123000508.html,"ARHT Media Named Official HoloPresence™ Partner at  Art Basel Hong Kong May 19 – 23, 2021",ART.V
GlobeNewswire,/news/arht-media-grants-company-stock-224500966.html,ARHT Media Grants Company Stock Options,ART.V
GlobeNewswire,/news/arht-media-announces-first-quarter-123000672.html,ARHT Media Announces First Quarter 2021 Results,ART.V
ACCESSWIRE,/news/ampd-cloud-computing-inc-announce-203500379.html,AMPD and Cloud-A Computing Inc. Announce Completion of Share Purchase Agreement,AMPD.CN
ACCESSWIRE,/news/ampd-ventures-announces-closing-second-211000946.html,AMPD Ventures Announces Closing of Second and Final Tranche of Private Placement,AMPD.CN
ACCESSWIRE,/news/ampd-signs-share-purchase-agreement-203500024.html,"AMPD Signs Share Purchase Agreement to Acquire 100% of Canadian Cloud Provider, Cloud-A Computing Inc.",AMPD.CN
Newsfile,/news/graph-blockchain-announces-closing-beyond-110000679.html,Graph Blockchain Announces Closing Beyond the Moon Inc. Acquisition,GBLC.CN
Newsfile,/news/graph-blockchain-announces-german-listing-110000678.html,Graph Blockchain Announces German Listing,GBLC.CN
Newsfile,/news/graph-blockchain-acquire-nft-company-070000067.html,Graph Blockchain to Acquire NFT Company New World Inc.,GBLC.CN
GlobeNewswire,/news/fmw-media-inc-street-tv-203700213.html,"FMW Media, Inc.’s “New To The Street” TV Announces 7 Interviews for This Week’s Broadcast, Sunday, June 13, 2021, on NEWSMAX TV, Hour Slot 10-11 am ET",SWIS.CN
ACCESSWIRE,/news/globex-data-issues-stock-options-231000706.html,GlobeX Data Issues Stock Options to Directors and Officers,SWIS.CN
ACCESSWIRE,/news/globex-data-launch-sekur-commercial-120000091.html,"GlobeX Data to Launch ""Sekur"" Commercial on NTD - Reaching Over 50 million Households Nationwide in the USA",SWIS.CN
CNW Group,/news/quebecs-second-vip-cinemas-opens-133000925.html,Quebec's Second VIP Cinemas Opens Tomorrow in Downtown Montreal at Cineplex Cinemas Forum and VIP,CGX.TO
CNW Group,/news/cineplex-announces-election-directors-annual-210000863.html,Cineplex Announces Election of Directors at Annual General Meeting of Shareholders,CGX.TO
Yahoo Finance,/news/redditors-wrong-on-amc-as-disney-and-other-studios-drive-secular-decline-veteran-media-analyst-200403919.html,AMC is in 'secular decline' as Disney and other studios bypass movie theaters: veteran analyst,CGX.TO
Zacks,/news/cenovus-cve-strong-industry-solid-124212881.html,"Cenovus (CVE): Strong Industry, Solid Earnings Estimate Revisions",CVE.TO
GlobeNewswire,/news/canada-largest-oil-sands-producers-104500917.html,Canada’s largest oil sands producers announce unprecedented alliance to achieve net zero greenhouse gas emissions,CVE.TO
Investopedia,/m/090652ba-3619-3579-8f1a-9f9fa3704ac7/the-7-biggest-canadian.html,The 7 Biggest Canadian Natural Gas Companies,CVE.TO
CNW Group,/news/mistango-river-resources-announces-3-130800872.html,Nauticol Energy and Enhance Energy partner to capture up to one million tonnes of CO2 annually from Blue Methanol production and distribution business,TTT.CN
Business Wire,/news/trutrace-technologies-joins-forces-customer-140000140.html,TruTrace Technologies Joins Forces with Customer Engagement Expert PharmaCentra to Provide a Blockchain-Secured Ecosystem for Medical Cannabis,TTT.CN
Business Wire,/news/applied-dna-trutrace-technologies-unveil-130000431.html,Applied DNA and TruTrace Technologies™ Unveil Complete Cannabis Product Validation and Authentication Solution,TTT.CN
Investor's Business Daily,/m/6e8fb483-3ff2-3a41-8275-9e9949427873/are-any-canadian-marijuana.html,Are Any Canadian Marijuana Stocks Good Buys As Ontario Eases Lockdowns?,ACB.TO
Motley Fool,/m/a11b4011-e230-3808-8ba4-794e05be9ed3/2-ways-aurora-cannabis-is.html,2 Ways Aurora Cannabis Is Shooting Itself in the Foot,ACB.TO
Motley Fool,/m/18f7a2fd-b448-3bc4-aff4-ffc250ae3eea/want-to-keep-your-money-.html,Want to Keep Your Money? Avoid Cannabis Stocks With These 3 Traits,ACB.TO
Reuters,/news/1-u-seeks-25-5-173039960.html,UPDATE 2-U.S. seeks $25.5 million fine from Air Canada over delayed refunds,AC.TO
Reuters,/news/u-seeks-25-5-million-164728098.html,U.S. seeks $25.5 million fine from Air Canada over delayed refunds,AC.TO
CNW Group,/news/air-canada-supports-economic-recovery-125400029.html,"Air Canada Supports Economic Recovery as the Country's Leading Carrier, Serving 50 Cities Across Canada to Enable Canadians to Conveniently Connect",AC.TO
CNW Group,/news/iiroc-trading-halt-ydx-114600505.html,IIROC Trading Halt - YDX,YDX.V
ACCESSWIRE,/news/ydx-innovation-corporate-224500011.html,YDX Innovation Corporate Update,YDX.V
ACCESSWIRE,/news/ydx-innovation-announces-letter-intent-001500506.html,YDX Innovation Announces Letter of Intent for Reverse Takeover with Moshun Media Development Corp.,YDX.V
GlobeNewswire,/news/next-super-stocks-move-ai-144100436.html,"Next Super Stocks on the Move: AI/ML Innovations (OTC: AIMLF), Red Light Holland (OTC: TRUFF), Victory Square Technologies (OTC: VSQTF), and Reliq Health Tech (OTC: RQHTF)",VST.CN
GlobeNewswire,/news/victory-square-portfolio-company-gameon-110000511.html,"Victory Square Portfolio Company, GameOn Entertainment Technologies, Partners With MX Player to Introduce Cricket Prediction Games",VST.CN
GlobeNewswire,/news/victory-square-technologies-portfolio-company-131900954.html,Victory Square Technologies Portfolio Company Immersive Tech Announces Appointment of HTC China President Alvin Wang Graylin to its Board of Directors,VST.CN
CNW Group,/news/vsblty-announces-pricing-overnight-marketed-133000960.html,VSBLTY Announces Pricing of Overnight Marketed Financing,VSBY.CN
GlobeNewswire,/news/tech-mahindra-inks-agreement-vsblty-111000467.html,TECH MAHINDRA INKS AGREEMENT WITH VSBLTY & INTEL TO CREATE THE FIRST DIGITAL IN-STORE MEDIA NETWORK THROUGHOUT LATIN AMERICA,VSBY.CN
GlobeNewswire,/news/vsblty-ceo-provides-corporate-111000326.html,VSBLTY CEO PROVIDES CORPORATE UPDATE,VSBY.CN
SmarterAnalyst,/news/lightspeed-acquire-two-e-commerce-085642096.html,Lightspeed to Acquire Two E-Commerce Platforms for $925 M; Street Says Buy,LSPD.TO
Bloomberg,/news/lightspeed-bets-925-million-m-170210115.html,Lightspeed Bets $925 Million on M&A to Beef Up E-Commerce Wares,LSPD.TO
PR Newswire,/news/lightspeed-acquire-ecwid-nuorder-unify-110000158.html,Lightspeed to acquire Ecwid and NuORDER to unify commerce ecosystem and ignite business creation,LSPD.TO
TipRanks,/news/2-stocks-flirting-bottom-analysts-003506694.html,2 Stocks That Are Flirting With a Bottom; Analysts Say ‘Buy’,OCFT
PR Newswire,/news/ndb-bank-appoints-axion-deliver-033000769.html,"NDB Bank appoints Axion to deliver Sri Lanka's first AI-based Video Know-Your-Customer built by OneConnect to engage customers remotely, securely and seamlessly",OCFT
GlobeNewswire,/news/lexinfintech-holdings-ltd-announces-resignation-094700734.html,LexinFintech Holdings Ltd. Announces Resignation of Chief Financial Officer,OCFT
GlobeNewswire,/news/cloudmd-appoints-karen-adams-president-113000578.html,CloudMD Appoints Karen Adams as President and Provides Update on Oncidium Acquisition,DOC.V
GlobeNewswire,/news/cloudmd-reports-record-revenue-8-200900295.html,CloudMD Reports Record Revenue of $8.8 Million in First Quarter 2021,DOC.V
GlobeNewswire,/news/cloudmd-report-first-quarter-2021-073000674.html,"CloudMD to Report First Quarter 2021 Financial Results on May 27, 2021",DOC.V
Newsfile,/news/peak-hires-former-bdc-executive-120000111.html,Peak Hires Former BDC Executive as Director of Marketing and Communications,PKK.CN
Newsfile,/news/peak-embauche-un-ancien-cadre-120000471.html,Peak embauche un ancien cadre de la BDC à titre de directeur de marketing et des communications,PKK.CN
Newsfile,/news/les-r-sultats-du-premier-031000676.html,"Les résultats du premier trimestre 2021 de Peak montrent un chiffre d'affaires de 14,2M$, préparant le terrain pour une année pleine de potentielle",PKK.CN
GlobeNewswire,/news/threed-capital-inc-announces-unaudited-213000286.html,"ThreeD Capital Inc. Announces Unaudited May 31, 2021 Net Asset Value Per Share - $1.07",IDK.CN
GlobeNewswire,/news/threed-capital-inc-disposes-securities-230000405.html,ThreeD Capital Inc. Disposes of Securities of Windfall Geotek Inc.,IDK.CN
GlobeNewswire,/news/threed-capital-inc-releases-results-031000660.html,"ThreeD Capital Inc. Releases Results  For the Three and Nine Months Ended March 31, 2021",IDK.CN
ACCESSWIRE,/news/electrovaya-announces-litarion-settlement-210000590.html,Electrovaya Announces Litarion Settlement,EFL.TO
ACCESSWIRE,/news/electrovaya-inc-host-earnings-call-101500565.html,"Electrovaya, Inc. to Host Earnings Call",EFL.TO
ACCESSWIRE,/news/electrovaya-reports-q2-fy2021-financial-224500511.html,Electrovaya Reports Q2 FY2021 Financial Results Quarterly,EFL.TO
PR Newswire,/news/eat-beyond-portfolio-company-plant-130000486.html,Eat Beyond Portfolio Company Plant Power Raises $7.5 Million,EATS.CN
PR Newswire,/news/eat-beyond-portfolio-company-good-130000890.html,"Eat Beyond Portfolio Company good natured® Develops Microwavable, Compostable Containers",EATS.CN
CNW Group,/news/eat-beyond-portfolio-company-eat-130000605.html,Eat Beyond Portfolio Company Eat Just Secures $170 Million,EATS.CN
CNW Group,/news/modern-plant-based-foods-enters-130000139.html,Modern Plant-Based Foods Enters Ready Made Meal Market,MEAT.CN
CNW Group,/news/modern-plant-based-foods-expands-200500753.html,Modern Plant-Based Foods Expands Product Offerings of its Meat Alternatives to Calgary Co-Op Stores,MEAT.CN
CNW Group,/news/modern-plant-based-foods-appoints-014200417.html,Modern Plant-Based Foods Appoints Chef Karen Barnaby as Product Development and Scale-Up Specialist,MEAT.CN
Newsfile,/news/bee-vectoring-technologies-adds-territory-120000745.html,Bee Vectoring Technologies Adds New Territory Manager to Fast-Track Expansion in California,BEE.CN
Newsfile,/news/retransmission-bee-vectoring-technologies-announces-120000808.html,RETRANSMISSION: Bee Vectoring Technologies Announces First-Time Revenues in US Pacific Northwest,BEE.CN
Newsfile,/news/bee-vectoring-technologies-invitation-q2-110000965.html,Bee Vectoring Technologies: Invitation to the Q2 Virtual Investor Summit,BEE.CN
PR Newswire,/news/predictiv-ai-formalizes-thermalpass-relationship-123000002.html,Predictiv AI Formalizes ThermalPass Relationship with Commersive,PAI.V
PR Newswire,/news/predictiv-ai-reports-q4-2021-123300421.html,Predictiv AI Reports Q4 2021 & Fiscal 2021 Financial Results,PAI.V
CNW Group,/news/thermalpass-looked-upon-k-12-120000869.html,ThermalPass is Looked Upon in K-12 Education Market as First Line of Defense to Reduce the Spread of Covid-19,PAI.V
Newsfile,/news/mineworx-technologies-invites-join-us-141800553.html,Mineworx Technologies Invites You to Join Us at the Q2 Virtual Investor Summit,MWX.V
GlobeNewswire,/news/mineworx-grants-stock-options-191900262.html,Mineworx Grants Stock Options,MWX.V
GlobeNewswire,/news/mineworx-announces-early-redemption-debentures-093000796.html,Mineworx Announces Early Redemption of Debentures,MWX.V
CNW Group,/news/minerva-intelligence-clarity-gold-announce-120000735.html,Minerva Intelligence and Clarity Gold Announce Driver AI Analysis for the Destiny Project,MVAI.V
GlobeNewswire,/news/clarity-gold-minerva-intelligence-announce-120000822.html,Clarity Gold and Minerva Intelligence Announce Driver AI Analysis for the Destiny Project,MVAI.V
CNW Group,/news/minerva-intelligence-announces-over-1-120000904.html,"Minerva Intelligence Announces Over 1,000% Revenue Growth From Prior Year Quarter and 2021 Q1 Results",MVAI.V
CNW Group,/news/iiroc-trading-halt-quis-wt-161400608.html,IIROC Trading Halt - QUIS.WT,QUIS.V
GlobeNewswire,/news/quisitive-reports-first-quarter-2021-203000310.html,Quisitive Reports First Quarter 2021 Financial Results,QUIS.V
ACCESSWIRE,/news/quisitive-technology-solutions-inc-host-191500260.html,"Quisitive Technology Solutions, Inc. to Host Earnings Call",QUIS.V
GlobeNewswire,/news/trackx-reports-q2-2021-financial-120000441.html,TrackX Reports Q2 2021 Financial Results,TKX.V
GlobeNewswire,/news/trackx-hires-chief-marketing-officer-120000459.html,TrackX Hires Chief Marketing Officer to drive Supply Chain and Sustainability Initiatives,TKX.V
GlobeNewswire,/news/trackx-announces-closing-private-placement-181100124.html,TrackX Announces Closing of Private Placement,TKX.V
PR Newswire,/news/imaginear-otcqb-ipnff-selected-presenting-110000853.html,ImagineAR (OTCQB:IPNFF) Selected as a Presenting Startup Finalist for the DEC Association Tech Day 2021,IP.CN
CNW Group,/news/imaginear-otcqb-ipnff-selected-finalist-111600911.html,ImagineAR (OTCQB:IPNFF) Selected as Finalist for the Euroleague FANXP Innovation Challenge,IP.CN
PR Newswire,/news/multi-platinum-rapper-jeezy-partnership-120000455.html,"Multi-Platinum Rapper, Jeezy, In Partnership with Oasis Digital Studios, Releases His Iconic Snowman Logo as AR-Enhanced NFTs",IP.CN
Newsfile,/news/netcents-technology-provides-delayed-yearly-150000463.html,NetCents Technology Provides Update on Delayed Yearly Audited Financial Statements,NC.CN
Newsfile,/news/netcents-technology-provides-detail-regarding-173500701.html,NetCents Technology Provides Detail Regarding Cease Trade Order,NC.CN
CNW Group,/news/iiroc-trading-halt-nc-121600572.html,IIROC Trading Halt - NC,NC.CN
GlobeNewswire,/news/earthrenew-closes-over-subscribed-private-210000339.html,EarthRenew Closes Over-Subscribed Private Placement,ERTH.CN
GlobeNewswire,/news/earthrenew-completes-shares-debt-settlements-220000195.html,EarthRenew Completes Shares for Debt Settlements,ERTH.CN
GlobeNewswire,/news/earthrenew-announces-private-placement-financing-000000468.html,EarthRenew Announces Private Placement Financing,ERTH.CN
Newsfile,/news/appia-announces-start-summer-exploration-130300060.html,Appia Announces Start of Summer Exploration Program on Rare Earth Elements and Uranium Projects,API.CN
Newsfile,/news/appia-announces-appointment-global-rare-162100170.html,Appia Announces Appointment of Global Rare Earths Expert Jack Lifton as Strategic Adviser to the Company,API.CN
Newsfile,/news/appia-announces-closing-5-75-160100261.html,"Appia Announces Closing of $5.75 Million Bought Deal Financing, Including Full Exercise of the Over-Allotment Option",API.CN
GlobeNewswire,/news/sharc-energy-ship-two-piranha-120000804.html,SHARC Energy to Ship Two Piranha T15’s for Seniors’ Living Development,SHRC.CN
GlobeNewswire,/news/sharc-energy-announces-first-quarter-120000777.html,SHARC Energy Announces First Quarter 2021 Financial Results,SHRC.CN
GlobeNewswire,/news/sharc-energy-announces-fourth-quarter-231500488.html,SHARC Energy Announces Fourth Quarter and Fiscal Year 2020 Financial Results,SHRC.CN
Simply Wall St.,/news/now-time-look-buying-legend-102801321.html,Is Now The Time To Look At Buying Legend Power Systems Inc. (CVE:LPS)?,LPS.V
ACCESSWIRE,/news/legend-power-systems-inc-closes-131000111.html,Legend Power Systems Inc. Closes $10.3 Million Upsized Bought Deal Offering,LPS.V
ACCESSWIRE,/news/legend-power-r-reports-q2-200000807.html,Legend Power(R) Reports Q2 2021 Financial Results,LPS.V
CNW Group,/news/mcloud-fidus-global-bring-assetcare-110000151.html,mCloud and Fidus Global Bring AssetCare™ to State of Arkansas Government Buildings,MCLD.V
CNW Group,/news/mcloud-delivers-ai-grid-adaptive-110000726.html,mCloud Delivers AI Grid-Adaptive Energy Savings to First 20 Buildings with Utility Partners in North America,MCLD.V
CNW Group,/news/mcloud-host-virtual-mcloud-connect-110000528.html,mCloud to Host Virtual mCloud Connect 2021 on September 14,MCLD.V
PR Newswire,/news/biorem-reports-first-quarter-2021-120000211.html,BIOREM Reports First Quarter 2021 Financial Results,BRM.V
PR Newswire,/news/biorem-reports-2-1-million-120000703.html,Biorem Reports $2.1 million Earnings for Fiscal 2020,BRM.V
CNW Group,/news/enerplus-releases-2020-esg-report-100000740.html,TSX Venture Exchange Stock Maintenance Bulletins,BRM.V
Simply Wall St.,/news/shareholders-thrilled-ecosynthetix-tse-eco-055739692.html,Shareholders Are Thrilled That The EcoSynthetix (TSE:ECO) Share Price Increased 291%,ECO.TO
CNW Group,/news/ecosynthetix-announces-changes-board-directors-210000923.html,EcoSynthetix Announces Changes to Board of Directors,ECO.TO
CNW Group,/news/ecosynthetix-announces-voting-results-election-210000176.html,EcoSynthetix Announces Voting Results for Election of Directors,ECO.TO
Simply Wall St.,/news/does-eguana-technologies-cve-egt-083834879.html,Does Eguana Technologies (CVE:EGT) Have A Healthy Balance Sheet?,EGT.V
GlobeNewswire,/news/eguana-announces-2nd-quarter-2021-201200494.html,Eguana Announces 2nd Quarter 2021 Financial Results,EGT.V
GlobeNewswire,/news/eguana-announces-date-second-quarter-210000766.html,Eguana Announces Date for Second Quarter 2021 Financial Results and Conference Call,EGT.V
Newsfile,/news/greenbriar-announces-forward-living-real-040100503.html,Greenbriar Announces Forward Living Real Estate Investment Newsletter,GRB.V
Newsfile,/news/comprehensive-greenbriar-news-release-040100915.html,Comprehensive Greenbriar News Release,GRB.V
Newsfile,/news/greenbriar-announces-wealth-building-program-221000849.html,Greenbriar Announces Wealth Building Program with Paul Morris Keller Williams Forward Living,GRB.V
Benzinga,/news/greenpower-motor-co-highlights-zero-133416272.html,"GreenPower Motor Co. Highlights its Zero-Emissions, Fully Electric Vehicles EV Star, the BEAST and AV Star",GPV.V
Investopedia,/m/53329ce5-951b-3f1d-b3e1-13e3d8d60c42/top-electric-car-stocks-for.html,Top Electric Car Stocks for Q3 2021,GPV.V
Oilprice.com,/news/fuel-future-9-times-more-003000115.html,The Fuel Of The Future That’s 9 Times More Efficient Than Lithium,GPV.V
GlobeNewswire,/news/westport-fuel-systems-announces-closing-124400973.html,Westport Fuel Systems Announces Closing of Marketed Public Offering and Exercise of Over-Allotment Option,WPRT.TO
Oilprice.com,/news/could-household-chemical-become-superfuel-230000653.html,Could This Household Chemical Become The Superfuel Of The Future?,WPRT.TO
GlobeNewswire,/news/westport-fuel-systems-announces-pricing-043200308.html,Westport Fuel Systems Announces Pricing of Marketed Public Offering,WPRT.TO
ACCESSWIRE,/news/cielo-receives-conditional-approval-list-130000427.html,Cielo Receives Conditional Approval to List on the TSX Venture Exchange,CMC.CN
ACCESSWIRE,/news/cielo-secures-land-purchase-build-130000104.html,Cielo Secures Land Purchase to Build Second 100% Owned Facility in Alberta and Debt Financing for Purchase,CMC.CN
ACCESSWIRE,/news/cielo-announces-changes-board-directors-130000206.html,Cielo Announces Changes to the Board of Directors,CMC.CN
GlobeNewswire,/news/pharmather-present-h-c-wainwright-120000366.html,PharmaTher To Present At The H.C. Wainwright Psychedelics In Psychiatry And Beyond Virtual Conference,PHRM.CN
GlobeNewswire,/news/pharmather-files-fda-pre-ind-120000599.html,PharmaTher Files FDA Pre-IND Meeting Request and Briefing Package For KETABET™ To Treat Depression,PHRM.CN
GlobeNewswire,/news/pharmather-provides-research-development-milestones-120000997.html,PharmaTher Provides Research and Development Update and Milestones for 2021,PHRM.CN
GlobeNewswire,/news/willie-cecil-joins-flyht-company-115900974.html,Willie Cecil Joins FLYHT as Company Launches Industry Leading AFIRS Edge with World’s First 5G wQAR,FLY.V
GlobeNewswire,/news/flyht-present-2021-ld-micro-110400179.html,FLYHT to Present at 2021 LD Micro Invitational XI,FLY.V
Newsfile,/news/flyht-aerospace-solutions-ltd-invitation-120000678.html,Flyht Aerospace Solutions Ltd.: Invitation to the Q2 Virtual Investor Summit,FLY.V
CNW Group,/news/danavation-technologies-announces-digital-smart-110000468.html,"Danavation Technologies Announces Digital Smart Labels™ Installation at Toys ""R"" Us Location in Thornhill, Ontario",DVN.CN
CNW Group,/news/danavation-technologies-announces-letter-intent-110000213.html,"Danavation Technologies Announces Letter of Intent for Digital Smart Labels™ Installation at Esso and LCBO Outlet Location in York, Ontario",DVN.CN
Newsfile,/news/danavation-technologies-corp-discusses-digital-130000232.html,Danavation Technologies Corp. Discusses New Digital Smart Label(TM) Features and First International Distribution Partnership with The Stock Day Podcast,DVN.CN
Business Wire,/news/namsys-reports-annual-meeting-shareholders-165600981.html,"NamSys Reports on the Annual Meeting of Shareholders Held Virtually on April 29, 2021",CTZ.V
Business Wire,/news/namsys-reports-results-operations-fiscal-174600885.html,"NamSys Reports Results of Operations for the Fiscal 2021 First Quarter, January 31st, 2021",CTZ.V
Business Wire,/news/namsys-reports-results-operations-fiscal-202200214.html,NamSys Reports Results of Operations for Fiscal 2020,CTZ.V
ACCESSWIRE,/news/keynotes-educational-panels-42-canadian-140000492.html,"Keynotes, Educational Panels and 42 Canadian-Listed Public Companies Presenting at the SNN Network Canada Virtual Event - January 6-7, 2021",MRBL.CN
ACCESSWIRE,/news/marble-financial-present-snn-network-120000210.html,"Marble Financial to Present at the SNN Network Canada Virtual Event on Thursday January 7, 2021",MRBL.CN
Newsfile,/news/marble-financial-inc-data-driven-182200831.html,"Marble Financial Inc., A Data-Driven Financial Future, CEO Clip Video",MRBL.CN
CNW Group,/news/carl-data-solutions-releases-q3-031800923.html,Carl Data Solutions releases Q3 - 2021 results with fiscal foundation in place,CRL.CN
CNW Group,/news/carl-data-solutions-hires-veteran-130000957.html,"Carl Data Solutions hires veteran software marketing executive and technology journalist as Director, Corporate Communications to build IR and PR impact",CRL.CN
CNW Group,/news/carl-data-solutions-cse-crl-071000009.html,"Carl Data Solutions (CSE: CRL) announces new capital, team members, partnerships and growth objectives for Industry 4.0",CRL.CN
CNW Group,/news/iiroc-trade-resumption-adco-wt-132800098.html,IIROC Trade Resumption - ADCO.WT,ADCO.TO
ACCESSWIRE,/news/adcore-announces-closing-marketed-offering-130000812.html,Adcore Announces Closing of Marketed Offering,ADCO.TO
CNW Group,/news/iiroc-trading-halt-adco-wt-120900220.html,IIROC Trading Halt - ADCO.WT,ADCO.TO
GlobeNewswire,/news/data-storage-completes-merger-flagship-120000121.html,Data Storage Completes Merger of Flagship Solutions Group,DTST
GlobeNewswire,/news/data-storage-corporation-present-summer-161000477.html,Data Storage Corporation to Present at the Summer Solstice Conference - Best Ideas from the Buy-Side on June 1st,DTST
ACCESSWIRE,/news/35-best-ideas-companies-present-231500576.html,"35 of the Best Ideas Companies to Present at the Summer Solstice - Best Ideas from the Buy-Side Virtual Investor Conference on June 1-4, 2021",DTST
