source,link_href,link_text,ticker
CNW Group,/news/bher-launches-national-online-challenge-173000875.html,IIROC Trading Resumption - NNO,NNO.V
CNW Group,/news/r-e-m-n-d-110000096.html,IIROC Trading Halt - NNO,NNO.V
Simply Wall St.,/news/life-cielo-waste-solutions-cse-141115782.html,Such Is Life: How Cielo Waste Solutions (CSE:CMC) Shareholders Saw Their Shares Drop 69%,CMC.CN
ACCESSWIRE,/news/cielo-announces-private-placement-offering-210400882.html,"Cielo Announces Private Placement Offering of Convertible Debenture Units and First Closing of $396,000, Extension of Joint Venture Agreement Deadline",CMC.CN
ACCESSWIRE,/news/cielo-jv-partner-secures-80-132600913.html,"Cielo’s JV Partner Secures 80 Acre Site for Renewable Fuel Facility Near Medicine Hat, AB",CMC.CN
GlobeNewswire,/news/pharmather-approved-trade-otcqb-venture-133000903.html,PharmaTher Approved to Trade on the OTCQB Venture Market,PHRM.CN
GlobeNewswire,/news/pharmather-announces-application-otcqb-listing-130000651.html,PharmaTher Announces Application for OTCQB Listing,PHRM.CN
GlobeNewswire,/news/pharmather-signs-loi-sell-psilocybin-125900591.html,PharmaTher Signs LOI to Sell Psilocybin Program to Revive Therapeutics,PHRM.CN
GlobeNewswire,/news/flyht-participate-moneyshow-january-virtual-120400468.html,FLYHT to Participate in MoneyShow January Virtual Expo,FLY.V
GlobeNewswire,/news/flyht-announces-ravn-alaska-return-120400363.html,FLYHT Announces Ravn Alaska’s Return to Service and Provides Business Update,FLY.V
Simply Wall St.,/news/flyht-aerospace-solutions-ltd-cve-072505293.html,FLYHT Aerospace Solutions Ltd.'s (CVE:FLY) Path To Profitability,FLY.V
ACCESSWIRE,/news/kabn-north-america-engages-entoro-133000483.html,"KABN North America Engages Entoro Capital, LLC as Financial Advisors in the United States of America",KABN.CN
ACCESSWIRE,/news/kabn-north-america-imagine-ar-130000873.html,KABN North America and Imagine AR Bring Augmented Reality to Liquid Avatar’s Verified Self Sovereign Identity Users,KABN.CN
PR Newswire,/news/xtm-kabn-north-america-unveil-123000323.html,XTM and KABN North America Unveil New Challenger Banking Program for Verified Self Sovereign Identity Users,KABN.CN
