source,link_href,link_text,ticker
ACCESSWIRE,/news/hive-blockchain-announces-closing-usd-060000131.html,HIVE Blockchain Announces Closing of USD $15 Million Convertible Debenture Private Placement,HIVE.V
InvestorPlace,/news/4-crypto-mining-stocks-worth-165938416.html,4 Crypto Mining Stocks Worth Investing In,HIVE.V
ACCESSWIRE,/news/hive-blockchain-doubles-bitcoin-production-060500674.html,HIVE Blockchain Doubles Its Bitcoin Production Capacity With The Purchase of New Generation Bitcoin Miners,HIVE.V
CNW Group,/news/veriforce-acquires-canadas-leading-compliance-120500956.html,"Namaste Technologies Continues Upward Revenue Trend, Reporting Estimated Q4 Revenue and Fiscal 2020",N.V
PR Newswire,/news/namaste-technologies-exploring-entry-usa-130000259.html,Namaste Technologies Exploring Entry into the USA Leveraging Proprietary VendorLink Technology via CannMart.com in Collaboration with DankStop,N.V
CNW Group,/news/unifor-activists-hit-streets-labour-090000464.html,"Namaste Technologies Announces the Launch of its Consumer-Focused Recreational House Brand ""Roilty""",N.V
PR Newswire,/news/why-experts-believe-2021-anticipated-131200282.html,Why Experts Believe 2021 is Anticipated to be a Strong Year For Cannabis Industry,APHA.TO
Yahoo Finance,/news/cannabis-companies-continue-their-rally-as-curaleaf-chairman-applauds-quicker-reform-120028344.html,Cannabis companies continue their rally as Curaleaf chairman applauds 'quicker' reform,APHA.TO
Motley Fool,/m/4a288f02-6e1e-3fc0-802c-7028c30c89f3/5-marijuana-stocks-with-the.html,5 Marijuana Stocks With the Most Cash in 2021,APHA.TO
Zacks,/news/top-stock-picks-week-january-193207792.html,"Top Stock Picks for Week of January 11, 2021",BB.TO
CNW Group,/news/blackberry-unveils-industrys-first-unified-120000187.html,Chartwell reaches agreement with SEIU Local 1 (Ontario) and SQEES 298 (Quebec),BB.TO
Motley Fool,/m/2a85e467-8da4-3441-9e5e-1e4fac4e05c8/why-shares-of-blackberry.html,Why Shares of BlackBerry Soared in December,BB.TO
Newsfile,/news/hut-8-mining-corp-announces-061500145.html,Hut 8 Mining Corp. Announces CAD$77.5 Million Private Placement with Institutional Investors,HUT.TO
Newsfile,/news/hut-8-mining-corp-opens-223000052.html,Hut 8 Mining Corp opens Bitcoin Yield Account with Genesis,HUT.TO
Newsfile,/news/hut-8-announces-results-2020-224400889.html,Hut 8 Announces Results of 2020 Annual and Special Meeting of Shareholders,HUT.TO
GlobeNewswire,/news/turmalina-intersects-6m-23-7-130000431.html,Turmalina Intersects 6m at 23.7 g/t Gold and 142 g/t Silver Near Surface in Newly Identified Oxide Zone at SFdLA,TBX.V
GlobeNewswire,/news/phase-two-drilling-continues-intersect-120000640.html,Phase Two Drilling Continues to Intersect Strong Gold-Silver-Copper Mineralisation at San Francisco de Los Andes,TBX.V
Simply Wall St.,/news/were-not-very-worried-turmalina-181415660.html,We're Not Very Worried About Turmalina Metals' (CVE:TBX) Cash Burn Rate,TBX.V
GlobeNewswire,/news/arht-media-beams-milken-institute-133000296.html,ARHT Media Beams Milken Institute Chairman From Los Angeles To Singapore For The Milken Institute's 2020 Asia Summit - A Hybrid Event That Took Place At The Iconic Marina Bay Sands Hotel,ART.V
GlobeNewswire,/news/arht-media-strategic-partner-electronics-133000601.html,ARHT Media Strategic Partner Electronics & Engineering Pte Ltd  To Open A Capture and Display Studio in Singapore To Meet Growing Demand in South East Asia,ART.V
GlobeNewswire,/news/join-first-ever-wisekey-transhumancode-130000714.html,Join the First-Ever WISeKey TransHumanCode Holograminar on December 14 at 3:00 pm CET,ART.V
PR Newswire,/news/kcsa-strategic-communications-host-inaugural-183600969.html,"KCSA Strategic Communications to Host Inaugural KCSA Psychedelics Investor Conference on January 26-27, 2021",MYCO.CN
GlobeNewswire,/news/mydecine-innovations-group-appoints-gordon-123000366.html,Mydecine Innovations Group Appoints Gordon Neal to Board of Directors and Dean Ditto as Chief Financial Officer,MYCO.CN
InvestorPlace,/news/5-groovy-psychedelic-stocks-buy-181906552.html,5 Groovy Psychedelic Stocks to Buy,MYCO.CN
ACCESSWIRE,/news/ampd-ventures-announces-closing-private-225000300.html,AMPD Ventures Announces Closing of Private Placement,AMPD.CN
ACCESSWIRE,/news/ampd-ventures-announces-updates-previously-223000873.html,AMPD Ventures Announces Updates to Previously Announced Private Placement,AMPD.CN
ACCESSWIRE,/news/ampd-ventures-announces-proposed-private-221500246.html,AMPD Ventures Announces Proposed Private Placement,AMPD.CN
Newsfile,/news/graph-blockchain-establishes-special-committee-135200576.html,Graph Blockchain Establishes Special Committee to Review M&A Opportunities,GBLC.CN
Newsfile,/news/graph-earned-84-483-q2-131000369.html,"Graph Earned $84,483 in Q2",GBLC.CN
Newsfile,/news/graph-blockchain-announces-grant-options-223100302.html,Graph Blockchain Announces Grant of Options,GBLC.CN
ACCESSWIRE,/news/globex-data-readies-latin-america-110000718.html,GlobeX Data Readies Latin America Launch of SekurMessenger with America Movil’s Telcel – Aims to Replace WhatsApp for Business Users,SWIS.CN
ACCESSWIRE,/news/globex-data-ceo-interviewed-proactive-173000227.html,"GlobeX Data CEO Interviewed on Proactive About Its Oversubscribed Private Placement and the Sekur.com Launch in North America, Latin America and South Asia",SWIS.CN
ACCESSWIRE,/news/globex-data-ltd-announces-oversubscribed-014000168.html,GlobeX Data Ltd. Announces Oversubscribed Private Placement,SWIS.CN
CNW Group,/news/iiroc-trading-resumption-sxl-184800110.html,BitePRO Report Record Sales Of Bite Resistant Clothing Due To Increasing Violence In Schools,MTRX.V
GlobeNewswire,/news/loop-insights-signs-loi-acquire-110000542.html,"Loop Insights Signs LOI To Acquire Passcreator, A Leading European Digital Wallet And Mobile Marketing Company With Tier-1 Global Clients",MTRX.V
GlobeNewswire,/news/loop-insights-selected-bdg-sports-110000158.html,Loop Insights Selected by bdG Sports to Provide Venue Management Platform to NCAA Big West Conference Championships at Mandalay Bay in Las Vegas,MTRX.V
Yahoo Finance Video,/video/expect-streaming-industry-2021-160241873.html,What to expect from the streaming industry in 2021,CGX.TO
CNW Group,/news/great-west-lifeco-reports-second-233400389.html,Health Canada authorizes Moderna COVID-19 vaccine,CGX.TO
CNW Group,/news/dragonfly-therapeutics-initiates-phase-1-130000856.html,Scotiabank and Cineplex Announce Enhancements to the SCENE Loyalty Program,CGX.TO
Zacks,/news/cenovus-cve-jumps-61-4-151403315.html,Cenovus (CVE) Jumps 61.4% in 3 Months: More Room to Run?,CVE.TO
Zacks,/news/cenovus-cve-closes-stock-merger-132001898.html,Cenovus (CVE) Closes All-Stock Merger Deal With Husky Energy,CVE.TO
Moody's,/news/husky-energy-inc-moodys-downgrades-225906630.html,Husky Energy Inc. -- Moody's downgrades Husky to Baa3; outlook negative,CVE.TO
Business Wire,/news/trutrace-technologies-appoints-two-members-125900471.html,TruTrace Technologies Appoints Two New Members to Board of Directors,TTT.CN
CNW Group,/news/mistango-river-resources-announces-3-130800872.html,Minister Qualtrough welcomes report by Future Skills Council that will help Canadians prepare for a changing and modern labour market,TTT.CN
Business Wire,/news/trutrace-technologies-ensures-consumer-safety-120000185.html,"TruTrace Technologies Ensures Consumer Safety for Riviera Beverages & Bottling, West One Logistics and their Hygen-X Sanitizer Products",TTT.CN
GlobeNewswire,/news/ev-battery-tech-provides-updates-140000887.html,EV Battery Tech Provides Updates on Definitive Agreement with EcoVille and LOI with Hillcrest,HRH.V
GlobeNewswire,/news/ev-battery-tech-signs-letter-130000276.html,EV Battery Tech signs Letter of Intent to Develop ESS Solutions for Renewable Energy,HRH.V
CNW Group,/news/iiroc-trading-resumption-hrh-124800763.html,SHL Call Center Hiring Solution Increases Customer Satisfaction by 32%,HRH.V
Yahoo Finance,/news/cannabis-companies-continue-their-rally-as-curaleaf-chairman-applauds-quicker-reform-120028344.html,Cannabis companies continue their rally as Curaleaf chairman applauds 'quicker' reform,ACB.TO
MarketWatch,/m/4a5344c6-dfa2-3932-9ff0-7bae92d454df/cannabis-industry-investors.html,"Cannabis-industry investors ‘are likely overestimating the odds for federal decriminalization,’ analyst says",ACB.TO
Zacks,/news/options-traders-betting-big-move-134801313.html,Are Options Traders Betting on a Big Move in Aurora Cannabis (ACB) Stock?,ACB.TO
GlobeNewswire,/news/air-canada-receives-apex-diamond-171500801.html,Air Canada Receives APEX’s Diamond Status Certification For Its CleanCare+ Biosafety Program in Response to COVID-19,AC.TO
CNW Group,/news/mcmaster-healthlabs-air-canada-greater-100000417.html,IIROC Trading Resumption - EVE.WT,AC.TO
CNW Group,/news/healthspace-announces-contract-state-oregon-123000861.html,Statement from the Taxpayers' Ombudsperson regarding the service provided by the Canada Revenue Agency on the emergency benefit programs,AC.TO
ACCESSWIRE,/news/ydx-announces-cash-conservation-monetization-101500100.html,YDX Announces Cash Conservation and Monetization Plans,YDX.V
ACCESSWIRE,/news/ydx-announces-closing-fully-subscribed-100000211.html,YDX Announces Closing of Fully Subscribed Non-brokered Private Placement,YDX.V
ACCESSWIRE,/news/ydx-announces-launch-parabellum-esports-101500838.html,"YDX Announces the Launch of Parabellum Esports, Canada’s Newest Competitive Esports Team",YDX.V
CNW Group,/news/media-advisory-minister-schulte-virtually-173100178.html,IIROC Trade Resumption - VST,VST.CN
GlobeNewswire,/news/victory-square-technologies-portfolio-company-180600158.html,"Victory Square Technologies Portfolio Company Receives Brazilian ANVISA Approval for Sale, Distribution & Use of Safetest 15 Minute Covid-19 Rapid Test for Brazil",VST.CN
CNW Group,/news/north-peak-resources-announces-non-142000234.html,IIROC Trading Halt - VST,VST.CN
CNW Group,/news/aprinoia-announces-approval-nmpa-initiate-060000312.html,Firstlight Media's cloud-native OTT platform to support new streaming venture Struum,VSBY.CN
ACCESSWIRE,/news/keynotes-educational-panels-42-canadian-140000306.html,"Keynotes, Educational Panels and 42 Canadian-Listed Public Companies Present at the SNN Network Canada Virtual Event on January 6-7, 2021",VSBY.CN
ACCESSWIRE,/news/vsblty-present-snn-network-canada-144000909.html,"VSBLTY to Present at the SNN Network Canada Virtual Event on Thursday, January 7, 2021",VSBY.CN
CNW Group,/news/one-largest-global-american-banks-090000970.html,Lightspeed Revolutionizes Supply Chain of Independent Retailers with Launch of Supplier Network,LSPD.TO
CNW Group,/news/lightspeed-launches-ecom-restaurants-110000370.html,Subway® Canada Celebrates the Launch of Nationwide Curbside Pick-Up by Giving Canadians the Chance to Drive Away with a New Car,LSPD.TO
CNW Group,/news/lightspeed-announces-first-quarter-2021-104500423.html,Ontario Brain Institute Increases Investment in Diamond Therapeutics to Accelerate Innovation in Mental Health,LSPD.TO
Motley Fool,/m/914334a3-1fc2-3ef2-a001-789fe6cca419/why-oneconnect-financial.html,Why OneConnect Financial Technology Rocketed 103.6% Higher in 2020,OCFT
PR Newswire,/news/oneconnect-ceo-fintech-transformation-now-025100052.html,OneConnect CEO: Fintech Transformation Now a Driver of Growth in Banking Sector,OCFT
Simply Wall St.,/news/oneconnect-financial-technologys-nyse-ocft-083509706.html,Is OneConnect Financial Technology's (NYSE:OCFT) 107% Share Price Increase Well Justified?,OCFT
GlobeNewswire,/news/cloudmd-closes-acquisition-humanacare-industry-123000310.html,"CloudMD Closes Acquisition of HumanaCare, an Industry Leader in Employee Health Services, Providing a Transformational Platform that Promotes Short and Long-Term Health and Wellness",DOC.V
CNW Group,/news/obsidian-energy-proposes-combination-transaction-100000487.html,"Ontario Lottery and Gaming Corporation - EVENING LOTTERY WINNING NUMBERS - January 2, 2021",DOC.V
CNW Group,/news/luxury-brand-partners-announces-one-130000385.html,Madison's Lumber Reporter - Forest of Products,DOC.V
Newsfile,/news/peaks-lending-hub-helps-facilitate-123000570.html,"Peak's Lending Hub Helps Facilitate First Loans to Network of 55,000 Social Media Influencers",PKK.CN
Newsfile,/news/le-lending-hub-peak-aide-123000583.html,Le « Lending Hub » de Peak aide à faciliter les premiers prêts à son réseau de 55 000 influenceurs de médias sociaux,PKK.CN
Newsfile,/news/la-plateforme-lending-hub-peak-123000226.html,La plateforme « Lending Hub » de Peak aide sa filiale à clôturer 2020 avec une prestigieuse cote de crédit gouvernementale,PKK.CN
GlobeNewswire,/news/threed-capital-inc-announces-completion-220100442.html,ThreeD Capital Inc. Announces Completion of Private Placement with ZeU Technologies Inc.,IDK.CN
GlobeNewswire,/news/threed-capital-acquires-securities-electric-142100317.html,ThreeD Capital Acquires Securities of Electric Metals (USA) Ltd. through Two Private Placements and Sheldon Inwentash to become Chairman,IDK.CN
GlobeNewswire,/news/threed-capital-largest-investment-psychedelics-151900965.html,"ThreeD Capital To Make Largest Investment Into Psychedelics Industry With US$450,000 Investment Into Wuhan General Group (China) Inc.",IDK.CN
ACCESSWIRE,/news/electrovaya-closes-cdn-3-27-225500232.html,Electrovaya Closes CDN $3.27 Million Private Placement,EFL.TO
ACCESSWIRE,/news/raymond-electrovaya-announce-strategic-supply-051000378.html,Raymond and Electrovaya Announce Strategic Supply Agreement,EFL.TO
CNW Group,/news/fdas-convalescent-plasma-eua-requires-194900599.html,GSMA Announces MWC Shanghai Is Back For 2021,EFL.TO
Newsfile,/news/very-good-food-company-begins-123000319.html,The Very Good Food Company Begins Commissioning of its Vancouver-based Production Facility and Announces Changes to Senior Leadership Team,VERY.CN
Newsfile,/news/very-good-food-company-announces-123000701.html,The Very Good Food Company Announces Strategic Expansion into Plant-Based Dairy Alternatives Market with the Planned Acquisition of The Cultured Nut,VERY.CN
InvestorPlace,/news/6-hot-vegan-stocks-plant-165829679.html,6 Hot Vegan Stocks That Will Make You Go Plant-Based,VERY.CN
CNW Group,/news/healthspace-finalizes-paid-agreement-state-123000291.html,"/R E M I N D E R -- Media Advisory - Prime Minister's itinerary for Tuesday, January 12, 2021/",EATS.CN
CNW Group,/news/laserfiche-spark-invites-change-makers-120000221.html,"Eat Beyond Portfolio Company, Singapore's TurtleTree Labs Launches TurtleTree Scientific",EATS.CN
PR Newswire,/news/eat-beyond-adds-lebron-james-140000528.html,"Eat Beyond Adds LeBron James' Longtime Athletic Trainer and Recovery Expert, Mike Mancias, as Advisor",EATS.CN
CNW Group,/news/azimut-carries-100-line-km-120000955.html,"Modern Meat Announces Launching into the Multi Billion Dollar Dairy Alternative Market with its Line of Oat M*lk, Almond M*lk, and a Barista Edition",MEAT.CN
CNW Group,/news/mcloud-appoints-rca-financial-partners-110000857.html,"Modern Meat Announces Q1, 2021 Launch of Modern Meat Products in the United States",MEAT.CN
CNW Group,/news/lufa-farms-doubles-production-capacity-100000843.html,"Vena Wins Comparably Awards for Best Company Culture, Best Company for Women and Best Company for Diversity",MEAT.CN
Newsfile,/news/retransmission-bee-vectoring-technologies-completes-130000072.html,"RETRANSMISSION: Bee Vectoring Technologies Completes California Approval Review Process, Gaining Access to Biggest Commercial Market in US",BEE.CN
Newsfile,/news/bee-vectoring-technologies-completes-california-060000895.html,"Bee Vectoring Technologies Completes California Approval Review Process, Gaining Access to Biggest Commercial Market in US",BEE.CN
Newsfile,/news/bee-vectoring-technologies-adds-territory-130000509.html,Bee Vectoring Technologies Adds Territory Manager to Grow Market Reach in Pacific Northwest,BEE.CN
CNW Group,/news/hydro-ottawa-first-electric-utility-160000164.html,Predictiv AI Provides Year in Review Corporate Update,PAI.V
CNW Group,/news/desjardins-supports-canadian-youth-prepare-120000180.html,Predictiv AI Signs Additional Purchase Orders for its ThermalPass Fever Detection System,PAI.V
CNW Group,/news/iiroc-trade-resumption-vcan-133200459.html,"Notice to the media - COVID-19 Update (December 22, 2020) - Ministers and Government of Canada officials to hold a news conference on coronavirus disease",PAI.V
GlobeNewswire,/news/mineworx-announces-corporate-webinar-103000207.html,Mineworx Announces Corporate Update Webinar,MWX.V
GlobeNewswire,/news/mineworx-advances-pilot-phase-diesel-100000898.html,Mineworx Advances to Pilot Phase Of Its Diesel Catalytic Converter Recycling Plant,MWX.V
GlobeNewswire,/news/mineworx-reports-details-annual-general-194500860.html,Mineworx Reports on Details of the Annual General Meeting,MWX.V
CNW Group,/news/minerva-intelligence-announces-2020-annual-202900244.html,Minerva Intelligence Announces 2020 Annual General Meeting Results,MVAI.V
CNW Group,/news/government-canada-haida-nation-announce-173400412.html,Minerva Announces Contract with Freeport Resources for TERRA Mining AI Suite,MVAI.V
CNW Group,/news/minerva-prospector-announce-partnership-promises-110000805.html,"Media Advisory - Prime Minister's itinerary for Friday, October 23, 2020",MVAI.V
CNW Group,/news/quisitives-ledgerpay-executes-loi-bank-130400666.html,Quisitive's LedgerPay Executes LOI with Bank Sponsor to Enable Payment Processing,QUIS.V
ACCESSWIRE,/news/keynotes-educational-panels-42-canadian-140000749.html,"Keynotes, Educational Panels and 42 Canadian-Listed Public Companies to Present at the SNN Network Canada Virtual Event on January 6-7, 2021",QUIS.V
ACCESSWIRE,/news/quisitive-present-snn-network-canada-133000311.html,"Quisitive to Present at the SNN Network Canada Virtual Event on Thursday, January 7, 2021",QUIS.V
GlobeNewswire,/news/trackx-topl-announce-strategic-partnership-130000988.html,TrackX and Topl Announce Strategic Partnership Combining Blockchain with Asset Management to Empower End-to-End Supply Chain Transparency,TKX.V
GlobeNewswire,/news/trackx-announces-enterprise-wide-expansion-154900266.html,TrackX Announces Enterprise-Wide Expansion  for Global Powersports Company,TKX.V
Simply Wall St.,/news/investors-feel-trackx-holdings-cve-184933050.html,How Should Investors Feel About TrackX Holdings' (CVE:TKX) CEO Remuneration?,TKX.V
CNW Group,/news/govtech-leader-payit-picks-toronto-130000968.html,ImagineAR and KABN North America Bring Augmented Reality to Liquid Avatar's Verified Self Sovereign Identity Users,IP.CN
CNW Group,/news/international-companies-host-live-webcasts-133500828.html,"ImagineAR Featured in Global Sports Innovation Center (GSIC) White Paper ""Next-Generation Fan Engagement: The Coming Together of Content, Commercial, Code & The Consumer""",IP.CN
CNW Group,/news/government-canada-celebrates-opening-youth-141500217.html,MFDA Hearing Panel accepts settlement agreement with Orrin Gilmour,IP.CN
Newsfile,/news/netcents-expands-product-offering-creating-080500086.html,NetCents Expands Product Offering by Creating Interest Bearing Accounts,NC.CN
Newsfile,/news/netcents-technology-announces-significant-growth-080500573.html,"NetCents Technology Announces Significant Growth in Merchant Accounts, Projects Further Demand Acceleration",NC.CN
Newsfile,/news/netcents-recruits-chief-technical-officer-140000553.html,NetCents Recruits Chief Technical Officer with Significant Blockchain and Cryptocurrency Experience,NC.CN
GlobeNewswire,/news/repeat-earthrenew-acquire-stake-replenish-120000718.html,"REPEAT - EarthRenew to Acquire Stake in Replenish Nutrients Ltd., a Leader in Crop Inputs and the Soil Solution Space",ERTH.CN
GlobeNewswire,/news/earthrenew-acquire-stake-replenish-nutrients-050000374.html,"EarthRenew to Acquire Stake in Replenish Nutrients Ltd., a Leader in Crop Inputs and the Soil Solution Space",ERTH.CN
GlobeNewswire,/news/earthrenew-enters-marketing-agreement-233000623.html,EarthRenew Enters Into Marketing Agreement,ERTH.CN
Newsfile,/news/appia-announces-exercise-warrants-cash-154400225.html,Appia Announces Exercise of Warrants and Cash Position,API.CN
Newsfile,/news/appia-announces-closing-non-brokered-131600554.html,Appia Announces Closing of Non-Brokered Private Placement,API.CN
Newsfile,/news/appia-reports-significant-price-increases-142300936.html,Appia Reports on Significant Price Increases in Rare Earth Oxides as China Announces New Export Control Law,API.CN
GlobeNewswire,/news/sharc-energy-fully-subscribes-3-130000493.html,SHARC Energy Fully Subscribes $3.0M Private Placement,SHRC.CN
GlobeNewswire,/news/sharc-energy-chosen-wastewater-energy-130000552.html,SHARC Energy Chosen to Provide Wastewater Energy Recovery for Seattle’s Greenest Residential Building Complex,SHRC.CN
GlobeNewswire,/news/sharc-energy-reports-q3-2020-130000654.html,SHARC Energy Reports on Q3 2020,SHRC.CN
ACCESSWIRE,/news/legend-channel-partner-places-orders-120000077.html,Legend Channel Partner Places Orders for 29 SmartGATE Insights Service Engagements,LPS.V
Simply Wall St.,/news/shareholders-thrilled-legend-power-systems-085200651.html,Shareholders Are Thrilled That The Legend Power Systems (CVE:LPS) Share Price Increased 241%,LPS.V
ACCESSWIRE,/news/legend-power-grants-stock-options-202000611.html,Legend Power Grants Stock Options,LPS.V
ACCESSWIRE,/news/keynotes-educational-panels-42-canadian-140000251.html,"Keynotes, Educational Panels and 42 Canadian-Listed Public Companies to Present at the SNN Network Canada Virtual Event on January 6-7, 2021",MCLD.V
CNW Group,/news/wsib-holds-premium-rates-ontario-143000188.html,mCloud Closes US$1.870 Million Second Tranche of Convertible Equity Debenture Totaling US$4.668 Million in Aggregate,MCLD.V
PR Newswire,/news/mcloud-connects-first-ten-york-120000807.html,mCloud Connects First Ten New York Buildings in New Multi-Site Commercial Building Campaign,MCLD.V
PR Newswire,/news/biorem-announces-research-project-city-130000954.html,BIOREM Announces Research Project with City of New York to Control Release of Bioaerosols from Waste Water Treatment Facilities,BRM.V
PR Newswire,/news/biorem-announces-successful-demonstration-projects-130000521.html,BIOREM Announces Successful Demonstration Projects Assessing Novel Biological Processes for the Mitigation of Industrial VOC Emissions,BRM.V
PR Newswire,/news/biorem-reports-2020-third-quarter-130000767.html,BIOREM Reports 2020 Third Quarter Results,BRM.V
CNW Group,/news/ecosynthetix-reports-third-quarter-2020-220000530.html,"Rowers Set Off On 3,000 Mile Journey Across The Atlantic Ocean - The Talisker Whisky Atlantic Challenge 2020 Begins",ECO.TO
CNW Group,/news/ecosynthetix-host-2020-third-quarter-150000376.html,"EV2020VÉ, the most important conference of the decade in electric mobility",ECO.TO
Simply Wall St.,/news/announcing-ecosynthetix-tse-eco-stock-125524266.html,Announcing: EcoSynthetix (TSE:ECO) Stock Increased An Energizing 160% In The Last Five Years,ECO.TO
Simply Wall St.,/news/introducing-eguana-technologies-cve-egt-080927495.html,"Introducing Eguana Technologies (CVE:EGT), The Stock That Soared 340% In The Last Year",EGT.V
CNW Group,/news/ngx-energy-announces-receipt-reserves-142800609.html,171 Canadian Credit Cards Ranked For 2021 By The creditcardGenius Algorithm,EGT.V
GlobeNewswire,/news/eguana-announces-closing-1-5-140000623.html,Eguana Announces Closing of $1.5 Million Investment from Institutional Investor,EGT.V
GlobeNewswire,/news/eestor-corporation-provides-ongoing-transactions-130300264.html,EEStor Corporation Provides Update on Ongoing Transactions,ESU.V
GlobeNewswire,/news/eestor-corporation-announces-closing-private-130000372.html,EEStor Corporation Announces Closing of Private Placement,ESU.V
GlobeNewswire,/news/eestor-corporation-announces-further-increase-130000245.html,EEStor Corporation Announces Further Increase of Private Placement and Debt Settlement,ESU.V
Newsfile,/news/greenbriar-capital-corp-appoints-paul-230700161.html,Greenbriar Capital Corp Appoints Paul M. Morris as CEO of Sage Ranch,GRB.V
Newsfile,/news/greenbriar-capital-corp-announces-private-050100967.html,Greenbriar Capital Corp Announces Private Placement,GRB.V
Newsfile,/news/greenbriar-capital-corp-announces-acquisition-050100055.html,Greenbriar Capital Corp Announces Acquisition of 500MW Solar Energy Project Portfolio in Alberta,GRB.V
CNW Group,/news/producers-immersive-van-gogh-announce-170000788.html,"GreenPower Motor Announces Current Vehicle Production, Deliveries for the Quarter Ended December 31, 2020 and Doubling School Bus Production",GPV.V
CNW Group,/news/greenpower-reports-fiscal-first-quarter-200200276.html,Glassdoor Announces Winners Of Its Employees' Choice Awards Recognizing Canada's 25 Best Places To Work In 2021,GPV.V
CNW Group,/news/iiroc-trading-resumption-gpv-141200803.html,Emerging reports of hearing loss during the COVID-19 pandemic and the importance of accessibility to audiological services,GPV.V
Motley Fool,/m/20944121-b541-32c3-8d29-9fbed2aaf74b/why-blink-charging-lithium.html,"Why Blink Charging, Lithium Americas, and Westport Fuel Systems Stocks All Jumped Today",WPRT.TO
GlobeNewswire,/news/westport-fuel-systems-appoints-director-220000636.html,Westport Fuel Systems Appoints New Director,WPRT.TO
Zacks,/news/westport-wprt-rides-eco-friendly-142602268.html,Westport (WPRT) Rides on Eco-Friendly Product Mix Amid Headwinds,WPRT.TO
Simply Wall St.,/news/oceanic-wind-energy-cve-nkw-121742571.html,Can Oceanic Wind Energy (CVE:NKW) Afford To Invest In Growth?,NKW.V
CNW Group,/news/iiroc-trading-resumption-nkw-152000089.html,IIROC Trading Resumption - NKW,NKW.V
GlobeNewswire,/news/naikun-wind-provides-additional-details-150606276.html,NaiKun Wind Provides Additional Details Regarding the Sale of NaiKun Offshore Wind Project,NKW.V
Newsfile,/news/nano-one-enters-cathode-evaluation-080500168.html,Nano One Enters into a Cathode Evaluation Agreement with Major Global Automotive Company,NNO.V
