source,link_href,link_text,ticker
CNW Group,/news/network-media-group-receives-strategic-110000193.html,Network Media Group Receives Strategic Investment from Hive Blockchain Technologies and U.S. Global Investors for NFT and Digital Content Initiatives,HIVE.V
Newsfile,/news/retransmission-hive-blockchain-technologies-announces-110000794.html,RETRANSMISSION: HIVE Blockchain Technologies Announces Strategic Investment in NFT Business,HIVE.V
Newsfile,/news/hive-blockchain-technologies-announces-strategic-050600646.html,HIVE Blockchain Technologies Announces Strategic Investment in NFT Business,HIVE.V
Newsfile,/news/hive-blockchain-restates-previously-issued-110000827.html,"HIVE Blockchain Restates Previously Issued Financial Statements Based on Non-Cash Valuation of 25,000 Ethereum Investments",HIVE.V
Motley Fool,/m/1828ff34-0acf-3746-8c3f-f5a7db37c892/why-cryptocurrency-stocks.html,Why Cryptocurrency Stocks Were Up This Week,HIVE.V
Newsfile,/news/retransmission-hive-increasing-hashpower-585-100000951.html,"RETRANSMISSION: HIVE Increasing Hashpower By 585 PH/s By Buying 6,500 High Performance Bitcoin Miners",HIVE.V
Newsfile,/news/hive-increasing-hashpower-585-ph-050000274.html,"HIVE Increasing Hashpower By 585 PH/s By Buying 6,500 High Performance Bitcoin Miners",HIVE.V
Newsfile,/news/retransmission-hive-blockchain-provides-market-100000829.html,RETRANSMISSION: HIVE Blockchain Provides Update on At-the-Market Offering,HIVE.V
Newsfile,/news/hive-blockchain-provides-market-offering-050000239.html,HIVE Blockchain Provides Update on At-the-Market Offering,HIVE.V
Newsfile,/news/retransmission-hive-blockchain-announces-appointment-100000363.html,RETRANSMISSION: HIVE Blockchain Announces Appointment of Diana Biggs to HIVE Switzerland Board of Directors,HIVE.V
Oilprice.com,/news/bidding-war-begin-remarkable-oil-141500906.html,Is A Bidding War About To Begin For This Remarkable Oil Tech?,PQEFF
ACCESSWIRE,/news/petroteq-responds-unsolicited-takeover-bid-005000816.html,Petroteq Responds to Unsolicited Takeover Bid by Viston United Swiss AG,PQEFF
ACCESSWIRE,/news/petroteq-announces-letter-shareholders-r-130000755.html,"Petroteq Announces Letter to Shareholders from R. G. Bailey, CEO and Chairman",PQEFF
ACCESSWIRE,/news/correction-petroteq-provides-tsxv-application-101500377.html,CORRECTION: Petroteq Provides Update on TSXV Application for Reinstatement,PQEFF
ACCESSWIRE,/news/petroteq-provides-tsxv-application-reinstatement-022000570.html,Petroteq Provides Update on TSXV Application for Reinstatement,PQEFF
ACCESSWIRE,/news/petroteq-energy-announces-completion-quadrise-130000157.html,Petroteq Energy Announces Completion of Quadrise Testing Program,PQEFF
ACCESSWIRE,/news/petroteq-provides-corporate-130000592.html,Petroteq Provides a Corporate Update,PQEFF
ACCESSWIRE,/news/petroteq-receives-confirmation-proof-funds-130000663.html,Petroteq Receives Confirmation of Proof of Funds From Bidder,PQEFF
ACCESSWIRE,/news/petroteq-announces-revocation-cease-trade-130000894.html,Petroteq Announces Revocation of Cease Trade Order,PQEFF
ACCESSWIRE,/news/management-filing-financials-130000895.html,Management Update on Filing of Financials,PQEFF
GlobeNewswire,/news/sprout-ai-rapid-expansion-continues-123000803.html,Sprout AI’s Rapid Expansion Continues During Daunting Times,SPRT.CN
GlobeNewswire,/news/sprout-ai-inc-announces-initial-123000449.html,Sprout AI Inc. Announces Initial Sales Order,SPRT.CN
GlobeNewswire,/news/sprout-ai-inc-announces-marketing-123000419.html,Sprout AI Inc. Announces Marketing Team,SPRT.CN
GlobeNewswire,/news/sprout-ai-inc-announces-jon-123000396.html,Sprout AI Inc. Announces Jon Olsen as Interim CFO,SPRT.CN
GlobeNewswire,/news/sprout-ai-inc-q2-financial-130000678.html,Sprout AI Inc. Q2 Financial Report,SPRT.CN
GlobeNewswire,/news/sprout-ai-inc-vertical-farming-120000666.html,Sprout AI Inc. Vertical Farming Aims to Provide Sustainable Solutions to Global Food Production,SPRT.CN
GlobeNewswire,/news/sprout-ai-inc-commences-trading-120000529.html,Sprout AI Inc. Commences Trading on the Canadian Securities Exchange,SPRT.CN
PR Newswire,/news/blackberry-participate-upcoming-investor-conferences-120000432.html,BlackBerry to Participate in Upcoming Investor Conferences,BB.TO
Zacks,/news/blackberry-bb-gains-lags-market-215009461.html,BlackBerry (BB) Gains But Lags Market: What You Should Know,BB.TO
CNW Group,/news/blackberry-okta-partner-deliver-seamless-120000042.html,BlackBerry and Okta Partner to Deliver Seamless Identity and Access Capabilities,BB.TO
Benzinga,/news/elon-musks-net-worth-grew-202248352.html,Elon Musk's Net Worth Grew By The Value Of These 3 Companies Combined Today,BB.TO
Zacks,/news/blackberry-bb-stock-sinks-market-215009912.html,BlackBerry (BB) Stock Sinks As Market Gains: What You Should Know,BB.TO
Insider Monkey,/news/hedge-funds-dumping-blackberry-limited-180355374.html,Hedge Funds Are Dumping BlackBerry Limited (BB),BB.TO
CNW Group,/news/blackberry-named-newsweeks-list-most-120000171.html,BlackBerry Named to Newsweek's List of the Most Loved Workplaces for 2021,BB.TO
InvestorPlace,/news/blackberry-rise-nearly-35-free-202914269.html,Blackberry Can Rise Nearly 35% As Its Free Cash Flow Turns Positive,BB.TO
Zacks,/news/blackberry-bb-6-6-since-153003541.html,BlackBerry (BB) Up 6.6% Since Last Earnings Report: Can It Continue?,BB.TO
Investor's Business Daily,/m/7a61721c-1b1f-3257-9fd6-6c1ab575f5f9/is-blackberry-stock-a-buy-.html,"Is BlackBerry Stock A Buy? What Fundamentals, Fund Metrics, Chart Say",BB.TO
PR Newswire,/news/hut-8-mining-announces-third-170700939.html,Hut 8 Mining Announces Third Site Status Update,HUT.TO
Newsfile,/news/btv-showcases-cloud-dx-hut-100000863.html,"BTV Showcases Cloud DX, Hut 8 Mining, Monarch Mining, Ion Energy and Danavation Technologies",HUT.TO
PR Newswire,/news/hut-8-mining-announces-purchase-113000155.html,"Hut 8 Mining Announces Purchase of 12,000 New MicroBT Miners for Delivery Starting January 2022",HUT.TO
CNW Group,/news/hut-8-joins-alternative-investment-113000800.html,Hut 8 Joins Alternative Investment Management Summit Dubai Edition 2021,HUT.TO
Newsfile,/news/btv-features-emerging-companies-cannabis-193000045.html,BTV Features Emerging Companies from Cannabis to Gold,HUT.TO
PR Newswire,/news/hut-8-mining-provides-production-113000978.html,Hut 8 Mining Provides Production Update,HUT.TO
CNW Group,/news/hut-8-mining-closes-us-151000141.html,Hut 8 Mining Closes US$173 Million Common Share Public Offering,HUT.TO
CNW Group,/news/hut-8-mining-announces-pricing-115800009.html,Hut 8 Mining Announces Pricing of $US150 Million Public Offering,HUT.TO
CNW Group,/news/hut-8-mining-announces-proposed-200500329.html,Hut 8 Mining Announces Proposed Public Offering,HUT.TO
CNW Group,/news/hut-8-announces-certification-authorized-121400061.html,Hut 8 Announces Certification as Authorized MicroBT Repair Centre for Canada,HUT.TO
CNW Group,/news/updated-timing-cineplex-inc-announces-120000068.html,Updated Timing: Cineplex Inc. Announces Details of Third Quarter 2021 Earnings Release and Conference Call,CGX.TO
CNW Group,/news/cineplex-inc-announces-details-third-130000158.html,Cineplex Inc. Announces Details of Third Quarter 2021 Earnings Release and Conference Call,CGX.TO
CNW Group,/news/cineplex-launches-national-brand-campaign-120000988.html,"Cineplex Launches National Brand Campaign, Where Escape Begins, to Remind Canadians About the Magic of the Cinema Experience",CGX.TO
Yahoo Finance Video,/video/free-guy-dominates-weekend-box-161637093.html,"'Free Guy’ dominates weekend box office, raking in $18.8M",CGX.TO
CNW Group,/news/cineplex-inc-reports-second-quarter-101500957.html,Cineplex Inc. Reports Second Quarter Results,CGX.TO
CNW Group,/news/calling-big-screen-buffs-extra-113000746.html,"Calling All Big Screen Buffs and Extra Butter Lovers! Cineplex Launches CineClub™, Canada's First of Its Kind Movie Subscription Program for Just $9.99/Month",CGX.TO
CNW Group,/news/ready-bring-game-rec-room-130000192.html,Get Ready to Bring Your 'A' Game: The Rec Room Opens TODAY in Barrie!,CGX.TO
CNW Group,/news/cineplex-inc-announces-details-second-140000251.html,Cineplex Inc. Announces Details of Second Quarter 2021 Earnings Release and Conference Call,CGX.TO
CNW Group,/news/big-screen-back-ontario-moviegoers-170400585.html,THE BIG SCREEN IS BACK: Ontario Moviegoers Return to Cineplex Theatres Starting Next Friday,CGX.TO
CNW Group,/news/cineplex-vip-cinemas-brentwood-opens-150000451.html,Cineplex VIP Cinemas Brentwood Opens Today in Burnaby!,CGX.TO
GlobeNewswire,/news/cenovus-headwater-announce-closing-227-122300087.html,Cenovus and Headwater announce the closing of $227.5 million bought deal secondary offering of Headwater common shares,CVE.TO
Oilprice.com,/news/canada-oil-stocks-trading-bargain-170000995.html,Canada’s Oil Stocks Are Trading At Bargain Basement Prices,CVE.TO
Zacks,/news/cenovus-cve-jumps-30-7-153503723.html,Cenovus (CVE) Jumps 30.7% in 6 Months: More Room to Run?,CVE.TO
CNW Group,/news/cenovus-headwater-announce-increase-previously-130200993.html,Cenovus and Headwater announce increase to previously announced bought deal secondary offering of Headwater common shares,CVE.TO
CNW Group,/news/cenovus-headwater-announce-bought-deal-203400690.html,Cenovus and Headwater announce bought deal secondary offering of Headwater common shares worth approximately $114 million,CVE.TO
GlobeNewswire,/news/cenovus-announces-pricing-terms-pending-171900480.html,Cenovus announces the Pricing Terms of its Pending Maximum Tender Offer,CVE.TO
GlobeNewswire,/news/cenovus-announces-early-tender-results-122700324.html,Cenovus announces the Early Tender Results and Increase of its Pending Maximum Tender Offer,CVE.TO
GlobeNewswire,/news/cenovus-redeem-3-950-notes-120000323.html,"Cenovus to redeem its 3.950% notes due April 15, 2022 and 3.000% notes due August 15, 2022",CVE.TO
GlobeNewswire,/news/cenovus-announces-expiration-results-tender-232500161.html,Cenovus announces Expiration and Results of Any and All Tender Offer,CVE.TO
GlobeNewswire,/news/cenovus-announces-pricing-terms-pending-190400919.html,Cenovus announces the Pricing Terms of its Pending Any and All Tender Offer,CVE.TO
Insider Monkey,/news/11-best-hemp-stocks-buy-095952503.html,11 Best Hemp Stocks To Buy Now,ACB.TO
Investor's Business Daily,/m/6e8fb483-3ff2-3a41-8275-9e9949427873/are-any-marijuana-stocks-on.html,Are Any Marijuana Stocks On U.S. Exchanges Good Buys As This One Breaks Out?,ACB.TO
CNW Group,/news/aurora-announces-manufacturing-agreement-valens-110000388.html,Aurora Announces Manufacturing Agreement with The Valens Company,ACB.TO
Motley Fool,/m/3ea8e14e-2307-3fff-9d22-4096ffc2bff3/better-cannabis-stock-.html,Better Cannabis Stock: Sundial Growers vs. Aurora Cannabis,ACB.TO
PR Newswire,/news/aurora-cannabis-host-first-quarter-210000404.html,Aurora Cannabis to Host First Quarter Fiscal Year 2022 Investor Conference Call,ACB.TO
Yahoo Finance Video,/video/gorilla-rx-ceo-black-owned-184909196.html,Gorilla Rx CEO on Black-owned cannabis companies: ‘We must rely on ourselves’,ACB.TO
Yahoo Finance Video,/video/al-harrington-vow-viola-household-184334897.html,Al Harrington’s vow to make Viola a ‘household name’ in a booming cannabis industry,ACB.TO
Motley Fool,/m/ac40c5fc-4e6d-3954-8f7c-5a0b57867cff/did-aurora-cannabis-give.html,Did Aurora Cannabis Give Investors Reasons for Hope With Its Fiscal Q4 Results?,ACB.TO
Insider Monkey,/news/11-best-robinhood-stocks-buy-205527901.html,11 Best Robinhood Stocks To Buy According To Hedge Funds,ACB.TO
Insider Monkey,/news/10-best-stocks-under-10-211527433.html,10 Best Stocks Under $10 According to Billionaire Daniel Och’s OZ Management,ACB.TO
Reuters,/news/canada-stocks-energy-healthcare-stocks-140422150.html,"CANADA STOCKS-Energy, healthcare stocks drag TSX; Air Canada jumps",AC.TO
Reuters,/news/airlines-reopen-lounges-perks-more-114051966.html,"Airlines reopen lounges with new perks, more walk-ins from economy",AC.TO
Reuters,/news/focus-airlines-reopen-lounges-perks-113611841.html,"FOCUS-Airlines reopen lounges with new perks, more walk-ins from economy",AC.TO
Reuters,/news/1-air-canada-posts-smaller-101941300.html,"UPDATE 2-Air Canada revenue beats on border reopening, travel rebound",AC.TO
Reuters,/news/air-canada-posts-smaller-third-101606025.html,"Air Canada revenue beats on border reopening, travel rebound",AC.TO
CNW Group,/news/air-canada-reports-third-quarter-100000782.html,Air Canada Reports Third Quarter 2021 Results,AC.TO
CNW Group,/news/applications-now-open-third-captain-130000337.html,Applications Now Open For Third Year Of The Captain Judy Cameron Scholarship Sponsored By Air Canada,AC.TO
CNW Group,/news/air-canada-introduces-company-wide-133000259.html,Air Canada Introduces Company-Wide Plan for the Safe Return of its Employees to the Workplace,AC.TO
CNW Group,/news/air-canada-support-development-sustainable-110200653.html,Air Canada to Support the Development of Sustainable Fuel and Decarbonization Technology through a new Industry Group,AC.TO
CNW Group,/news/air-canada-offers-industrys-most-121600530.html,"Air Canada Offers Industry's Most Comprehensive Travel Testing Options in Partnership with Switch Health, Including Self-Administered Tests",AC.TO
Business Wire,/news/law-offices-frank-r-cruz-201600033.html,The Law Offices of Frank R. Cruz Announces Investigation of Lightspeed Commerce Inc. (LSPD) on Behalf of Investors,LSPD.TO
Motley Fool,/m/6203a48b-e19d-3e49-a467-257c2c41149c/why-lightspeed-commerce-stock.html,Why Lightspeed Commerce Stock Took a Dive Today,LSPD.TO
Business Wire,/news/investor-alert-law-offices-howard-191400057.html,INVESTOR ALERT: Law Offices of Howard G. Smith Announces Investigation of Lightspeed Commerce Inc. (LSPD) on Behalf of Investors,LSPD.TO
CNW Group,/news/lightspeed-announces-second-quarter-2022-110000384.html,Lightspeed Announces Second Quarter 2022 Financial Results,LSPD.TO
PR Newswire,/news/shareholder-alert-pomerantz-law-firm-070400133.html,SHAREHOLDER ALERT: Pomerantz Law Firm Investigates Claims On Behalf of Investors of Lightspeed Commerce Inc. - LSPD,LSPD.TO
PR Newswire,/news/lightspeed-payments-availability-expands-apac-110000382.html,Lightspeed Payments Availability Expands to New APAC and US Customer Locations,LSPD.TO
PR Newswire,/news/rosen-leading-investor-rights-law-004000942.html,"ROSEN, A LEADING INVESTOR RIGHTS LAW FIRM, Encourages Lightspeed Commerce Inc. Investors with Losses to Inquire About Class Action Investigation - LSPD",LSPD.TO
PR Newswire,/news/lightspeed-launches-flagship-ecommerce-solution-110000293.html,Lightspeed Launches New Flagship eCommerce Solution to Retail Customers,LSPD.TO
CNW Group,/news/lightspeed-announces-capital-markets-day-225500502.html,Lightspeed Announces Capital Markets Day 2021,LSPD.TO
CNW Group,/news/lightspeed-builds-financial-services-expanding-130000330.html,"Lightspeed Builds on Financial Services, Expanding Lightspeed Capital in the U.S.",LSPD.TO
Business Wire,/news/oneconnect-announce-third-quarter-financial-130000127.html,OneConnect to Announce Third Quarter Financial Results,OCFT
Simply Wall St.,/news/oneconnect-financial-technology-nyse-ocft-134147515.html,OneConnect Financial Technology (NYSE:OCFT) Has Debt But No Earnings; Should You Worry?,OCFT
Insider Monkey,/news/10-small-cap-stocks-buy-101300375.html,10 Small-Cap Stocks to Buy According to ‘Australia’s Warren Buffett’ Kerr Neilson,OCFT
South China Morning Post,/news/ping-oneconnect-sets-pace-hong-093000302.html,"Ping An OneConnect sets the pace as Hong Kong's virtual banks deliver better services to SMEs, keep sector giants on their toes",OCFT
PR Newswire,/news/oneconnect-accelerates-strategic-growth-one-082000446.html,"OneConnect Accelerates Strategic Growth with New ""One Body and Two Wings"" Five-year Strategy",OCFT
Business Wire,/news/oneconnect-responds-whistleblower-complaint-124500617.html,OneConnect Responds to Whistleblower Complaint,OCFT
Business Wire,/news/oneconnect-announces-memorandum-understanding-purchase-100000744.html,OneConnect Announces Memorandum of Understanding to Purchase Majority Stake in a Credit Technology Company,OCFT
Business Wire,/news/oneconnect-announces-management-intends-increase-104500557.html,OneConnect Announces that Its Management Intends to Increase Their Shareholdings Demonstrating Confidence in the Prospects for Its Business,OCFT
Simply Wall St.,/news/oneconnect-financial-technologys-nyse-ocft-123033325.html,OneConnect Financial Technology's(NYSE:OCFT) Share Price Is Down 75% Over The Past Year.,OCFT
Business Wire,/news/scott-scott-attorneys-law-llp-171100594.html,"Scott+Scott Attorneys at Law LLP Announces Investigation into OneConnect Financial Technology Co., Ltd. (OCFT)",OCFT
GlobeNewswire,/news/cloudmd-adds-comprehensive-health-wellness-113000677.html,CloudMD Adds Comprehensive Health and Wellness Coaching to Proprietary Integrated Health Services Platform,DOC.V
GlobeNewswire,/news/cloudmd-adopts-advance-notice-policy-225700654.html,CloudMD Adopts Advance Notice Policy,DOC.V
GlobeNewswire,/news/cloudmd-appoints-angel-paravicini-svp-113000004.html,"CloudMD Appoints Angel Paravicini as SVP, Business Development and Customer Success to Drive Expansion Across North America and Globally",DOC.V
GlobeNewswire,/news/cloudmd-strengthens-board-director-nominations-113000444.html,CloudMD Strengthens Board with New Director Nominations and Announces Change of Auditors,DOC.V
GlobeNewswire,/news/cloudmd-partners-19-post-secondary-113000082.html,CloudMD Partners with 19 New Post-Secondary Institutions to Provide Integrated Mental Health Support Programs to Students,DOC.V
Simply Wall St.,/news/cloudmd-software-services-inc-cve-130613952.html,CloudMD Software & Services Inc. (CVE:DOC): Are Analysts Optimistic?,DOC.V
GlobeNewswire,/news/cloudmd-reports-record-revenue-15-202000481.html,CloudMD Reports Record Revenue of $15.7 Million in Second Quarter 2021; 9% Quarter Over Quarter Organic Growth,DOC.V
GlobeNewswire,/news/cloudmd-report-second-quarter-financial-113000646.html,"CloudMD to Report Second Quarter Financial Results on August 25, 2021",DOC.V
GlobeNewswire,/news/inagene-aspiria-team-improve-mental-100000897.html,Inagene and Aspiria team up to improve mental health care for post-secondary students,DOC.V
GlobeNewswire,/news/cloudmd-present-canaccord-genuity-growth-113000517.html,CloudMD to Present at the Canaccord Genuity Growth Conference,DOC.V
Newsfile,/news/shareholder-alert-pomerantz-law-firm-012500790.html,SHAREHOLDER ALERT: Pomerantz Law Firm Investigates Claims On Behalf of Investors of Peak Fintech Group Inc. - PKKFF,PKK.CN
PR Newswire,/news/ongoing-investigation-reminder-schall-law-155000447.html,ONGOING INVESTIGATION REMINDER: The Schall Law Firm Announces it is Investigating Claims Against Peak Fintech Group Inc. and Encourages Investors with Losses to Contact the Firm,PKK.CN
Newsfile,/news/peak-fintech-business-hub-shows-120000245.html,Peak Fintech Business Hub Shows Promising Results Following Entry into Oil and Gas Industry in Q3,PKK.CN
Newsfile,/news/le-business-hub-peak-fintech-120000948.html,Le Business Hub de Peak Fintech affiche des résultats prometteurs après son entré dans l'industrie pétrolière au 3e trimestre,PKK.CN
Business Wire,/news/peak-alert-bragar-eagel-squire-023100049.html,"PEAK ALERT: Bragar Eagel & Squire, P.C. is Investigating Peak Fintech Group Inc. on Behalf of Peak Stockholders and Encourages Investors to Contact the Firm",PKK.CN
PR Newswire,/news/equity-alert-rosen-leading-investor-013000996.html,"EQUITY ALERT: ROSEN, LEADING INVESTOR COUNSEL, Encourages Peak Fintech Group Inc. Investors with Losses to Inquire About Class Action Investigation - TNT, PKKFF",PKK.CN
ACCESSWIRE,/news/ongoing-investigation-alert-schall-law-212500547.html,ONGOING INVESTIGATION ALERT: The Schall Law Firm Announces it is Investigating Claims Against Peak Fintech Group Inc. and Encourages Investors with Losses to Contact the Firm,PKK.CN
Newsfile,/news/investigation-block-leviton-investigating-peak-183500659.html,INVESTIGATION: Block & Leviton Is Investigating Peak Fintech Group For Potential Securities Law Violations; Investors Who Have Lost Money Are Encouraged to Contact the Firm,PKK.CN
Business Wire,/news/investigation-notice-schall-law-firm-124000687.html,INVESTIGATION NOTICE: The Schall Law Firm Announces it is Investigating Claims Against Peak Fintech Group Inc. and Encourages Investors with Losses to Contact the Firm,PKK.CN
GlobeNewswire,/news/peak-fintech-group-inc-investors-003400393.html,"Peak Fintech Group, Inc. Investors: Company Investigated by the Portnoy Law Firm",PKK.CN
ACCESSWIRE,/news/cielo-announces-operational-corporate-043000760.html,Cielo Announces Operational and Corporate Update,CMC.V
ACCESSWIRE,/news/cielo-announces-fiscal-q1-2022-035500469.html,Cielo Announces Fiscal Q1 2022 Financial Results,CMC.V
ACCESSWIRE,/news/cielo-announces-fiscal-q1-2022-064500969.html,Cielo Announces Fiscal Q1 2022 Conference Call and Webcast,CMC.V
ACCESSWIRE,/news/cielo-announces-corporate-change-provides-043500501.html,Cielo Announces Corporate Change and Provides Operational Update,CMC.V
ACCESSWIRE,/news/cielo-announces-resignation-directors-012500370.html,Cielo Announces Resignation of Directors,CMC.V
ACCESSWIRE,/news/cielo-announces-filing-annual-financial-130000941.html,Cielo Announces Filing of Annual Financial Statements and Annual Results,CMC.V
ACCESSWIRE,/news/cielo-announces-appointment-andrea-whyte-011000290.html,Cielo Announces Appointment of Andrea Whyte to Board of Directors and Provides MCTO Update,CMC.V
ACCESSWIRE,/news/cielo-announces-application-management-cease-130000682.html,Cielo Announces Application for The Management Cease Trade Order has Been Accepted,CMC.V
ACCESSWIRE,/news/cielo-signs-letter-intent-offtake-133000914.html,"Cielo Signs Letter of Intent for Offtake Agreement, Provides Operational Update and Announces Office Move",CMC.V
ACCESSWIRE,/news/cielo-announces-closing-cdn-4m-130000840.html,Cielo Announces the Closing of CDN$4M Unsecured Convertible Debenture Financing,CMC.V
