source,link_href,link_text,ticker
Business Wire,/news/nextech-ceo-evan-gappelberg-buys-113000042.html,"Nextech CEO Evan Gappelberg Buys 262,744 Shares of Company Stock",NTAR.NE
Business Wire,/news/nextech-ar-solutions-corp-announces-113000307.html,Nextech AR Solutions Corp. Announces Board and Management Changes,NTAR.NE
Business Wire,/news/nextech-ar-solutions-corp-announces-113000369.html,Nextech AR Solutions Corp. Announces a LiveX Showcase Event ‘LiveNow’ Featuring Guest Speaker Entrepreneur Gary Vee,NTAR.NE
ACCESSWIRE,/news/hive-announces-10-mw-expansion-051500994.html,"HIVE Announces 10 MW Expansion of Green Energy GPU Data Centre in Sweden, HODL and ESG Update",HIVE.V
ACCESSWIRE,/news/hive-announces-sale-norwegian-subsidiary-050000663.html,HIVE Announces Sale of Norwegian Subsidiary with Associated Debt and HODL Update,HIVE.V
TipRanks,/news/hive-blockchain-technologies-compelling-under-121837067.html,HIVE Blockchain Technologies Is A Compelling Under-the-Radar Crypto Play,HIVE.V
GlobeNewswire,/news/namaste-technologies-announces-phyto-extractions-113000148.html,Namaste Technologies Announces Phyto Extractions Shatter Now Available Nationally for Medical Consumers,N.V
GlobeNewswire,/news/namaste-technologies-reports-first-quarter-113000835.html,Namaste Technologies Reports First Quarter 2021 Financial Results,N.V
GlobeNewswire,/news/namaste-technologies-provides-corporate-including-210000677.html,Namaste Technologies Provides Corporate Update Including Launch of CannMart.com in French for Quebec and All Francophones in Canada,N.V
Yahoo Finance Video,/video/amc-pops-reddit-traders-double-133617963.html,AMC pops as Reddit traders double down,BB.TO
Barrons.com,/m/a1feb455-19bd-3f39-a9ae-e7b8530c4a97/amc-stock-rallies-to-end-the.html,AMC Stock Rallies to End the Week. The Meme Trade Is Still Hot.,BB.TO
Oilprice.com,/news/could-no-1-ev-stock-230000445.html,Could This Be The No.1 EV Stock Of 2021?,BB.TO
CNW Group,/news/enterprise-blockchain-processor-taal-becomes-113000196.html,"Enterprise Blockchain Processor, TAAL, becomes Hut 8's Newest Hosting Services Partner",HUT.TO
CNW Group,/news/hut-8-mining-advances-high-120700876.html,Hut 8 Mining Advances High-Performance Computing Capabilities with Procurement of Tier 1 Server Hardware,HUT.TO
CNW Group,/news/hut-8-provides-agm-advances-113000282.html,"Hut 8 Provides AGM Update and Advances its Commitment to Board Diversity, with Appointment of Alexia Hefti to the Board of Directors",HUT.TO
GlobeNewswire,/news/drilling-sfdla-continues-intersect-high-120000447.html,"Drilling at SFdLA Continues to Intersect High Grade Mineralisation, including 4.2m at 8.3% Cu, 1.8 g/t Au and 743 g/t Ag (16% CuEq)",TBX.V
Simply Wall St.,/news/think-turmalina-metals-cve-tbx-090244759.html,We Think Turmalina Metals (CVE:TBX) Can Afford To Drive Business Growth,TBX.V
GlobeNewswire,/news/laura-bastias-appointed-independent-director-234300070.html,Laura Bastias Appointed Independent Director,TBX.V
GlobeNewswire,/news/arht-media-named-official-holopresence-123000508.html,"ARHT Media Named Official HoloPresence™ Partner at  Art Basel Hong Kong May 19 – 23, 2021",ART.V
GlobeNewswire,/news/arht-media-grants-company-stock-224500966.html,ARHT Media Grants Company Stock Options,ART.V
GlobeNewswire,/news/arht-media-announces-first-quarter-123000672.html,ARHT Media Announces First Quarter 2021 Results,ART.V
ACCESSWIRE,/news/ampd-signs-share-purchase-agreement-203500024.html,"AMPD Signs Share Purchase Agreement to Acquire 100% of Canadian Cloud Provider, Cloud-A Computing Inc.",AMPD.CN
ACCESSWIRE,/news/stock-option-grant-214500371.html,Stock Option Grant,AMPD.CN
ACCESSWIRE,/news/ampd-joins-dell-technologies-partner-130000061.html,AMPD Joins the Dell Technologies Partner Program as a Dell Cloud Service Provider,AMPD.CN
GlobeNewswire,/news/fmw-media-inc-street-tv-194500767.html,"FMW Media, Inc.’s “New To The Street” TV Announces Its 181st Show Broadcasting on the Fox Business Network  Featuring 5 Interviews, Airing Tonight, May 24, 2021 @ 10:30PM PT",SWIS.CN
ACCESSWIRE,/news/globex-data-featured-street-newsmax-211500124.html,"GlobeX Data to Be Featured on “New to the Street” on NEWSMAX TV, Sunday May 23 2021 at 10:00AM EST",SWIS.CN
ACCESSWIRE,/news/globex-data-ltd-announces-updated-062000837.html,GlobeX Data Ltd. Announces Updated Higher Amount of Closing of Non-Brokered Private Placement,SWIS.CN
GlobeNewswire,/news/emerging-markets-report-whole-level-111700693.html,Emerging Markets Report: A Whole New Level,MTRX.V
GlobeNewswire,/news/telus-upgrades-loop-insight-partnership-100000976.html,TELUS Upgrades Loop Insight Partnership Status From IoT Marketplace To Direct Reseller In Multi-Year Agreement.  TELUS To Directly Resell Loop Solutions As A TELUS Product To National Business Customers,MTRX.V
GlobeNewswire,/news/emerging-markets-report-next-generation-110700367.html,Emerging Markets Report: A Next Generation Move in a $225 Billion Market,MTRX.V
CNW Group,/news/cineplex-announces-election-directors-annual-210000863.html,Cineplex Announces Election of Directors at Annual General Meeting of Shareholders,CGX.TO
Yahoo Finance,/news/redditors-wrong-on-amc-as-disney-and-other-studios-drive-secular-decline-veteran-media-analyst-200403919.html,AMC is in 'secular decline' as Disney and other studios bypass movie theaters: veteran analyst,CGX.TO
SmarterAnalyst,/news/cineplex-1q-revenue-falls-85-150230124.html,Cineplex’s 1Q Revenue Falls 85% As Most Theaters Remain Closed; Shares Drop 5%,CGX.TO
Zacks,/news/cenovus-cve-divests-marten-hills-135801539.html,Cenovus (CVE) Divests Marten Hills Royalty Interest to Topaz,CVE.TO
GlobeNewswire,/news/cenovus-sells-marten-hills-royalty-202600899.html,Cenovus sells Marten Hills royalty interest for more than $100 million,CVE.TO
Simply Wall St.,/news/alexander-pourbaix-ceo-president-director-051821390.html,"Alexander Pourbaix Is The CEO, President & Director of Cenovus Energy Inc. (TSE:CVE) And They Just Picked Up 11% More Shares",CVE.TO
CNW Group,/news/mistango-river-resources-announces-3-130800872.html,Nauticol Energy and Enhance Energy partner to capture up to one million tonnes of CO2 annually from Blue Methanol production and distribution business,TTT.CN
Business Wire,/news/trutrace-technologies-joins-forces-customer-140000140.html,TruTrace Technologies Joins Forces with Customer Engagement Expert PharmaCentra to Provide a Blockchain-Secured Ecosystem for Medical Cannabis,TTT.CN
Business Wire,/news/applied-dna-trutrace-technologies-unveil-130000431.html,Applied DNA and TruTrace Technologies™ Unveil Complete Cannabis Product Validation and Authentication Solution,TTT.CN
Benzinga,/news/cannabis-countdown-top-10-marijuana-131757933.html,Cannabis Countdown: Top 10 Marijuana and Psychedelic Stock News Stories of the Week,ACB.TO
PR Newswire,/news/science-innovation-business-unit-advance-110000189.html,New Science & Innovation Business Unit to Advance Aurora's Leadership in Biosynthesis and Plant Genetics,ACB.TO
Investor's Business Daily,/m/6e8fb483-3ff2-3a41-8275-9e9949427873/are-any-canadian-marijuana.html,Are Any Canadian Marijuana Stocks Good Buys As Ontario Sees Reopenings Ahead?,ACB.TO
CNW Group,/news/aeroplan-partners-rocky-mountaineer-luxury-150000255.html,Aeroplan Partners with Rocky Mountaineer on Luxury Rail Vacations,AC.TO
SmarterAnalyst,/news/air-canada-partners-edmonton-international-194351605.html,Air Canada Partners With Edmonton International Airport to Reduce Carbon Emissions,AC.TO
CNW Group,/news/air-canada-supports-india-relief-151400363.html,Air Canada Supports India Relief Efforts by Transporting Critical COVID-19 Medical Supplies,AC.TO
CNW Group,/news/iiroc-trading-halt-ydx-114600505.html,IIROC Trading Halt - YDX,YDX.V
ACCESSWIRE,/news/ydx-innovation-corporate-224500011.html,YDX Innovation Corporate Update,YDX.V
ACCESSWIRE,/news/ydx-innovation-announces-letter-intent-001500506.html,YDX Innovation Announces Letter of Intent for Reverse Takeover with Moshun Media Development Corp.,YDX.V
GlobeNewswire,/news/victory-square-portfolio-company-gameon-165900454.html,"Victory Square Portfolio Company, GameOn Entertainment Technologies Inc. Announces Start of Trading On The CSE Under Symbol (CSE:GET)",VST.CN
GlobeNewswire,/news/victory-square-technologies-launches-discreetcare-114500316.html,Victory Square Technologies Launches DiscreetCare – a Full-Service Web App for the Treatment of Sensitive & Delicate Medical Issues,VST.CN
GlobeNewswire,/news/victory-square-technologies-declares-special-132000734.html,Victory Square Technologies Declares a Special Common Share Dividend of Its Interest in Portfolio Company GameOn Entertainment Technologies Inc.,VST.CN
GlobeNewswire,/news/sensormatic-solutions-johnson-controls-expands-194600002.html,"Sensormatic Solutions by Johnson Controls Expands Partnership With VSBLTY to Enhance Shopper Engagements, Retail Outcomes and Connectivity",VSBY.CN
GlobeNewswire,/news/vsblty-onyx-glass-jointly-create-111000578.html,VSBLTY & ONYX GLASS JOINTLY CREATE FIRST PATENTED OPAQUE TO 100% TRANSPARENT GLASS COOLER DOORS FEATURING FULL-COLOR VIDEO,VSBY.CN
GlobeNewswire,/news/vsblty-ability-enterprise-sign-mou-111000365.html,VSBLTY & ABILITY ENTERPRISE SIGN MOU TO MARKET AI-ENABLED INTELLIGENT CAMERAS & SOFTWARE TO LARGE CUSTOMERS WORLDWIDE,VSBY.CN
PR Newswire,/news/briteco-partners-lightspeed-pos-offer-130000081.html,BriteCo partners with Lightspeed POS to offer free appraisal system for retail jewelers and A+ rated insurance for their customers,LSPD.TO
Simply Wall St.,/news/shareholders-thrilled-lightspeed-pos-tse-095632198.html,Shareholders Are Thrilled That The Lightspeed POS (TSE:LSPD) Share Price Increased 157%,LSPD.TO
Zacks,/news/strength-seen-lightspeed-pos-inc-163504077.html,Strength Seen in Lightspeed POS Inc. (LSPD): Can Its 15.7% Jump Turn into More Strength?,LSPD.TO
GlobeNewswire,/news/lexinfintech-holdings-ltd-announces-resignation-094700734.html,LexinFintech Holdings Ltd. Announces Resignation of Chief Financial Officer,OCFT
Zacks,/news/oneconnect-financial-technology-co-ltd-133901123.html,"OneConnect Financial Technology Co., Ltd. Sponsored ADR (OCFT) Surges 6.7%: Is This an Indication of Further Gains?",OCFT
PR Newswire,/news/sb-finance-partners-oneconnect-financial-030000096.html,SB Finance partners with OneConnect Financial Technology to roll-out cloud based financial technology,OCFT
GlobeNewswire,/news/cloudmd-reports-record-revenue-8-200900295.html,CloudMD Reports Record Revenue of $8.8 Million in First Quarter 2021,DOC.V
GlobeNewswire,/news/cloudmd-report-first-quarter-2021-073000674.html,"CloudMD to Report First Quarter 2021 Financial Results on May 27, 2021",DOC.V
GlobeNewswire,/news/cloudmd-closes-acquisition-rxi-providing-113000696.html,"CloudMD Closes Acquisition of Rxi, Providing an Established Specialty Drug Management and Patient Support Program to the Employer Market",DOC.V
Zacks Small Cap Research,/news/pkkff-major-customer-wins-q4-155000250.html,PKKFF: Major Customer Wins In Q4 Could Result in Revenues Doubling in 2021,PKK.CN
Newsfile,/news/les-revenus-peak-d-passent-032600110.html,Les revenus de Peak dépassent les 40 millions de dollars en 2020 dans les résultats financiers audités de fin d'année,PKK.CN
Newsfile,/news/peak-2020-revenues-top-40m-031700820.html,Peak 2020 Revenues Top $40M in Audited Year-End Financial Results,PKK.CN
GlobeNewswire,/news/threed-capital-inc-disposes-securities-230000405.html,ThreeD Capital Inc. Disposes of Securities of Windfall Geotek Inc.,IDK.CN
GlobeNewswire,/news/threed-capital-inc-releases-results-031000660.html,"ThreeD Capital Inc. Releases Results  For the Three and Nine Months Ended March 31, 2021",IDK.CN
GlobeNewswire,/news/threed-capital-inc-announces-unaudited-231200823.html,"ThreeD Capital Inc. Announces Unaudited April 30, 2021 Net Asset Value Per Share - $1.22",IDK.CN
ACCESSWIRE,/news/electrovaya-inc-host-earnings-call-101500565.html,"Electrovaya, Inc. to Host Earnings Call",EFL.TO
ACCESSWIRE,/news/electrovaya-reports-q2-fy2021-financial-224500511.html,Electrovaya Reports Q2 FY2021 Financial Results Quarterly,EFL.TO
ACCESSWIRE,/news/electrovaya-announces-q2-2021-quarter-180000103.html,"Electrovaya Announces Q2 2021 - Quarter End March 31, 2021 Earnings Release and Conference Call to Discuss the Quarterly Financial Results",EFL.TO
CNW Group,/news/eat-beyond-portfolio-company-nabati-130000391.html,Eat Beyond Portfolio Company Nabati Foods Builds New Facility,EATS.CN
CNW Group,/news/eat-beyond-portfolio-company-good-130000093.html,Eat Beyond Portfolio Company good natured® Announces Major Acquisition,EATS.CN
PR Newswire,/news/eat-beyond-adds-daydream-hemp-130000427.html,Eat Beyond adds Daydream Hemp and Adaptogen Drinks to its Portfolio,EATS.CN
CNW Group,/news/modern-plant-based-foods-appoints-014200417.html,Modern Plant-Based Foods Appoints Chef Karen Barnaby as Product Development and Scale-Up Specialist,MEAT.CN
CNW Group,/news/mcloud-appoints-rca-financial-partners-110000857.html,Canadian housing market sees imbalances increase in large cities and smaller centres,MEAT.CN
CNW Group,/news/valens-company-verse-cannabis-roll-210000292.html,"edatanetworks Inc. Enhances Patent Portfolio with USPTO in Broadcast Advertising, Voice for Community, and Automated Cause Marketing",MEAT.CN
Newsfile,/news/bee-vectoring-technologies-adds-territory-120000745.html,Bee Vectoring Technologies Adds New Territory Manager to Fast-Track Expansion in California,BEE.CN
Newsfile,/news/retransmission-bee-vectoring-technologies-announces-120000808.html,RETRANSMISSION: Bee Vectoring Technologies Announces First-Time Revenues in US Pacific Northwest,BEE.CN
Newsfile,/news/bee-vectoring-technologies-invitation-q2-110000965.html,Bee Vectoring Technologies: Invitation to the Q2 Virtual Investor Summit,BEE.CN
CNW Group,/news/thermalpass-looked-upon-k-12-120000869.html,ThermalPass is Looked Upon in K-12 Education Market as First Line of Defense to Reduce the Spread of Covid-19,PAI.V
CNW Group,/news/thermalpass-offers-more-bang-bundle-120000197.html,ThermalPass Offers More Bang by the Bundle for Companies Equipping Their Facilities to Mitigate the Spread of Covid-19,PAI.V
PR Newswire,/news/skelton-truck-lines-first-adopt-132000104.html,Skelton Truck Lines is First to Adopt Alert Fleet Mobile App as Use Case for Future Roll out of Advanced Road-Weather Hazard System,PAI.V
Newsfile,/news/mineworx-technologies-invites-join-us-141800553.html,Mineworx Technologies Invites You to Join Us at the Q2 Virtual Investor Summit,MWX.V
GlobeNewswire,/news/mineworx-grants-stock-options-191900262.html,Mineworx Grants Stock Options,MWX.V
GlobeNewswire,/news/mineworx-announces-early-redemption-debentures-093000796.html,Mineworx Announces Early Redemption of Debentures,MWX.V
CNW Group,/news/minerva-intelligence-announces-over-1-120000904.html,"Minerva Intelligence Announces Over 1,000% Revenue Growth From Prior Year Quarter and 2021 Q1 Results",MVAI.V
CNW Group,/news/minerva-intelligence-partnership-4dm-design-123000623.html,"Minerva Intelligence, in Partnership with 4DM, to Design a New National-Scale Hydrographic Data Model for Natural Resources Canada",MVAI.V
Newsfile,/news/minerva-intelligence-announces-participation-q2-110000025.html,Minerva Intelligence Announces Participation in the Q2 Virtual Investor Summit,MVAI.V
GlobeNewswire,/news/quisitive-reports-first-quarter-2021-203000310.html,Quisitive Reports First Quarter 2021 Financial Results,QUIS.V
ACCESSWIRE,/news/quisitive-technology-solutions-inc-host-191500260.html,"Quisitive Technology Solutions, Inc. to Host Earnings Call",QUIS.V
GlobeNewswire,/news/quisitive-announces-acceleration-warrant-expiry-200500313.html,Quisitive Announces Acceleration of Warrant Expiry Date,QUIS.V
GlobeNewswire,/news/trackx-hires-chief-marketing-officer-120000459.html,TrackX Hires Chief Marketing Officer to drive Supply Chain and Sustainability Initiatives,TKX.V
GlobeNewswire,/news/trackx-announces-closing-private-placement-181100124.html,TrackX Announces Closing of Private Placement,TKX.V
GlobeNewswire,/news/trackx-reports-q4-fiscal-2020-133600382.html,TrackX Reports Q4 and Fiscal 2020 Financial Results,TKX.V
PR Newswire,/news/imaginear-otcqb-ipnff-selected-presenting-110000853.html,ImagineAR (OTCQB:IPNFF) Selected as a Presenting Startup Finalist for the DEC Association Tech Day 2021,IP.CN
CNW Group,/news/imaginear-otcqb-ipnff-selected-finalist-111600911.html,ImagineAR (OTCQB:IPNFF) Selected as Finalist for the Euroleague FANXP Innovation Challenge,IP.CN
PR Newswire,/news/multi-platinum-rapper-jeezy-partnership-120000455.html,"Multi-Platinum Rapper, Jeezy, In Partnership with Oasis Digital Studios, Releases His Iconic Snowman Logo as AR-Enhanced NFTs",IP.CN
Newsfile,/news/netcents-technology-provides-delayed-yearly-150000463.html,NetCents Technology Provides Update on Delayed Yearly Audited Financial Statements,NC.CN
Newsfile,/news/netcents-technology-provides-detail-regarding-173500701.html,NetCents Technology Provides Detail Regarding Cease Trade Order,NC.CN
CNW Group,/news/iiroc-trading-halt-nc-121600572.html,IIROC Trading Halt - NC,NC.CN
GlobeNewswire,/news/earthrenew-closes-over-subscribed-private-210000339.html,EarthRenew Closes Over-Subscribed Private Placement,ERTH.CN
GlobeNewswire,/news/earthrenew-completes-shares-debt-settlements-220000195.html,EarthRenew Completes Shares for Debt Settlements,ERTH.CN
GlobeNewswire,/news/earthrenew-announces-private-placement-financing-000000468.html,EarthRenew Announces Private Placement Financing,ERTH.CN
Newsfile,/news/appia-announces-closing-5-75-160100261.html,"Appia Announces Closing of $5.75 Million Bought Deal Financing, Including Full Exercise of the Over-Allotment Option",API.CN
GlobeNewswire,/news/appia-increases-previously-announced-bought-201800252.html,APPIA INCREASES PREVIOUSLY ANNOUNCED BOUGHT DEAL FINANCING TO $5 MILLION,API.CN
Newsfile,/news/appia-announces-4-million-bought-123700778.html,Appia Announces $4 Million Bought Deal Private Placement Financing,API.CN
GlobeNewswire,/news/sharc-energy-announces-first-quarter-120000777.html,SHARC Energy Announces First Quarter 2021 Financial Results,SHRC.CN
GlobeNewswire,/news/sharc-energy-announces-fourth-quarter-231500488.html,SHARC Energy Announces Fourth Quarter and Fiscal Year 2020 Financial Results,SHRC.CN
GlobeNewswire,/news/sharc-energy-ships-piranha-hc-120000054.html,SHARC Energy Ships PIRANHA HC to Forward-Thinking Vancouver Residential Project,SHRC.CN
ACCESSWIRE,/news/legend-power-schedules-q2-2021-154500352.html,Legend Power Schedules Q2 2021 Financial Results Release and Conference Call,LPS.V
CNW Group,/news/legend-power-systems-inc-announces-152300700.html,Legend Power Systems Inc. Announces Increase to Bought Deal Offering of up to $10.3 Million,LPS.V
CNW Group,/news/legend-power-systems-inc-announces-194200615.html,Legend Power Systems Inc. Announces $7.5 MIllion Bought Deal Offering,LPS.V
CNW Group,/news/mcloud-announces-first-quarter-2021-220000012.html,mCloud Announces First Quarter 2021 Financial Results,MCLD.V
CNW Group,/news/tsx-venture-exchange-mcloud-c-143000287.html,"TSX Venture Exchange, mCloud, C-Suite at The Open",MCLD.V
CNW Group,/news/mcloud-goes-live-first-utility-110000858.html,mCloud Goes Live with First Utility Program Buildings in New York State,MCLD.V
PR Newswire,/news/biorem-reports-first-quarter-2021-120000211.html,BIOREM Reports First Quarter 2021 Financial Results,BRM.V
PR Newswire,/news/biorem-reports-2-1-million-120000703.html,Biorem Reports $2.1 million Earnings for Fiscal 2020,BRM.V
CNW Group,/news/enerplus-releases-2020-esg-report-100000740.html,TSX Venture Exchange Stock Maintenance Bulletins,BRM.V
CNW Group,/news/ecosynthetix-announces-changes-board-directors-210000923.html,EcoSynthetix Announces Changes to Board of Directors,ECO.TO
CNW Group,/news/ecosynthetix-announces-voting-results-election-210000176.html,EcoSynthetix Announces Voting Results for Election of Directors,ECO.TO
CNW Group,/news/ecosynthetix-announces-normal-course-issuer-110000192.html,EcoSynthetix Announces Normal Course Issuer Bid,ECO.TO
GlobeNewswire,/news/freyr-eguana-sign-mou-joint-120000646.html,FREYR and Eguana Sign MoU for Joint Development of Battery Modules and supply of FREYR Battery Cells for Rapidly Growing ESS Markets,EGT.V
CNW Group,/news/eguana-technologies-announces-change-auditor-103000886.html,Eguana Technologies Announces Change of Auditor to KPMG LLP,EGT.V
GlobeNewswire,/news/10kw-evolve-final-certification-scheduled-103000433.html,"10kW Evolve Final Certification Scheduled, Eguana Prepares for First Production",EGT.V
Newsfile,/news/comprehensive-greenbriar-news-release-040100915.html,Comprehensive Greenbriar News Release,GRB.V
Newsfile,/news/greenbriar-announces-wealth-building-program-221000849.html,Greenbriar Announces Wealth Building Program with Paul Morris Keller Williams Forward Living,GRB.V
Newsfile,/news/greenbriar-announces-voya-financial-extension-182800694.html,Greenbriar Announces Voya Financial Extension of USD $195 Million Project Finance Mandate for Montalva,GRB.V
SmarterAnalyst,/news/greenpower-delivers-star-cab-chassis-105536213.html,GreenPower Delivers Star Cab and Chassis to Berkshire Hathaway’s Forest River,GPV.V
CNW Group,/news/greenpower-delivers-five-ev-star-123000437.html,GreenPower Delivers Five EV Star Cab and Chassis to Forest River,GPV.V
PR Newswire,/news/greenpower-announces-results-annual-general-232100679.html,GreenPower Announces Results of Annual General and Special Meeting,GPV.V
GlobeNewswire,/news/westport-fuel-systems-acquire-stako-131300129.html,"Westport Fuel Systems to Acquire Stako sp. z o.o., a World Leader in the Manufacturing of Liquified Petroleum Gas Fuel Storage",WPRT.TO
Oilprice.com,/news/could-no-1-ev-stock-230000445.html,Could This Be The No.1 EV Stock Of 2021?,WPRT.TO
Zacks,/news/westport-wprt-plunges-13-3-111311942.html,Westport (WPRT) Plunges 13.3% Since Q1 Loss Amid Chip Crunch,WPRT.TO
Simply Wall St.,/news/oceanic-wind-energy-cve-nkw-121742571.html,Can Oceanic Wind Energy (CVE:NKW) Afford To Invest In Growth?,NKW.V
Newsfile,/news/nano-one-receives-conditional-approval-070500896.html,Nano One Receives Conditional Approval to Graduate to the Toronto Stock Exchange,NNO.V
Newsfile,/news/nano-one-enters-co-development-070500205.html,Nano One Enters into a Co-Development Agreement with Niobium Producer CBMM,NNO.V
Newsfile,/news/nano-one-advances-joint-development-070500243.html,Nano One Advances Joint Development Work with Asian Cathode Producer,NNO.V
ACCESSWIRE,/news/cielo-secures-land-purchase-build-130000104.html,Cielo Secures Land Purchase to Build Second 100% Owned Facility in Alberta and Debt Financing for Purchase,CMC.CN
ACCESSWIRE,/news/cielo-announces-changes-board-directors-130000206.html,Cielo Announces Changes to the Board of Directors,CMC.CN
ACCESSWIRE,/news/cielo-announces-closing-cdn-10m-130000105.html,Cielo Announces Closing of CDN$10M Non-Brokered Convertible Debenture Financing and Conversion to Shares,CMC.CN
GlobeNewswire,/news/pharmather-collaborates-medisynergics-develop-patented-120000436.html,PharmaTher Collaborates with MediSynergics to Develop Patented Ketamine Formulation for Pain Disorders and to Discover Novel Psychedelic Formulations,PHRM.CN
GlobeNewswire,/news/pharmather-files-fda-orphan-drug-120500798.html,PharmaTher Files for FDA Orphan Drug Designation for Ketamine to Treat Lou Gehrig’s Disease,PHRM.CN
GlobeNewswire,/news/accomplished-clinical-researcher-matthew-macaluso-132800924.html,Accomplished Clinical Researcher Matthew Macaluso Joins as Scientific and Clinical Advisor for PharmaTher’s Ketamine Programs,PHRM.CN
Newsfile,/news/flyht-aerospace-solutions-ltd-invitation-120000678.html,Flyht Aerospace Solutions Ltd.: Invitation to the Q2 Virtual Investor Summit,FLY.V
GlobeNewswire,/news/flyht-announces-amendment-grant-incentive-110400082.html,FLYHT Announces Amendment to Grant of Incentive Stock Options,FLY.V
GlobeNewswire,/news/flyht-participate-q2-investor-summit-110400298.html,FLYHT to Participate in the Q2 Investor Summit,FLY.V
CNW Group,/news/danavation-technologies-announces-first-overseas-110000670.html,"Danavation Technologies Announces First Overseas Distribution Partnership for Marketing of Digital Smart Labels™ in Bermuda, Latin America and the Caribbean",DVN.CN
Newsfile,/news/danavation-technologies-shaking-retail-digital-170600345.html,"Danavation Technologies, Shaking up Retail with Digital Label Solutions, CEO Clip Video",DVN.CN
Newsfile,/news/btv-investor-alert-video-danavation-174500858.html,BTV Investor Alert Video: Danavation Technologies - State-of-the-Art Digital Smart Labels(TM),DVN.CN
Business Wire,/news/namsys-reports-annual-meeting-shareholders-165600981.html,"NamSys Reports on the Annual Meeting of Shareholders Held Virtually on April 29, 2021",CTZ.V
Business Wire,/news/namsys-reports-results-operations-fiscal-174600885.html,"NamSys Reports Results of Operations for the Fiscal 2021 First Quarter, January 31st, 2021",CTZ.V
Business Wire,/news/namsys-reports-results-operations-fiscal-202200214.html,NamSys Reports Results of Operations for Fiscal 2020,CTZ.V
ACCESSWIRE,/news/keynotes-educational-panels-42-canadian-140000492.html,"Keynotes, Educational Panels and 42 Canadian-Listed Public Companies Presenting at the SNN Network Canada Virtual Event - January 6-7, 2021",MRBL.CN
ACCESSWIRE,/news/marble-financial-present-snn-network-120000210.html,"Marble Financial to Present at the SNN Network Canada Virtual Event on Thursday January 7, 2021",MRBL.CN
Newsfile,/news/marble-financial-inc-data-driven-182200831.html,"Marble Financial Inc., A Data-Driven Financial Future, CEO Clip Video",MRBL.CN
CNW Group,/news/carl-data-solutions-hires-veteran-130000957.html,"Carl Data Solutions hires veteran software marketing executive and technology journalist as Director, Corporate Communications to build IR and PR impact",CRL.CN
