source,link_href,link_text,ticker
PR Newswire,/news/inspira-technologies-performed-hyla-blood-130000940.html,"Inspira™ Technologies Performed HYLA™ Blood Sensor In-Vivo Study, in Preparation of Planned Human Studies",IINN
PR Newswire,/news/inspira-technologies-present-h-c-130000187.html,Inspira™ Technologies to Present at the H.C. Wainwright 24th Annual Global Investor Conference,IINN
PR Newswire,/news/inspira-technologies-reports-second-quarter-130000178.html,Inspira™ Technologies Reports Second Quarter 2022 Financial Results,IINN
PR Newswire,/news/inspira-technologies-reveals-next-generation-130000871.html,"Inspira™ Technologies Reveals Next Generation Liby™ System, an Extracorporeal Membrane Oxygenation System, Targeting a $531 Million Global ECMO Market",IINN
PR Newswire,/news/inspira-technologies-signs-strategic-agreement-123000623.html,"Inspira™ Technologies Signs Strategic Agreement in U.S. to potentially provide $59 million for Inspira for deployment of 3,889 HYLA™ Blood Sensors",IINN
Yahoo Finance Video,/video/inspira-stock-soars-peloton-offers-195746187.html,"Inspira stock soars, Peloton offers workers cash bonuses, Rivian deliveries more than triple in Q2",IINN
PR Newswire,/news/inspira-technologies-develops-non-invasive-123000344.html,Inspira™ Technologies Develops a Non-Invasive Blood Sensor Designed to Alert Real-Time Change in Patients - Potentially Targets $2.5 Billion ABG Market,IINN
ACCESSWIRE,/news/redchip-interviews-inspira-technologies-cfo-130000720.html,RedChip Interviews Inspira Technologies' CFO Joe Hayon,IINN
PR Newswire,/news/inspira-technologies-announces-first-quarter-133000113.html,Inspira™ Technologies Announces First Quarter 2022 Financial Results,IINN
PR Newswire,/news/inspira-technologies-participate-upcoming-events-133000021.html,Inspira™ Technologies to Participate in Upcoming Events in May,IINN
Zacks,/news/zim-integrated-shipping-services-zim-214509168.html,ZIM Integrated Shipping Services (ZIM) Gains But Lags Market: What You Should Know,ZIM
GuruFocus.com,/news/zim-undervalued-despite-astounding-payout-174434767.html,Zim Is Undervalued Despite an Astounding Payout Record,ZIM
Motley Fool,/m/67af79e8-4bef-3c4d-84da-ccd757c7071f/2-beaten-down-income-stocks.html,2 Beaten-Down Income Stocks With Jaw-Dropping Yields,ZIM
PR Newswire,/news/zim-announces-large-scale-long-120000719.html,ZIM Announces Large-Scale Long-Term LNG Bunkering Agreement with Shell,ZIM
InvestorPlace,/news/too-much-fear-priced-zim-162020995.html,There’s Too Much Fear Priced Into ZIM Integrated Shipping Stock,ZIM
PR Newswire,/news/zim-updates-withholding-tax-procedures-120000522.html,ZIM Updates on Withholding Tax Procedures on September 2022 Cash Dividend,ZIM
Investor's Business Daily,/m/2ff5f14f-e6ca-3192-8441-a04e6d652aa3/zim-integrated-shipping.html,ZIM Integrated Shipping Services Stock Shows Improving Market Leadership; Earns 83 RS Rating,ZIM
Motley Fool,/m/04235fc7-7528-3f9f-b987-16b8144dd2e4/zim-integrated-shipping.html,ZIM Integrated Shipping Services Ltd. (ZIM) Q2 2022 Earnings Call Transcript,ZIM
Benzinga,/news/zim-integrated-shipping-shares-down-132357562.html,ZIM Integrated Shipping Shares Down After Q2 Results Miss Street Expectations,ZIM
PR Newswire,/news/zim-reports-financial-results-second-110000639.html,ZIM Reports Financial Results for the Second Quarter of 2022,ZIM
Zacks,/news/united-states-steel-x-gains-215009721.html,United States Steel (X) Gains But Lags Market: What You Should Know,X
Business Wire,/news/u-steel-pittsburgh-penguins-community-190900606.html,"U. S. Steel, Pittsburgh Penguins, Community Partners, Join Governor Tom Wolf to Break Ground for Braddock Carnegie Library Renovation",X
TheStreet.com,/m/d1d2eb53-359a-353a-9f06-349cf761f02a/u-s-steel-exec-.html,U.S. Steel Exec: Sustainability 'Integral to the Overall Strategy',X
Zacks,/news/united-states-steel-x-dips-215009948.html,United States Steel (X) Dips More Than Broader Markets: What You Should Know,X
Zacks,/news/most-watched-stock-united-states-130001196.html,Is Most-Watched Stock United States Steel Corporation (X) Worth Betting on Now?,X
Motley Fool,/m/4bf1de93-4f62-3077-9077-873ba9b5a97a/why-shares-in-united-states.html,Why Shares in United States Steel Slumped This Week,X
Zacks,/news/united-states-steel-x-stock-220010748.html,United States Steel (X) Stock Moves -0.64%: What You Should Know,X
Investor's Business Daily,/m/d2a02752-e059-337a-b398-a594c3c3ba90/steel-dynamics-boosts.html,Steel Dynamics Boosts Outlook; U.S. Steel Cites 'Market Headwinds' After Nucor Warning,X
Barrons.com,/m/cfc61d6d-ceee-36ae-936a-8aa14b28b870/u-s-steel%E2%80%99s-guidance.html,U.S. Steel’s Guidance Disappoints. It Joins Nucor in Citing Weaker Demand.,X
MarketWatch,/m/c938254e-0321-3e39-a4e5-e3e32138c7c0/us-steel-to-miss.html,US Steel to miss third-quarter earnings target but CEO says company remains solid despite headwinds,X
